{
  "dataset": "ADNI_PHC_T1_Age_VQA",
  "task": "age_regression",
  "source_csvs": {
    "phc": "/home/arpa/ADSP_PHC_T1_MUSE_08Oct2025.csv",
    "image_subject_map": "/home/arpa/20251126_ImageID_subject.csv"
  },
  "mri_root": "/home/arpa/ADNI_Nifti_QC_N4",
  "label_space": [
    "continuous_age_years"
  ],
  "num_samples": 1482,
  "source_counts": {
    "phc": 7410,
    "unmapped": 3024,
    "missing_files": 427
  },
  "notes": {
    "sex_mapping": {
      "1": "male",
      "2": "female"
    },
    "question_template": "MRI scan (Image Data ID {image_id}) acquired on {acq_date} for a {sex} participant (visit {visit}). Predict the subject's T1 scan age in years and answer with a numeric value using one decimal place."
  },
  "split": "test",
  "split_ratio": "80/20",
  "split_seed": 42,
  "samples": [
    {
      "image_id": "I307060",
      "image_path": "ADNI_Nifti_QC_N4/I307060_T1_N4.nii.gz",
      "ptid": "082_S_4339",
      "visit": "v05",
      "acq_date": "5/30/2012",
      "phc_scan_date": "2012-05-30",
      "source": "phc",
      "question": "MRI scan (Image Data ID I307060) acquired on 5/30/2012 for a male participant (visit v05). Predict the subject's T1 scan age in years and answer with a numeric value using one decimal place.",
      "answer": "84.9",
      "answer_code": "84.9",
      "answer_units": "years",
      "demographics": {
        "sex": "male",
        "sex_code": "1",
        "visit": "v05",
        "phc_scandate": "2012-05-30",
        "image_acq_date": "5/30/2012"
      }
    },
    {
      "image_id": "I105696",
      "image_path": "ADNI_Nifti_QC_N4/I105696_T1_N4.nii.gz",
      "ptid": "141_S_0810",
      "visit": "m12",
      "acq_date": "11/24/2007",
      "phc_scan_date": "2007-11-24",
      "source": "phc",
      "question": "MRI scan (Image Data ID I105696) acquired on 11/24/2007 for a male participant (visit m12). Predict the subject's T1 scan age in years and answer with a numeric value using one decimal place.",
      "answer": "84.6",
      "answer_code": "84.6",
      "answer_units": "years",
      "demographics": {
        "sex": "male",
        "sex_code": "1",
        "visit": "m12",
        "phc_scandate": "2007-11-24",
        "image_acq_date": "11/24/2007"
      }
    },
    {
      "image_id": "I10933",
      "image_path": "ADNI_Nifti_QC_N4/I10933_T1_N4.nii.gz",
      "ptid": "027_S_0120",
      "visit": "sc",
      "acq_date": "2/06/2006",
      "phc_scan_date": "2006-02-06",
      "source": "phc",
      "question": "MRI scan (Image Data ID I10933) acquired on 2/06/2006 for a male participant (visit sc). Predict the subject's T1 scan age in years and answer with a numeric value using one decimal place.",
      "answer": "72.1",
      "answer_code": "72.1",
      "answer_units": "years",
      "demographics": {
        "sex": "male",
        "sex_code": "1",
        "visit": "sc",
        "phc_scandate": "2006-02-06",
        "image_acq_date": "2/06/2006"
      }
    },
    {
      "image_id": "I56731",
      "image_path": "ADNI_Nifti_QC_N4/I56731_T1_N4.nii.gz",
      "ptid": "053_S_0389",
      "visit": "m12",
      "acq_date": "5/09/2007",
      "phc_scan_date": "2007-05-09",
      "source": "phc",
      "question": "MRI scan (Image Data ID I56731) acquired on 5/09/2007 for a female participant (visit m12). Predict the subject's T1 scan age in years and answer with a numeric value using one decimal place.",
      "answer": "72.6",
      "answer_code": "72.6",
      "answer_units": "years",
      "demographics": {
        "sex": "female",
        "sex_code": "2",
        "visit": "m12",
        "phc_scandate": "2007-05-09",
        "image_acq_date": "5/09/2007"
      }
    },
    {
      "image_id": "I279284",
      "image_path": "ADNI_Nifti_QC_N4/I279284_T1_N4.nii.gz",
      "ptid": "082_S_4244",
      "visit": "v04",
      "acq_date": "1/18/2012",
      "phc_scan_date": "2012-01-18",
      "source": "phc",
      "question": "MRI scan (Image Data ID I279284) acquired on 1/18/2012 for a male participant (visit v04). Predict the subject's T1 scan age in years and answer with a numeric value using one decimal place.",
      "answer": "91.7",
      "answer_code": "91.7",
      "answer_units": "years",
      "demographics": {
        "sex": "male",
        "sex_code": "1",
        "visit": "v04",
        "phc_scandate": "2012-01-18",
        "image_acq_date": "1/18/2012"
      }
    },
    {
      "image_id": "I399199",
      "image_path": "ADNI_Nifti_QC_N4/I399199_T1_N4.nii.gz",
      "ptid": "005_S_0610",
      "visit": "v21",
      "acq_date": "11/21/2013",
      "phc_scan_date": "2013-11-21",
      "source": "phc",
      "question": "MRI scan (Image Data ID I399199) acquired on 11/21/2013 for a male participant (visit v21). Predict the subject's T1 scan age in years and answer with a numeric value using one decimal place.",
      "answer": "86.6",
      "answer_code": "86.6",
      "answer_units": "years",
      "demographics": {
        "sex": "male",
        "sex_code": "1",
        "visit": "v21",
        "phc_scandate": "2013-11-21",
        "image_acq_date": "11/21/2013"
      }
    },
    {
      "image_id": "I107542",
      "image_path": "ADNI_Nifti_QC_N4/I107542_T1_N4.nii.gz",
      "ptid": "116_S_0382",
      "visit": "m24",
      "acq_date": "5/28/2008",
      "phc_scan_date": "2008-05-28",
      "source": "phc",
      "question": "MRI scan (Image Data ID I107542) acquired on 5/28/2008 for a female participant (visit m24). Predict the subject's T1 scan age in years and answer with a numeric value using one decimal place.",
      "answer": "77.7",
      "answer_code": "77.7",
      "answer_units": "years",
      "demographics": {
        "sex": "female",
        "sex_code": "2",
        "visit": "m24",
        "phc_scandate": "2008-05-28",
        "image_acq_date": "5/28/2008"
      }
    },
    {
      "image_id": "I99698",
      "image_path": "ADNI_Nifti_QC_N4/I99698_T1_N4.nii.gz",
      "ptid": "127_S_0259",
      "visit": "m24",
      "acq_date": "3/27/2008",
      "phc_scan_date": "2008-03-27",
      "source": "phc",
      "question": "MRI scan (Image Data ID I99698) acquired on 3/27/2008 for a male participant (visit m24). Predict the subject's T1 scan age in years and answer with a numeric value using one decimal place.",
      "answer": "72.7",
      "answer_code": "72.7",
      "answer_units": "years",
      "demographics": {
        "sex": "male",
        "sex_code": "1",
        "visit": "m24",
        "phc_scandate": "2008-03-27",
        "image_acq_date": "3/27/2008"
      }
    },
    {
      "image_id": "I160754",
      "image_path": "ADNI_Nifti_QC_N4/I160754_T1_N4.nii.gz",
      "ptid": "002_S_1070",
      "visit": "m36",
      "acq_date": "12/10/2009",
      "phc_scan_date": "2009-12-10",
      "source": "phc",
      "question": "MRI scan (Image Data ID I160754) acquired on 12/10/2009 for a male participant (visit m36). Predict the subject's T1 scan age in years and answer with a numeric value using one decimal place.",
      "answer": "76.8",
      "answer_code": "76.8",
      "answer_units": "years",
      "demographics": {
        "sex": "male",
        "sex_code": "1",
        "visit": "m36",
        "phc_scandate": "2009-12-10",
        "image_acq_date": "12/10/2009"
      }
    },
    {
      "image_id": "I93875",
      "image_path": "ADNI_Nifti_QC_N4/I93875_T1_N4.nii.gz",
      "ptid": "024_S_1307",
      "visit": "m12",
      "acq_date": "2/28/2008",
      "phc_scan_date": "2008-02-28",
      "source": "phc",
      "question": "MRI scan (Image Data ID I93875) acquired on 2/28/2008 for a female participant (visit m12). Predict the subject's T1 scan age in years and answer with a numeric value using one decimal place.",
      "answer": "76.4",
      "answer_code": "76.4",
      "answer_units": "years",
      "demographics": {
        "sex": "female",
        "sex_code": "2",
        "visit": "m12",
        "phc_scandate": "2008-02-28",
        "image_acq_date": "2/28/2008"
      }
    },
    {
      "image_id": "I399834",
      "image_path": "ADNI_Nifti_QC_N4/I399834_T1_N4.nii.gz",
      "ptid": "137_S_0994",
      "visit": "v21",
      "acq_date": "12/03/2013",
      "phc_scan_date": "2013-12-03",
      "source": "phc",
      "question": "MRI scan (Image Data ID I399834) acquired on 12/03/2013 for a female participant (visit v21). Predict the subject's T1 scan age in years and answer with a numeric value using one decimal place.",
      "answer": "62.3",
      "answer_code": "62.3",
      "answer_units": "years",
      "demographics": {
        "sex": "female",
        "sex_code": "2",
        "visit": "v21",
        "phc_scandate": "2013-12-03",
        "image_acq_date": "12/03/2013"
      }
    },
    {
      "image_id": "I290382",
      "image_path": "ADNI_Nifti_QC_N4/I290382_T1_N4.nii.gz",
      "ptid": "099_S_4498",
      "visit": "v02",
      "acq_date": "3/15/2012",
      "phc_scan_date": "2012-03-15",
      "source": "phc",
      "question": "MRI scan (Image Data ID I290382) acquired on 3/15/2012 for a female participant (visit v02). Predict the subject's T1 scan age in years and answer with a numeric value using one decimal place.",
      "answer": "77.7",
      "answer_code": "77.7",
      "answer_units": "years",
      "demographics": {
        "sex": "female",
        "sex_code": "2",
        "visit": "v02",
        "phc_scandate": "2012-03-15",
        "image_acq_date": "3/15/2012"
      }
    },
    {
      "image_id": "I285808",
      "image_path": "ADNI_Nifti_QC_N4/I285808_T1_N4.nii.gz",
      "ptid": "002_S_4521",
      "visit": "v02",
      "acq_date": "2/17/2012",
      "phc_scan_date": "2012-02-17",
      "source": "phc",
      "question": "MRI scan (Image Data ID I285808) acquired on 2/17/2012 for a male participant (visit v02). Predict the subject's T1 scan age in years and answer with a numeric value using one decimal place.",
      "answer": "70.1",
      "answer_code": "70.1",
      "answer_units": "years",
      "demographics": {
        "sex": "male",
        "sex_code": "1",
        "visit": "v02",
        "phc_scandate": "2012-02-17",
        "image_acq_date": "2/17/2012"
      }
    },
    {
      "image_id": "I191943",
      "image_path": "ADNI_Nifti_QC_N4/I191943_T1_N4.nii.gz",
      "ptid": "027_S_0835",
      "visit": "m48",
      "acq_date": "9/02/2010",
      "phc_scan_date": "2010-09-02",
      "source": "phc",
      "question": "MRI scan (Image Data ID I191943) acquired on 9/02/2010 for a male participant (visit m48). Predict the subject's T1 scan age in years and answer with a numeric value using one decimal place.",
      "answer": "76.9",
      "answer_code": "76.9",
      "answer_units": "years",
      "demographics": {
        "sex": "male",
        "sex_code": "1",
        "visit": "m48",
        "phc_scandate": "2010-09-02",
        "image_acq_date": "9/02/2010"
      }
    },
    {
      "image_id": "I382149",
      "image_path": "ADNI_Nifti_QC_N4/I382149_T1_N4.nii.gz",
      "ptid": "116_S_4092",
      "visit": "v21",
      "acq_date": "7/22/2013",
      "phc_scan_date": "2013-07-22",
      "source": "phc",
      "question": "MRI scan (Image Data ID I382149) acquired on 7/22/2013 for a female participant (visit v21). Predict the subject's T1 scan age in years and answer with a numeric value using one decimal place.",
      "answer": "83.7",
      "answer_code": "83.7",
      "answer_units": "years",
      "demographics": {
        "sex": "female",
        "sex_code": "2",
        "visit": "v21",
        "phc_scandate": "2013-07-22",
        "image_acq_date": "7/22/2013"
      }
    },
    {
      "image_id": "I75553",
      "image_path": "ADNI_Nifti_QC_N4/I75553_T1_N4.nii.gz",
      "ptid": "027_S_0850",
      "visit": "m12",
      "acq_date": "9/26/2007",
      "phc_scan_date": "2007-09-26",
      "source": "phc",
      "question": "MRI scan (Image Data ID I75553) acquired on 9/26/2007 for a male participant (visit m12). Predict the subject's T1 scan age in years and answer with a numeric value using one decimal place.",
      "answer": "79.3",
      "answer_code": "79.3",
      "answer_units": "years",
      "demographics": {
        "sex": "male",
        "sex_code": "1",
        "visit": "m12",
        "phc_scandate": "2007-09-26",
        "image_acq_date": "9/26/2007"
      }
    },
    {
      "image_id": "I440020",
      "image_path": "ADNI_Nifti_QC_N4/I440020_T1_N4.nii.gz",
      "ptid": "072_S_4871",
      "visit": "v21",
      "acq_date": "8/12/2014",
      "phc_scan_date": "2014-08-12",
      "source": "phc",
      "question": "MRI scan (Image Data ID I440020) acquired on 8/12/2014 for a female participant (visit v21). Predict the subject's T1 scan age in years and answer with a numeric value using one decimal place.",
      "answer": "68.6",
      "answer_code": "68.6",
      "answer_units": "years",
      "demographics": {
        "sex": "female",
        "sex_code": "2",
        "visit": "v21",
        "phc_scandate": "2014-08-12",
        "image_acq_date": "8/12/2014"
      }
    },
    {
      "image_id": "I261100",
      "image_path": "ADNI_Nifti_QC_N4/I261100_T1_N4.nii.gz",
      "ptid": "941_S_4036",
      "visit": "v04",
      "acq_date": "10/06/2011",
      "phc_scan_date": "2011-10-06",
      "source": "phc",
      "question": "MRI scan (Image Data ID I261100) acquired on 10/06/2011 for a male participant (visit v04). Predict the subject's T1 scan age in years and answer with a numeric value using one decimal place.",
      "answer": "74.5",
      "answer_code": "74.5",
      "answer_units": "years",
      "demographics": {
        "sex": "male",
        "sex_code": "1",
        "visit": "v04",
        "phc_scandate": "2011-10-06",
        "image_acq_date": "10/06/2011"
      }
    },
    {
      "image_id": "I330241",
      "image_path": "ADNI_Nifti_QC_N4/I330241_T1_N4.nii.gz",
      "ptid": "072_S_4539",
      "visit": "v05",
      "acq_date": "9/05/2012",
      "phc_scan_date": "2012-09-05",
      "source": "phc",
      "question": "MRI scan (Image Data ID I330241) acquired on 9/05/2012 for a female participant (visit v05). Predict the subject's T1 scan age in years and answer with a numeric value using one decimal place.",
      "answer": "67",
      "answer_code": "67",
      "answer_units": "years",
      "demographics": {
        "sex": "female",
        "sex_code": "2",
        "visit": "v05",
        "phc_scandate": "2012-09-05",
        "image_acq_date": "9/05/2012"
      }
    },
    {
      "image_id": "I40902",
      "image_path": "ADNI_Nifti_QC_N4/I40902_T1_N4.nii.gz",
      "ptid": "033_S_1279",
      "visit": "sc",
      "acq_date": "2/12/2007",
      "phc_scan_date": "2007-02-12",
      "source": "phc",
      "question": "MRI scan (Image Data ID I40902) acquired on 2/12/2007 for a female participant (visit sc). Predict the subject's T1 scan age in years and answer with a numeric value using one decimal place.",
      "answer": "68.4",
      "answer_code": "68.4",
      "answer_units": "years",
      "demographics": {
        "sex": "female",
        "sex_code": "2",
        "visit": "sc",
        "phc_scandate": "2007-02-12",
        "image_acq_date": "2/12/2007"
      }
    },
    {
      "image_id": "I288452",
      "image_path": "ADNI_Nifti_QC_N4/I288452_T1_N4.nii.gz",
      "ptid": "022_S_4291",
      "visit": "v04",
      "acq_date": "2/29/2012",
      "phc_scan_date": "2012-02-29",
      "source": "phc",
      "question": "MRI scan (Image Data ID I288452) acquired on 2/29/2012 for a female participant (visit v04). Predict the subject's T1 scan age in years and answer with a numeric value using one decimal place.",
      "answer": "76",
      "answer_code": "76",
      "answer_units": "years",
      "demographics": {
        "sex": "female",
        "sex_code": "2",
        "visit": "v04",
        "phc_scandate": "2012-02-29",
        "image_acq_date": "2/29/2012"
      }
    },
    {
      "image_id": "I298650",
      "image_path": "ADNI_Nifti_QC_N4/I298650_T1_N4.nii.gz",
      "ptid": "135_S_4281",
      "visit": "v05",
      "acq_date": "4/19/2012",
      "phc_scan_date": "2012-04-19",
      "source": "phc",
      "question": "MRI scan (Image Data ID I298650) acquired on 4/19/2012 for a female participant (visit v05). Predict the subject's T1 scan age in years and answer with a numeric value using one decimal place.",
      "answer": "78.1",
      "answer_code": "78.1",
      "answer_units": "years",
      "demographics": {
        "sex": "female",
        "sex_code": "2",
        "visit": "v05",
        "phc_scandate": "2012-04-19",
        "image_acq_date": "4/19/2012"
      }
    },
    {
      "image_id": "I396289",
      "image_path": "ADNI_Nifti_QC_N4/I396289_T1_N4.nii.gz",
      "ptid": "051_S_5285",
      "visit": "v02",
      "acq_date": "10/28/2013",
      "phc_scan_date": "2013-10-28",
      "source": "phc",
      "question": "MRI scan (Image Data ID I396289) acquired on 10/28/2013 for a male participant (visit v02). Predict the subject's T1 scan age in years and answer with a numeric value using one decimal place.",
      "answer": "71.7",
      "answer_code": "71.7",
      "answer_units": "years",
      "demographics": {
        "sex": "male",
        "sex_code": "1",
        "visit": "v02",
        "phc_scandate": "2013-10-28",
        "image_acq_date": "10/28/2013"
      }
    },
    {
      "image_id": "I389487",
      "image_path": "ADNI_Nifti_QC_N4/I389487_T1_N4.nii.gz",
      "ptid": "033_S_4177",
      "visit": "v21",
      "acq_date": "9/11/2013",
      "phc_scan_date": "2013-09-11",
      "source": "phc",
      "question": "MRI scan (Image Data ID I389487) acquired on 9/11/2013 for a male participant (visit v21). Predict the subject's T1 scan age in years and answer with a numeric value using one decimal place.",
      "answer": "87.1",
      "answer_code": "87.1",
      "answer_units": "years",
      "demographics": {
        "sex": "male",
        "sex_code": "1",
        "visit": "v21",
        "phc_scandate": "2013-09-11",
        "image_acq_date": "9/11/2013"
      }
    },
    {
      "image_id": "I355689",
      "image_path": "ADNI_Nifti_QC_N4/I355689_T1_N4.nii.gz",
      "ptid": "135_S_4446",
      "visit": "v11",
      "acq_date": "1/22/2013",
      "phc_scan_date": "2013-01-22",
      "source": "phc",
      "question": "MRI scan (Image Data ID I355689) acquired on 1/22/2013 for a female participant (visit v11). Predict the subject's T1 scan age in years and answer with a numeric value using one decimal place.",
      "answer": "69.5",
      "answer_code": "69.5",
      "answer_units": "years",
      "demographics": {
        "sex": "female",
        "sex_code": "2",
        "visit": "v11",
        "phc_scandate": "2013-01-22",
        "image_acq_date": "1/22/2013"
      }
    },
    {
      "image_id": "I270300",
      "image_path": "ADNI_Nifti_QC_N4/I270300_T1_N4.nii.gz",
      "ptid": "027_S_2219",
      "visit": "m12",
      "acq_date": "12/06/2011",
      "phc_scan_date": "2011-12-06",
      "source": "phc",
      "question": "MRI scan (Image Data ID I270300) acquired on 12/06/2011 for a male participant (visit m12). Predict the subject's T1 scan age in years and answer with a numeric value using one decimal place.",
      "answer": "75.4",
      "answer_code": "75.4",
      "answer_units": "years",
      "demographics": {
        "sex": "male",
        "sex_code": "1",
        "visit": "m12",
        "phc_scandate": "2011-12-06",
        "image_acq_date": "12/06/2011"
      }
    },
    {
      "image_id": "I153405",
      "image_path": "ADNI_Nifti_QC_N4/I153405_T1_N4.nii.gz",
      "ptid": "041_S_1418",
      "visit": "m24",
      "acq_date": "8/18/2009",
      "phc_scan_date": "2009-08-18",
      "source": "phc",
      "question": "MRI scan (Image Data ID I153405) acquired on 8/18/2009 for a male participant (visit m24). Predict the subject's T1 scan age in years and answer with a numeric value using one decimal place.",
      "answer": "83.7",
      "answer_code": "83.7",
      "answer_units": "years",
      "demographics": {
        "sex": "male",
        "sex_code": "1",
        "visit": "m24",
        "phc_scandate": "2009-08-18",
        "image_acq_date": "8/18/2009"
      }
    },
    {
      "image_id": "I40273",
      "image_path": "ADNI_Nifti_QC_N4/I40273_T1_N4.nii.gz",
      "ptid": "023_S_0139",
      "visit": "m12",
      "acq_date": "2/15/2007",
      "phc_scan_date": "2007-02-15",
      "source": "phc",
      "question": "MRI scan (Image Data ID I40273) acquired on 2/15/2007 for a female participant (visit m12). Predict the subject's T1 scan age in years and answer with a numeric value using one decimal place.",
      "answer": "67",
      "answer_code": "67",
      "answer_units": "years",
      "demographics": {
        "sex": "female",
        "sex_code": "2",
        "visit": "m12",
        "phc_scandate": "2007-02-15",
        "image_acq_date": "2/15/2007"
      }
    },
    {
      "image_id": "I23097",
      "image_path": "ADNI_Nifti_QC_N4/I23097_T1_N4.nii.gz",
      "ptid": "116_S_0752",
      "visit": "sc",
      "acq_date": "8/16/2006",
      "phc_scan_date": "2006-08-16",
      "source": "phc",
      "question": "MRI scan (Image Data ID I23097) acquired on 8/16/2006 for a female participant (visit sc). Predict the subject's T1 scan age in years and answer with a numeric value using one decimal place.",
      "answer": "82",
      "answer_code": "82",
      "answer_units": "years",
      "demographics": {
        "sex": "female",
        "sex_code": "2",
        "visit": "sc",
        "phc_scandate": "2006-08-16",
        "image_acq_date": "8/16/2006"
      }
    },
    {
      "image_id": "I13152",
      "image_path": "ADNI_Nifti_QC_N4/I13152_T1_N4.nii.gz",
      "ptid": "037_S_0303",
      "visit": "sc",
      "acq_date": "4/07/2006",
      "phc_scan_date": "2006-04-07",
      "source": "phc",
      "question": "MRI scan (Image Data ID I13152) acquired on 4/07/2006 for a male participant (visit sc). Predict the subject's T1 scan age in years and answer with a numeric value using one decimal place.",
      "answer": "84.4",
      "answer_code": "84.4",
      "answer_units": "years",
      "demographics": {
        "sex": "male",
        "sex_code": "1",
        "visit": "sc",
        "phc_scandate": "2006-04-07",
        "image_acq_date": "4/07/2006"
      }
    },
    {
      "image_id": "I212301",
      "image_path": "ADNI_Nifti_QC_N4/I212301_T1_N4.nii.gz",
      "ptid": "141_S_2210",
      "visit": "scmri",
      "acq_date": "1/04/2011",
      "phc_scan_date": "2011-01-04",
      "source": "phc",
      "question": "MRI scan (Image Data ID I212301) acquired on 1/04/2011 for a female participant (visit scmri). Predict the subject's T1 scan age in years and answer with a numeric value using one decimal place.",
      "answer": "80.1",
      "answer_code": "80.1",
      "answer_units": "years",
      "demographics": {
        "sex": "female",
        "sex_code": "2",
        "visit": "scmri",
        "phc_scandate": "2011-01-04",
        "image_acq_date": "1/04/2011"
      }
    },
    {
      "image_id": "I67541",
      "image_path": "ADNI_Nifti_QC_N4/I67541_T1_N4.nii.gz",
      "ptid": "027_S_1254",
      "visit": "m06",
      "acq_date": "8/13/2007",
      "phc_scan_date": "2007-08-13",
      "source": "phc",
      "question": "MRI scan (Image Data ID I67541) acquired on 8/13/2007 for a male participant (visit m06). Predict the subject's T1 scan age in years and answer with a numeric value using one decimal place.",
      "answer": "84.9",
      "answer_code": "84.9",
      "answer_units": "years",
      "demographics": {
        "sex": "male",
        "sex_code": "1",
        "visit": "m06",
        "phc_scandate": "2007-08-13",
        "image_acq_date": "8/13/2007"
      }
    },
    {
      "image_id": "I395745",
      "image_path": "ADNI_Nifti_QC_N4/I395745_T1_N4.nii.gz",
      "ptid": "073_S_4216",
      "visit": "v21",
      "acq_date": "10/22/2013",
      "phc_scan_date": "2013-10-22",
      "source": "phc",
      "question": "MRI scan (Image Data ID I395745) acquired on 10/22/2013 for a male participant (visit v21). Predict the subject's T1 scan age in years and answer with a numeric value using one decimal place.",
      "answer": "58.6",
      "answer_code": "58.6",
      "answer_units": "years",
      "demographics": {
        "sex": "male",
        "sex_code": "1",
        "visit": "v21",
        "phc_scandate": "2013-10-22",
        "image_acq_date": "10/22/2013"
      }
    },
    {
      "image_id": "I286944",
      "image_path": "ADNI_Nifti_QC_N4/I286944_T1_N4.nii.gz",
      "ptid": "031_S_4194",
      "visit": "v05",
      "acq_date": "2/28/2012",
      "phc_scan_date": "2012-02-28",
      "source": "phc",
      "question": "MRI scan (Image Data ID I286944) acquired on 2/28/2012 for a male participant (visit v05). Predict the subject's T1 scan age in years and answer with a numeric value using one decimal place.",
      "answer": "62.6",
      "answer_code": "62.6",
      "answer_units": "years",
      "demographics": {
        "sex": "male",
        "sex_code": "1",
        "visit": "v05",
        "phc_scandate": "2012-02-28",
        "image_acq_date": "2/28/2012"
      }
    },
    {
      "image_id": "I419542",
      "image_path": "ADNI_Nifti_QC_N4/I419542_T1_N4.nii.gz",
      "ptid": "037_S_4308",
      "visit": "v21",
      "acq_date": "4/09/2014",
      "phc_scan_date": "2014-04-09",
      "source": "phc",
      "question": "MRI scan (Image Data ID I419542) acquired on 4/09/2014 for a male participant (visit v21). Predict the subject's T1 scan age in years and answer with a numeric value using one decimal place.",
      "answer": "76.3",
      "answer_code": "76.3",
      "answer_units": "years",
      "demographics": {
        "sex": "male",
        "sex_code": "1",
        "visit": "v21",
        "phc_scandate": "2014-04-09",
        "image_acq_date": "4/09/2014"
      }
    },
    {
      "image_id": "I37761",
      "image_path": "ADNI_Nifti_QC_N4/I37761_T1_N4.nii.gz",
      "ptid": "007_S_1206",
      "visit": "bl",
      "acq_date": "1/30/2007",
      "phc_scan_date": "2007-01-30",
      "source": "phc",
      "question": "MRI scan (Image Data ID I37761) acquired on 1/30/2007 for a male participant (visit bl). Predict the subject's T1 scan age in years and answer with a numeric value using one decimal place.",
      "answer": "73",
      "answer_code": "73",
      "answer_units": "years",
      "demographics": {
        "sex": "male",
        "sex_code": "1",
        "visit": "bl",
        "phc_scandate": "2007-01-30",
        "image_acq_date": "1/30/2007"
      }
    },
    {
      "image_id": "I345532",
      "image_path": "ADNI_Nifti_QC_N4/I345532_T1_N4.nii.gz",
      "ptid": "014_S_4328",
      "visit": "v11",
      "acq_date": "11/08/2012",
      "phc_scan_date": "2012-11-08",
      "source": "phc",
      "question": "MRI scan (Image Data ID I345532) acquired on 11/08/2012 for a female participant (visit v11). Predict the subject's T1 scan age in years and answer with a numeric value using one decimal place.",
      "answer": "68.7",
      "answer_code": "68.7",
      "answer_units": "years",
      "demographics": {
        "sex": "female",
        "sex_code": "2",
        "visit": "v11",
        "phc_scandate": "2012-11-08",
        "image_acq_date": "11/08/2012"
      }
    },
    {
      "image_id": "I209511",
      "image_path": "ADNI_Nifti_QC_N4/I209511_T1_N4.nii.gz",
      "ptid": "068_S_2248",
      "visit": "scmri",
      "acq_date": "12/21/2010",
      "phc_scan_date": "2010-12-21",
      "source": "phc",
      "question": "MRI scan (Image Data ID I209511) acquired on 12/21/2010 for a male participant (visit scmri). Predict the subject's T1 scan age in years and answer with a numeric value using one decimal place.",
      "answer": "76.2",
      "answer_code": "76.2",
      "answer_units": "years",
      "demographics": {
        "sex": "male",
        "sex_code": "1",
        "visit": "scmri",
        "phc_scandate": "2010-12-21",
        "image_acq_date": "12/21/2010"
      }
    },
    {
      "image_id": "I30624",
      "image_path": "ADNI_Nifti_QC_N4/I30624_T1_N4.nii.gz",
      "ptid": "114_S_0458",
      "visit": "m06",
      "acq_date": "11/27/2006",
      "phc_scan_date": "2006-11-27",
      "source": "phc",
      "question": "MRI scan (Image Data ID I30624) acquired on 11/27/2006 for a female participant (visit m06). Predict the subject's T1 scan age in years and answer with a numeric value using one decimal place.",
      "answer": "83.6",
      "answer_code": "83.6",
      "answer_units": "years",
      "demographics": {
        "sex": "female",
        "sex_code": "2",
        "visit": "m06",
        "phc_scandate": "2006-11-27",
        "image_acq_date": "11/27/2006"
      }
    },
    {
      "image_id": "I77171",
      "image_path": "ADNI_Nifti_QC_N4/I77171_T1_N4.nii.gz",
      "ptid": "027_S_0256",
      "visit": "m18",
      "acq_date": "10/08/2007",
      "phc_scan_date": "2007-10-08",
      "source": "phc",
      "question": "MRI scan (Image Data ID I77171) acquired on 10/08/2007 for a male participant (visit m18). Predict the subject's T1 scan age in years and answer with a numeric value using one decimal place.",
      "answer": "71.8",
      "answer_code": "71.8",
      "answer_units": "years",
      "demographics": {
        "sex": "male",
        "sex_code": "1",
        "visit": "m18",
        "phc_scandate": "2007-10-08",
        "image_acq_date": "10/08/2007"
      }
    },
    {
      "image_id": "I298235",
      "image_path": "ADNI_Nifti_QC_N4/I298235_T1_N4.nii.gz",
      "ptid": "041_S_4200",
      "visit": "v05",
      "acq_date": "4/18/2012",
      "phc_scan_date": "2012-04-18",
      "source": "phc",
      "question": "MRI scan (Image Data ID I298235) acquired on 4/18/2012 for a female participant (visit v05). Predict the subject's T1 scan age in years and answer with a numeric value using one decimal place.",
      "answer": "70.9",
      "answer_code": "70.9",
      "answer_units": "years",
      "demographics": {
        "sex": "female",
        "sex_code": "2",
        "visit": "v05",
        "phc_scandate": "2012-04-18",
        "image_acq_date": "4/18/2012"
      }
    },
    {
      "image_id": "I56051",
      "image_path": "ADNI_Nifti_QC_N4/I56051_T1_N4.nii.gz",
      "ptid": "137_S_0994",
      "visit": "m06",
      "acq_date": "6/05/2007",
      "phc_scan_date": "2007-06-05",
      "source": "phc",
      "question": "MRI scan (Image Data ID I56051) acquired on 6/05/2007 for a female participant (visit m06). Predict the subject's T1 scan age in years and answer with a numeric value using one decimal place.",
      "answer": "55.8",
      "answer_code": "55.8",
      "answer_units": "years",
      "demographics": {
        "sex": "female",
        "sex_code": "2",
        "visit": "m06",
        "phc_scandate": "2007-06-05",
        "image_acq_date": "6/05/2007"
      }
    },
    {
      "image_id": "I124711",
      "image_path": "ADNI_Nifti_QC_N4/I124711_T1_N4.nii.gz",
      "ptid": "109_S_1157",
      "visit": "m12",
      "acq_date": "1/23/2008",
      "phc_scan_date": "2008-01-23",
      "source": "phc",
      "question": "MRI scan (Image Data ID I124711) acquired on 1/23/2008 for a female participant (visit m12). Predict the subject's T1 scan age in years and answer with a numeric value using one decimal place.",
      "answer": "86",
      "answer_code": "86",
      "answer_units": "years",
      "demographics": {
        "sex": "female",
        "sex_code": "2",
        "visit": "m12",
        "phc_scandate": "2008-01-23",
        "image_acq_date": "1/23/2008"
      }
    },
    {
      "image_id": "I16451",
      "image_path": "ADNI_Nifti_QC_N4/I16451_T1_N4.nii.gz",
      "ptid": "023_S_0604",
      "visit": "sc",
      "acq_date": "6/02/2006",
      "phc_scan_date": "2006-06-02",
      "source": "phc",
      "question": "MRI scan (Image Data ID I16451) acquired on 6/02/2006 for a male participant (visit sc). Predict the subject's T1 scan age in years and answer with a numeric value using one decimal place.",
      "answer": "86.6",
      "answer_code": "86.6",
      "answer_units": "years",
      "demographics": {
        "sex": "male",
        "sex_code": "1",
        "visit": "sc",
        "phc_scandate": "2006-06-02",
        "image_acq_date": "6/02/2006"
      }
    },
    {
      "image_id": "I263916",
      "image_path": "ADNI_Nifti_QC_N4/I263916_T1_N4.nii.gz",
      "ptid": "041_S_4004",
      "visit": "v05",
      "acq_date": "10/28/2011",
      "phc_scan_date": "2011-10-28",
      "source": "phc",
      "question": "MRI scan (Image Data ID I263916) acquired on 10/28/2011 for a female participant (visit v05). Predict the subject's T1 scan age in years and answer with a numeric value using one decimal place.",
      "answer": "67.4",
      "answer_code": "67.4",
      "answer_units": "years",
      "demographics": {
        "sex": "female",
        "sex_code": "2",
        "visit": "v05",
        "phc_scandate": "2011-10-28",
        "image_acq_date": "10/28/2011"
      }
    },
    {
      "image_id": "I49367",
      "image_path": "ADNI_Nifti_QC_N4/I49367_T1_N4.nii.gz",
      "ptid": "023_S_0388",
      "visit": "m12",
      "acq_date": "4/17/2007",
      "phc_scan_date": "2007-04-17",
      "source": "phc",
      "question": "MRI scan (Image Data ID I49367) acquired on 4/17/2007 for a male participant (visit m12). Predict the subject's T1 scan age in years and answer with a numeric value using one decimal place.",
      "answer": "72.3",
      "answer_code": "72.3",
      "answer_units": "years",
      "demographics": {
        "sex": "male",
        "sex_code": "1",
        "visit": "m12",
        "phc_scandate": "2007-04-17",
        "image_acq_date": "4/17/2007"
      }
    },
    {
      "image_id": "I293375",
      "image_path": "ADNI_Nifti_QC_N4/I293375_T1_N4.nii.gz",
      "ptid": "128_S_4607",
      "visit": "v02",
      "acq_date": "3/26/2012",
      "phc_scan_date": "2012-03-26",
      "source": "phc",
      "question": "MRI scan (Image Data ID I293375) acquired on 3/26/2012 for a female participant (visit v02). Predict the subject's T1 scan age in years and answer with a numeric value using one decimal place.",
      "answer": "56.3",
      "answer_code": "56.3",
      "answer_units": "years",
      "demographics": {
        "sex": "female",
        "sex_code": "2",
        "visit": "v02",
        "phc_scandate": "2012-03-26",
        "image_acq_date": "3/26/2012"
      }
    },
    {
      "image_id": "I269953",
      "image_path": "ADNI_Nifti_QC_N4/I269953_T1_N4.nii.gz",
      "ptid": "041_S_4037",
      "visit": "v05",
      "acq_date": "12/05/2011",
      "phc_scan_date": "2011-12-05",
      "source": "phc",
      "question": "MRI scan (Image Data ID I269953) acquired on 12/05/2011 for a male participant (visit v05). Predict the subject's T1 scan age in years and answer with a numeric value using one decimal place.",
      "answer": "76.3",
      "answer_code": "76.3",
      "answer_units": "years",
      "demographics": {
        "sex": "male",
        "sex_code": "1",
        "visit": "v05",
        "phc_scandate": "2011-12-05",
        "image_acq_date": "12/05/2011"
      }
    },
    {
      "image_id": "I85308",
      "image_path": "ADNI_Nifti_QC_N4/I85308_T1_N4.nii.gz",
      "ptid": "022_S_1394",
      "visit": "m06",
      "acq_date": "12/14/2007",
      "phc_scan_date": "2007-12-14",
      "source": "phc",
      "question": "MRI scan (Image Data ID I85308) acquired on 12/14/2007 for a male participant (visit m06). Predict the subject's T1 scan age in years and answer with a numeric value using one decimal place.",
      "answer": "77.7",
      "answer_code": "77.7",
      "answer_units": "years",
      "demographics": {
        "sex": "male",
        "sex_code": "1",
        "visit": "m06",
        "phc_scandate": "2007-12-14",
        "image_acq_date": "12/14/2007"
      }
    },
    {
      "image_id": "I390424",
      "image_path": "ADNI_Nifti_QC_N4/I390424_T1_N4.nii.gz",
      "ptid": "013_S_4917",
      "visit": "v11",
      "acq_date": "8/06/2013",
      "phc_scan_date": "2013-08-06",
      "source": "phc",
      "question": "MRI scan (Image Data ID I390424) acquired on 8/06/2013 for a male participant (visit v11). Predict the subject's T1 scan age in years and answer with a numeric value using one decimal place.",
      "answer": "76",
      "answer_code": "76",
      "answer_units": "years",
      "demographics": {
        "sex": "male",
        "sex_code": "1",
        "visit": "v11",
        "phc_scandate": "2013-08-06",
        "image_acq_date": "8/06/2013"
      }
    },
    {
      "image_id": "I322227",
      "image_path": "ADNI_Nifti_QC_N4/I322227_T1_N4.nii.gz",
      "ptid": "073_S_2182",
      "visit": "v06",
      "acq_date": "8/06/2012",
      "phc_scan_date": "2012-08-06",
      "source": "phc",
      "question": "MRI scan (Image Data ID I322227) acquired on 8/06/2012 for a male participant (visit v06). Predict the subject's T1 scan age in years and answer with a numeric value using one decimal place.",
      "answer": "67.3",
      "answer_code": "67.3",
      "answer_units": "years",
      "demographics": {
        "sex": "male",
        "sex_code": "1",
        "visit": "v06",
        "phc_scandate": "2012-08-06",
        "image_acq_date": "8/06/2012"
      }
    },
    {
      "image_id": "I56717",
      "image_path": "ADNI_Nifti_QC_N4/I56717_T1_N4.nii.gz",
      "ptid": "053_S_0507",
      "visit": "m12",
      "acq_date": "6/11/2007",
      "phc_scan_date": "2007-06-11",
      "source": "phc",
      "question": "MRI scan (Image Data ID I56717) acquired on 6/11/2007 for a female participant (visit m12). Predict the subject's T1 scan age in years and answer with a numeric value using one decimal place.",
      "answer": "56.4",
      "answer_code": "56.4",
      "answer_units": "years",
      "demographics": {
        "sex": "female",
        "sex_code": "2",
        "visit": "m12",
        "phc_scandate": "2007-06-11",
        "image_acq_date": "6/11/2007"
      }
    },
    {
      "image_id": "I51665",
      "image_path": "ADNI_Nifti_QC_N4/I51665_T1_N4.nii.gz",
      "ptid": "023_S_0030",
      "visit": "m18",
      "acq_date": "4/27/2007",
      "phc_scan_date": "2007-04-27",
      "source": "phc",
      "question": "MRI scan (Image Data ID I51665) acquired on 4/27/2007 for a female participant (visit m18). Predict the subject's T1 scan age in years and answer with a numeric value using one decimal place.",
      "answer": "81.6",
      "answer_code": "81.6",
      "answer_units": "years",
      "demographics": {
        "sex": "female",
        "sex_code": "2",
        "visit": "m18",
        "phc_scandate": "2007-04-27",
        "image_acq_date": "4/27/2007"
      }
    },
    {
      "image_id": "I468185",
      "image_path": "ADNI_Nifti_QC_N4/I468185_T1_N4.nii.gz",
      "ptid": "114_S_5047",
      "visit": "v21",
      "acq_date": "12/29/2014",
      "phc_scan_date": "2014-12-29",
      "source": "phc",
      "question": "MRI scan (Image Data ID I468185) acquired on 12/29/2014 for a female participant (visit v21). Predict the subject's T1 scan age in years and answer with a numeric value using one decimal place.",
      "answer": "71",
      "answer_code": "71",
      "answer_units": "years",
      "demographics": {
        "sex": "female",
        "sex_code": "2",
        "visit": "v21",
        "phc_scandate": "2014-12-29",
        "image_acq_date": "12/29/2014"
      }
    },
    {
      "image_id": "I471756",
      "image_path": "ADNI_Nifti_QC_N4/I471756_T1_N4.nii.gz",
      "ptid": "094_S_2201",
      "visit": "v31",
      "acq_date": "2/03/2015",
      "phc_scan_date": "2015-02-03",
      "source": "phc",
      "question": "MRI scan (Image Data ID I471756) acquired on 2/03/2015 for a female participant (visit v31). Predict the subject's T1 scan age in years and answer with a numeric value using one decimal place.",
      "answer": "67.9",
      "answer_code": "67.9",
      "answer_units": "years",
      "demographics": {
        "sex": "female",
        "sex_code": "2",
        "visit": "v31",
        "phc_scandate": "2015-02-03",
        "image_acq_date": "2/03/2015"
      }
    },
    {
      "image_id": "I398430",
      "image_path": "ADNI_Nifti_QC_N4/I398430_T1_N4.nii.gz",
      "ptid": "136_S_4189",
      "visit": "v21",
      "acq_date": "11/06/2013",
      "phc_scan_date": "2013-11-06",
      "source": "phc",
      "question": "MRI scan (Image Data ID I398430) acquired on 11/06/2013 for a female participant (visit v21). Predict the subject's T1 scan age in years and answer with a numeric value using one decimal place.",
      "answer": "75.4",
      "answer_code": "75.4",
      "answer_units": "years",
      "demographics": {
        "sex": "female",
        "sex_code": "2",
        "visit": "v21",
        "phc_scandate": "2013-11-06",
        "image_acq_date": "11/06/2013"
      }
    },
    {
      "image_id": "I106131",
      "image_path": "ADNI_Nifti_QC_N4/I106131_T1_N4.nii.gz",
      "ptid": "094_S_0434",
      "visit": "m24",
      "acq_date": "5/08/2008",
      "phc_scan_date": "2008-05-08",
      "source": "phc",
      "question": "MRI scan (Image Data ID I106131) acquired on 5/08/2008 for a male participant (visit m24). Predict the subject's T1 scan age in years and answer with a numeric value using one decimal place.",
      "answer": "73.9",
      "answer_code": "73.9",
      "answer_units": "years",
      "demographics": {
        "sex": "male",
        "sex_code": "1",
        "visit": "m24",
        "phc_scandate": "2008-05-08",
        "image_acq_date": "5/08/2008"
      }
    },
    {
      "image_id": "I416662",
      "image_path": "ADNI_Nifti_QC_N4/I416662_T1_N4.nii.gz",
      "ptid": "007_S_4387",
      "visit": "v21",
      "acq_date": "12/02/2013",
      "phc_scan_date": "2013-12-02",
      "source": "phc",
      "question": "MRI scan (Image Data ID I416662) acquired on 12/02/2013 for a female participant (visit v21). Predict the subject's T1 scan age in years and answer with a numeric value using one decimal place.",
      "answer": "78.2",
      "answer_code": "78.2",
      "answer_units": "years",
      "demographics": {
        "sex": "female",
        "sex_code": "2",
        "visit": "v21",
        "phc_scandate": "2013-12-02",
        "image_acq_date": "12/02/2013"
      }
    },
    {
      "image_id": "I372419",
      "image_path": "ADNI_Nifti_QC_N4/I372419_T1_N4.nii.gz",
      "ptid": "016_S_4646",
      "visit": "v11",
      "acq_date": "5/14/2013",
      "phc_scan_date": "2013-05-14",
      "source": "phc",
      "question": "MRI scan (Image Data ID I372419) acquired on 5/14/2013 for a female participant (visit v11). Predict the subject's T1 scan age in years and answer with a numeric value using one decimal place.",
      "answer": "62",
      "answer_code": "62",
      "answer_units": "years",
      "demographics": {
        "sex": "female",
        "sex_code": "2",
        "visit": "v11",
        "phc_scandate": "2013-05-14",
        "image_acq_date": "5/14/2013"
      }
    },
    {
      "image_id": "I189998",
      "image_path": "ADNI_Nifti_QC_N4/I189998_T1_N4.nii.gz",
      "ptid": "016_S_2031",
      "visit": "scmri",
      "acq_date": "8/11/2010",
      "phc_scan_date": "2010-08-11",
      "source": "phc",
      "question": "MRI scan (Image Data ID I189998) acquired on 8/11/2010 for a male participant (visit scmri). Predict the subject's T1 scan age in years and answer with a numeric value using one decimal place.",
      "answer": "72.7",
      "answer_code": "72.7",
      "answer_units": "years",
      "demographics": {
        "sex": "male",
        "sex_code": "1",
        "visit": "scmri",
        "phc_scandate": "2010-08-11",
        "image_acq_date": "8/11/2010"
      }
    },
    {
      "image_id": "I134227",
      "image_path": "ADNI_Nifti_QC_N4/I134227_T1_N4.nii.gz",
      "ptid": "018_S_0043",
      "visit": "m36",
      "acq_date": "1/21/2009",
      "phc_scan_date": "2009-01-21",
      "source": "phc",
      "question": "MRI scan (Image Data ID I134227) acquired on 1/21/2009 for a male participant (visit m36). Predict the subject's T1 scan age in years and answer with a numeric value using one decimal place.",
      "answer": "79.5",
      "answer_code": "79.5",
      "answer_units": "years",
      "demographics": {
        "sex": "male",
        "sex_code": "1",
        "visit": "m36",
        "phc_scandate": "2009-01-21",
        "image_acq_date": "1/21/2009"
      }
    },
    {
      "image_id": "I347019",
      "image_path": "ADNI_Nifti_QC_N4/I347019_T1_N4.nii.gz",
      "ptid": "114_S_4379",
      "visit": "v05",
      "acq_date": "11/09/2012",
      "phc_scan_date": "2012-11-09",
      "source": "phc",
      "question": "MRI scan (Image Data ID I347019) acquired on 11/09/2012 for a female participant (visit v05). Predict the subject's T1 scan age in years and answer with a numeric value using one decimal place.",
      "answer": "88.9",
      "answer_code": "88.9",
      "answer_units": "years",
      "demographics": {
        "sex": "female",
        "sex_code": "2",
        "visit": "v05",
        "phc_scandate": "2012-11-09",
        "image_acq_date": "11/09/2012"
      }
    },
    {
      "image_id": "I259331",
      "image_path": "ADNI_Nifti_QC_N4/I259331_T1_N4.nii.gz",
      "ptid": "130_S_2403",
      "visit": "scmri",
      "acq_date": "9/30/2011",
      "phc_scan_date": "2011-09-30",
      "source": "phc",
      "question": "MRI scan (Image Data ID I259331) acquired on 9/30/2011 for a female participant (visit scmri). Predict the subject's T1 scan age in years and answer with a numeric value using one decimal place.",
      "answer": "79.3",
      "answer_code": "79.3",
      "answer_units": "years",
      "demographics": {
        "sex": "female",
        "sex_code": "2",
        "visit": "scmri",
        "phc_scandate": "2011-09-30",
        "image_acq_date": "9/30/2011"
      }
    },
    {
      "image_id": "I137683",
      "image_path": "ADNI_Nifti_QC_N4/I137683_T1_N4.nii.gz",
      "ptid": "036_S_1135",
      "visit": "m24",
      "acq_date": "1/16/2009",
      "phc_scan_date": "2009-01-16",
      "source": "phc",
      "question": "MRI scan (Image Data ID I137683) acquired on 1/16/2009 for a male participant (visit m24). Predict the subject's T1 scan age in years and answer with a numeric value using one decimal place.",
      "answer": "77.8",
      "answer_code": "77.8",
      "answer_units": "years",
      "demographics": {
        "sex": "male",
        "sex_code": "1",
        "visit": "m24",
        "phc_scandate": "2009-01-16",
        "image_acq_date": "1/16/2009"
      }
    },
    {
      "image_id": "I125423",
      "image_path": "ADNI_Nifti_QC_N4/I125423_T1_N4.nii.gz",
      "ptid": "133_S_0912",
      "visit": "m24",
      "acq_date": "11/06/2008",
      "phc_scan_date": "2008-11-06",
      "source": "phc",
      "question": "MRI scan (Image Data ID I125423) acquired on 11/06/2008 for a female participant (visit m24). Predict the subject's T1 scan age in years and answer with a numeric value using one decimal place.",
      "answer": "76.1",
      "answer_code": "76.1",
      "answer_units": "years",
      "demographics": {
        "sex": "female",
        "sex_code": "2",
        "visit": "m24",
        "phc_scandate": "2008-11-06",
        "image_acq_date": "11/06/2008"
      }
    },
    {
      "image_id": "I168313",
      "image_path": "ADNI_Nifti_QC_N4/I168313_T1_N4.nii.gz",
      "ptid": "023_S_0058",
      "visit": "m48",
      "acq_date": "3/19/2010",
      "phc_scan_date": "2010-03-19",
      "source": "phc",
      "question": "MRI scan (Image Data ID I168313) acquired on 3/19/2010 for a male participant (visit m48). Predict the subject's T1 scan age in years and answer with a numeric value using one decimal place.",
      "answer": "74.5",
      "answer_code": "74.5",
      "answer_units": "years",
      "demographics": {
        "sex": "male",
        "sex_code": "1",
        "visit": "m48",
        "phc_scandate": "2010-03-19",
        "image_acq_date": "3/19/2010"
      }
    },
    {
      "image_id": "I27395",
      "image_path": "ADNI_Nifti_QC_N4/I27395_T1_N4.nii.gz",
      "ptid": "014_S_0328",
      "visit": "m06",
      "acq_date": "10/24/2006",
      "phc_scan_date": "2006-10-24",
      "source": "phc",
      "question": "MRI scan (Image Data ID I27395) acquired on 10/24/2006 for a male participant (visit m06). Predict the subject's T1 scan age in years and answer with a numeric value using one decimal place.",
      "answer": "77.3",
      "answer_code": "77.3",
      "answer_units": "years",
      "demographics": {
        "sex": "male",
        "sex_code": "1",
        "visit": "m06",
        "phc_scandate": "2006-10-24",
        "image_acq_date": "10/24/2006"
      }
    },
    {
      "image_id": "I79682",
      "image_path": "ADNI_Nifti_QC_N4/I79682_T1_N4.nii.gz",
      "ptid": "037_S_0552",
      "visit": "m12",
      "acq_date": "6/06/2007",
      "phc_scan_date": "2007-06-06",
      "source": "phc",
      "question": "MRI scan (Image Data ID I79682) acquired on 6/06/2007 for a female participant (visit m12). Predict the subject's T1 scan age in years and answer with a numeric value using one decimal place.",
      "answer": "61.2",
      "answer_code": "61.2",
      "answer_units": "years",
      "demographics": {
        "sex": "female",
        "sex_code": "2",
        "visit": "m12",
        "phc_scandate": "2007-06-06",
        "image_acq_date": "6/06/2007"
      }
    },
    {
      "image_id": "I25013",
      "image_path": "ADNI_Nifti_QC_N4/I25013_T1_N4.nii.gz",
      "ptid": "033_S_0920",
      "visit": "sc",
      "acq_date": "9/22/2006",
      "phc_scan_date": "2006-09-22",
      "source": "phc",
      "question": "MRI scan (Image Data ID I25013) acquired on 9/22/2006 for a female participant (visit sc). Predict the subject's T1 scan age in years and answer with a numeric value using one decimal place.",
      "answer": "80.1",
      "answer_code": "80.1",
      "answer_units": "years",
      "demographics": {
        "sex": "female",
        "sex_code": "2",
        "visit": "sc",
        "phc_scandate": "2006-09-22",
        "image_acq_date": "9/22/2006"
      }
    },
    {
      "image_id": "I208838",
      "image_path": "ADNI_Nifti_QC_N4/I208838_T1_N4.nii.gz",
      "ptid": "032_S_2240",
      "visit": "scmri",
      "acq_date": "12/15/2010",
      "phc_scan_date": "2010-12-15",
      "source": "phc",
      "question": "MRI scan (Image Data ID I208838) acquired on 12/15/2010 for a male participant (visit scmri). Predict the subject's T1 scan age in years and answer with a numeric value using one decimal place.",
      "answer": "78.2",
      "answer_code": "78.2",
      "answer_units": "years",
      "demographics": {
        "sex": "male",
        "sex_code": "1",
        "visit": "scmri",
        "phc_scandate": "2010-12-15",
        "image_acq_date": "12/15/2010"
      }
    },
    {
      "image_id": "I14928",
      "image_path": "ADNI_Nifti_QC_N4/I14928_T1_N4.nii.gz",
      "ptid": "027_S_0485",
      "visit": "sc",
      "acq_date": "5/08/2006",
      "phc_scan_date": "2006-05-08",
      "source": "phc",
      "question": "MRI scan (Image Data ID I14928) acquired on 5/08/2006 for a male participant (visit sc). Predict the subject's T1 scan age in years and answer with a numeric value using one decimal place.",
      "answer": "64.5",
      "answer_code": "64.5",
      "answer_units": "years",
      "demographics": {
        "sex": "male",
        "sex_code": "1",
        "visit": "sc",
        "phc_scandate": "2006-05-08",
        "image_acq_date": "5/08/2006"
      }
    },
    {
      "image_id": "I42742",
      "image_path": "ADNI_Nifti_QC_N4/I42742_T1_N4.nii.gz",
      "ptid": "006_S_0547",
      "visit": "m06",
      "acq_date": "3/05/2007",
      "phc_scan_date": "2007-03-05",
      "source": "phc",
      "question": "MRI scan (Image Data ID I42742) acquired on 3/05/2007 for a male participant (visit m06). Predict the subject's T1 scan age in years and answer with a numeric value using one decimal place.",
      "answer": "76.5",
      "answer_code": "76.5",
      "answer_units": "years",
      "demographics": {
        "sex": "male",
        "sex_code": "1",
        "visit": "m06",
        "phc_scandate": "2007-03-05",
        "image_acq_date": "3/05/2007"
      }
    },
    {
      "image_id": "I163765",
      "image_path": "ADNI_Nifti_QC_N4/I163765_T1_N4.nii.gz",
      "ptid": "029_S_1073",
      "visit": "m36",
      "acq_date": "1/13/2010",
      "phc_scan_date": "2010-01-13",
      "source": "phc",
      "question": "MRI scan (Image Data ID I163765) acquired on 1/13/2010 for a female participant (visit m36). Predict the subject's T1 scan age in years and answer with a numeric value using one decimal place.",
      "answer": "68.9",
      "answer_code": "68.9",
      "answer_units": "years",
      "demographics": {
        "sex": "female",
        "sex_code": "2",
        "visit": "m36",
        "phc_scandate": "2010-01-13",
        "image_acq_date": "1/13/2010"
      }
    },
    {
      "image_id": "I743656",
      "image_path": "ADNI_Nifti_QC_N4/I743656_T1_N4.nii.gz",
      "ptid": "005_S_0553",
      "visit": "v51",
      "acq_date": "6/23/2016",
      "phc_scan_date": "2016-06-23",
      "source": "phc",
      "question": "MRI scan (Image Data ID I743656) acquired on 6/23/2016 for a male participant (visit v51). Predict the subject's T1 scan age in years and answer with a numeric value using one decimal place.",
      "answer": "94.9",
      "answer_code": "94.9",
      "answer_units": "years",
      "demographics": {
        "sex": "male",
        "sex_code": "1",
        "visit": "v51",
        "phc_scandate": "2016-06-23",
        "image_acq_date": "6/23/2016"
      }
    },
    {
      "image_id": "I421369",
      "image_path": "ADNI_Nifti_QC_N4/I421369_T1_N4.nii.gz",
      "ptid": "131_S_0384",
      "visit": "v21",
      "acq_date": "4/23/2014",
      "phc_scan_date": "2014-04-23",
      "source": "phc",
      "question": "MRI scan (Image Data ID I421369) acquired on 4/23/2014 for a male participant (visit v21). Predict the subject's T1 scan age in years and answer with a numeric value using one decimal place.",
      "answer": "88",
      "answer_code": "88",
      "answer_units": "years",
      "demographics": {
        "sex": "male",
        "sex_code": "1",
        "visit": "v21",
        "phc_scandate": "2014-04-23",
        "image_acq_date": "4/23/2014"
      }
    },
    {
      "image_id": "I37859",
      "image_path": "ADNI_Nifti_QC_N4/I37859_T1_N4.nii.gz",
      "ptid": "027_S_1254",
      "visit": "sc",
      "acq_date": "1/31/2007",
      "phc_scan_date": "2007-01-31",
      "source": "phc",
      "question": "MRI scan (Image Data ID I37859) acquired on 1/31/2007 for a male participant (visit sc). Predict the subject's T1 scan age in years and answer with a numeric value using one decimal place.",
      "answer": "84.4",
      "answer_code": "84.4",
      "answer_units": "years",
      "demographics": {
        "sex": "male",
        "sex_code": "1",
        "visit": "sc",
        "phc_scandate": "2007-01-31",
        "image_acq_date": "1/31/2007"
      }
    },
    {
      "image_id": "I289459",
      "image_path": "ADNI_Nifti_QC_N4/I289459_T1_N4.nii.gz",
      "ptid": "116_S_1243",
      "visit": "v06",
      "acq_date": "3/08/2012",
      "phc_scan_date": "2012-03-08",
      "source": "phc",
      "question": "MRI scan (Image Data ID I289459) acquired on 3/08/2012 for a male participant (visit v06). Predict the subject's T1 scan age in years and answer with a numeric value using one decimal place.",
      "answer": "82.5",
      "answer_code": "82.5",
      "answer_units": "years",
      "demographics": {
        "sex": "male",
        "sex_code": "1",
        "visit": "v06",
        "phc_scandate": "2012-03-08",
        "image_acq_date": "3/08/2012"
      }
    },
    {
      "image_id": "I371168",
      "image_path": "ADNI_Nifti_QC_N4/I371168_T1_N4.nii.gz",
      "ptid": "137_S_4587",
      "visit": "v11",
      "acq_date": "5/06/2013",
      "phc_scan_date": "2013-05-06",
      "source": "phc",
      "question": "MRI scan (Image Data ID I371168) acquired on 5/06/2013 for a female participant (visit v11). Predict the subject's T1 scan age in years and answer with a numeric value using one decimal place.",
      "answer": "66.9",
      "answer_code": "66.9",
      "answer_units": "years",
      "demographics": {
        "sex": "female",
        "sex_code": "2",
        "visit": "v11",
        "phc_scandate": "2013-05-06",
        "image_acq_date": "5/06/2013"
      }
    },
    {
      "image_id": "I417163",
      "image_path": "ADNI_Nifti_QC_N4/I417163_T1_N4.nii.gz",
      "ptid": "037_S_4432",
      "visit": "v21",
      "acq_date": "3/19/2014",
      "phc_scan_date": "2014-03-19",
      "source": "phc",
      "question": "MRI scan (Image Data ID I417163) acquired on 3/19/2014 for a male participant (visit v21). Predict the subject's T1 scan age in years and answer with a numeric value using one decimal place.",
      "answer": "63.8",
      "answer_code": "63.8",
      "answer_units": "years",
      "demographics": {
        "sex": "male",
        "sex_code": "1",
        "visit": "v21",
        "phc_scandate": "2014-03-19",
        "image_acq_date": "3/19/2014"
      }
    },
    {
      "image_id": "I307198",
      "image_path": "ADNI_Nifti_QC_N4/I307198_T1_N4.nii.gz",
      "ptid": "128_S_4742",
      "visit": "v02",
      "acq_date": "5/31/2012",
      "phc_scan_date": "2012-05-31",
      "source": "phc",
      "question": "MRI scan (Image Data ID I307198) acquired on 5/31/2012 for a female participant (visit v02). Predict the subject's T1 scan age in years and answer with a numeric value using one decimal place.",
      "answer": "70.7",
      "answer_code": "70.7",
      "answer_units": "years",
      "demographics": {
        "sex": "female",
        "sex_code": "2",
        "visit": "v02",
        "phc_scandate": "2012-05-31",
        "image_acq_date": "5/31/2012"
      }
    },
    {
      "image_id": "I301748",
      "image_path": "ADNI_Nifti_QC_N4/I301748_T1_N4.nii.gz",
      "ptid": "116_S_4483",
      "visit": "v04",
      "acq_date": "5/02/2012",
      "phc_scan_date": "2012-05-02",
      "source": "phc",
      "question": "MRI scan (Image Data ID I301748) acquired on 5/02/2012 for a female participant (visit v04). Predict the subject's T1 scan age in years and answer with a numeric value using one decimal place.",
      "answer": "69.9",
      "answer_code": "69.9",
      "answer_units": "years",
      "demographics": {
        "sex": "female",
        "sex_code": "2",
        "visit": "v04",
        "phc_scandate": "2012-05-02",
        "image_acq_date": "5/02/2012"
      }
    },
    {
      "image_id": "I447048",
      "image_path": "ADNI_Nifti_QC_N4/I447048_T1_N4.nii.gz",
      "ptid": "098_S_2079",
      "visit": "v31",
      "acq_date": "10/07/2014",
      "phc_scan_date": "2014-10-07",
      "source": "phc",
      "question": "MRI scan (Image Data ID I447048) acquired on 10/07/2014 for a male participant (visit v31). Predict the subject's T1 scan age in years and answer with a numeric value using one decimal place.",
      "answer": "69.7",
      "answer_code": "69.7",
      "answer_units": "years",
      "demographics": {
        "sex": "male",
        "sex_code": "1",
        "visit": "v31",
        "phc_scandate": "2014-10-07",
        "image_acq_date": "10/07/2014"
      }
    },
    {
      "image_id": "I425389",
      "image_path": "ADNI_Nifti_QC_N4/I425389_T1_N4.nii.gz",
      "ptid": "137_S_4678",
      "visit": "v21",
      "acq_date": "5/20/2014",
      "phc_scan_date": "2014-05-20",
      "source": "phc",
      "question": "MRI scan (Image Data ID I425389) acquired on 5/20/2014 for a female participant (visit v21). Predict the subject's T1 scan age in years and answer with a numeric value using one decimal place.",
      "answer": "74.5",
      "answer_code": "74.5",
      "answer_units": "years",
      "demographics": {
        "sex": "female",
        "sex_code": "2",
        "visit": "v21",
        "phc_scandate": "2014-05-20",
        "image_acq_date": "5/20/2014"
      }
    },
    {
      "image_id": "I167036",
      "image_path": "ADNI_Nifti_QC_N4/I167036_T1_N4.nii.gz",
      "ptid": "037_S_1078",
      "visit": "m36",
      "acq_date": "3/01/2010",
      "phc_scan_date": "2010-03-01",
      "source": "phc",
      "question": "MRI scan (Image Data ID I167036) acquired on 3/01/2010 for a male participant (visit m36). Predict the subject's T1 scan age in years and answer with a numeric value using one decimal place.",
      "answer": "74",
      "answer_code": "74",
      "answer_units": "years",
      "demographics": {
        "sex": "male",
        "sex_code": "1",
        "visit": "m36",
        "phc_scandate": "2010-03-01",
        "image_acq_date": "3/01/2010"
      }
    },
    {
      "image_id": "I633466",
      "image_path": "ADNI_Nifti_QC_N4/I633466_T1_N4.nii.gz",
      "ptid": "009_S_4359",
      "visit": "v41",
      "acq_date": "2/15/2016",
      "phc_scan_date": "2016-02-15",
      "source": "phc",
      "question": "MRI scan (Image Data ID I633466) acquired on 2/15/2016 for a male participant (visit v41). Predict the subject's T1 scan age in years and answer with a numeric value using one decimal place.",
      "answer": "81",
      "answer_code": "81",
      "answer_units": "years",
      "demographics": {
        "sex": "male",
        "sex_code": "1",
        "visit": "v41",
        "phc_scandate": "2016-02-15",
        "image_acq_date": "2/15/2016"
      }
    },
    {
      "image_id": "I318655",
      "image_path": "ADNI_Nifti_QC_N4/I318655_T1_N4.nii.gz",
      "ptid": "128_S_4671",
      "visit": "v04",
      "acq_date": "7/25/2012",
      "phc_scan_date": "2012-07-25",
      "source": "phc",
      "question": "MRI scan (Image Data ID I318655) acquired on 7/25/2012 for a male participant (visit v04). Predict the subject's T1 scan age in years and answer with a numeric value using one decimal place.",
      "answer": "82.1",
      "answer_code": "82.1",
      "answer_units": "years",
      "demographics": {
        "sex": "male",
        "sex_code": "1",
        "visit": "v04",
        "phc_scandate": "2012-07-25",
        "image_acq_date": "7/25/2012"
      }
    },
    {
      "image_id": "I25973",
      "image_path": "ADNI_Nifti_QC_N4/I25973_T1_N4.nii.gz",
      "ptid": "027_S_0256",
      "visit": "m06",
      "acq_date": "10/06/2006",
      "phc_scan_date": "2006-10-06",
      "source": "phc",
      "question": "MRI scan (Image Data ID I25973) acquired on 10/06/2006 for a male participant (visit m06). Predict the subject's T1 scan age in years and answer with a numeric value using one decimal place.",
      "answer": "70.8",
      "answer_code": "70.8",
      "answer_units": "years",
      "demographics": {
        "sex": "male",
        "sex_code": "1",
        "visit": "m06",
        "phc_scandate": "2006-10-06",
        "image_acq_date": "10/06/2006"
      }
    },
    {
      "image_id": "I173313",
      "image_path": "ADNI_Nifti_QC_N4/I173313_T1_N4.nii.gz",
      "ptid": "116_S_0361",
      "visit": "m48",
      "acq_date": "5/04/2010",
      "phc_scan_date": "2010-05-04",
      "source": "phc",
      "question": "MRI scan (Image Data ID I173313) acquired on 5/04/2010 for a male participant (visit m48). Predict the subject's T1 scan age in years and answer with a numeric value using one decimal place.",
      "answer": "78.6",
      "answer_code": "78.6",
      "answer_units": "years",
      "demographics": {
        "sex": "male",
        "sex_code": "1",
        "visit": "m48",
        "phc_scandate": "2010-05-04",
        "image_acq_date": "5/04/2010"
      }
    },
    {
      "image_id": "I302425",
      "image_path": "ADNI_Nifti_QC_N4/I302425_T1_N4.nii.gz",
      "ptid": "098_S_0172",
      "visit": "v11",
      "acq_date": "3/25/2012",
      "phc_scan_date": "2012-03-25",
      "source": "phc",
      "question": "MRI scan (Image Data ID I302425) acquired on 3/25/2012 for a female participant (visit v11). Predict the subject's T1 scan age in years and answer with a numeric value using one decimal place.",
      "answer": "76.8",
      "answer_code": "76.8",
      "answer_units": "years",
      "demographics": {
        "sex": "female",
        "sex_code": "2",
        "visit": "v11",
        "phc_scandate": "2012-03-25",
        "image_acq_date": "3/25/2012"
      }
    },
    {
      "image_id": "I273295",
      "image_path": "ADNI_Nifti_QC_N4/I273295_T1_N4.nii.gz",
      "ptid": "022_S_2379",
      "visit": "m06",
      "acq_date": "12/06/2011",
      "phc_scan_date": "2011-12-06",
      "source": "phc",
      "question": "MRI scan (Image Data ID I273295) acquired on 12/06/2011 for a male participant (visit m06). Predict the subject's T1 scan age in years and answer with a numeric value using one decimal place.",
      "answer": "66.6",
      "answer_code": "66.6",
      "answer_units": "years",
      "demographics": {
        "sex": "male",
        "sex_code": "1",
        "visit": "m06",
        "phc_scandate": "2011-12-06",
        "image_acq_date": "12/06/2011"
      }
    },
    {
      "image_id": "I285287",
      "image_path": "ADNI_Nifti_QC_N4/I285287_T1_N4.nii.gz",
      "ptid": "007_S_0101",
      "visit": "v06",
      "acq_date": "2/16/2012",
      "phc_scan_date": "2012-02-16",
      "source": "phc",
      "question": "MRI scan (Image Data ID I285287) acquired on 2/16/2012 for a male participant (visit v06). Predict the subject's T1 scan age in years and answer with a numeric value using one decimal place.",
      "answer": "79.8",
      "answer_code": "79.8",
      "answer_units": "years",
      "demographics": {
        "sex": "male",
        "sex_code": "1",
        "visit": "v06",
        "phc_scandate": "2012-02-16",
        "image_acq_date": "2/16/2012"
      }
    },
    {
      "image_id": "I100021",
      "image_path": "ADNI_Nifti_QC_N4/I100021_T1_N4.nii.gz",
      "ptid": "094_S_1330",
      "visit": "m12",
      "acq_date": "3/18/2008",
      "phc_scan_date": "2008-03-18",
      "source": "phc",
      "question": "MRI scan (Image Data ID I100021) acquired on 3/18/2008 for a male participant (visit m12). Predict the subject's T1 scan age in years and answer with a numeric value using one decimal place.",
      "answer": "62.9",
      "answer_code": "62.9",
      "answer_units": "years",
      "demographics": {
        "sex": "male",
        "sex_code": "1",
        "visit": "m12",
        "phc_scandate": "2008-03-18",
        "image_acq_date": "3/18/2008"
      }
    },
    {
      "image_id": "I356347",
      "image_path": "ADNI_Nifti_QC_N4/I356347_T1_N4.nii.gz",
      "ptid": "003_S_4350",
      "visit": "v11",
      "acq_date": "12/06/2012",
      "phc_scan_date": "2012-12-06",
      "source": "phc",
      "question": "MRI scan (Image Data ID I356347) acquired on 12/06/2012 for a male participant (visit v11). Predict the subject's T1 scan age in years and answer with a numeric value using one decimal place.",
      "answer": "74",
      "answer_code": "74",
      "answer_units": "years",
      "demographics": {
        "sex": "male",
        "sex_code": "1",
        "visit": "v11",
        "phc_scandate": "2012-12-06",
        "image_acq_date": "12/06/2012"
      }
    },
    {
      "image_id": "I729614",
      "image_path": "ADNI_Nifti_QC_N4/I729614_T1_N4.nii.gz",
      "ptid": "067_S_4767",
      "visit": "v41",
      "acq_date": "6/07/2016",
      "phc_scan_date": "2016-06-07",
      "source": "phc",
      "question": "MRI scan (Image Data ID I729614) acquired on 6/07/2016 for a female participant (visit v41). Predict the subject's T1 scan age in years and answer with a numeric value using one decimal place.",
      "answer": "70.5",
      "answer_code": "70.5",
      "answer_units": "years",
      "demographics": {
        "sex": "female",
        "sex_code": "2",
        "visit": "v41",
        "phc_scandate": "2016-06-07",
        "image_acq_date": "6/07/2016"
      }
    },
    {
      "image_id": "I56126",
      "image_path": "ADNI_Nifti_QC_N4/I56126_T1_N4.nii.gz",
      "ptid": "052_S_1054",
      "visit": "m06",
      "acq_date": "6/06/2007",
      "phc_scan_date": "2007-06-06",
      "source": "phc",
      "question": "MRI scan (Image Data ID I56126) acquired on 6/06/2007 for a male participant (visit m06). Predict the subject's T1 scan age in years and answer with a numeric value using one decimal place.",
      "answer": "70.5",
      "answer_code": "70.5",
      "answer_units": "years",
      "demographics": {
        "sex": "male",
        "sex_code": "1",
        "visit": "m06",
        "phc_scandate": "2007-06-06",
        "image_acq_date": "6/06/2007"
      }
    },
    {
      "image_id": "I153456",
      "image_path": "ADNI_Nifti_QC_N4/I153456_T1_N4.nii.gz",
      "ptid": "126_S_0709",
      "visit": "m36",
      "acq_date": "8/17/2009",
      "phc_scan_date": "2009-08-17",
      "source": "phc",
      "question": "MRI scan (Image Data ID I153456) acquired on 8/17/2009 for a male participant (visit m36). Predict the subject's T1 scan age in years and answer with a numeric value using one decimal place.",
      "answer": "87",
      "answer_code": "87",
      "answer_units": "years",
      "demographics": {
        "sex": "male",
        "sex_code": "1",
        "visit": "m36",
        "phc_scandate": "2009-08-17",
        "image_acq_date": "8/17/2009"
      }
    },
    {
      "image_id": "I89297",
      "image_path": "ADNI_Nifti_QC_N4/I89297_T1_N4.nii.gz",
      "ptid": "133_S_0629",
      "visit": "m18",
      "acq_date": "2/04/2008",
      "phc_scan_date": "2008-02-04",
      "source": "phc",
      "question": "MRI scan (Image Data ID I89297) acquired on 2/04/2008 for a male participant (visit m18). Predict the subject's T1 scan age in years and answer with a numeric value using one decimal place.",
      "answer": "72.5",
      "answer_code": "72.5",
      "answer_units": "years",
      "demographics": {
        "sex": "male",
        "sex_code": "1",
        "visit": "m18",
        "phc_scandate": "2008-02-04",
        "image_acq_date": "2/04/2008"
      }
    },
    {
      "image_id": "I495957",
      "image_path": "ADNI_Nifti_QC_N4/I495957_T1_N4.nii.gz",
      "ptid": "027_S_5169",
      "visit": "v21",
      "acq_date": "6/05/2015",
      "phc_scan_date": "2015-06-05",
      "source": "phc",
      "question": "MRI scan (Image Data ID I495957) acquired on 6/05/2015 for a female participant (visit v21). Predict the subject's T1 scan age in years and answer with a numeric value using one decimal place.",
      "answer": "67.9",
      "answer_code": "67.9",
      "answer_units": "years",
      "demographics": {
        "sex": "female",
        "sex_code": "2",
        "visit": "v21",
        "phc_scandate": "2015-06-05",
        "image_acq_date": "6/05/2015"
      }
    },
    {
      "image_id": "I291410",
      "image_path": "ADNI_Nifti_QC_N4/I291410_T1_N4.nii.gz",
      "ptid": "941_S_1195",
      "visit": "v06",
      "acq_date": "3/21/2012",
      "phc_scan_date": "2012-03-21",
      "source": "phc",
      "question": "MRI scan (Image Data ID I291410) acquired on 3/21/2012 for a male participant (visit v06). Predict the subject's T1 scan age in years and answer with a numeric value using one decimal place.",
      "answer": "82.2",
      "answer_code": "82.2",
      "answer_units": "years",
      "demographics": {
        "sex": "male",
        "sex_code": "1",
        "visit": "v06",
        "phc_scandate": "2012-03-21",
        "image_acq_date": "3/21/2012"
      }
    },
    {
      "image_id": "I205877",
      "image_path": "ADNI_Nifti_QC_N4/I205877_T1_N4.nii.gz",
      "ptid": "067_S_2195",
      "visit": "scmri",
      "acq_date": "11/19/2010",
      "phc_scan_date": "2010-11-19",
      "source": "phc",
      "question": "MRI scan (Image Data ID I205877) acquired on 11/19/2010 for a male participant (visit scmri). Predict the subject's T1 scan age in years and answer with a numeric value using one decimal place.",
      "answer": "68.1",
      "answer_code": "68.1",
      "answer_units": "years",
      "demographics": {
        "sex": "male",
        "sex_code": "1",
        "visit": "scmri",
        "phc_scandate": "2010-11-19",
        "image_acq_date": "11/19/2010"
      }
    },
    {
      "image_id": "I41856",
      "image_path": "ADNI_Nifti_QC_N4/I41856_T1_N4.nii.gz",
      "ptid": "114_S_0173",
      "visit": "m12",
      "acq_date": "2/27/2007",
      "phc_scan_date": "2007-02-27",
      "source": "phc",
      "question": "MRI scan (Image Data ID I41856) acquired on 2/27/2007 for a male participant (visit m12). Predict the subject's T1 scan age in years and answer with a numeric value using one decimal place.",
      "answer": "74.4",
      "answer_code": "74.4",
      "answer_units": "years",
      "demographics": {
        "sex": "male",
        "sex_code": "1",
        "visit": "m12",
        "phc_scandate": "2007-02-27",
        "image_acq_date": "2/27/2007"
      }
    },
    {
      "image_id": "I316679",
      "image_path": "ADNI_Nifti_QC_N4/I316679_T1_N4.nii.gz",
      "ptid": "029_S_4279",
      "visit": "v05",
      "acq_date": "7/16/2012",
      "phc_scan_date": "2012-07-16",
      "source": "phc",
      "question": "MRI scan (Image Data ID I316679) acquired on 7/16/2012 for a male participant (visit v05). Predict the subject's T1 scan age in years and answer with a numeric value using one decimal place.",
      "answer": "84.6",
      "answer_code": "84.6",
      "answer_units": "years",
      "demographics": {
        "sex": "male",
        "sex_code": "1",
        "visit": "v05",
        "phc_scandate": "2012-07-16",
        "image_acq_date": "7/16/2012"
      }
    },
    {
      "image_id": "I638784",
      "image_path": "ADNI_Nifti_QC_N4/I638784_T1_N4.nii.gz",
      "ptid": "007_S_4488",
      "visit": "v41",
      "acq_date": "2/22/2016",
      "phc_scan_date": "2016-02-22",
      "source": "phc",
      "question": "MRI scan (Image Data ID I638784) acquired on 2/22/2016 for a male participant (visit v41). Predict the subject's T1 scan age in years and answer with a numeric value using one decimal place.",
      "answer": "76.8",
      "answer_code": "76.8",
      "answer_units": "years",
      "demographics": {
        "sex": "male",
        "sex_code": "1",
        "visit": "v41",
        "phc_scandate": "2016-02-22",
        "image_acq_date": "2/22/2016"
      }
    },
    {
      "image_id": "I82715",
      "image_path": "ADNI_Nifti_QC_N4/I82715_T1_N4.nii.gz",
      "ptid": "141_S_0915",
      "visit": "m12",
      "acq_date": "11/17/2007",
      "phc_scan_date": "2007-11-17",
      "source": "phc",
      "question": "MRI scan (Image Data ID I82715) acquired on 11/17/2007 for a female participant (visit m12). Predict the subject's T1 scan age in years and answer with a numeric value using one decimal place.",
      "answer": "81.8",
      "answer_code": "81.8",
      "answer_units": "years",
      "demographics": {
        "sex": "female",
        "sex_code": "2",
        "visit": "m12",
        "phc_scandate": "2007-11-17",
        "image_acq_date": "11/17/2007"
      }
    },
    {
      "image_id": "I544645",
      "image_path": "ADNI_Nifti_QC_N4/I544645_T1_N4.nii.gz",
      "ptid": "035_S_4082",
      "visit": "v41",
      "acq_date": "11/03/2015",
      "phc_scan_date": "2015-11-03",
      "source": "phc",
      "question": "MRI scan (Image Data ID I544645) acquired on 11/03/2015 for a male participant (visit v41). Predict the subject's T1 scan age in years and answer with a numeric value using one decimal place.",
      "answer": "79.9",
      "answer_code": "79.9",
      "answer_units": "years",
      "demographics": {
        "sex": "male",
        "sex_code": "1",
        "visit": "v41",
        "phc_scandate": "2015-11-03",
        "image_acq_date": "11/03/2015"
      }
    },
    {
      "image_id": "I284251",
      "image_path": "ADNI_Nifti_QC_N4/I284251_T1_N4.nii.gz",
      "ptid": "116_S_1232",
      "visit": "v06",
      "acq_date": "2/10/2012",
      "phc_scan_date": "2012-02-10",
      "source": "phc",
      "question": "MRI scan (Image Data ID I284251) acquired on 2/10/2012 for a female participant (visit v06). Predict the subject's T1 scan age in years and answer with a numeric value using one decimal place.",
      "answer": "77.2",
      "answer_code": "77.2",
      "answer_units": "years",
      "demographics": {
        "sex": "female",
        "sex_code": "2",
        "visit": "v06",
        "phc_scandate": "2012-02-10",
        "image_acq_date": "2/10/2012"
      }
    },
    {
      "image_id": "I341881",
      "image_path": "ADNI_Nifti_QC_N4/I341881_T1_N4.nii.gz",
      "ptid": "094_S_4234",
      "visit": "v11",
      "acq_date": "10/18/2012",
      "phc_scan_date": "2012-10-18",
      "source": "phc",
      "question": "MRI scan (Image Data ID I341881) acquired on 10/18/2012 for a male participant (visit v11). Predict the subject's T1 scan age in years and answer with a numeric value using one decimal place.",
      "answer": "71.2",
      "answer_code": "71.2",
      "answer_units": "years",
      "demographics": {
        "sex": "male",
        "sex_code": "1",
        "visit": "v11",
        "phc_scandate": "2012-10-18",
        "image_acq_date": "10/18/2012"
      }
    },
    {
      "image_id": "I160613",
      "image_path": "ADNI_Nifti_QC_N4/I160613_T1_N4.nii.gz",
      "ptid": "031_S_1066",
      "visit": "m36",
      "acq_date": "12/07/2009",
      "phc_scan_date": "2009-12-07",
      "source": "phc",
      "question": "MRI scan (Image Data ID I160613) acquired on 12/07/2009 for a male participant (visit m36). Predict the subject's T1 scan age in years and answer with a numeric value using one decimal place.",
      "answer": "75.6",
      "answer_code": "75.6",
      "answer_units": "years",
      "demographics": {
        "sex": "male",
        "sex_code": "1",
        "visit": "m36",
        "phc_scandate": "2009-12-07",
        "image_acq_date": "12/07/2009"
      }
    },
    {
      "image_id": "I399740",
      "image_path": "ADNI_Nifti_QC_N4/I399740_T1_N4.nii.gz",
      "ptid": "141_S_1004",
      "visit": "v21",
      "acq_date": "11/20/2013",
      "phc_scan_date": "2013-11-20",
      "source": "phc",
      "question": "MRI scan (Image Data ID I399740) acquired on 11/20/2013 for a female participant (visit v21). Predict the subject's T1 scan age in years and answer with a numeric value using one decimal place.",
      "answer": "81.1",
      "answer_code": "81.1",
      "answer_units": "years",
      "demographics": {
        "sex": "female",
        "sex_code": "2",
        "visit": "v21",
        "phc_scandate": "2013-11-20",
        "image_acq_date": "11/20/2013"
      }
    },
    {
      "image_id": "I305199",
      "image_path": "ADNI_Nifti_QC_N4/I305199_T1_N4.nii.gz",
      "ptid": "041_S_4720",
      "visit": "v02",
      "acq_date": "5/14/2012",
      "phc_scan_date": "2012-05-14",
      "source": "phc",
      "question": "MRI scan (Image Data ID I305199) acquired on 5/14/2012 for a male participant (visit v02). Predict the subject's T1 scan age in years and answer with a numeric value using one decimal place.",
      "answer": "77.5",
      "answer_code": "77.5",
      "answer_units": "years",
      "demographics": {
        "sex": "male",
        "sex_code": "1",
        "visit": "v02",
        "phc_scandate": "2012-05-14",
        "image_acq_date": "5/14/2012"
      }
    },
    {
      "image_id": "I405667",
      "image_path": "ADNI_Nifti_QC_N4/I405667_T1_N4.nii.gz",
      "ptid": "007_S_1206",
      "visit": "v21",
      "acq_date": "1/21/2014",
      "phc_scan_date": "2014-01-21",
      "source": "phc",
      "question": "MRI scan (Image Data ID I405667) acquired on 1/21/2014 for a male participant (visit v21). Predict the subject's T1 scan age in years and answer with a numeric value using one decimal place.",
      "answer": "80",
      "answer_code": "80",
      "answer_units": "years",
      "demographics": {
        "sex": "male",
        "sex_code": "1",
        "visit": "v21",
        "phc_scandate": "2014-01-21",
        "image_acq_date": "1/21/2014"
      }
    },
    {
      "image_id": "I256321",
      "image_path": "ADNI_Nifti_QC_N4/I256321_T1_N4.nii.gz",
      "ptid": "014_S_4039",
      "visit": "v04",
      "acq_date": "9/15/2011",
      "phc_scan_date": "2011-09-15",
      "source": "phc",
      "question": "MRI scan (Image Data ID I256321) acquired on 9/15/2011 for a male participant (visit v04). Predict the subject's T1 scan age in years and answer with a numeric value using one decimal place.",
      "answer": "56.3",
      "answer_code": "56.3",
      "answer_units": "years",
      "demographics": {
        "sex": "male",
        "sex_code": "1",
        "visit": "v04",
        "phc_scandate": "2011-09-15",
        "image_acq_date": "9/15/2011"
      }
    },
    {
      "image_id": "I424528",
      "image_path": "ADNI_Nifti_QC_N4/I424528_T1_N4.nii.gz",
      "ptid": "135_S_4676",
      "visit": "v21",
      "acq_date": "5/12/2014",
      "phc_scan_date": "2014-05-12",
      "source": "phc",
      "question": "MRI scan (Image Data ID I424528) acquired on 5/12/2014 for a male participant (visit v21). Predict the subject's T1 scan age in years and answer with a numeric value using one decimal place.",
      "answer": "81",
      "answer_code": "81",
      "answer_units": "years",
      "demographics": {
        "sex": "male",
        "sex_code": "1",
        "visit": "v21",
        "phc_scandate": "2014-05-12",
        "image_acq_date": "5/12/2014"
      }
    },
    {
      "image_id": "I87471",
      "image_path": "ADNI_Nifti_QC_N4/I87471_T1_N4.nii.gz",
      "ptid": "036_S_0976",
      "visit": "m12",
      "acq_date": "1/15/2008",
      "phc_scan_date": "2008-01-15",
      "source": "phc",
      "question": "MRI scan (Image Data ID I87471) acquired on 1/15/2008 for a male participant (visit m12). Predict the subject's T1 scan age in years and answer with a numeric value using one decimal place.",
      "answer": "81.7",
      "answer_code": "81.7",
      "answer_units": "years",
      "demographics": {
        "sex": "male",
        "sex_code": "1",
        "visit": "m12",
        "phc_scandate": "2008-01-15",
        "image_acq_date": "1/15/2008"
      }
    },
    {
      "image_id": "I423289",
      "image_path": "ADNI_Nifti_QC_N4/I423289_T1_N4.nii.gz",
      "ptid": "013_S_5137",
      "visit": "v11",
      "acq_date": "5/01/2014",
      "phc_scan_date": "2014-05-01",
      "source": "phc",
      "question": "MRI scan (Image Data ID I423289) acquired on 5/01/2014 for a female participant (visit v11). Predict the subject's T1 scan age in years and answer with a numeric value using one decimal place.",
      "answer": "80",
      "answer_code": "80",
      "answer_units": "years",
      "demographics": {
        "sex": "female",
        "sex_code": "2",
        "visit": "v11",
        "phc_scandate": "2014-05-01",
        "image_acq_date": "5/01/2014"
      }
    },
    {
      "image_id": "I281036",
      "image_path": "ADNI_Nifti_QC_N4/I281036_T1_N4.nii.gz",
      "ptid": "126_S_4458",
      "visit": "v02",
      "acq_date": "1/20/2012",
      "phc_scan_date": "2012-01-20",
      "source": "phc",
      "question": "MRI scan (Image Data ID I281036) acquired on 1/20/2012 for a female participant (visit v02). Predict the subject's T1 scan age in years and answer with a numeric value using one decimal place.",
      "answer": "76.2",
      "answer_code": "76.2",
      "answer_units": "years",
      "demographics": {
        "sex": "female",
        "sex_code": "2",
        "visit": "v02",
        "phc_scandate": "2012-01-20",
        "image_acq_date": "1/20/2012"
      }
    },
    {
      "image_id": "I267493",
      "image_path": "ADNI_Nifti_QC_N4/I267493_T1_N4.nii.gz",
      "ptid": "002_S_4171",
      "visit": "v04",
      "acq_date": "11/17/2011",
      "phc_scan_date": "2011-11-17",
      "source": "phc",
      "question": "MRI scan (Image Data ID I267493) acquired on 11/17/2011 for a male participant (visit v04). Predict the subject's T1 scan age in years and answer with a numeric value using one decimal place.",
      "answer": "69.7",
      "answer_code": "69.7",
      "answer_units": "years",
      "demographics": {
        "sex": "male",
        "sex_code": "1",
        "visit": "v04",
        "phc_scandate": "2011-11-17",
        "image_acq_date": "11/17/2011"
      }
    },
    {
      "image_id": "I190995",
      "image_path": "ADNI_Nifti_QC_N4/I190995_T1_N4.nii.gz",
      "ptid": "041_S_1418",
      "visit": "m36",
      "acq_date": "8/17/2010",
      "phc_scan_date": "2010-08-17",
      "source": "phc",
      "question": "MRI scan (Image Data ID I190995) acquired on 8/17/2010 for a male participant (visit m36). Predict the subject's T1 scan age in years and answer with a numeric value using one decimal place.",
      "answer": "84.7",
      "answer_code": "84.7",
      "answer_units": "years",
      "demographics": {
        "sex": "male",
        "sex_code": "1",
        "visit": "m36",
        "phc_scandate": "2010-08-17",
        "image_acq_date": "8/17/2010"
      }
    },
    {
      "image_id": "I464329",
      "image_path": "ADNI_Nifti_QC_N4/I464329_T1_N4.nii.gz",
      "ptid": "067_S_0059",
      "visit": "v31",
      "acq_date": "12/15/2014",
      "phc_scan_date": "2014-12-15",
      "source": "phc",
      "question": "MRI scan (Image Data ID I464329) acquired on 12/15/2014 for a female participant (visit v31). Predict the subject's T1 scan age in years and answer with a numeric value using one decimal place.",
      "answer": "80",
      "answer_code": "80",
      "answer_units": "years",
      "demographics": {
        "sex": "female",
        "sex_code": "2",
        "visit": "v31",
        "phc_scandate": "2014-12-15",
        "image_acq_date": "12/15/2014"
      }
    },
    {
      "image_id": "I337395",
      "image_path": "ADNI_Nifti_QC_N4/I337395_T1_N4.nii.gz",
      "ptid": "010_S_4345",
      "visit": "v05",
      "acq_date": "9/20/2012",
      "phc_scan_date": "2012-09-20",
      "source": "phc",
      "question": "MRI scan (Image Data ID I337395) acquired on 9/20/2012 for a male participant (visit v05). Predict the subject's T1 scan age in years and answer with a numeric value using one decimal place.",
      "answer": "70.6",
      "answer_code": "70.6",
      "answer_units": "years",
      "demographics": {
        "sex": "male",
        "sex_code": "1",
        "visit": "v05",
        "phc_scandate": "2012-09-20",
        "image_acq_date": "9/20/2012"
      }
    },
    {
      "image_id": "I294653",
      "image_path": "ADNI_Nifti_QC_N4/I294653_T1_N4.nii.gz",
      "ptid": "037_S_4214",
      "visit": "v05",
      "acq_date": "4/02/2012",
      "phc_scan_date": "2012-04-02",
      "source": "phc",
      "question": "MRI scan (Image Data ID I294653) acquired on 4/02/2012 for a male participant (visit v05). Predict the subject's T1 scan age in years and answer with a numeric value using one decimal place.",
      "answer": "74.8",
      "answer_code": "74.8",
      "answer_units": "years",
      "demographics": {
        "sex": "male",
        "sex_code": "1",
        "visit": "v05",
        "phc_scandate": "2012-04-02",
        "image_acq_date": "4/02/2012"
      }
    },
    {
      "image_id": "I350451",
      "image_path": "ADNI_Nifti_QC_N4/I350451_T1_N4.nii.gz",
      "ptid": "010_S_4442",
      "visit": "v05",
      "acq_date": "12/03/2012",
      "phc_scan_date": "2012-12-03",
      "source": "phc",
      "question": "MRI scan (Image Data ID I350451) acquired on 12/03/2012 for a female participant (visit v05). Predict the subject's T1 scan age in years and answer with a numeric value using one decimal place.",
      "answer": "75.2",
      "answer_code": "75.2",
      "answer_units": "years",
      "demographics": {
        "sex": "female",
        "sex_code": "2",
        "visit": "v05",
        "phc_scandate": "2012-12-03",
        "image_acq_date": "12/03/2012"
      }
    },
    {
      "image_id": "I300894",
      "image_path": "ADNI_Nifti_QC_N4/I300894_T1_N4.nii.gz",
      "ptid": "029_S_4652",
      "visit": "v02",
      "acq_date": "4/20/2012",
      "phc_scan_date": "2012-04-20",
      "source": "phc",
      "question": "MRI scan (Image Data ID I300894) acquired on 4/20/2012 for a male participant (visit v02). Predict the subject's T1 scan age in years and answer with a numeric value using one decimal place.",
      "answer": "79.4",
      "answer_code": "79.4",
      "answer_units": "years",
      "demographics": {
        "sex": "male",
        "sex_code": "1",
        "visit": "v02",
        "phc_scandate": "2012-04-20",
        "image_acq_date": "4/20/2012"
      }
    },
    {
      "image_id": "I311364",
      "image_path": "ADNI_Nifti_QC_N4/I311364_T1_N4.nii.gz",
      "ptid": "073_S_4312",
      "visit": "v05",
      "acq_date": "6/19/2012",
      "phc_scan_date": "2012-06-19",
      "source": "phc",
      "question": "MRI scan (Image Data ID I311364) acquired on 6/19/2012 for a male participant (visit v05). Predict the subject's T1 scan age in years and answer with a numeric value using one decimal place.",
      "answer": "70",
      "answer_code": "70",
      "answer_units": "years",
      "demographics": {
        "sex": "male",
        "sex_code": "1",
        "visit": "v05",
        "phc_scandate": "2012-06-19",
        "image_acq_date": "6/19/2012"
      }
    },
    {
      "image_id": "I416205",
      "image_path": "ADNI_Nifti_QC_N4/I416205_T1_N4.nii.gz",
      "ptid": "053_S_4557",
      "visit": "v21",
      "acq_date": "3/07/2014",
      "phc_scan_date": "2014-03-07",
      "source": "phc",
      "question": "MRI scan (Image Data ID I416205) acquired on 3/07/2014 for a female participant (visit v21). Predict the subject's T1 scan age in years and answer with a numeric value using one decimal place.",
      "answer": "85.4",
      "answer_code": "85.4",
      "answer_units": "years",
      "demographics": {
        "sex": "female",
        "sex_code": "2",
        "visit": "v21",
        "phc_scandate": "2014-03-07",
        "image_acq_date": "3/07/2014"
      }
    },
    {
      "image_id": "I313318",
      "image_path": "ADNI_Nifti_QC_N4/I313318_T1_N4.nii.gz",
      "ptid": "128_S_4607",
      "visit": "v04",
      "acq_date": "6/28/2012",
      "phc_scan_date": "2012-06-28",
      "source": "phc",
      "question": "MRI scan (Image Data ID I313318) acquired on 6/28/2012 for a female participant (visit v04). Predict the subject's T1 scan age in years and answer with a numeric value using one decimal place.",
      "answer": "56.5",
      "answer_code": "56.5",
      "answer_units": "years",
      "demographics": {
        "sex": "female",
        "sex_code": "2",
        "visit": "v04",
        "phc_scandate": "2012-06-28",
        "image_acq_date": "6/28/2012"
      }
    },
    {
      "image_id": "I341434",
      "image_path": "ADNI_Nifti_QC_N4/I341434_T1_N4.nii.gz",
      "ptid": "003_S_4441",
      "visit": "v05",
      "acq_date": "10/18/2012",
      "phc_scan_date": "2012-10-18",
      "source": "phc",
      "question": "MRI scan (Image Data ID I341434) acquired on 10/18/2012 for a female participant (visit v05). Predict the subject's T1 scan age in years and answer with a numeric value using one decimal place.",
      "answer": "69.6",
      "answer_code": "69.6",
      "answer_units": "years",
      "demographics": {
        "sex": "female",
        "sex_code": "2",
        "visit": "v05",
        "phc_scandate": "2012-10-18",
        "image_acq_date": "10/18/2012"
      }
    },
    {
      "image_id": "I379678",
      "image_path": "ADNI_Nifti_QC_N4/I379678_T1_N4.nii.gz",
      "ptid": "052_S_4945",
      "visit": "v05",
      "acq_date": "7/08/2013",
      "phc_scan_date": "2013-07-08",
      "source": "phc",
      "question": "MRI scan (Image Data ID I379678) acquired on 7/08/2013 for a male participant (visit v05). Predict the subject's T1 scan age in years and answer with a numeric value using one decimal place.",
      "answer": "57.3",
      "answer_code": "57.3",
      "answer_units": "years",
      "demographics": {
        "sex": "male",
        "sex_code": "1",
        "visit": "v05",
        "phc_scandate": "2013-07-08",
        "image_acq_date": "7/08/2013"
      }
    },
    {
      "image_id": "I254727",
      "image_path": "ADNI_Nifti_QC_N4/I254727_T1_N4.nii.gz",
      "ptid": "014_S_0658",
      "visit": "v06",
      "acq_date": "8/25/2011",
      "phc_scan_date": "2011-08-25",
      "source": "phc",
      "question": "MRI scan (Image Data ID I254727) acquired on 8/25/2011 for a male participant (visit v06). Predict the subject's T1 scan age in years and answer with a numeric value using one decimal place.",
      "answer": "77.4",
      "answer_code": "77.4",
      "answer_units": "years",
      "demographics": {
        "sex": "male",
        "sex_code": "1",
        "visit": "v06",
        "phc_scandate": "2011-08-25",
        "image_acq_date": "8/25/2011"
      }
    },
    {
      "image_id": "I276937",
      "image_path": "ADNI_Nifti_QC_N4/I276937_T1_N4.nii.gz",
      "ptid": "099_S_2205",
      "visit": "v06",
      "acq_date": "1/10/2012",
      "phc_scan_date": "2012-01-10",
      "source": "phc",
      "question": "MRI scan (Image Data ID I276937) acquired on 1/10/2012 for a male participant (visit v06). Predict the subject's T1 scan age in years and answer with a numeric value using one decimal place.",
      "answer": "86",
      "answer_code": "86",
      "answer_units": "years",
      "demographics": {
        "sex": "male",
        "sex_code": "1",
        "visit": "v06",
        "phc_scandate": "2012-01-10",
        "image_acq_date": "1/10/2012"
      }
    },
    {
      "image_id": "I498744",
      "image_path": "ADNI_Nifti_QC_N4/I498744_T1_N4.nii.gz",
      "ptid": "100_S_5102",
      "visit": "v21",
      "acq_date": "5/29/2015",
      "phc_scan_date": "2015-05-29",
      "source": "phc",
      "question": "MRI scan (Image Data ID I498744) acquired on 5/29/2015 for a female participant (visit v21). Predict the subject's T1 scan age in years and answer with a numeric value using one decimal place.",
      "answer": "68.7",
      "answer_code": "68.7",
      "answer_units": "years",
      "demographics": {
        "sex": "female",
        "sex_code": "2",
        "visit": "v21",
        "phc_scandate": "2015-05-29",
        "image_acq_date": "5/29/2015"
      }
    },
    {
      "image_id": "I399798",
      "image_path": "ADNI_Nifti_QC_N4/I399798_T1_N4.nii.gz",
      "ptid": "033_S_5013",
      "visit": "v11",
      "acq_date": "12/02/2013",
      "phc_scan_date": "2013-12-02",
      "source": "phc",
      "question": "MRI scan (Image Data ID I399798) acquired on 12/02/2013 for a female participant (visit v11). Predict the subject's T1 scan age in years and answer with a numeric value using one decimal place.",
      "answer": "69.5",
      "answer_code": "69.5",
      "answer_units": "years",
      "demographics": {
        "sex": "female",
        "sex_code": "2",
        "visit": "v11",
        "phc_scandate": "2013-12-02",
        "image_acq_date": "12/02/2013"
      }
    },
    {
      "image_id": "I137467",
      "image_path": "ADNI_Nifti_QC_N4/I137467_T1_N4.nii.gz",
      "ptid": "033_S_1279",
      "visit": "m24",
      "acq_date": "2/27/2009",
      "phc_scan_date": "2009-02-27",
      "source": "phc",
      "question": "MRI scan (Image Data ID I137467) acquired on 2/27/2009 for a female participant (visit m24). Predict the subject's T1 scan age in years and answer with a numeric value using one decimal place.",
      "answer": "70.4",
      "answer_code": "70.4",
      "answer_units": "years",
      "demographics": {
        "sex": "female",
        "sex_code": "2",
        "visit": "m24",
        "phc_scandate": "2009-02-27",
        "image_acq_date": "2/27/2009"
      }
    },
    {
      "image_id": "I321536",
      "image_path": "ADNI_Nifti_QC_N4/I321536_T1_N4.nii.gz",
      "ptid": "116_S_4635",
      "visit": "v04",
      "acq_date": "7/24/2012",
      "phc_scan_date": "2012-07-24",
      "source": "phc",
      "question": "MRI scan (Image Data ID I321536) acquired on 7/24/2012 for a female participant (visit v04). Predict the subject's T1 scan age in years and answer with a numeric value using one decimal place.",
      "answer": "73.1",
      "answer_code": "73.1",
      "answer_units": "years",
      "demographics": {
        "sex": "female",
        "sex_code": "2",
        "visit": "v04",
        "phc_scandate": "2012-07-24",
        "image_acq_date": "7/24/2012"
      }
    },
    {
      "image_id": "I391963",
      "image_path": "ADNI_Nifti_QC_N4/I391963_T1_N4.nii.gz",
      "ptid": "137_S_4852",
      "visit": "v11",
      "acq_date": "9/25/2013",
      "phc_scan_date": "2013-09-25",
      "source": "phc",
      "question": "MRI scan (Image Data ID I391963) acquired on 9/25/2013 for a female participant (visit v11). Predict the subject's T1 scan age in years and answer with a numeric value using one decimal place.",
      "answer": "65.4",
      "answer_code": "65.4",
      "answer_units": "years",
      "demographics": {
        "sex": "female",
        "sex_code": "2",
        "visit": "v11",
        "phc_scandate": "2013-09-25",
        "image_acq_date": "9/25/2013"
      }
    },
    {
      "image_id": "I118226",
      "image_path": "ADNI_Nifti_QC_N4/I118226_T1_N4.nii.gz",
      "ptid": "029_S_0824",
      "visit": "m24",
      "acq_date": "9/19/2008",
      "phc_scan_date": "2008-09-19",
      "source": "phc",
      "question": "MRI scan (Image Data ID I118226) acquired on 9/19/2008 for a female participant (visit m24). Predict the subject's T1 scan age in years and answer with a numeric value using one decimal place.",
      "answer": "78.4",
      "answer_code": "78.4",
      "answer_units": "years",
      "demographics": {
        "sex": "female",
        "sex_code": "2",
        "visit": "m24",
        "phc_scandate": "2008-09-19",
        "image_acq_date": "9/19/2008"
      }
    },
    {
      "image_id": "I61704",
      "image_path": "ADNI_Nifti_QC_N4/I61704_T1_N4.nii.gz",
      "ptid": "005_S_0546",
      "visit": "m12",
      "acq_date": "7/23/2007",
      "phc_scan_date": "2007-07-23",
      "source": "phc",
      "question": "MRI scan (Image Data ID I61704) acquired on 7/23/2007 for a male participant (visit m12). Predict the subject's T1 scan age in years and answer with a numeric value using one decimal place.",
      "answer": "80.7",
      "answer_code": "80.7",
      "answer_units": "years",
      "demographics": {
        "sex": "male",
        "sex_code": "1",
        "visit": "m12",
        "phc_scandate": "2007-07-23",
        "image_acq_date": "7/23/2007"
      }
    },
    {
      "image_id": "I30132",
      "image_path": "ADNI_Nifti_QC_N4/I30132_T1_N4.nii.gz",
      "ptid": "036_S_1001",
      "visit": "sc",
      "acq_date": "11/20/2006",
      "phc_scan_date": "2006-11-20",
      "source": "phc",
      "question": "MRI scan (Image Data ID I30132) acquired on 11/20/2006 for a male participant (visit sc). Predict the subject's T1 scan age in years and answer with a numeric value using one decimal place.",
      "answer": "69.4",
      "answer_code": "69.4",
      "answer_units": "years",
      "demographics": {
        "sex": "male",
        "sex_code": "1",
        "visit": "sc",
        "phc_scandate": "2006-11-20",
        "image_acq_date": "11/20/2006"
      }
    },
    {
      "image_id": "I403392",
      "image_path": "ADNI_Nifti_QC_N4/I403392_T1_N4.nii.gz",
      "ptid": "022_S_2167",
      "visit": "v21",
      "acq_date": "12/20/2013",
      "phc_scan_date": "2013-12-20",
      "source": "phc",
      "question": "MRI scan (Image Data ID I403392) acquired on 12/20/2013 for a male participant (visit v21). Predict the subject's T1 scan age in years and answer with a numeric value using one decimal place.",
      "answer": "83.9",
      "answer_code": "83.9",
      "answer_units": "years",
      "demographics": {
        "sex": "male",
        "sex_code": "1",
        "visit": "v21",
        "phc_scandate": "2013-12-20",
        "image_acq_date": "12/20/2013"
      }
    },
    {
      "image_id": "I59845",
      "image_path": "ADNI_Nifti_QC_N4/I59845_T1_N4.nii.gz",
      "ptid": "133_S_0488",
      "visit": "m12",
      "acq_date": "7/11/2007",
      "phc_scan_date": "2007-07-11",
      "source": "phc",
      "question": "MRI scan (Image Data ID I59845) acquired on 7/11/2007 for a female participant (visit m12). Predict the subject's T1 scan age in years and answer with a numeric value using one decimal place.",
      "answer": "72.2",
      "answer_code": "72.2",
      "answer_units": "years",
      "demographics": {
        "sex": "female",
        "sex_code": "2",
        "visit": "m12",
        "phc_scandate": "2007-07-11",
        "image_acq_date": "7/11/2007"
      }
    },
    {
      "image_id": "I310648",
      "image_path": "ADNI_Nifti_QC_N4/I310648_T1_N4.nii.gz",
      "ptid": "072_S_4539",
      "visit": "v04",
      "acq_date": "6/15/2012",
      "phc_scan_date": "2012-06-15",
      "source": "phc",
      "question": "MRI scan (Image Data ID I310648) acquired on 6/15/2012 for a female participant (visit v04). Predict the subject's T1 scan age in years and answer with a numeric value using one decimal place.",
      "answer": "66.8",
      "answer_code": "66.8",
      "answer_units": "years",
      "demographics": {
        "sex": "female",
        "sex_code": "2",
        "visit": "v04",
        "phc_scandate": "2012-06-15",
        "image_acq_date": "6/15/2012"
      }
    },
    {
      "image_id": "I332115",
      "image_path": "ADNI_Nifti_QC_N4/I332115_T1_N4.nii.gz",
      "ptid": "022_S_4444",
      "visit": "v05",
      "acq_date": "8/22/2012",
      "phc_scan_date": "2012-08-22",
      "source": "phc",
      "question": "MRI scan (Image Data ID I332115) acquired on 8/22/2012 for a male participant (visit v05). Predict the subject's T1 scan age in years and answer with a numeric value using one decimal place.",
      "answer": "78.2",
      "answer_code": "78.2",
      "answer_units": "years",
      "demographics": {
        "sex": "male",
        "sex_code": "1",
        "visit": "v05",
        "phc_scandate": "2012-08-22",
        "image_acq_date": "8/22/2012"
      }
    },
    {
      "image_id": "I297567",
      "image_path": "ADNI_Nifti_QC_N4/I297567_T1_N4.nii.gz",
      "ptid": "130_S_4250",
      "visit": "v05",
      "acq_date": "4/11/2012",
      "phc_scan_date": "2012-04-11",
      "source": "phc",
      "question": "MRI scan (Image Data ID I297567) acquired on 4/11/2012 for a male participant (visit v05). Predict the subject's T1 scan age in years and answer with a numeric value using one decimal place.",
      "answer": "79.1",
      "answer_code": "79.1",
      "answer_units": "years",
      "demographics": {
        "sex": "male",
        "sex_code": "1",
        "visit": "v05",
        "phc_scandate": "2012-04-11",
        "image_acq_date": "4/11/2012"
      }
    },
    {
      "image_id": "I274113",
      "image_path": "ADNI_Nifti_QC_N4/I274113_T1_N4.nii.gz",
      "ptid": "018_S_2155",
      "visit": "v06",
      "acq_date": "12/22/2011",
      "phc_scan_date": "2011-12-22",
      "source": "phc",
      "question": "MRI scan (Image Data ID I274113) acquired on 12/22/2011 for a female participant (visit v06). Predict the subject's T1 scan age in years and answer with a numeric value using one decimal place.",
      "answer": "70.1",
      "answer_code": "70.1",
      "answer_units": "years",
      "demographics": {
        "sex": "female",
        "sex_code": "2",
        "visit": "v06",
        "phc_scandate": "2011-12-22",
        "image_acq_date": "12/22/2011"
      }
    },
    {
      "image_id": "I112648",
      "image_path": "ADNI_Nifti_QC_N4/I112648_T1_N4.nii.gz",
      "ptid": "029_S_0914",
      "visit": "m18",
      "acq_date": "7/03/2008",
      "phc_scan_date": "2008-07-03",
      "source": "phc",
      "question": "MRI scan (Image Data ID I112648) acquired on 7/03/2008 for a male participant (visit m18). Predict the subject's T1 scan age in years and answer with a numeric value using one decimal place.",
      "answer": "76.3",
      "answer_code": "76.3",
      "answer_units": "years",
      "demographics": {
        "sex": "male",
        "sex_code": "1",
        "visit": "m18",
        "phc_scandate": "2008-07-03",
        "image_acq_date": "7/03/2008"
      }
    },
    {
      "image_id": "I799803",
      "image_path": "ADNI_Nifti_QC_N4/I799803_T1_N4.nii.gz",
      "ptid": "135_S_4356",
      "visit": "v51",
      "acq_date": "12/12/2016",
      "phc_scan_date": "2016-12-12",
      "source": "phc",
      "question": "MRI scan (Image Data ID I799803) acquired on 12/12/2016 for a male participant (visit v51). Predict the subject's T1 scan age in years and answer with a numeric value using one decimal place.",
      "answer": "73.3",
      "answer_code": "73.3",
      "answer_units": "years",
      "demographics": {
        "sex": "male",
        "sex_code": "1",
        "visit": "v51",
        "phc_scandate": "2016-12-12",
        "image_acq_date": "12/12/2016"
      }
    },
    {
      "image_id": "I396164",
      "image_path": "ADNI_Nifti_QC_N4/I396164_T1_N4.nii.gz",
      "ptid": "033_S_0923",
      "visit": "v21",
      "acq_date": "10/25/2013",
      "phc_scan_date": "2013-10-25",
      "source": "phc",
      "question": "MRI scan (Image Data ID I396164) acquired on 10/25/2013 for a male participant (visit v21). Predict the subject's T1 scan age in years and answer with a numeric value using one decimal place.",
      "answer": "90.4",
      "answer_code": "90.4",
      "answer_units": "years",
      "demographics": {
        "sex": "male",
        "sex_code": "1",
        "visit": "v21",
        "phc_scandate": "2013-10-25",
        "image_acq_date": "10/25/2013"
      }
    },
    {
      "image_id": "I791888",
      "image_path": "ADNI_Nifti_QC_N4/I791888_T1_N4.nii.gz",
      "ptid": "068_S_0210",
      "visit": "v41",
      "acq_date": "11/03/2016",
      "phc_scan_date": "2016-11-03",
      "source": "phc",
      "question": "MRI scan (Image Data ID I791888) acquired on 11/03/2016 for a female participant (visit v41). Predict the subject's T1 scan age in years and answer with a numeric value using one decimal place.",
      "answer": "83.2",
      "answer_code": "83.2",
      "answer_units": "years",
      "demographics": {
        "sex": "female",
        "sex_code": "2",
        "visit": "v41",
        "phc_scandate": "2016-11-03",
        "image_acq_date": "11/03/2016"
      }
    },
    {
      "image_id": "I60802",
      "image_path": "ADNI_Nifti_QC_N4/I60802_T1_N4.nii.gz",
      "ptid": "128_S_1088",
      "visit": "m06",
      "acq_date": "7/18/2007",
      "phc_scan_date": "2007-07-18",
      "source": "phc",
      "question": "MRI scan (Image Data ID I60802) acquired on 7/18/2007 for a male participant (visit m06). Predict the subject's T1 scan age in years and answer with a numeric value using one decimal place.",
      "answer": "88.6",
      "answer_code": "88.6",
      "answer_units": "years",
      "demographics": {
        "sex": "male",
        "sex_code": "1",
        "visit": "m06",
        "phc_scandate": "2007-07-18",
        "image_acq_date": "7/18/2007"
      }
    },
    {
      "image_id": "I696286",
      "image_path": "ADNI_Nifti_QC_N4/I696286_T1_N4.nii.gz",
      "ptid": "029_S_4652",
      "visit": "v31",
      "acq_date": "9/15/2015",
      "phc_scan_date": "2015-09-15",
      "source": "phc",
      "question": "MRI scan (Image Data ID I696286) acquired on 9/15/2015 for a male participant (visit v31). Predict the subject's T1 scan age in years and answer with a numeric value using one decimal place.",
      "answer": "82.8",
      "answer_code": "82.8",
      "answer_units": "years",
      "demographics": {
        "sex": "male",
        "sex_code": "1",
        "visit": "v31",
        "phc_scandate": "2015-09-15",
        "image_acq_date": "9/15/2015"
      }
    },
    {
      "image_id": "I387203",
      "image_path": "ADNI_Nifti_QC_N4/I387203_T1_N4.nii.gz",
      "ptid": "031_S_4149",
      "visit": "v21",
      "acq_date": "8/23/2013",
      "phc_scan_date": "2013-08-23",
      "source": "phc",
      "question": "MRI scan (Image Data ID I387203) acquired on 8/23/2013 for a male participant (visit v21). Predict the subject's T1 scan age in years and answer with a numeric value using one decimal place.",
      "answer": "75.4",
      "answer_code": "75.4",
      "answer_units": "years",
      "demographics": {
        "sex": "male",
        "sex_code": "1",
        "visit": "v21",
        "phc_scandate": "2013-08-23",
        "image_acq_date": "8/23/2013"
      }
    },
    {
      "image_id": "I161313",
      "image_path": "ADNI_Nifti_QC_N4/I161313_T1_N4.nii.gz",
      "ptid": "052_S_0671",
      "visit": "m36",
      "acq_date": "12/21/2009",
      "phc_scan_date": "2009-12-21",
      "source": "phc",
      "question": "MRI scan (Image Data ID I161313) acquired on 12/21/2009 for a female participant (visit m36). Predict the subject's T1 scan age in years and answer with a numeric value using one decimal place.",
      "answer": "64.6",
      "answer_code": "64.6",
      "answer_units": "years",
      "demographics": {
        "sex": "female",
        "sex_code": "2",
        "visit": "m36",
        "phc_scandate": "2009-12-21",
        "image_acq_date": "12/21/2009"
      }
    },
    {
      "image_id": "I272941",
      "image_path": "ADNI_Nifti_QC_N4/I272941_T1_N4.nii.gz",
      "ptid": "067_S_4212",
      "visit": "v04",
      "acq_date": "12/19/2011",
      "phc_scan_date": "2011-12-19",
      "source": "phc",
      "question": "MRI scan (Image Data ID I272941) acquired on 12/19/2011 for a male participant (visit v04). Predict the subject's T1 scan age in years and answer with a numeric value using one decimal place.",
      "answer": "65",
      "answer_code": "65",
      "answer_units": "years",
      "demographics": {
        "sex": "male",
        "sex_code": "1",
        "visit": "v04",
        "phc_scandate": "2011-12-19",
        "image_acq_date": "12/19/2011"
      }
    },
    {
      "image_id": "I492146",
      "image_path": "ADNI_Nifti_QC_N4/I492146_T1_N4.nii.gz",
      "ptid": "037_S_5126",
      "visit": "v21",
      "acq_date": "5/13/2015",
      "phc_scan_date": "2015-05-13",
      "source": "phc",
      "question": "MRI scan (Image Data ID I492146) acquired on 5/13/2015 for a female participant (visit v21). Predict the subject's T1 scan age in years and answer with a numeric value using one decimal place.",
      "answer": "70.7",
      "answer_code": "70.7",
      "answer_units": "years",
      "demographics": {
        "sex": "female",
        "sex_code": "2",
        "visit": "v21",
        "phc_scandate": "2015-05-13",
        "image_acq_date": "5/13/2015"
      }
    },
    {
      "image_id": "I188697",
      "image_path": "ADNI_Nifti_QC_N4/I188697_T1_N4.nii.gz",
      "ptid": "014_S_0548",
      "visit": "m48",
      "acq_date": "7/30/2010",
      "phc_scan_date": "2010-07-30",
      "source": "phc",
      "question": "MRI scan (Image Data ID I188697) acquired on 7/30/2010 for a female participant (visit m48). Predict the subject's T1 scan age in years and answer with a numeric value using one decimal place.",
      "answer": "78",
      "answer_code": "78",
      "answer_units": "years",
      "demographics": {
        "sex": "female",
        "sex_code": "2",
        "visit": "m48",
        "phc_scandate": "2010-07-30",
        "image_acq_date": "7/30/2010"
      }
    },
    {
      "image_id": "I176995",
      "image_path": "ADNI_Nifti_QC_N4/I176995_T1_N4.nii.gz",
      "ptid": "052_S_1250",
      "visit": "m36",
      "acq_date": "5/25/2010",
      "phc_scan_date": "2010-05-25",
      "source": "phc",
      "question": "MRI scan (Image Data ID I176995) acquired on 5/25/2010 for a female participant (visit m36). Predict the subject's T1 scan age in years and answer with a numeric value using one decimal place.",
      "answer": "76.6",
      "answer_code": "76.6",
      "answer_units": "years",
      "demographics": {
        "sex": "female",
        "sex_code": "2",
        "visit": "m36",
        "phc_scandate": "2010-05-25",
        "image_acq_date": "5/25/2010"
      }
    },
    {
      "image_id": "I55989",
      "image_path": "ADNI_Nifti_QC_N4/I55989_T1_N4.nii.gz",
      "ptid": "136_S_0874",
      "visit": "m06",
      "acq_date": "6/05/2007",
      "phc_scan_date": "2007-06-05",
      "source": "phc",
      "question": "MRI scan (Image Data ID I55989) acquired on 6/05/2007 for a female participant (visit m06). Predict the subject's T1 scan age in years and answer with a numeric value using one decimal place.",
      "answer": "66.7",
      "answer_code": "66.7",
      "answer_units": "years",
      "demographics": {
        "sex": "female",
        "sex_code": "2",
        "visit": "m06",
        "phc_scandate": "2007-06-05",
        "image_acq_date": "6/05/2007"
      }
    },
    {
      "image_id": "I71764",
      "image_path": "ADNI_Nifti_QC_N4/I71764_T1_N4.nii.gz",
      "ptid": "073_S_0565",
      "visit": "m12",
      "acq_date": "9/04/2007",
      "phc_scan_date": "2007-09-04",
      "source": "phc",
      "question": "MRI scan (Image Data ID I71764) acquired on 9/04/2007 for a male participant (visit m12). Predict the subject's T1 scan age in years and answer with a numeric value using one decimal place.",
      "answer": "75.9",
      "answer_code": "75.9",
      "answer_units": "years",
      "demographics": {
        "sex": "male",
        "sex_code": "1",
        "visit": "m12",
        "phc_scandate": "2007-09-04",
        "image_acq_date": "9/04/2007"
      }
    },
    {
      "image_id": "I283359",
      "image_path": "ADNI_Nifti_QC_N4/I283359_T1_N4.nii.gz",
      "ptid": "073_S_4155",
      "visit": "v05",
      "acq_date": "2/06/2012",
      "phc_scan_date": "2012-02-06",
      "source": "phc",
      "question": "MRI scan (Image Data ID I283359) acquired on 2/06/2012 for a female participant (visit v05). Predict the subject's T1 scan age in years and answer with a numeric value using one decimal place.",
      "answer": "78.2",
      "answer_code": "78.2",
      "answer_units": "years",
      "demographics": {
        "sex": "female",
        "sex_code": "2",
        "visit": "v05",
        "phc_scandate": "2012-02-06",
        "image_acq_date": "2/06/2012"
      }
    },
    {
      "image_id": "I61166",
      "image_path": "ADNI_Nifti_QC_N4/I61166_T1_N4.nii.gz",
      "ptid": "027_S_1213",
      "visit": "m06",
      "acq_date": "7/20/2007",
      "phc_scan_date": "2007-07-20",
      "source": "phc",
      "question": "MRI scan (Image Data ID I61166) acquired on 7/20/2007 for a female participant (visit m06). Predict the subject's T1 scan age in years and answer with a numeric value using one decimal place.",
      "answer": "75.4",
      "answer_code": "75.4",
      "answer_units": "years",
      "demographics": {
        "sex": "female",
        "sex_code": "2",
        "visit": "m06",
        "phc_scandate": "2007-07-20",
        "image_acq_date": "7/20/2007"
      }
    },
    {
      "image_id": "I344137",
      "image_path": "ADNI_Nifti_QC_N4/I344137_T1_N4.nii.gz",
      "ptid": "126_S_4686",
      "visit": "v05",
      "acq_date": "11/06/2012",
      "phc_scan_date": "2012-11-06",
      "source": "phc",
      "question": "MRI scan (Image Data ID I344137) acquired on 11/06/2012 for a male participant (visit v05). Predict the subject's T1 scan age in years and answer with a numeric value using one decimal place.",
      "answer": "72.3",
      "answer_code": "72.3",
      "answer_units": "years",
      "demographics": {
        "sex": "male",
        "sex_code": "1",
        "visit": "v05",
        "phc_scandate": "2012-11-06",
        "image_acq_date": "11/06/2012"
      }
    },
    {
      "image_id": "I352141",
      "image_path": "ADNI_Nifti_QC_N4/I352141_T1_N4.nii.gz",
      "ptid": "027_S_0074",
      "visit": "v06",
      "acq_date": "12/17/2012",
      "phc_scan_date": "2012-12-17",
      "source": "phc",
      "question": "MRI scan (Image Data ID I352141) acquired on 12/17/2012 for a male participant (visit v06). Predict the subject's T1 scan age in years and answer with a numeric value using one decimal place.",
      "answer": "85.4",
      "answer_code": "85.4",
      "answer_units": "years",
      "demographics": {
        "sex": "male",
        "sex_code": "1",
        "visit": "v06",
        "phc_scandate": "2012-12-17",
        "image_acq_date": "12/17/2012"
      }
    },
    {
      "image_id": "I24984",
      "image_path": "ADNI_Nifti_QC_N4/I24984_T1_N4.nii.gz",
      "ptid": "128_S_0863",
      "visit": "sc",
      "acq_date": "9/25/2006",
      "phc_scan_date": "2006-09-25",
      "source": "phc",
      "question": "MRI scan (Image Data ID I24984) acquired on 9/25/2006 for a male participant (visit sc). Predict the subject's T1 scan age in years and answer with a numeric value using one decimal place.",
      "answer": "79.3",
      "answer_code": "79.3",
      "answer_units": "years",
      "demographics": {
        "sex": "male",
        "sex_code": "1",
        "visit": "sc",
        "phc_scandate": "2006-09-25",
        "image_acq_date": "9/25/2006"
      }
    },
    {
      "image_id": "I253445",
      "image_path": "ADNI_Nifti_QC_N4/I253445_T1_N4.nii.gz",
      "ptid": "023_S_4115",
      "visit": "v02",
      "acq_date": "8/30/2011",
      "phc_scan_date": "2011-08-30",
      "source": "phc",
      "question": "MRI scan (Image Data ID I253445) acquired on 8/30/2011 for a male participant (visit v02). Predict the subject's T1 scan age in years and answer with a numeric value using one decimal place.",
      "answer": "67.6",
      "answer_code": "67.6",
      "answer_units": "years",
      "demographics": {
        "sex": "male",
        "sex_code": "1",
        "visit": "v02",
        "phc_scandate": "2011-08-30",
        "image_acq_date": "8/30/2011"
      }
    },
    {
      "image_id": "I75356",
      "image_path": "ADNI_Nifti_QC_N4/I75356_T1_N4.nii.gz",
      "ptid": "057_S_0818",
      "visit": "m12",
      "acq_date": "9/26/2007",
      "phc_scan_date": "2007-09-26",
      "source": "phc",
      "question": "MRI scan (Image Data ID I75356) acquired on 9/26/2007 for a female participant (visit m12). Predict the subject's T1 scan age in years and answer with a numeric value using one decimal place.",
      "answer": "75.1",
      "answer_code": "75.1",
      "answer_units": "years",
      "demographics": {
        "sex": "female",
        "sex_code": "2",
        "visit": "m12",
        "phc_scandate": "2007-09-26",
        "image_acq_date": "9/26/2007"
      }
    },
    {
      "image_id": "I196431",
      "image_path": "ADNI_Nifti_QC_N4/I196431_T1_N4.nii.gz",
      "ptid": "031_S_2022",
      "visit": "m03",
      "acq_date": "10/12/2010",
      "phc_scan_date": "2010-10-12",
      "source": "phc",
      "question": "MRI scan (Image Data ID I196431) acquired on 10/12/2010 for a male participant (visit m03). Predict the subject's T1 scan age in years and answer with a numeric value using one decimal place.",
      "answer": "66.3",
      "answer_code": "66.3",
      "answer_units": "years",
      "demographics": {
        "sex": "male",
        "sex_code": "1",
        "visit": "m03",
        "phc_scandate": "2010-10-12",
        "image_acq_date": "10/12/2010"
      }
    },
    {
      "image_id": "I632429",
      "image_path": "ADNI_Nifti_QC_N4/I632429_T1_N4.nii.gz",
      "ptid": "036_S_4430",
      "visit": "v41",
      "acq_date": "2/10/2016",
      "phc_scan_date": "2016-02-10",
      "source": "phc",
      "question": "MRI scan (Image Data ID I632429) acquired on 2/10/2016 for a male participant (visit v41). Predict the subject's T1 scan age in years and answer with a numeric value using one decimal place.",
      "answer": "84.2",
      "answer_code": "84.2",
      "answer_units": "years",
      "demographics": {
        "sex": "male",
        "sex_code": "1",
        "visit": "v41",
        "phc_scandate": "2016-02-10",
        "image_acq_date": "2/10/2016"
      }
    },
    {
      "image_id": "I343372",
      "image_path": "ADNI_Nifti_QC_N4/I343372_T1_N4.nii.gz",
      "ptid": "129_S_4287",
      "visit": "v11",
      "acq_date": "10/30/2012",
      "phc_scan_date": "2012-10-30",
      "source": "phc",
      "question": "MRI scan (Image Data ID I343372) acquired on 10/30/2012 for a female participant (visit v11). Predict the subject's T1 scan age in years and answer with a numeric value using one decimal place.",
      "answer": "72",
      "answer_code": "72",
      "answer_units": "years",
      "demographics": {
        "sex": "female",
        "sex_code": "2",
        "visit": "v11",
        "phc_scandate": "2012-10-30",
        "image_acq_date": "10/30/2012"
      }
    },
    {
      "image_id": "I76723",
      "image_path": "ADNI_Nifti_QC_N4/I76723_T1_N4.nii.gz",
      "ptid": "007_S_0249",
      "visit": "m18",
      "acq_date": "10/03/2007",
      "phc_scan_date": "2007-10-03",
      "source": "phc",
      "question": "MRI scan (Image Data ID I76723) acquired on 10/03/2007 for a female participant (visit m18). Predict the subject's T1 scan age in years and answer with a numeric value using one decimal place.",
      "answer": "73.6",
      "answer_code": "73.6",
      "answer_units": "years",
      "demographics": {
        "sex": "female",
        "sex_code": "2",
        "visit": "m18",
        "phc_scandate": "2007-10-03",
        "image_acq_date": "10/03/2007"
      }
    },
    {
      "image_id": "I478695",
      "image_path": "ADNI_Nifti_QC_N4/I478695_T1_N4.nii.gz",
      "ptid": "013_S_1186",
      "visit": "v31",
      "acq_date": "3/18/2015",
      "phc_scan_date": "2015-03-18",
      "source": "phc",
      "question": "MRI scan (Image Data ID I478695) acquired on 3/18/2015 for a male participant (visit v31). Predict the subject's T1 scan age in years and answer with a numeric value using one decimal place.",
      "answer": "91.4",
      "answer_code": "91.4",
      "answer_units": "years",
      "demographics": {
        "sex": "male",
        "sex_code": "1",
        "visit": "v31",
        "phc_scandate": "2015-03-18",
        "image_acq_date": "3/18/2015"
      }
    },
    {
      "image_id": "I49581",
      "image_path": "ADNI_Nifti_QC_N4/I49581_T1_N4.nii.gz",
      "ptid": "057_S_0839",
      "visit": "m06",
      "acq_date": "4/18/2007",
      "phc_scan_date": "2007-04-18",
      "source": "phc",
      "question": "MRI scan (Image Data ID I49581) acquired on 4/18/2007 for a female participant (visit m06). Predict the subject's T1 scan age in years and answer with a numeric value using one decimal place.",
      "answer": "80.1",
      "answer_code": "80.1",
      "answer_units": "years",
      "demographics": {
        "sex": "female",
        "sex_code": "2",
        "visit": "m06",
        "phc_scandate": "2007-04-18",
        "image_acq_date": "4/18/2007"
      }
    },
    {
      "image_id": "I365441",
      "image_path": "ADNI_Nifti_QC_N4/I365441_T1_N4.nii.gz",
      "ptid": "073_S_5023",
      "visit": "v05",
      "acq_date": "4/03/2013",
      "phc_scan_date": "2013-04-03",
      "source": "phc",
      "question": "MRI scan (Image Data ID I365441) acquired on 4/03/2013 for a female participant (visit v05). Predict the subject's T1 scan age in years and answer with a numeric value using one decimal place.",
      "answer": "64.4",
      "answer_code": "64.4",
      "answer_units": "years",
      "demographics": {
        "sex": "female",
        "sex_code": "2",
        "visit": "v05",
        "phc_scandate": "2013-04-03",
        "image_acq_date": "4/03/2013"
      }
    },
    {
      "image_id": "I297182",
      "image_path": "ADNI_Nifti_QC_N4/I297182_T1_N4.nii.gz",
      "ptid": "018_S_4313",
      "visit": "v04",
      "acq_date": "4/12/2012",
      "phc_scan_date": "2012-04-12",
      "source": "phc",
      "question": "MRI scan (Image Data ID I297182) acquired on 4/12/2012 for a female participant (visit v04). Predict the subject's T1 scan age in years and answer with a numeric value using one decimal place.",
      "answer": "77.5",
      "answer_code": "77.5",
      "answer_units": "years",
      "demographics": {
        "sex": "female",
        "sex_code": "2",
        "visit": "v04",
        "phc_scandate": "2012-04-12",
        "image_acq_date": "4/12/2012"
      }
    },
    {
      "image_id": "I137062",
      "image_path": "ADNI_Nifti_QC_N4/I137062_T1_N4.nii.gz",
      "ptid": "033_S_1308",
      "visit": "m24",
      "acq_date": "2/25/2009",
      "phc_scan_date": "2009-02-25",
      "source": "phc",
      "question": "MRI scan (Image Data ID I137062) acquired on 2/25/2009 for a male participant (visit m24). Predict the subject's T1 scan age in years and answer with a numeric value using one decimal place.",
      "answer": "81.8",
      "answer_code": "81.8",
      "answer_units": "years",
      "demographics": {
        "sex": "male",
        "sex_code": "1",
        "visit": "m24",
        "phc_scandate": "2009-02-25",
        "image_acq_date": "2/25/2009"
      }
    },
    {
      "image_id": "I41480",
      "image_path": "ADNI_Nifti_QC_N4/I41480_T1_N4.nii.gz",
      "ptid": "014_S_0169",
      "visit": "m12",
      "acq_date": "2/22/2007",
      "phc_scan_date": "2007-02-22",
      "source": "phc",
      "question": "MRI scan (Image Data ID I41480) acquired on 2/22/2007 for a female participant (visit m12). Predict the subject's T1 scan age in years and answer with a numeric value using one decimal place.",
      "answer": "73.1",
      "answer_code": "73.1",
      "answer_units": "years",
      "demographics": {
        "sex": "female",
        "sex_code": "2",
        "visit": "m12",
        "phc_scandate": "2007-02-22",
        "image_acq_date": "2/22/2007"
      }
    },
    {
      "image_id": "I354420",
      "image_path": "ADNI_Nifti_QC_N4/I354420_T1_N4.nii.gz",
      "ptid": "068_S_4340",
      "visit": "v11",
      "acq_date": "1/09/2013",
      "phc_scan_date": "2013-01-09",
      "source": "phc",
      "question": "MRI scan (Image Data ID I354420) acquired on 1/09/2013 for a female participant (visit v11). Predict the subject's T1 scan age in years and answer with a numeric value using one decimal place.",
      "answer": "67.9",
      "answer_code": "67.9",
      "answer_units": "years",
      "demographics": {
        "sex": "female",
        "sex_code": "2",
        "visit": "v11",
        "phc_scandate": "2013-01-09",
        "image_acq_date": "1/09/2013"
      }
    },
    {
      "image_id": "I137981",
      "image_path": "ADNI_Nifti_QC_N4/I137981_T1_N4.nii.gz",
      "ptid": "041_S_1418",
      "visit": "m18",
      "acq_date": "2/23/2009",
      "phc_scan_date": "2009-02-23",
      "source": "phc",
      "question": "MRI scan (Image Data ID I137981) acquired on 2/23/2009 for a male participant (visit m18). Predict the subject's T1 scan age in years and answer with a numeric value using one decimal place.",
      "answer": "83.2",
      "answer_code": "83.2",
      "answer_units": "years",
      "demographics": {
        "sex": "male",
        "sex_code": "1",
        "visit": "m18",
        "phc_scandate": "2009-02-23",
        "image_acq_date": "2/23/2009"
      }
    },
    {
      "image_id": "I16960",
      "image_path": "ADNI_Nifti_QC_N4/I16960_T1_N4.nii.gz",
      "ptid": "023_S_0058",
      "visit": "m06",
      "acq_date": "6/13/2006",
      "phc_scan_date": "2006-06-13",
      "source": "phc",
      "question": "MRI scan (Image Data ID I16960) acquired on 6/13/2006 for a male participant (visit m06). Predict the subject's T1 scan age in years and answer with a numeric value using one decimal place.",
      "answer": "70.7",
      "answer_code": "70.7",
      "answer_units": "years",
      "demographics": {
        "sex": "male",
        "sex_code": "1",
        "visit": "m06",
        "phc_scandate": "2006-06-13",
        "image_acq_date": "6/13/2006"
      }
    },
    {
      "image_id": "I487764",
      "image_path": "ADNI_Nifti_QC_N4/I487764_T1_N4.nii.gz",
      "ptid": "041_S_4974",
      "visit": "v05",
      "acq_date": "4/23/2013",
      "phc_scan_date": "2013-04-23",
      "source": "phc",
      "question": "MRI scan (Image Data ID I487764) acquired on 4/23/2013 for a male participant (visit v05). Predict the subject's T1 scan age in years and answer with a numeric value using one decimal place.",
      "answer": "74",
      "answer_code": "74",
      "answer_units": "years",
      "demographics": {
        "sex": "male",
        "sex_code": "1",
        "visit": "v05",
        "phc_scandate": "2013-04-23",
        "image_acq_date": "4/23/2013"
      }
    },
    {
      "image_id": "I343041",
      "image_path": "ADNI_Nifti_QC_N4/I343041_T1_N4.nii.gz",
      "ptid": "051_S_4980",
      "visit": "v02",
      "acq_date": "10/29/2012",
      "phc_scan_date": "2012-10-29",
      "source": "phc",
      "question": "MRI scan (Image Data ID I343041) acquired on 10/29/2012 for a male participant (visit v02). Predict the subject's T1 scan age in years and answer with a numeric value using one decimal place.",
      "answer": "87.4",
      "answer_code": "87.4",
      "answer_units": "years",
      "demographics": {
        "sex": "male",
        "sex_code": "1",
        "visit": "v02",
        "phc_scandate": "2012-10-29",
        "image_acq_date": "10/29/2012"
      }
    },
    {
      "image_id": "I358884",
      "image_path": "ADNI_Nifti_QC_N4/I358884_T1_N4.nii.gz",
      "ptid": "036_S_4491",
      "visit": "v11",
      "acq_date": "2/12/2013",
      "phc_scan_date": "2013-02-12",
      "source": "phc",
      "question": "MRI scan (Image Data ID I358884) acquired on 2/12/2013 for a male participant (visit v11). Predict the subject's T1 scan age in years and answer with a numeric value using one decimal place.",
      "answer": "85.2",
      "answer_code": "85.2",
      "answer_units": "years",
      "demographics": {
        "sex": "male",
        "sex_code": "1",
        "visit": "v11",
        "phc_scandate": "2013-02-12",
        "image_acq_date": "2/12/2013"
      }
    },
    {
      "image_id": "I126423",
      "image_path": "ADNI_Nifti_QC_N4/I126423_T1_N4.nii.gz",
      "ptid": "024_S_1063",
      "visit": "m24",
      "acq_date": "11/13/2008",
      "phc_scan_date": "2008-11-13",
      "source": "phc",
      "question": "MRI scan (Image Data ID I126423) acquired on 11/13/2008 for a female participant (visit m24). Predict the subject's T1 scan age in years and answer with a numeric value using one decimal place.",
      "answer": "80.5",
      "answer_code": "80.5",
      "answer_units": "years",
      "demographics": {
        "sex": "female",
        "sex_code": "2",
        "visit": "m24",
        "phc_scandate": "2008-11-13",
        "image_acq_date": "11/13/2008"
      }
    },
    {
      "image_id": "I340077",
      "image_path": "ADNI_Nifti_QC_N4/I340077_T1_N4.nii.gz",
      "ptid": "116_S_4635",
      "visit": "v05",
      "acq_date": "10/15/2012",
      "phc_scan_date": "2012-10-15",
      "source": "phc",
      "question": "MRI scan (Image Data ID I340077) acquired on 10/15/2012 for a female participant (visit v05). Predict the subject's T1 scan age in years and answer with a numeric value using one decimal place.",
      "answer": "73.3",
      "answer_code": "73.3",
      "answer_units": "years",
      "demographics": {
        "sex": "female",
        "sex_code": "2",
        "visit": "v05",
        "phc_scandate": "2012-10-15",
        "image_acq_date": "10/15/2012"
      }
    },
    {
      "image_id": "I24850",
      "image_path": "ADNI_Nifti_QC_N4/I24850_T1_N4.nii.gz",
      "ptid": "057_S_0839",
      "visit": "sc",
      "acq_date": "9/20/2006",
      "phc_scan_date": "2006-09-20",
      "source": "phc",
      "question": "MRI scan (Image Data ID I24850) acquired on 9/20/2006 for a female participant (visit sc). Predict the subject's T1 scan age in years and answer with a numeric value using one decimal place.",
      "answer": "79.5",
      "answer_code": "79.5",
      "answer_units": "years",
      "demographics": {
        "sex": "female",
        "sex_code": "2",
        "visit": "sc",
        "phc_scandate": "2006-09-20",
        "image_acq_date": "9/20/2006"
      }
    },
    {
      "image_id": "I14964",
      "image_path": "ADNI_Nifti_QC_N4/I14964_T1_N4.nii.gz",
      "ptid": "027_S_0408",
      "visit": "sc",
      "acq_date": "5/10/2006",
      "phc_scan_date": "2006-05-10",
      "source": "phc",
      "question": "MRI scan (Image Data ID I14964) acquired on 5/10/2006 for a male participant (visit sc). Predict the subject's T1 scan age in years and answer with a numeric value using one decimal place.",
      "answer": "82.3",
      "answer_code": "82.3",
      "answer_units": "years",
      "demographics": {
        "sex": "male",
        "sex_code": "1",
        "visit": "sc",
        "phc_scandate": "2006-05-10",
        "image_acq_date": "5/10/2006"
      }
    },
    {
      "image_id": "I35355",
      "image_path": "ADNI_Nifti_QC_N4/I35355_T1_N4.nii.gz",
      "ptid": "126_S_0405",
      "visit": "m06",
      "acq_date": "1/05/2007",
      "phc_scan_date": "2007-01-05",
      "source": "phc",
      "question": "MRI scan (Image Data ID I35355) acquired on 1/05/2007 for a male participant (visit m06). Predict the subject's T1 scan age in years and answer with a numeric value using one decimal place.",
      "answer": "76.8",
      "answer_code": "76.8",
      "answer_units": "years",
      "demographics": {
        "sex": "male",
        "sex_code": "1",
        "visit": "m06",
        "phc_scandate": "2007-01-05",
        "image_acq_date": "1/05/2007"
      }
    },
    {
      "image_id": "I53772",
      "image_path": "ADNI_Nifti_QC_N4/I53772_T1_N4.nii.gz",
      "ptid": "053_S_0919",
      "visit": "m06",
      "acq_date": "5/08/2007",
      "phc_scan_date": "2007-05-08",
      "source": "phc",
      "question": "MRI scan (Image Data ID I53772) acquired on 5/08/2007 for a male participant (visit m06). Predict the subject's T1 scan age in years and answer with a numeric value using one decimal place.",
      "answer": "63.1",
      "answer_code": "63.1",
      "answer_units": "years",
      "demographics": {
        "sex": "male",
        "sex_code": "1",
        "visit": "m06",
        "phc_scandate": "2007-05-08",
        "image_acq_date": "5/08/2007"
      }
    },
    {
      "image_id": "I424878",
      "image_path": "ADNI_Nifti_QC_N4/I424878_T1_N4.nii.gz",
      "ptid": "014_S_2308",
      "visit": "v21",
      "acq_date": "5/14/2014",
      "phc_scan_date": "2014-05-14",
      "source": "phc",
      "question": "MRI scan (Image Data ID I424878) acquired on 5/14/2014 for a male participant (visit v21). Predict the subject's T1 scan age in years and answer with a numeric value using one decimal place.",
      "answer": "78.2",
      "answer_code": "78.2",
      "answer_units": "years",
      "demographics": {
        "sex": "male",
        "sex_code": "1",
        "visit": "v21",
        "phc_scandate": "2014-05-14",
        "image_acq_date": "5/14/2014"
      }
    },
    {
      "image_id": "I367798",
      "image_path": "ADNI_Nifti_QC_N4/I367798_T1_N4.nii.gz",
      "ptid": "099_S_0958",
      "visit": "m06",
      "acq_date": "5/17/2007",
      "phc_scan_date": "2007-05-17",
      "source": "phc",
      "question": "MRI scan (Image Data ID I367798) acquired on 5/17/2007 for a male participant (visit m06). Predict the subject's T1 scan age in years and answer with a numeric value using one decimal place.",
      "answer": "65",
      "answer_code": "65",
      "answer_units": "years",
      "demographics": {
        "sex": "male",
        "sex_code": "1",
        "visit": "m06",
        "phc_scandate": "2007-05-17",
        "image_acq_date": "5/17/2007"
      }
    },
    {
      "image_id": "I306307",
      "image_path": "ADNI_Nifti_QC_N4/I306307_T1_N4.nii.gz",
      "ptid": "011_S_4547",
      "visit": "v04",
      "acq_date": "5/24/2012",
      "phc_scan_date": "2012-05-24",
      "source": "phc",
      "question": "MRI scan (Image Data ID I306307) acquired on 5/24/2012 for a male participant (visit v04). Predict the subject's T1 scan age in years and answer with a numeric value using one decimal place.",
      "answer": "77.6",
      "answer_code": "77.6",
      "answer_units": "years",
      "demographics": {
        "sex": "male",
        "sex_code": "1",
        "visit": "v04",
        "phc_scandate": "2012-05-24",
        "image_acq_date": "5/24/2012"
      }
    },
    {
      "image_id": "I495348",
      "image_path": "ADNI_Nifti_QC_N4/I495348_T1_N4.nii.gz",
      "ptid": "041_S_4037",
      "visit": "v41",
      "acq_date": "5/28/2015",
      "phc_scan_date": "2015-05-28",
      "source": "phc",
      "question": "MRI scan (Image Data ID I495348) acquired on 5/28/2015 for a male participant (visit v41). Predict the subject's T1 scan age in years and answer with a numeric value using one decimal place.",
      "answer": "79.8",
      "answer_code": "79.8",
      "answer_units": "years",
      "demographics": {
        "sex": "male",
        "sex_code": "1",
        "visit": "v41",
        "phc_scandate": "2015-05-28",
        "image_acq_date": "5/28/2015"
      }
    },
    {
      "image_id": "I259722",
      "image_path": "ADNI_Nifti_QC_N4/I259722_T1_N4.nii.gz",
      "ptid": "011_S_4105",
      "visit": "v04",
      "acq_date": "10/05/2011",
      "phc_scan_date": "2011-10-05",
      "source": "phc",
      "question": "MRI scan (Image Data ID I259722) acquired on 10/05/2011 for a female participant (visit v04). Predict the subject's T1 scan age in years and answer with a numeric value using one decimal place.",
      "answer": "71.1",
      "answer_code": "71.1",
      "answer_units": "years",
      "demographics": {
        "sex": "female",
        "sex_code": "2",
        "visit": "v04",
        "phc_scandate": "2011-10-05",
        "image_acq_date": "10/05/2011"
      }
    },
    {
      "image_id": "I634519",
      "image_path": "ADNI_Nifti_QC_N4/I634519_T1_N4.nii.gz",
      "ptid": "135_S_4446",
      "visit": "v41",
      "acq_date": "2/18/2016",
      "phc_scan_date": "2016-02-18",
      "source": "phc",
      "question": "MRI scan (Image Data ID I634519) acquired on 2/18/2016 for a female participant (visit v41). Predict the subject's T1 scan age in years and answer with a numeric value using one decimal place.",
      "answer": "72.6",
      "answer_code": "72.6",
      "answer_units": "years",
      "demographics": {
        "sex": "female",
        "sex_code": "2",
        "visit": "v41",
        "phc_scandate": "2016-02-18",
        "image_acq_date": "2/18/2016"
      }
    },
    {
      "image_id": "I340266",
      "image_path": "ADNI_Nifti_QC_N4/I340266_T1_N4.nii.gz",
      "ptid": "009_S_4741",
      "visit": "v04",
      "acq_date": "10/15/2012",
      "phc_scan_date": "2012-10-15",
      "source": "phc",
      "question": "MRI scan (Image Data ID I340266) acquired on 10/15/2012 for a male participant (visit v04). Predict the subject's T1 scan age in years and answer with a numeric value using one decimal place.",
      "answer": "62.1",
      "answer_code": "62.1",
      "answer_units": "years",
      "demographics": {
        "sex": "male",
        "sex_code": "1",
        "visit": "v04",
        "phc_scandate": "2012-10-15",
        "image_acq_date": "10/15/2012"
      }
    },
    {
      "image_id": "I23373",
      "image_path": "ADNI_Nifti_QC_N4/I23373_T1_N4.nii.gz",
      "ptid": "036_S_0813",
      "visit": "sc",
      "acq_date": "8/25/2006",
      "phc_scan_date": "2006-08-25",
      "source": "phc",
      "question": "MRI scan (Image Data ID I23373) acquired on 8/25/2006 for a male participant (visit sc). Predict the subject's T1 scan age in years and answer with a numeric value using one decimal place.",
      "answer": "72.9",
      "answer_code": "72.9",
      "answer_units": "years",
      "demographics": {
        "sex": "male",
        "sex_code": "1",
        "visit": "sc",
        "phc_scandate": "2006-08-25",
        "image_acq_date": "8/25/2006"
      }
    },
    {
      "image_id": "I330203",
      "image_path": "ADNI_Nifti_QC_N4/I330203_T1_N4.nii.gz",
      "ptid": "068_S_4914",
      "visit": "v02",
      "acq_date": "9/04/2012",
      "phc_scan_date": "2012-09-04",
      "source": "phc",
      "question": "MRI scan (Image Data ID I330203) acquired on 9/04/2012 for a female participant (visit v02). Predict the subject's T1 scan age in years and answer with a numeric value using one decimal place.",
      "answer": "62",
      "answer_code": "62",
      "answer_units": "years",
      "demographics": {
        "sex": "female",
        "sex_code": "2",
        "visit": "v02",
        "phc_scandate": "2012-09-04",
        "image_acq_date": "9/04/2012"
      }
    },
    {
      "image_id": "I505158",
      "image_path": "ADNI_Nifti_QC_N4/I505158_T1_N4.nii.gz",
      "ptid": "002_S_2010",
      "visit": "v41",
      "acq_date": "8/13/2015",
      "phc_scan_date": "2015-08-13",
      "source": "phc",
      "question": "MRI scan (Image Data ID I505158) acquired on 8/13/2015 for a female participant (visit v41). Predict the subject's T1 scan age in years and answer with a numeric value using one decimal place.",
      "answer": "68.2",
      "answer_code": "68.2",
      "answer_units": "years",
      "demographics": {
        "sex": "female",
        "sex_code": "2",
        "visit": "v41",
        "phc_scandate": "2015-08-13",
        "image_acq_date": "8/13/2015"
      }
    },
    {
      "image_id": "I351045",
      "image_path": "ADNI_Nifti_QC_N4/I351045_T1_N4.nii.gz",
      "ptid": "068_S_4274",
      "visit": "v11",
      "acq_date": "12/12/2012",
      "phc_scan_date": "2012-12-12",
      "source": "phc",
      "question": "MRI scan (Image Data ID I351045) acquired on 12/12/2012 for a male participant (visit v11). Predict the subject's T1 scan age in years and answer with a numeric value using one decimal place.",
      "answer": "64.3",
      "answer_code": "64.3",
      "answer_units": "years",
      "demographics": {
        "sex": "male",
        "sex_code": "1",
        "visit": "v11",
        "phc_scandate": "2012-12-12",
        "image_acq_date": "12/12/2012"
      }
    },
    {
      "image_id": "I394342",
      "image_path": "ADNI_Nifti_QC_N4/I394342_T1_N4.nii.gz",
      "ptid": "027_S_4938",
      "visit": "v11",
      "acq_date": "10/14/2013",
      "phc_scan_date": "2013-10-14",
      "source": "phc",
      "question": "MRI scan (Image Data ID I394342) acquired on 10/14/2013 for a male participant (visit v11). Predict the subject's T1 scan age in years and answer with a numeric value using one decimal place.",
      "answer": "72.1",
      "answer_code": "72.1",
      "answer_units": "years",
      "demographics": {
        "sex": "male",
        "sex_code": "1",
        "visit": "v11",
        "phc_scandate": "2013-10-14",
        "image_acq_date": "10/14/2013"
      }
    },
    {
      "image_id": "I297126",
      "image_path": "ADNI_Nifti_QC_N4/I297126_T1_N4.nii.gz",
      "ptid": "014_S_4401",
      "visit": "v04",
      "acq_date": "4/12/2012",
      "phc_scan_date": "2012-04-12",
      "source": "phc",
      "question": "MRI scan (Image Data ID I297126) acquired on 4/12/2012 for a female participant (visit v04). Predict the subject's T1 scan age in years and answer with a numeric value using one decimal place.",
      "answer": "67.9",
      "answer_code": "67.9",
      "answer_units": "years",
      "demographics": {
        "sex": "female",
        "sex_code": "2",
        "visit": "v04",
        "phc_scandate": "2012-04-12",
        "image_acq_date": "4/12/2012"
      }
    },
    {
      "image_id": "I298241",
      "image_path": "ADNI_Nifti_QC_N4/I298241_T1_N4.nii.gz",
      "ptid": "123_S_0298",
      "visit": "v06",
      "acq_date": "3/01/2012",
      "phc_scan_date": "2012-03-01",
      "source": "phc",
      "question": "MRI scan (Image Data ID I298241) acquired on 3/01/2012 for a male participant (visit v06). Predict the subject's T1 scan age in years and answer with a numeric value using one decimal place.",
      "answer": "82.5",
      "answer_code": "82.5",
      "answer_units": "years",
      "demographics": {
        "sex": "male",
        "sex_code": "1",
        "visit": "v06",
        "phc_scandate": "2012-03-01",
        "image_acq_date": "3/01/2012"
      }
    },
    {
      "image_id": "I315766",
      "image_path": "ADNI_Nifti_QC_N4/I315766_T1_N4.nii.gz",
      "ptid": "022_S_4805",
      "visit": "v02",
      "acq_date": "7/03/2012",
      "phc_scan_date": "2012-07-03",
      "source": "phc",
      "question": "MRI scan (Image Data ID I315766) acquired on 7/03/2012 for a female participant (visit v02). Predict the subject's T1 scan age in years and answer with a numeric value using one decimal place.",
      "answer": "72",
      "answer_code": "72",
      "answer_units": "years",
      "demographics": {
        "sex": "female",
        "sex_code": "2",
        "visit": "v02",
        "phc_scandate": "2012-07-03",
        "image_acq_date": "7/03/2012"
      }
    },
    {
      "image_id": "I389082",
      "image_path": "ADNI_Nifti_QC_N4/I389082_T1_N4.nii.gz",
      "ptid": "082_S_5282",
      "visit": "v02",
      "acq_date": "8/29/2013",
      "phc_scan_date": "2013-08-29",
      "source": "phc",
      "question": "MRI scan (Image Data ID I389082) acquired on 8/29/2013 for a male participant (visit v02). Predict the subject's T1 scan age in years and answer with a numeric value using one decimal place.",
      "answer": "67",
      "answer_code": "67",
      "answer_units": "years",
      "demographics": {
        "sex": "male",
        "sex_code": "1",
        "visit": "v02",
        "phc_scandate": "2013-08-29",
        "image_acq_date": "8/29/2013"
      }
    },
    {
      "image_id": "I229358",
      "image_path": "ADNI_Nifti_QC_N4/I229358_T1_N4.nii.gz",
      "ptid": "098_S_0171",
      "visit": "v06",
      "acq_date": "4/16/2011",
      "phc_scan_date": "2011-04-16",
      "source": "phc",
      "question": "MRI scan (Image Data ID I229358) acquired on 4/16/2011 for a female participant (visit v06). Predict the subject's T1 scan age in years and answer with a numeric value using one decimal place.",
      "answer": "83.6",
      "answer_code": "83.6",
      "answer_units": "years",
      "demographics": {
        "sex": "female",
        "sex_code": "2",
        "visit": "v06",
        "phc_scandate": "2011-04-16",
        "image_acq_date": "4/16/2011"
      }
    },
    {
      "image_id": "I27140",
      "image_path": "ADNI_Nifti_QC_N4/I27140_T1_N4.nii.gz",
      "ptid": "003_S_0981",
      "visit": "sc",
      "acq_date": "10/19/2006",
      "phc_scan_date": "2006-10-19",
      "source": "phc",
      "question": "MRI scan (Image Data ID I27140) acquired on 10/19/2006 for a female participant (visit sc). Predict the subject's T1 scan age in years and answer with a numeric value using one decimal place.",
      "answer": "84.4",
      "answer_code": "84.4",
      "answer_units": "years",
      "demographics": {
        "sex": "female",
        "sex_code": "2",
        "visit": "sc",
        "phc_scandate": "2006-10-19",
        "image_acq_date": "10/19/2006"
      }
    },
    {
      "image_id": "I84540",
      "image_path": "ADNI_Nifti_QC_N4/I84540_T1_N4.nii.gz",
      "ptid": "133_S_1031",
      "visit": "m12",
      "acq_date": "12/11/2007",
      "phc_scan_date": "2007-12-11",
      "source": "phc",
      "question": "MRI scan (Image Data ID I84540) acquired on 12/11/2007 for a female participant (visit m12). Predict the subject's T1 scan age in years and answer with a numeric value using one decimal place.",
      "answer": "78.3",
      "answer_code": "78.3",
      "answer_units": "years",
      "demographics": {
        "sex": "female",
        "sex_code": "2",
        "visit": "m12",
        "phc_scandate": "2007-12-11",
        "image_acq_date": "12/11/2007"
      }
    },
    {
      "image_id": "I315610",
      "image_path": "ADNI_Nifti_QC_N4/I315610_T1_N4.nii.gz",
      "ptid": "052_S_0671",
      "visit": "v06",
      "acq_date": "7/09/2012",
      "phc_scan_date": "2012-07-09",
      "source": "phc",
      "question": "MRI scan (Image Data ID I315610) acquired on 7/09/2012 for a female participant (visit v06). Predict the subject's T1 scan age in years and answer with a numeric value using one decimal place.",
      "answer": "67.2",
      "answer_code": "67.2",
      "answer_units": "years",
      "demographics": {
        "sex": "female",
        "sex_code": "2",
        "visit": "v06",
        "phc_scandate": "2012-07-09",
        "image_acq_date": "7/09/2012"
      }
    },
    {
      "image_id": "I271869",
      "image_path": "ADNI_Nifti_QC_N4/I271869_T1_N4.nii.gz",
      "ptid": "116_S_4043",
      "visit": "v05",
      "acq_date": "12/09/2011",
      "phc_scan_date": "2011-12-09",
      "source": "phc",
      "question": "MRI scan (Image Data ID I271869) acquired on 12/09/2011 for a male participant (visit v05). Predict the subject's T1 scan age in years and answer with a numeric value using one decimal place.",
      "answer": "82.7",
      "answer_code": "82.7",
      "answer_units": "years",
      "demographics": {
        "sex": "male",
        "sex_code": "1",
        "visit": "v05",
        "phc_scandate": "2011-12-09",
        "image_acq_date": "12/09/2011"
      }
    },
    {
      "image_id": "I56062",
      "image_path": "ADNI_Nifti_QC_N4/I56062_T1_N4.nii.gz",
      "ptid": "137_S_0972",
      "visit": "m06",
      "acq_date": "6/05/2007",
      "phc_scan_date": "2007-06-05",
      "source": "phc",
      "question": "MRI scan (Image Data ID I56062) acquired on 6/05/2007 for a male participant (visit m06). Predict the subject's T1 scan age in years and answer with a numeric value using one decimal place.",
      "answer": "78.5",
      "answer_code": "78.5",
      "answer_units": "years",
      "demographics": {
        "sex": "male",
        "sex_code": "1",
        "visit": "m06",
        "phc_scandate": "2007-06-05",
        "image_acq_date": "6/05/2007"
      }
    },
    {
      "image_id": "I171158",
      "image_path": "ADNI_Nifti_QC_N4/I171158_T1_N4.nii.gz",
      "ptid": "027_S_0256",
      "visit": "m48",
      "acq_date": "4/15/2010",
      "phc_scan_date": "2010-04-15",
      "source": "phc",
      "question": "MRI scan (Image Data ID I171158) acquired on 4/15/2010 for a male participant (visit m48). Predict the subject's T1 scan age in years and answer with a numeric value using one decimal place.",
      "answer": "74.3",
      "answer_code": "74.3",
      "answer_units": "years",
      "demographics": {
        "sex": "male",
        "sex_code": "1",
        "visit": "m48",
        "phc_scandate": "2010-04-15",
        "image_acq_date": "4/15/2010"
      }
    },
    {
      "image_id": "I104048",
      "image_path": "ADNI_Nifti_QC_N4/I104048_T1_N4.nii.gz",
      "ptid": "013_S_0240",
      "visit": "m24",
      "acq_date": "4/24/2008",
      "phc_scan_date": "2008-04-24",
      "source": "phc",
      "question": "MRI scan (Image Data ID I104048) acquired on 4/24/2008 for a male participant (visit m24). Predict the subject's T1 scan age in years and answer with a numeric value using one decimal place.",
      "answer": "90.5",
      "answer_code": "90.5",
      "answer_units": "years",
      "demographics": {
        "sex": "male",
        "sex_code": "1",
        "visit": "m24",
        "phc_scandate": "2008-04-24",
        "image_acq_date": "4/24/2008"
      }
    },
    {
      "image_id": "I263892",
      "image_path": "ADNI_Nifti_QC_N4/I263892_T1_N4.nii.gz",
      "ptid": "068_S_4134",
      "visit": "v04",
      "acq_date": "10/31/2011",
      "phc_scan_date": "2011-10-31",
      "source": "phc",
      "question": "MRI scan (Image Data ID I263892) acquired on 10/31/2011 for a female participant (visit v04). Predict the subject's T1 scan age in years and answer with a numeric value using one decimal place.",
      "answer": "69.1",
      "answer_code": "69.1",
      "answer_units": "years",
      "demographics": {
        "sex": "female",
        "sex_code": "2",
        "visit": "v04",
        "phc_scandate": "2011-10-31",
        "image_acq_date": "10/31/2011"
      }
    },
    {
      "image_id": "I70033",
      "image_path": "ADNI_Nifti_QC_N4/I70033_T1_N4.nii.gz",
      "ptid": "941_S_1194",
      "visit": "m06",
      "acq_date": "8/22/2007",
      "phc_scan_date": "2007-08-22",
      "source": "phc",
      "question": "MRI scan (Image Data ID I70033) acquired on 8/22/2007 for a male participant (visit m06). Predict the subject's T1 scan age in years and answer with a numeric value using one decimal place.",
      "answer": "85.4",
      "answer_code": "85.4",
      "answer_units": "years",
      "demographics": {
        "sex": "male",
        "sex_code": "1",
        "visit": "m06",
        "phc_scandate": "2007-08-22",
        "image_acq_date": "8/22/2007"
      }
    },
    {
      "image_id": "I95259",
      "image_path": "ADNI_Nifti_QC_N4/I95259_T1_N4.nii.gz",
      "ptid": "137_S_0722",
      "visit": "m18",
      "acq_date": "3/04/2008",
      "phc_scan_date": "2008-03-04",
      "source": "phc",
      "question": "MRI scan (Image Data ID I95259) acquired on 3/04/2008 for a male participant (visit m18). Predict the subject's T1 scan age in years and answer with a numeric value using one decimal place.",
      "answer": "71.8",
      "answer_code": "71.8",
      "answer_units": "years",
      "demographics": {
        "sex": "male",
        "sex_code": "1",
        "visit": "m18",
        "phc_scandate": "2008-03-04",
        "image_acq_date": "3/04/2008"
      }
    },
    {
      "image_id": "I316794",
      "image_path": "ADNI_Nifti_QC_N4/I316794_T1_N4.nii.gz",
      "ptid": "005_S_2390",
      "visit": "v06",
      "acq_date": "7/17/2012",
      "phc_scan_date": "2012-07-17",
      "source": "phc",
      "question": "MRI scan (Image Data ID I316794) acquired on 7/17/2012 for a female participant (visit v06). Predict the subject's T1 scan age in years and answer with a numeric value using one decimal place.",
      "answer": "89",
      "answer_code": "89",
      "answer_units": "years",
      "demographics": {
        "sex": "female",
        "sex_code": "2",
        "visit": "v06",
        "phc_scandate": "2012-07-17",
        "image_acq_date": "7/17/2012"
      }
    },
    {
      "image_id": "I299165",
      "image_path": "ADNI_Nifti_QC_N4/I299165_T1_N4.nii.gz",
      "ptid": "037_S_4381",
      "visit": "v04",
      "acq_date": "4/20/2012",
      "phc_scan_date": "2012-04-20",
      "source": "phc",
      "question": "MRI scan (Image Data ID I299165) acquired on 4/20/2012 for a female participant (visit v04). Predict the subject's T1 scan age in years and answer with a numeric value using one decimal place.",
      "answer": "55.3",
      "answer_code": "55.3",
      "answer_units": "years",
      "demographics": {
        "sex": "female",
        "sex_code": "2",
        "visit": "v04",
        "phc_scandate": "2012-04-20",
        "image_acq_date": "4/20/2012"
      }
    },
    {
      "image_id": "I361704",
      "image_path": "ADNI_Nifti_QC_N4/I361704_T1_N4.nii.gz",
      "ptid": "094_S_4503",
      "visit": "v11",
      "acq_date": "2/28/2013",
      "phc_scan_date": "2013-02-28",
      "source": "phc",
      "question": "MRI scan (Image Data ID I361704) acquired on 2/28/2013 for a female participant (visit v11). Predict the subject's T1 scan age in years and answer with a numeric value using one decimal place.",
      "answer": "72.8",
      "answer_code": "72.8",
      "answer_units": "years",
      "demographics": {
        "sex": "female",
        "sex_code": "2",
        "visit": "v11",
        "phc_scandate": "2013-02-28",
        "image_acq_date": "2/28/2013"
      }
    },
    {
      "image_id": "I78538",
      "image_path": "ADNI_Nifti_QC_N4/I78538_T1_N4.nii.gz",
      "ptid": "053_S_0919",
      "visit": "m12",
      "acq_date": "10/23/2007",
      "phc_scan_date": "2007-10-23",
      "source": "phc",
      "question": "MRI scan (Image Data ID I78538) acquired on 10/23/2007 for a male participant (visit m12). Predict the subject's T1 scan age in years and answer with a numeric value using one decimal place.",
      "answer": "63.5",
      "answer_code": "63.5",
      "answer_units": "years",
      "demographics": {
        "sex": "male",
        "sex_code": "1",
        "visit": "m12",
        "phc_scandate": "2007-10-23",
        "image_acq_date": "10/23/2007"
      }
    },
    {
      "image_id": "I392542",
      "image_path": "ADNI_Nifti_QC_N4/I392542_T1_N4.nii.gz",
      "ptid": "094_S_4162",
      "visit": "v21",
      "acq_date": "9/27/2013",
      "phc_scan_date": "2013-09-27",
      "source": "phc",
      "question": "MRI scan (Image Data ID I392542) acquired on 9/27/2013 for a female participant (visit v21). Predict the subject's T1 scan age in years and answer with a numeric value using one decimal place.",
      "answer": "73.5",
      "answer_code": "73.5",
      "answer_units": "years",
      "demographics": {
        "sex": "female",
        "sex_code": "2",
        "visit": "v21",
        "phc_scandate": "2013-09-27",
        "image_acq_date": "9/27/2013"
      }
    },
    {
      "image_id": "I313900",
      "image_path": "ADNI_Nifti_QC_N4/I313900_T1_N4.nii.gz",
      "ptid": "032_S_4755",
      "visit": "v02",
      "acq_date": "7/02/2012",
      "phc_scan_date": "2012-07-02",
      "source": "phc",
      "question": "MRI scan (Image Data ID I313900) acquired on 7/02/2012 for a male participant (visit v02). Predict the subject's T1 scan age in years and answer with a numeric value using one decimal place.",
      "answer": "71.7",
      "answer_code": "71.7",
      "answer_units": "years",
      "demographics": {
        "sex": "male",
        "sex_code": "1",
        "visit": "v02",
        "phc_scandate": "2012-07-02",
        "image_acq_date": "7/02/2012"
      }
    },
    {
      "image_id": "I109989",
      "image_path": "ADNI_Nifti_QC_N4/I109989_T1_N4.nii.gz",
      "ptid": "062_S_0535",
      "visit": "m24",
      "acq_date": "6/17/2008",
      "phc_scan_date": "2008-06-17",
      "source": "phc",
      "question": "MRI scan (Image Data ID I109989) acquired on 6/17/2008 for a male participant (visit m24). Predict the subject's T1 scan age in years and answer with a numeric value using one decimal place.",
      "answer": "78.9",
      "answer_code": "78.9",
      "answer_units": "years",
      "demographics": {
        "sex": "male",
        "sex_code": "1",
        "visit": "m24",
        "phc_scandate": "2008-06-17",
        "image_acq_date": "6/17/2008"
      }
    },
    {
      "image_id": "I352430",
      "image_path": "ADNI_Nifti_QC_N4/I352430_T1_N4.nii.gz",
      "ptid": "018_S_2133",
      "visit": "v11",
      "acq_date": "12/18/2012",
      "phc_scan_date": "2012-12-18",
      "source": "phc",
      "question": "MRI scan (Image Data ID I352430) acquired on 12/18/2012 for a female participant (visit v11). Predict the subject's T1 scan age in years and answer with a numeric value using one decimal place.",
      "answer": "64.8",
      "answer_code": "64.8",
      "answer_units": "years",
      "demographics": {
        "sex": "female",
        "sex_code": "2",
        "visit": "v11",
        "phc_scandate": "2012-12-18",
        "image_acq_date": "12/18/2012"
      }
    },
    {
      "image_id": "I375489",
      "image_path": "ADNI_Nifti_QC_N4/I375489_T1_N4.nii.gz",
      "ptid": "005_S_5038",
      "visit": "v05",
      "acq_date": "6/05/2013",
      "phc_scan_date": "2013-06-05",
      "source": "phc",
      "question": "MRI scan (Image Data ID I375489) acquired on 6/05/2013 for a male participant (visit v05). Predict the subject's T1 scan age in years and answer with a numeric value using one decimal place.",
      "answer": "82.1",
      "answer_code": "82.1",
      "answer_units": "years",
      "demographics": {
        "sex": "male",
        "sex_code": "1",
        "visit": "v05",
        "phc_scandate": "2013-06-05",
        "image_acq_date": "6/05/2013"
      }
    },
    {
      "image_id": "I320512",
      "image_path": "ADNI_Nifti_QC_N4/I320512_T1_N4.nii.gz",
      "ptid": "036_S_2380",
      "visit": "v06",
      "acq_date": "7/31/2012",
      "phc_scan_date": "2012-07-31",
      "source": "phc",
      "question": "MRI scan (Image Data ID I320512) acquired on 7/31/2012 for a male participant (visit v06). Predict the subject's T1 scan age in years and answer with a numeric value using one decimal place.",
      "answer": "69.1",
      "answer_code": "69.1",
      "answer_units": "years",
      "demographics": {
        "sex": "male",
        "sex_code": "1",
        "visit": "v06",
        "phc_scandate": "2012-07-31",
        "image_acq_date": "7/31/2012"
      }
    },
    {
      "image_id": "I310958",
      "image_path": "ADNI_Nifti_QC_N4/I310958_T1_N4.nii.gz",
      "ptid": "041_S_4041",
      "visit": "v11",
      "acq_date": "6/18/2012",
      "phc_scan_date": "2012-06-18",
      "source": "phc",
      "question": "MRI scan (Image Data ID I310958) acquired on 6/18/2012 for a female participant (visit v11). Predict the subject's T1 scan age in years and answer with a numeric value using one decimal place.",
      "answer": "79.1",
      "answer_code": "79.1",
      "answer_units": "years",
      "demographics": {
        "sex": "female",
        "sex_code": "2",
        "visit": "v11",
        "phc_scandate": "2012-06-18",
        "image_acq_date": "6/18/2012"
      }
    },
    {
      "image_id": "I385188",
      "image_path": "ADNI_Nifti_QC_N4/I385188_T1_N4.nii.gz",
      "ptid": "067_S_5159",
      "visit": "v04",
      "acq_date": "8/12/2013",
      "phc_scan_date": "2013-08-12",
      "source": "phc",
      "question": "MRI scan (Image Data ID I385188) acquired on 8/12/2013 for a female participant (visit v04). Predict the subject's T1 scan age in years and answer with a numeric value using one decimal place.",
      "answer": "66.8",
      "answer_code": "66.8",
      "answer_units": "years",
      "demographics": {
        "sex": "female",
        "sex_code": "2",
        "visit": "v04",
        "phc_scandate": "2013-08-12",
        "image_acq_date": "8/12/2013"
      }
    },
    {
      "image_id": "I285329",
      "image_path": "ADNI_Nifti_QC_N4/I285329_T1_N4.nii.gz",
      "ptid": "099_S_4480",
      "visit": "v02",
      "acq_date": "2/17/2012",
      "phc_scan_date": "2012-02-17",
      "source": "phc",
      "question": "MRI scan (Image Data ID I285329) acquired on 2/17/2012 for a female participant (visit v02). Predict the subject's T1 scan age in years and answer with a numeric value using one decimal place.",
      "answer": "63.9",
      "answer_code": "63.9",
      "answer_units": "years",
      "demographics": {
        "sex": "female",
        "sex_code": "2",
        "visit": "v02",
        "phc_scandate": "2012-02-17",
        "image_acq_date": "2/17/2012"
      }
    },
    {
      "image_id": "I55771",
      "image_path": "ADNI_Nifti_QC_N4/I55771_T1_N4.nii.gz",
      "ptid": "002_S_0413",
      "visit": "m12",
      "acq_date": "6/01/2007",
      "phc_scan_date": "2007-06-01",
      "source": "phc",
      "question": "MRI scan (Image Data ID I55771) acquired on 6/01/2007 for a female participant (visit m12). Predict the subject's T1 scan age in years and answer with a numeric value using one decimal place.",
      "answer": "77.5",
      "answer_code": "77.5",
      "answer_units": "years",
      "demographics": {
        "sex": "female",
        "sex_code": "2",
        "visit": "m12",
        "phc_scandate": "2007-06-01",
        "image_acq_date": "6/01/2007"
      }
    },
    {
      "image_id": "I76760",
      "image_path": "ADNI_Nifti_QC_N4/I76760_T1_N4.nii.gz",
      "ptid": "057_S_1379",
      "visit": "m06",
      "acq_date": "10/03/2007",
      "phc_scan_date": "2007-10-03",
      "source": "phc",
      "question": "MRI scan (Image Data ID I76760) acquired on 10/03/2007 for a male participant (visit m06). Predict the subject's T1 scan age in years and answer with a numeric value using one decimal place.",
      "answer": "88.4",
      "answer_code": "88.4",
      "answer_units": "years",
      "demographics": {
        "sex": "male",
        "sex_code": "1",
        "visit": "m06",
        "phc_scandate": "2007-10-03",
        "image_acq_date": "10/03/2007"
      }
    },
    {
      "image_id": "I39398",
      "image_path": "ADNI_Nifti_QC_N4/I39398_T1_N4.nii.gz",
      "ptid": "036_S_0672",
      "visit": "m06",
      "acq_date": "2/12/2007",
      "phc_scan_date": "2007-02-12",
      "source": "phc",
      "question": "MRI scan (Image Data ID I39398) acquired on 2/12/2007 for a female participant (visit m06). Predict the subject's T1 scan age in years and answer with a numeric value using one decimal place.",
      "answer": "62.7",
      "answer_code": "62.7",
      "answer_units": "years",
      "demographics": {
        "sex": "female",
        "sex_code": "2",
        "visit": "m06",
        "phc_scandate": "2007-02-12",
        "image_acq_date": "2/12/2007"
      }
    },
    {
      "image_id": "I339811",
      "image_path": "ADNI_Nifti_QC_N4/I339811_T1_N4.nii.gz",
      "ptid": "011_S_4235",
      "visit": "v11",
      "acq_date": "10/09/2012",
      "phc_scan_date": "2012-10-09",
      "source": "phc",
      "question": "MRI scan (Image Data ID I339811) acquired on 10/09/2012 for a male participant (visit v11). Predict the subject's T1 scan age in years and answer with a numeric value using one decimal place.",
      "answer": "64.9",
      "answer_code": "64.9",
      "answer_units": "years",
      "demographics": {
        "sex": "male",
        "sex_code": "1",
        "visit": "v11",
        "phc_scandate": "2012-10-09",
        "image_acq_date": "10/09/2012"
      }
    },
    {
      "image_id": "I30395",
      "image_path": "ADNI_Nifti_QC_N4/I30395_T1_N4.nii.gz",
      "ptid": "029_S_1038",
      "visit": "sc",
      "acq_date": "11/21/2006",
      "phc_scan_date": "2006-11-21",
      "source": "phc",
      "question": "MRI scan (Image Data ID I30395) acquired on 11/21/2006 for a male participant (visit sc). Predict the subject's T1 scan age in years and answer with a numeric value using one decimal place.",
      "answer": "83.3",
      "answer_code": "83.3",
      "answer_units": "years",
      "demographics": {
        "sex": "male",
        "sex_code": "1",
        "visit": "sc",
        "phc_scandate": "2006-11-21",
        "image_acq_date": "11/21/2006"
      }
    },
    {
      "image_id": "I234011",
      "image_path": "ADNI_Nifti_QC_N4/I234011_T1_N4.nii.gz",
      "ptid": "023_S_0331",
      "visit": "v06",
      "acq_date": "5/04/2011",
      "phc_scan_date": "2011-05-04",
      "source": "phc",
      "question": "MRI scan (Image Data ID I234011) acquired on 5/04/2011 for a female participant (visit v06). Predict the subject's T1 scan age in years and answer with a numeric value using one decimal place.",
      "answer": "69.8",
      "answer_code": "69.8",
      "answer_units": "years",
      "demographics": {
        "sex": "female",
        "sex_code": "2",
        "visit": "v06",
        "phc_scandate": "2011-05-04",
        "image_acq_date": "5/04/2011"
      }
    },
    {
      "image_id": "I389967",
      "image_path": "ADNI_Nifti_QC_N4/I389967_T1_N4.nii.gz",
      "ptid": "027_S_5093",
      "visit": "v05",
      "acq_date": "9/12/2013",
      "phc_scan_date": "2013-09-12",
      "source": "phc",
      "question": "MRI scan (Image Data ID I389967) acquired on 9/12/2013 for a female participant (visit v05). Predict the subject's T1 scan age in years and answer with a numeric value using one decimal place.",
      "answer": "70",
      "answer_code": "70",
      "answer_units": "years",
      "demographics": {
        "sex": "female",
        "sex_code": "2",
        "visit": "v05",
        "phc_scandate": "2013-09-12",
        "image_acq_date": "9/12/2013"
      }
    },
    {
      "image_id": "I235703",
      "image_path": "ADNI_Nifti_QC_N4/I235703_T1_N4.nii.gz",
      "ptid": "009_S_2381",
      "visit": "scmri",
      "acq_date": "5/18/2011",
      "phc_scan_date": "2011-05-18",
      "source": "phc",
      "question": "MRI scan (Image Data ID I235703) acquired on 5/18/2011 for a male participant (visit scmri). Predict the subject's T1 scan age in years and answer with a numeric value using one decimal place.",
      "answer": "69.3",
      "answer_code": "69.3",
      "answer_units": "years",
      "demographics": {
        "sex": "male",
        "sex_code": "1",
        "visit": "scmri",
        "phc_scandate": "2011-05-18",
        "image_acq_date": "5/18/2011"
      }
    },
    {
      "image_id": "I161111",
      "image_path": "ADNI_Nifti_QC_N4/I161111_T1_N4.nii.gz",
      "ptid": "041_S_1010",
      "visit": "m36",
      "acq_date": "12/15/2009",
      "phc_scan_date": "2009-12-15",
      "source": "phc",
      "question": "MRI scan (Image Data ID I161111) acquired on 12/15/2009 for a male participant (visit m36). Predict the subject's T1 scan age in years and answer with a numeric value using one decimal place.",
      "answer": "77.5",
      "answer_code": "77.5",
      "answer_units": "years",
      "demographics": {
        "sex": "male",
        "sex_code": "1",
        "visit": "m36",
        "phc_scandate": "2009-12-15",
        "image_acq_date": "12/15/2009"
      }
    },
    {
      "image_id": "I404879",
      "image_path": "ADNI_Nifti_QC_N4/I404879_T1_N4.nii.gz",
      "ptid": "003_S_4354",
      "visit": "v21",
      "acq_date": "1/14/2014",
      "phc_scan_date": "2014-01-14",
      "source": "phc",
      "question": "MRI scan (Image Data ID I404879) acquired on 1/14/2014 for a male participant (visit v21). Predict the subject's T1 scan age in years and answer with a numeric value using one decimal place.",
      "answer": "78",
      "answer_code": "78",
      "answer_units": "years",
      "demographics": {
        "sex": "male",
        "sex_code": "1",
        "visit": "v21",
        "phc_scandate": "2014-01-14",
        "image_acq_date": "1/14/2014"
      }
    },
    {
      "image_id": "I272048",
      "image_path": "ADNI_Nifti_QC_N4/I272048_T1_N4.nii.gz",
      "ptid": "068_S_4217",
      "visit": "v04",
      "acq_date": "12/14/2011",
      "phc_scan_date": "2011-12-14",
      "source": "phc",
      "question": "MRI scan (Image Data ID I272048) acquired on 12/14/2011 for a male participant (visit v04). Predict the subject's T1 scan age in years and answer with a numeric value using one decimal place.",
      "answer": "76.7",
      "answer_code": "76.7",
      "answer_units": "years",
      "demographics": {
        "sex": "male",
        "sex_code": "1",
        "visit": "v04",
        "phc_scandate": "2011-12-14",
        "image_acq_date": "12/14/2011"
      }
    },
    {
      "image_id": "I817508",
      "image_path": "ADNI_Nifti_QC_N4/I817508_T1_N4.nii.gz",
      "ptid": "035_S_4464",
      "visit": "v41",
      "acq_date": "6/08/2016",
      "phc_scan_date": "2016-06-08",
      "source": "phc",
      "question": "MRI scan (Image Data ID I817508) acquired on 6/08/2016 for a male participant (visit v41). Predict the subject's T1 scan age in years and answer with a numeric value using one decimal place.",
      "answer": "74.8",
      "answer_code": "74.8",
      "answer_units": "years",
      "demographics": {
        "sex": "male",
        "sex_code": "1",
        "visit": "v41",
        "phc_scandate": "2016-06-08",
        "image_acq_date": "6/08/2016"
      }
    },
    {
      "image_id": "I347902",
      "image_path": "ADNI_Nifti_QC_N4/I347902_T1_N4.nii.gz",
      "ptid": "100_S_4556",
      "visit": "v05",
      "acq_date": "11/26/2012",
      "phc_scan_date": "2012-11-26",
      "source": "phc",
      "question": "MRI scan (Image Data ID I347902) acquired on 11/26/2012 for a male participant (visit v05). Predict the subject's T1 scan age in years and answer with a numeric value using one decimal place.",
      "answer": "73.6",
      "answer_code": "73.6",
      "answer_units": "years",
      "demographics": {
        "sex": "male",
        "sex_code": "1",
        "visit": "v05",
        "phc_scandate": "2012-11-26",
        "image_acq_date": "11/26/2012"
      }
    },
    {
      "image_id": "I293759",
      "image_path": "ADNI_Nifti_QC_N4/I293759_T1_N4.nii.gz",
      "ptid": "027_S_0256",
      "visit": "m72",
      "acq_date": "3/26/2012",
      "phc_scan_date": "2012-03-26",
      "source": "phc",
      "question": "MRI scan (Image Data ID I293759) acquired on 3/26/2012 for a male participant (visit m72). Predict the subject's T1 scan age in years and answer with a numeric value using one decimal place.",
      "answer": "76.3",
      "answer_code": "76.3",
      "answer_units": "years",
      "demographics": {
        "sex": "male",
        "sex_code": "1",
        "visit": "m72",
        "phc_scandate": "2012-03-26",
        "image_acq_date": "3/26/2012"
      }
    },
    {
      "image_id": "I404959",
      "image_path": "ADNI_Nifti_QC_N4/I404959_T1_N4.nii.gz",
      "ptid": "052_S_4945",
      "visit": "v11",
      "acq_date": "1/17/2014",
      "phc_scan_date": "2014-01-17",
      "source": "phc",
      "question": "MRI scan (Image Data ID I404959) acquired on 1/17/2014 for a male participant (visit v11). Predict the subject's T1 scan age in years and answer with a numeric value using one decimal place.",
      "answer": "57.8",
      "answer_code": "57.8",
      "answer_units": "years",
      "demographics": {
        "sex": "male",
        "sex_code": "1",
        "visit": "v11",
        "phc_scandate": "2014-01-17",
        "image_acq_date": "1/17/2014"
      }
    },
    {
      "image_id": "I166803",
      "image_path": "ADNI_Nifti_QC_N4/I166803_T1_N4.nii.gz",
      "ptid": "116_S_1243",
      "visit": "m36",
      "acq_date": "2/25/2010",
      "phc_scan_date": "2010-02-25",
      "source": "phc",
      "question": "MRI scan (Image Data ID I166803) acquired on 2/25/2010 for a male participant (visit m36). Predict the subject's T1 scan age in years and answer with a numeric value using one decimal place.",
      "answer": "80.5",
      "answer_code": "80.5",
      "answer_units": "years",
      "demographics": {
        "sex": "male",
        "sex_code": "1",
        "visit": "m36",
        "phc_scandate": "2010-02-25",
        "image_acq_date": "2/25/2010"
      }
    },
    {
      "image_id": "I342479",
      "image_path": "ADNI_Nifti_QC_N4/I342479_T1_N4.nii.gz",
      "ptid": "136_S_4848",
      "visit": "v02",
      "acq_date": "10/15/2012",
      "phc_scan_date": "2012-10-15",
      "source": "phc",
      "question": "MRI scan (Image Data ID I342479) acquired on 10/15/2012 for a male participant (visit v02). Predict the subject's T1 scan age in years and answer with a numeric value using one decimal place.",
      "answer": "74.2",
      "answer_code": "74.2",
      "answer_units": "years",
      "demographics": {
        "sex": "male",
        "sex_code": "1",
        "visit": "v02",
        "phc_scandate": "2012-10-15",
        "image_acq_date": "10/15/2012"
      }
    },
    {
      "image_id": "I315927",
      "image_path": "ADNI_Nifti_QC_N4/I315927_T1_N4.nii.gz",
      "ptid": "029_S_4327",
      "visit": "v05",
      "acq_date": "7/09/2012",
      "phc_scan_date": "2012-07-09",
      "source": "phc",
      "question": "MRI scan (Image Data ID I315927) acquired on 7/09/2012 for a male participant (visit v05). Predict the subject's T1 scan age in years and answer with a numeric value using one decimal place.",
      "answer": "83.7",
      "answer_code": "83.7",
      "answer_units": "years",
      "demographics": {
        "sex": "male",
        "sex_code": "1",
        "visit": "v05",
        "phc_scandate": "2012-07-09",
        "image_acq_date": "7/09/2012"
      }
    },
    {
      "image_id": "I342439",
      "image_path": "ADNI_Nifti_QC_N4/I342439_T1_N4.nii.gz",
      "ptid": "014_S_4668",
      "visit": "v05",
      "acq_date": "10/25/2012",
      "phc_scan_date": "2012-10-25",
      "source": "phc",
      "question": "MRI scan (Image Data ID I342439) acquired on 10/25/2012 for a male participant (visit v05). Predict the subject's T1 scan age in years and answer with a numeric value using one decimal place.",
      "answer": "71.4",
      "answer_code": "71.4",
      "answer_units": "years",
      "demographics": {
        "sex": "male",
        "sex_code": "1",
        "visit": "v05",
        "phc_scandate": "2012-10-25",
        "image_acq_date": "10/25/2012"
      }
    },
    {
      "image_id": "I78416",
      "image_path": "ADNI_Nifti_QC_N4/I78416_T1_N4.nii.gz",
      "ptid": "011_S_0022",
      "visit": "m24",
      "acq_date": "10/22/2007",
      "phc_scan_date": "2007-10-22",
      "source": "phc",
      "question": "MRI scan (Image Data ID I78416) acquired on 10/22/2007 for a male participant (visit m24). Predict the subject's T1 scan age in years and answer with a numeric value using one decimal place.",
      "answer": "65.3",
      "answer_code": "65.3",
      "answer_units": "years",
      "demographics": {
        "sex": "male",
        "sex_code": "1",
        "visit": "m24",
        "phc_scandate": "2007-10-22",
        "image_acq_date": "10/22/2007"
      }
    },
    {
      "image_id": "I358308",
      "image_path": "ADNI_Nifti_QC_N4/I358308_T1_N4.nii.gz",
      "ptid": "109_S_4380",
      "visit": "v11",
      "acq_date": "1/29/2013",
      "phc_scan_date": "2013-01-29",
      "source": "phc",
      "question": "MRI scan (Image Data ID I358308) acquired on 1/29/2013 for a male participant (visit v11). Predict the subject's T1 scan age in years and answer with a numeric value using one decimal place.",
      "answer": "73.1",
      "answer_code": "73.1",
      "answer_units": "years",
      "demographics": {
        "sex": "male",
        "sex_code": "1",
        "visit": "v11",
        "phc_scandate": "2013-01-29",
        "image_acq_date": "1/29/2013"
      }
    },
    {
      "image_id": "I125611",
      "image_path": "ADNI_Nifti_QC_N4/I125611_T1_N4.nii.gz",
      "ptid": "029_S_0878",
      "visit": "m24",
      "acq_date": "11/04/2008",
      "phc_scan_date": "2008-11-04",
      "source": "phc",
      "question": "MRI scan (Image Data ID I125611) acquired on 11/04/2008 for a male participant (visit m24). Predict the subject's T1 scan age in years and answer with a numeric value using one decimal place.",
      "answer": "74.6",
      "answer_code": "74.6",
      "answer_units": "years",
      "demographics": {
        "sex": "male",
        "sex_code": "1",
        "visit": "m24",
        "phc_scandate": "2008-11-04",
        "image_acq_date": "11/04/2008"
      }
    },
    {
      "image_id": "I373680",
      "image_path": "ADNI_Nifti_QC_N4/I373680_T1_N4.nii.gz",
      "ptid": "029_S_5166",
      "visit": "v02",
      "acq_date": "5/22/2013",
      "phc_scan_date": "2013-05-22",
      "source": "phc",
      "question": "MRI scan (Image Data ID I373680) acquired on 5/22/2013 for a female participant (visit v02). Predict the subject's T1 scan age in years and answer with a numeric value using one decimal place.",
      "answer": "65.2",
      "answer_code": "65.2",
      "answer_units": "years",
      "demographics": {
        "sex": "female",
        "sex_code": "2",
        "visit": "v02",
        "phc_scandate": "2013-05-22",
        "image_acq_date": "5/22/2013"
      }
    },
    {
      "image_id": "I375292",
      "image_path": "ADNI_Nifti_QC_N4/I375292_T1_N4.nii.gz",
      "ptid": "135_S_5015",
      "visit": "v05",
      "acq_date": "6/04/2013",
      "phc_scan_date": "2013-06-04",
      "source": "phc",
      "question": "MRI scan (Image Data ID I375292) acquired on 6/04/2013 for a female participant (visit v05). Predict the subject's T1 scan age in years and answer with a numeric value using one decimal place.",
      "answer": "78.5",
      "answer_code": "78.5",
      "answer_units": "years",
      "demographics": {
        "sex": "female",
        "sex_code": "2",
        "visit": "v05",
        "phc_scandate": "2013-06-04",
        "image_acq_date": "6/04/2013"
      }
    },
    {
      "image_id": "I416153",
      "image_path": "ADNI_Nifti_QC_N4/I416153_T1_N4.nii.gz",
      "ptid": "031_S_4476",
      "visit": "v21",
      "acq_date": "3/05/2014",
      "phc_scan_date": "2014-03-05",
      "source": "phc",
      "question": "MRI scan (Image Data ID I416153) acquired on 3/05/2014 for a male participant (visit v21). Predict the subject's T1 scan age in years and answer with a numeric value using one decimal place.",
      "answer": "90.8",
      "answer_code": "90.8",
      "answer_units": "years",
      "demographics": {
        "sex": "male",
        "sex_code": "1",
        "visit": "v21",
        "phc_scandate": "2014-03-05",
        "image_acq_date": "3/05/2014"
      }
    },
    {
      "image_id": "I424547",
      "image_path": "ADNI_Nifti_QC_N4/I424547_T1_N4.nii.gz",
      "ptid": "041_S_4720",
      "visit": "v21",
      "acq_date": "5/12/2014",
      "phc_scan_date": "2014-05-12",
      "source": "phc",
      "question": "MRI scan (Image Data ID I424547) acquired on 5/12/2014 for a male participant (visit v21). Predict the subject's T1 scan age in years and answer with a numeric value using one decimal place.",
      "answer": "79.5",
      "answer_code": "79.5",
      "answer_units": "years",
      "demographics": {
        "sex": "male",
        "sex_code": "1",
        "visit": "v21",
        "phc_scandate": "2014-05-12",
        "image_acq_date": "5/12/2014"
      }
    },
    {
      "image_id": "I284904",
      "image_path": "ADNI_Nifti_QC_N4/I284904_T1_N4.nii.gz",
      "ptid": "009_S_4530",
      "visit": "v02",
      "acq_date": "2/14/2012",
      "phc_scan_date": "2012-02-14",
      "source": "phc",
      "question": "MRI scan (Image Data ID I284904) acquired on 2/14/2012 for a male participant (visit v02). Predict the subject's T1 scan age in years and answer with a numeric value using one decimal place.",
      "answer": "75.9",
      "answer_code": "75.9",
      "answer_units": "years",
      "demographics": {
        "sex": "male",
        "sex_code": "1",
        "visit": "v02",
        "phc_scandate": "2012-02-14",
        "image_acq_date": "2/14/2012"
      }
    },
    {
      "image_id": "I342550",
      "image_path": "ADNI_Nifti_QC_N4/I342550_T1_N4.nii.gz",
      "ptid": "135_S_4281",
      "visit": "v11",
      "acq_date": "10/25/2012",
      "phc_scan_date": "2012-10-25",
      "source": "phc",
      "question": "MRI scan (Image Data ID I342550) acquired on 10/25/2012 for a female participant (visit v11). Predict the subject's T1 scan age in years and answer with a numeric value using one decimal place.",
      "answer": "78.6",
      "answer_code": "78.6",
      "answer_units": "years",
      "demographics": {
        "sex": "female",
        "sex_code": "2",
        "visit": "v11",
        "phc_scandate": "2012-10-25",
        "image_acq_date": "10/25/2012"
      }
    },
    {
      "image_id": "I699529",
      "image_path": "ADNI_Nifti_QC_N4/I699529_T1_N4.nii.gz",
      "ptid": "098_S_4003",
      "visit": "v51",
      "acq_date": "5/03/2016",
      "phc_scan_date": "2016-05-03",
      "source": "phc",
      "question": "MRI scan (Image Data ID I699529) acquired on 5/03/2016 for a female participant (visit v51). Predict the subject's T1 scan age in years and answer with a numeric value using one decimal place.",
      "answer": "77.5",
      "answer_code": "77.5",
      "answer_units": "years",
      "demographics": {
        "sex": "female",
        "sex_code": "2",
        "visit": "v51",
        "phc_scandate": "2016-05-03",
        "image_acq_date": "5/03/2016"
      }
    },
    {
      "image_id": "I38686",
      "image_path": "ADNI_Nifti_QC_N4/I38686_T1_N4.nii.gz",
      "ptid": "131_S_0409",
      "visit": "m06",
      "acq_date": "2/08/2007",
      "phc_scan_date": "2007-02-08",
      "source": "phc",
      "question": "MRI scan (Image Data ID I38686) acquired on 2/08/2007 for a male participant (visit m06). Predict the subject's T1 scan age in years and answer with a numeric value using one decimal place.",
      "answer": "80",
      "answer_code": "80",
      "answer_units": "years",
      "demographics": {
        "sex": "male",
        "sex_code": "1",
        "visit": "m06",
        "phc_scandate": "2007-02-08",
        "image_acq_date": "2/08/2007"
      }
    },
    {
      "image_id": "I289923",
      "image_path": "ADNI_Nifti_QC_N4/I289923_T1_N4.nii.gz",
      "ptid": "073_S_2225",
      "visit": "v06",
      "acq_date": "3/12/2012",
      "phc_scan_date": "2012-03-12",
      "source": "phc",
      "question": "MRI scan (Image Data ID I289923) acquired on 3/12/2012 for a male participant (visit v06). Predict the subject's T1 scan age in years and answer with a numeric value using one decimal place.",
      "answer": "71.7",
      "answer_code": "71.7",
      "answer_units": "years",
      "demographics": {
        "sex": "male",
        "sex_code": "1",
        "visit": "v06",
        "phc_scandate": "2012-03-12",
        "image_acq_date": "3/12/2012"
      }
    },
    {
      "image_id": "I36025",
      "image_path": "ADNI_Nifti_QC_N4/I36025_T1_N4.nii.gz",
      "ptid": "018_S_0080",
      "visit": "m12",
      "acq_date": "1/11/2007",
      "phc_scan_date": "2007-01-11",
      "source": "phc",
      "question": "MRI scan (Image Data ID I36025) acquired on 1/11/2007 for a male participant (visit m12). Predict the subject's T1 scan age in years and answer with a numeric value using one decimal place.",
      "answer": "86.2",
      "answer_code": "86.2",
      "answer_units": "years",
      "demographics": {
        "sex": "male",
        "sex_code": "1",
        "visit": "m12",
        "phc_scandate": "2007-01-11",
        "image_acq_date": "1/11/2007"
      }
    },
    {
      "image_id": "I269843",
      "image_path": "ADNI_Nifti_QC_N4/I269843_T1_N4.nii.gz",
      "ptid": "941_S_4292",
      "visit": "v02",
      "acq_date": "12/05/2011",
      "phc_scan_date": "2011-12-05",
      "source": "phc",
      "question": "MRI scan (Image Data ID I269843) acquired on 12/05/2011 for a male participant (visit v02). Predict the subject's T1 scan age in years and answer with a numeric value using one decimal place.",
      "answer": "71.1",
      "answer_code": "71.1",
      "answer_units": "years",
      "demographics": {
        "sex": "male",
        "sex_code": "1",
        "visit": "v02",
        "phc_scandate": "2011-12-05",
        "image_acq_date": "12/05/2011"
      }
    },
    {
      "image_id": "I298456",
      "image_path": "ADNI_Nifti_QC_N4/I298456_T1_N4.nii.gz",
      "ptid": "135_S_4676",
      "visit": "v02",
      "acq_date": "4/19/2012",
      "phc_scan_date": "2012-04-19",
      "source": "phc",
      "question": "MRI scan (Image Data ID I298456) acquired on 4/19/2012 for a male participant (visit v02). Predict the subject's T1 scan age in years and answer with a numeric value using one decimal place.",
      "answer": "78.9",
      "answer_code": "78.9",
      "answer_units": "years",
      "demographics": {
        "sex": "male",
        "sex_code": "1",
        "visit": "v02",
        "phc_scandate": "2012-04-19",
        "image_acq_date": "4/19/2012"
      }
    },
    {
      "image_id": "I771645",
      "image_path": "ADNI_Nifti_QC_N4/I771645_T1_N4.nii.gz",
      "ptid": "099_S_2146",
      "visit": "v51",
      "acq_date": "9/02/2016",
      "phc_scan_date": "2016-09-02",
      "source": "phc",
      "question": "MRI scan (Image Data ID I771645) acquired on 9/02/2016 for a male participant (visit v51). Predict the subject's T1 scan age in years and answer with a numeric value using one decimal place.",
      "answer": "72.3",
      "answer_code": "72.3",
      "answer_units": "years",
      "demographics": {
        "sex": "male",
        "sex_code": "1",
        "visit": "v51",
        "phc_scandate": "2016-09-02",
        "image_acq_date": "9/02/2016"
      }
    },
    {
      "image_id": "I109368",
      "image_path": "ADNI_Nifti_QC_N4/I109368_T1_N4.nii.gz",
      "ptid": "062_S_0578",
      "visit": "m24",
      "acq_date": "6/11/2008",
      "phc_scan_date": "2008-06-11",
      "source": "phc",
      "question": "MRI scan (Image Data ID I109368) acquired on 6/11/2008 for a female participant (visit m24). Predict the subject's T1 scan age in years and answer with a numeric value using one decimal place.",
      "answer": "79.2",
      "answer_code": "79.2",
      "answer_units": "years",
      "demographics": {
        "sex": "female",
        "sex_code": "2",
        "visit": "m24",
        "phc_scandate": "2008-06-11",
        "image_acq_date": "6/11/2008"
      }
    },
    {
      "image_id": "I386092",
      "image_path": "ADNI_Nifti_QC_N4/I386092_T1_N4.nii.gz",
      "ptid": "041_S_4874",
      "visit": "v11",
      "acq_date": "8/19/2013",
      "phc_scan_date": "2013-08-19",
      "source": "phc",
      "question": "MRI scan (Image Data ID I386092) acquired on 8/19/2013 for a female participant (visit v11). Predict the subject's T1 scan age in years and answer with a numeric value using one decimal place.",
      "answer": "58.8",
      "answer_code": "58.8",
      "answer_units": "years",
      "demographics": {
        "sex": "female",
        "sex_code": "2",
        "visit": "v11",
        "phc_scandate": "2013-08-19",
        "image_acq_date": "8/19/2013"
      }
    },
    {
      "image_id": "I430427",
      "image_path": "ADNI_Nifti_QC_N4/I430427_T1_N4.nii.gz",
      "ptid": "016_S_4646",
      "visit": "v21",
      "acq_date": "6/10/2014",
      "phc_scan_date": "2014-06-10",
      "source": "phc",
      "question": "MRI scan (Image Data ID I430427) acquired on 6/10/2014 for a female participant (visit v21). Predict the subject's T1 scan age in years and answer with a numeric value using one decimal place.",
      "answer": "63",
      "answer_code": "63",
      "answer_units": "years",
      "demographics": {
        "sex": "female",
        "sex_code": "2",
        "visit": "v21",
        "phc_scandate": "2014-06-10",
        "image_acq_date": "6/10/2014"
      }
    },
    {
      "image_id": "I495737",
      "image_path": "ADNI_Nifti_QC_N4/I495737_T1_N4.nii.gz",
      "ptid": "130_S_4542",
      "visit": "v21",
      "acq_date": "4/04/2014",
      "phc_scan_date": "2014-04-04",
      "source": "phc",
      "question": "MRI scan (Image Data ID I495737) acquired on 4/04/2014 for a female participant (visit v21). Predict the subject's T1 scan age in years and answer with a numeric value using one decimal place.",
      "answer": "81.5",
      "answer_code": "81.5",
      "answer_units": "years",
      "demographics": {
        "sex": "female",
        "sex_code": "2",
        "visit": "v21",
        "phc_scandate": "2014-04-04",
        "image_acq_date": "4/04/2014"
      }
    },
    {
      "image_id": "I105662",
      "image_path": "ADNI_Nifti_QC_N4/I105662_T1_N4.nii.gz",
      "ptid": "141_S_0697",
      "visit": "m18",
      "acq_date": "4/29/2008",
      "phc_scan_date": "2008-04-29",
      "source": "phc",
      "question": "MRI scan (Image Data ID I105662) acquired on 4/29/2008 for a male participant (visit m18). Predict the subject's T1 scan age in years and answer with a numeric value using one decimal place.",
      "answer": "88.7",
      "answer_code": "88.7",
      "answer_units": "years",
      "demographics": {
        "sex": "male",
        "sex_code": "1",
        "visit": "m18",
        "phc_scandate": "2008-04-29",
        "image_acq_date": "4/29/2008"
      }
    },
    {
      "image_id": "I298228",
      "image_path": "ADNI_Nifti_QC_N4/I298228_T1_N4.nii.gz",
      "ptid": "023_S_4448",
      "visit": "v04",
      "acq_date": "4/18/2012",
      "phc_scan_date": "2012-04-18",
      "source": "phc",
      "question": "MRI scan (Image Data ID I298228) acquired on 4/18/2012 for a female participant (visit v04). Predict the subject's T1 scan age in years and answer with a numeric value using one decimal place.",
      "answer": "64.1",
      "answer_code": "64.1",
      "answer_units": "years",
      "demographics": {
        "sex": "female",
        "sex_code": "2",
        "visit": "v04",
        "phc_scandate": "2012-04-18",
        "image_acq_date": "4/18/2012"
      }
    },
    {
      "image_id": "I349878",
      "image_path": "ADNI_Nifti_QC_N4/I349878_T1_N4.nii.gz",
      "ptid": "109_S_4531",
      "visit": "v05",
      "acq_date": "9/27/2012",
      "phc_scan_date": "2012-09-27",
      "source": "phc",
      "question": "MRI scan (Image Data ID I349878) acquired on 9/27/2012 for a male participant (visit v05). Predict the subject's T1 scan age in years and answer with a numeric value using one decimal place.",
      "answer": "74.4",
      "answer_code": "74.4",
      "answer_units": "years",
      "demographics": {
        "sex": "male",
        "sex_code": "1",
        "visit": "v05",
        "phc_scandate": "2012-09-27",
        "image_acq_date": "9/27/2012"
      }
    },
    {
      "image_id": "I361437",
      "image_path": "ADNI_Nifti_QC_N4/I361437_T1_N4.nii.gz",
      "ptid": "002_S_4447",
      "visit": "v11",
      "acq_date": "1/30/2013",
      "phc_scan_date": "2013-01-30",
      "source": "phc",
      "question": "MRI scan (Image Data ID I361437) acquired on 1/30/2013 for a female participant (visit v11). Predict the subject's T1 scan age in years and answer with a numeric value using one decimal place.",
      "answer": "68.7",
      "answer_code": "68.7",
      "answer_units": "years",
      "demographics": {
        "sex": "female",
        "sex_code": "2",
        "visit": "v11",
        "phc_scandate": "2013-01-30",
        "image_acq_date": "1/30/2013"
      }
    },
    {
      "image_id": "I361540",
      "image_path": "ADNI_Nifti_QC_N4/I361540_T1_N4.nii.gz",
      "ptid": "073_S_4155",
      "visit": "v11",
      "acq_date": "2/20/2013",
      "phc_scan_date": "2013-02-20",
      "source": "phc",
      "question": "MRI scan (Image Data ID I361540) acquired on 2/20/2013 for a female participant (visit v11). Predict the subject's T1 scan age in years and answer with a numeric value using one decimal place.",
      "answer": "79.2",
      "answer_code": "79.2",
      "answer_units": "years",
      "demographics": {
        "sex": "female",
        "sex_code": "2",
        "visit": "v11",
        "phc_scandate": "2013-02-20",
        "image_acq_date": "2/20/2013"
      }
    },
    {
      "image_id": "I489877",
      "image_path": "ADNI_Nifti_QC_N4/I489877_T1_N4.nii.gz",
      "ptid": "072_S_4941",
      "visit": "v11",
      "acq_date": "10/21/2013",
      "phc_scan_date": "2013-10-21",
      "source": "phc",
      "question": "MRI scan (Image Data ID I489877) acquired on 10/21/2013 for a male participant (visit v11). Predict the subject's T1 scan age in years and answer with a numeric value using one decimal place.",
      "answer": "61.3",
      "answer_code": "61.3",
      "answer_units": "years",
      "demographics": {
        "sex": "male",
        "sex_code": "1",
        "visit": "v11",
        "phc_scandate": "2013-10-21",
        "image_acq_date": "10/21/2013"
      }
    },
    {
      "image_id": "I24504",
      "image_path": "ADNI_Nifti_QC_N4/I24504_T1_N4.nii.gz",
      "ptid": "114_S_0173",
      "visit": "m06",
      "acq_date": "9/08/2006",
      "phc_scan_date": "2006-09-08",
      "source": "phc",
      "question": "MRI scan (Image Data ID I24504) acquired on 9/08/2006 for a male participant (visit m06). Predict the subject's T1 scan age in years and answer with a numeric value using one decimal place.",
      "answer": "73.9",
      "answer_code": "73.9",
      "answer_units": "years",
      "demographics": {
        "sex": "male",
        "sex_code": "1",
        "visit": "m06",
        "phc_scandate": "2006-09-08",
        "image_acq_date": "9/08/2006"
      }
    },
    {
      "image_id": "I23491",
      "image_path": "ADNI_Nifti_QC_N4/I23491_T1_N4.nii.gz",
      "ptid": "141_S_0767",
      "visit": "sc",
      "acq_date": "8/27/2006",
      "phc_scan_date": "2006-08-27",
      "source": "phc",
      "question": "MRI scan (Image Data ID I23491) acquired on 8/27/2006 for a female participant (visit sc). Predict the subject's T1 scan age in years and answer with a numeric value using one decimal place.",
      "answer": "73.2",
      "answer_code": "73.2",
      "answer_units": "years",
      "demographics": {
        "sex": "female",
        "sex_code": "2",
        "visit": "sc",
        "phc_scandate": "2006-08-27",
        "image_acq_date": "8/27/2006"
      }
    },
    {
      "image_id": "I305043",
      "image_path": "ADNI_Nifti_QC_N4/I305043_T1_N4.nii.gz",
      "ptid": "009_S_4530",
      "visit": "v04",
      "acq_date": "5/16/2012",
      "phc_scan_date": "2012-05-16",
      "source": "phc",
      "question": "MRI scan (Image Data ID I305043) acquired on 5/16/2012 for a male participant (visit v04). Predict the subject's T1 scan age in years and answer with a numeric value using one decimal place.",
      "answer": "76.2",
      "answer_code": "76.2",
      "answer_units": "years",
      "demographics": {
        "sex": "male",
        "sex_code": "1",
        "visit": "v04",
        "phc_scandate": "2012-05-16",
        "image_acq_date": "5/16/2012"
      }
    },
    {
      "image_id": "I511016",
      "image_path": "ADNI_Nifti_QC_N4/I511016_T1_N4.nii.gz",
      "ptid": "002_S_5256",
      "visit": "v21",
      "acq_date": "9/10/2015",
      "phc_scan_date": "2015-09-10",
      "source": "phc",
      "question": "MRI scan (Image Data ID I511016) acquired on 9/10/2015 for a female participant (visit v21). Predict the subject's T1 scan age in years and answer with a numeric value using one decimal place.",
      "answer": "72.7",
      "answer_code": "72.7",
      "answer_units": "years",
      "demographics": {
        "sex": "female",
        "sex_code": "2",
        "visit": "v21",
        "phc_scandate": "2015-09-10",
        "image_acq_date": "9/10/2015"
      }
    },
    {
      "image_id": "I20566",
      "image_path": "ADNI_Nifti_QC_N4/I20566_T1_N4.nii.gz",
      "ptid": "023_S_0217",
      "visit": "m06",
      "acq_date": "8/15/2006",
      "phc_scan_date": "2006-08-15",
      "source": "phc",
      "question": "MRI scan (Image Data ID I20566) acquired on 8/15/2006 for a female participant (visit m06). Predict the subject's T1 scan age in years and answer with a numeric value using one decimal place.",
      "answer": "84.2",
      "answer_code": "84.2",
      "answer_units": "years",
      "demographics": {
        "sex": "female",
        "sex_code": "2",
        "visit": "m06",
        "phc_scandate": "2006-08-15",
        "image_acq_date": "8/15/2006"
      }
    },
    {
      "image_id": "I394089",
      "image_path": "ADNI_Nifti_QC_N4/I394089_T1_N4.nii.gz",
      "ptid": "941_S_2060",
      "visit": "v21",
      "acq_date": "10/09/2013",
      "phc_scan_date": "2013-10-09",
      "source": "phc",
      "question": "MRI scan (Image Data ID I394089) acquired on 10/09/2013 for a female participant (visit v21). Predict the subject's T1 scan age in years and answer with a numeric value using one decimal place.",
      "answer": "77.2",
      "answer_code": "77.2",
      "answer_units": "years",
      "demographics": {
        "sex": "female",
        "sex_code": "2",
        "visit": "v21",
        "phc_scandate": "2013-10-09",
        "image_acq_date": "10/09/2013"
      }
    },
    {
      "image_id": "I24827",
      "image_path": "ADNI_Nifti_QC_N4/I24827_T1_N4.nii.gz",
      "ptid": "130_S_0232",
      "visit": "m06",
      "acq_date": "9/05/2006",
      "phc_scan_date": "2006-09-05",
      "source": "phc",
      "question": "MRI scan (Image Data ID I24827) acquired on 9/05/2006 for a male participant (visit m06). Predict the subject's T1 scan age in years and answer with a numeric value using one decimal place.",
      "answer": "78.6",
      "answer_code": "78.6",
      "answer_units": "years",
      "demographics": {
        "sex": "male",
        "sex_code": "1",
        "visit": "m06",
        "phc_scandate": "2006-09-05",
        "image_acq_date": "9/05/2006"
      }
    },
    {
      "image_id": "I145752",
      "image_path": "ADNI_Nifti_QC_N4/I145752_T1_N4.nii.gz",
      "ptid": "127_S_0394",
      "visit": "m36",
      "acq_date": "6/11/2009",
      "phc_scan_date": "2009-06-11",
      "source": "phc",
      "question": "MRI scan (Image Data ID I145752) acquired on 6/11/2009 for a female participant (visit m36). Predict the subject's T1 scan age in years and answer with a numeric value using one decimal place.",
      "answer": "87.2",
      "answer_code": "87.2",
      "answer_units": "years",
      "demographics": {
        "sex": "female",
        "sex_code": "2",
        "visit": "m36",
        "phc_scandate": "2009-06-11",
        "image_acq_date": "6/11/2009"
      }
    },
    {
      "image_id": "I349848",
      "image_path": "ADNI_Nifti_QC_N4/I349848_T1_N4.nii.gz",
      "ptid": "037_S_0566",
      "visit": "v11",
      "acq_date": "12/06/2012",
      "phc_scan_date": "2012-12-06",
      "source": "phc",
      "question": "MRI scan (Image Data ID I349848) acquired on 12/06/2012 for a male participant (visit v11). Predict the subject's T1 scan age in years and answer with a numeric value using one decimal place.",
      "answer": "85.4",
      "answer_code": "85.4",
      "answer_units": "years",
      "demographics": {
        "sex": "male",
        "sex_code": "1",
        "visit": "v11",
        "phc_scandate": "2012-12-06",
        "image_acq_date": "12/06/2012"
      }
    },
    {
      "image_id": "I14224",
      "image_path": "ADNI_Nifti_QC_N4/I14224_T1_N4.nii.gz",
      "ptid": "137_S_0438",
      "visit": "sc",
      "acq_date": "4/27/2006",
      "phc_scan_date": "2006-04-27",
      "source": "phc",
      "question": "MRI scan (Image Data ID I14224) acquired on 4/27/2006 for a male participant (visit sc). Predict the subject's T1 scan age in years and answer with a numeric value using one decimal place.",
      "answer": "82",
      "answer_code": "82",
      "answer_units": "years",
      "demographics": {
        "sex": "male",
        "sex_code": "1",
        "visit": "sc",
        "phc_scandate": "2006-04-27",
        "image_acq_date": "4/27/2006"
      }
    },
    {
      "image_id": "I312909",
      "image_path": "ADNI_Nifti_QC_N4/I312909_T1_N4.nii.gz",
      "ptid": "073_S_4825",
      "visit": "v02",
      "acq_date": "6/26/2012",
      "phc_scan_date": "2012-06-26",
      "source": "phc",
      "question": "MRI scan (Image Data ID I312909) acquired on 6/26/2012 for a male participant (visit v02). Predict the subject's T1 scan age in years and answer with a numeric value using one decimal place.",
      "answer": "71.9",
      "answer_code": "71.9",
      "answer_units": "years",
      "demographics": {
        "sex": "male",
        "sex_code": "1",
        "visit": "v02",
        "phc_scandate": "2012-06-26",
        "image_acq_date": "6/26/2012"
      }
    },
    {
      "image_id": "I284424",
      "image_path": "ADNI_Nifti_QC_N4/I284424_T1_N4.nii.gz",
      "ptid": "007_S_4516",
      "visit": "v02",
      "acq_date": "2/13/2012",
      "phc_scan_date": "2012-02-13",
      "source": "phc",
      "question": "MRI scan (Image Data ID I284424) acquired on 2/13/2012 for a male participant (visit v02). Predict the subject's T1 scan age in years and answer with a numeric value using one decimal place.",
      "answer": "71.4",
      "answer_code": "71.4",
      "answer_units": "years",
      "demographics": {
        "sex": "male",
        "sex_code": "1",
        "visit": "v02",
        "phc_scandate": "2012-02-13",
        "image_acq_date": "2/13/2012"
      }
    },
    {
      "image_id": "I495892",
      "image_path": "ADNI_Nifti_QC_N4/I495892_T1_N4.nii.gz",
      "ptid": "037_S_4028",
      "visit": "v41",
      "acq_date": "6/04/2015",
      "phc_scan_date": "2015-06-04",
      "source": "phc",
      "question": "MRI scan (Image Data ID I495892) acquired on 6/04/2015 for a female participant (visit v41). Predict the subject's T1 scan age in years and answer with a numeric value using one decimal place.",
      "answer": "67.6",
      "answer_code": "67.6",
      "answer_units": "years",
      "demographics": {
        "sex": "female",
        "sex_code": "2",
        "visit": "v41",
        "phc_scandate": "2015-06-04",
        "image_acq_date": "6/04/2015"
      }
    },
    {
      "image_id": "I361938",
      "image_path": "ADNI_Nifti_QC_N4/I361938_T1_N4.nii.gz",
      "ptid": "052_S_4885",
      "visit": "v05",
      "acq_date": "3/04/2013",
      "phc_scan_date": "2013-03-04",
      "source": "phc",
      "question": "MRI scan (Image Data ID I361938) acquired on 3/04/2013 for a male participant (visit v05). Predict the subject's T1 scan age in years and answer with a numeric value using one decimal place.",
      "answer": "75.6",
      "answer_code": "75.6",
      "answer_units": "years",
      "demographics": {
        "sex": "male",
        "sex_code": "1",
        "visit": "v05",
        "phc_scandate": "2013-03-04",
        "image_acq_date": "3/04/2013"
      }
    },
    {
      "image_id": "I307594",
      "image_path": "ADNI_Nifti_QC_N4/I307594_T1_N4.nii.gz",
      "ptid": "067_S_4728",
      "visit": "v02",
      "acq_date": "6/01/2012",
      "phc_scan_date": "2012-06-01",
      "source": "phc",
      "question": "MRI scan (Image Data ID I307594) acquired on 6/01/2012 for a male participant (visit v02). Predict the subject's T1 scan age in years and answer with a numeric value using one decimal place.",
      "answer": "82",
      "answer_code": "82",
      "answer_units": "years",
      "demographics": {
        "sex": "male",
        "sex_code": "1",
        "visit": "v02",
        "phc_scandate": "2012-06-01",
        "image_acq_date": "6/01/2012"
      }
    },
    {
      "image_id": "I228464",
      "image_path": "ADNI_Nifti_QC_N4/I228464_T1_N4.nii.gz",
      "ptid": "053_S_2357",
      "visit": "scmri",
      "acq_date": "4/20/2011",
      "phc_scan_date": "2011-04-20",
      "source": "phc",
      "question": "MRI scan (Image Data ID I228464) acquired on 4/20/2011 for a male participant (visit scmri). Predict the subject's T1 scan age in years and answer with a numeric value using one decimal place.",
      "answer": "71.8",
      "answer_code": "71.8",
      "answer_units": "years",
      "demographics": {
        "sex": "male",
        "sex_code": "1",
        "visit": "scmri",
        "phc_scandate": "2011-04-20",
        "image_acq_date": "4/20/2011"
      }
    },
    {
      "image_id": "I124649",
      "image_path": "ADNI_Nifti_QC_N4/I124649_T1_N4.nii.gz",
      "ptid": "024_S_0985",
      "visit": "m24",
      "acq_date": "10/30/2008",
      "phc_scan_date": "2008-10-30",
      "source": "phc",
      "question": "MRI scan (Image Data ID I124649) acquired on 10/30/2008 for a male participant (visit m24). Predict the subject's T1 scan age in years and answer with a numeric value using one decimal place.",
      "answer": "81.8",
      "answer_code": "81.8",
      "answer_units": "years",
      "demographics": {
        "sex": "male",
        "sex_code": "1",
        "visit": "m24",
        "phc_scandate": "2008-10-30",
        "image_acq_date": "10/30/2008"
      }
    },
    {
      "image_id": "I31746",
      "image_path": "ADNI_Nifti_QC_N4/I31746_T1_N4.nii.gz",
      "ptid": "036_S_0576",
      "visit": "m06",
      "acq_date": "12/05/2006",
      "phc_scan_date": "2006-12-05",
      "source": "phc",
      "question": "MRI scan (Image Data ID I31746) acquired on 12/05/2006 for a male participant (visit m06). Predict the subject's T1 scan age in years and answer with a numeric value using one decimal place.",
      "answer": "78.1",
      "answer_code": "78.1",
      "answer_units": "years",
      "demographics": {
        "sex": "male",
        "sex_code": "1",
        "visit": "m06",
        "phc_scandate": "2006-12-05",
        "image_acq_date": "12/05/2006"
      }
    },
    {
      "image_id": "I285900",
      "image_path": "ADNI_Nifti_QC_N4/I285900_T1_N4.nii.gz",
      "ptid": "116_S_4167",
      "visit": "v05",
      "acq_date": "2/17/2012",
      "phc_scan_date": "2012-02-17",
      "source": "phc",
      "question": "MRI scan (Image Data ID I285900) acquired on 2/17/2012 for a female participant (visit v05). Predict the subject's T1 scan age in years and answer with a numeric value using one decimal place.",
      "answer": "70.1",
      "answer_code": "70.1",
      "answer_units": "years",
      "demographics": {
        "sex": "female",
        "sex_code": "2",
        "visit": "v05",
        "phc_scandate": "2012-02-17",
        "image_acq_date": "2/17/2012"
      }
    },
    {
      "image_id": "I369912",
      "image_path": "ADNI_Nifti_QC_N4/I369912_T1_N4.nii.gz",
      "ptid": "027_S_2336",
      "visit": "v06",
      "acq_date": "5/02/2013",
      "phc_scan_date": "2013-05-02",
      "source": "phc",
      "question": "MRI scan (Image Data ID I369912) acquired on 5/02/2013 for a female participant (visit v06). Predict the subject's T1 scan age in years and answer with a numeric value using one decimal place.",
      "answer": "75.1",
      "answer_code": "75.1",
      "answer_units": "years",
      "demographics": {
        "sex": "female",
        "sex_code": "2",
        "visit": "v06",
        "phc_scandate": "2013-05-02",
        "image_acq_date": "5/02/2013"
      }
    },
    {
      "image_id": "I153216",
      "image_path": "ADNI_Nifti_QC_N4/I153216_T1_N4.nii.gz",
      "ptid": "116_S_0649",
      "visit": "m36",
      "acq_date": "8/14/2009",
      "phc_scan_date": "2009-08-14",
      "source": "phc",
      "question": "MRI scan (Image Data ID I153216) acquired on 8/14/2009 for a male participant (visit m36). Predict the subject's T1 scan age in years and answer with a numeric value using one decimal place.",
      "answer": "89.8",
      "answer_code": "89.8",
      "answer_units": "years",
      "demographics": {
        "sex": "male",
        "sex_code": "1",
        "visit": "m36",
        "phc_scandate": "2009-08-14",
        "image_acq_date": "8/14/2009"
      }
    },
    {
      "image_id": "I361812",
      "image_path": "ADNI_Nifti_QC_N4/I361812_T1_N4.nii.gz",
      "ptid": "041_S_4513",
      "visit": "v11",
      "acq_date": "3/01/2013",
      "phc_scan_date": "2013-03-01",
      "source": "phc",
      "question": "MRI scan (Image Data ID I361812) acquired on 3/01/2013 for a male participant (visit v11). Predict the subject's T1 scan age in years and answer with a numeric value using one decimal place.",
      "answer": "61.8",
      "answer_code": "61.8",
      "answer_units": "years",
      "demographics": {
        "sex": "male",
        "sex_code": "1",
        "visit": "v11",
        "phc_scandate": "2013-03-01",
        "image_acq_date": "3/01/2013"
      }
    },
    {
      "image_id": "I306579",
      "image_path": "ADNI_Nifti_QC_N4/I306579_T1_N4.nii.gz",
      "ptid": "012_S_4012",
      "visit": "v11",
      "acq_date": "5/21/2012",
      "phc_scan_date": "2012-05-21",
      "source": "phc",
      "question": "MRI scan (Image Data ID I306579) acquired on 5/21/2012 for a female participant (visit v11). Predict the subject's T1 scan age in years and answer with a numeric value using one decimal place.",
      "answer": "70.1",
      "answer_code": "70.1",
      "answer_units": "years",
      "demographics": {
        "sex": "female",
        "sex_code": "2",
        "visit": "v11",
        "phc_scandate": "2012-05-21",
        "image_acq_date": "5/21/2012"
      }
    },
    {
      "image_id": "I549804",
      "image_path": "ADNI_Nifti_QC_N4/I549804_T1_N4.nii.gz",
      "ptid": "037_S_4071",
      "visit": "v41",
      "acq_date": "11/11/2015",
      "phc_scan_date": "2015-11-11",
      "source": "phc",
      "question": "MRI scan (Image Data ID I549804) acquired on 11/11/2015 for a male participant (visit v41). Predict the subject's T1 scan age in years and answer with a numeric value using one decimal place.",
      "answer": "89",
      "answer_code": "89",
      "answer_units": "years",
      "demographics": {
        "sex": "male",
        "sex_code": "1",
        "visit": "v41",
        "phc_scandate": "2015-11-11",
        "image_acq_date": "11/11/2015"
      }
    },
    {
      "image_id": "I53030",
      "image_path": "ADNI_Nifti_QC_N4/I53030_T1_N4.nii.gz",
      "ptid": "027_S_0307",
      "visit": "m12",
      "acq_date": "5/01/2007",
      "phc_scan_date": "2007-05-01",
      "source": "phc",
      "question": "MRI scan (Image Data ID I53030) acquired on 5/01/2007 for a male participant (visit m12). Predict the subject's T1 scan age in years and answer with a numeric value using one decimal place.",
      "answer": "79.7",
      "answer_code": "79.7",
      "answer_units": "years",
      "demographics": {
        "sex": "male",
        "sex_code": "1",
        "visit": "m12",
        "phc_scandate": "2007-05-01",
        "image_acq_date": "5/01/2007"
      }
    },
    {
      "image_id": "I304618",
      "image_path": "ADNI_Nifti_QC_N4/I304618_T1_N4.nii.gz",
      "ptid": "135_S_4723",
      "visit": "v02",
      "acq_date": "5/16/2012",
      "phc_scan_date": "2012-05-16",
      "source": "phc",
      "question": "MRI scan (Image Data ID I304618) acquired on 5/16/2012 for a female participant (visit v02). Predict the subject's T1 scan age in years and answer with a numeric value using one decimal place.",
      "answer": "69.5",
      "answer_code": "69.5",
      "answer_units": "years",
      "demographics": {
        "sex": "female",
        "sex_code": "2",
        "visit": "v02",
        "phc_scandate": "2012-05-16",
        "image_acq_date": "5/16/2012"
      }
    },
    {
      "image_id": "I794172",
      "image_path": "ADNI_Nifti_QC_N4/I794172_T1_N4.nii.gz",
      "ptid": "127_S_4301",
      "visit": "v51",
      "acq_date": "11/17/2016",
      "phc_scan_date": "2016-11-17",
      "source": "phc",
      "question": "MRI scan (Image Data ID I794172) acquired on 11/17/2016 for a male participant (visit v51). Predict the subject's T1 scan age in years and answer with a numeric value using one decimal place.",
      "answer": "79.8",
      "answer_code": "79.8",
      "answer_units": "years",
      "demographics": {
        "sex": "male",
        "sex_code": "1",
        "visit": "v51",
        "phc_scandate": "2016-11-17",
        "image_acq_date": "11/17/2016"
      }
    },
    {
      "image_id": "I405621",
      "image_path": "ADNI_Nifti_QC_N4/I405621_T1_N4.nii.gz",
      "ptid": "137_S_4258",
      "visit": "v21",
      "acq_date": "10/18/2013",
      "phc_scan_date": "2013-10-18",
      "source": "phc",
      "question": "MRI scan (Image Data ID I405621) acquired on 10/18/2013 for a male participant (visit v21). Predict the subject's T1 scan age in years and answer with a numeric value using one decimal place.",
      "answer": "78",
      "answer_code": "78",
      "answer_units": "years",
      "demographics": {
        "sex": "male",
        "sex_code": "1",
        "visit": "v21",
        "phc_scandate": "2013-10-18",
        "image_acq_date": "10/18/2013"
      }
    },
    {
      "image_id": "I89992",
      "image_path": "ADNI_Nifti_QC_N4/I89992_T1_N4.nii.gz",
      "ptid": "141_S_1152",
      "visit": "m12",
      "acq_date": "2/03/2008",
      "phc_scan_date": "2008-02-03",
      "source": "phc",
      "question": "MRI scan (Image Data ID I89992) acquired on 2/03/2008 for a female participant (visit m12). Predict the subject's T1 scan age in years and answer with a numeric value using one decimal place.",
      "answer": "72.6",
      "answer_code": "72.6",
      "answer_units": "years",
      "demographics": {
        "sex": "female",
        "sex_code": "2",
        "visit": "m12",
        "phc_scandate": "2008-02-03",
        "image_acq_date": "2/03/2008"
      }
    },
    {
      "image_id": "I115201",
      "image_path": "ADNI_Nifti_QC_N4/I115201_T1_N4.nii.gz",
      "ptid": "016_S_1092",
      "visit": "m18",
      "acq_date": "7/31/2008",
      "phc_scan_date": "2008-07-31",
      "source": "phc",
      "question": "MRI scan (Image Data ID I115201) acquired on 7/31/2008 for a male participant (visit m18). Predict the subject's T1 scan age in years and answer with a numeric value using one decimal place.",
      "answer": "76.1",
      "answer_code": "76.1",
      "answer_units": "years",
      "demographics": {
        "sex": "male",
        "sex_code": "1",
        "visit": "m18",
        "phc_scandate": "2008-07-31",
        "image_acq_date": "7/31/2008"
      }
    },
    {
      "image_id": "I290839",
      "image_path": "ADNI_Nifti_QC_N4/I290839_T1_N4.nii.gz",
      "ptid": "006_S_1130",
      "visit": "v06",
      "acq_date": "3/19/2012",
      "phc_scan_date": "2012-03-19",
      "source": "phc",
      "question": "MRI scan (Image Data ID I290839) acquired on 3/19/2012 for a female participant (visit v06). Predict the subject's T1 scan age in years and answer with a numeric value using one decimal place.",
      "answer": "76.5",
      "answer_code": "76.5",
      "answer_units": "years",
      "demographics": {
        "sex": "female",
        "sex_code": "2",
        "visit": "v06",
        "phc_scandate": "2012-03-19",
        "image_acq_date": "3/19/2012"
      }
    },
    {
      "image_id": "I440845",
      "image_path": "ADNI_Nifti_QC_N4/I440845_T1_N4.nii.gz",
      "ptid": "153_S_4838",
      "visit": "v21",
      "acq_date": "8/26/2014",
      "phc_scan_date": "2014-08-26",
      "source": "phc",
      "question": "MRI scan (Image Data ID I440845) acquired on 8/26/2014 for a male participant (visit v21). Predict the subject's T1 scan age in years and answer with a numeric value using one decimal place.",
      "answer": "77.9",
      "answer_code": "77.9",
      "answer_units": "years",
      "demographics": {
        "sex": "male",
        "sex_code": "1",
        "visit": "v21",
        "phc_scandate": "2014-08-26",
        "image_acq_date": "8/26/2014"
      }
    },
    {
      "image_id": "I316960",
      "image_path": "ADNI_Nifti_QC_N4/I316960_T1_N4.nii.gz",
      "ptid": "013_S_4768",
      "visit": "v02",
      "acq_date": "6/26/2012",
      "phc_scan_date": "2012-06-26",
      "source": "phc",
      "question": "MRI scan (Image Data ID I316960) acquired on 6/26/2012 for a female participant (visit v02). Predict the subject's T1 scan age in years and answer with a numeric value using one decimal place.",
      "answer": "61.9",
      "answer_code": "61.9",
      "answer_units": "years",
      "demographics": {
        "sex": "female",
        "sex_code": "2",
        "visit": "v02",
        "phc_scandate": "2012-06-26",
        "image_acq_date": "6/26/2012"
      }
    },
    {
      "image_id": "I314061",
      "image_path": "ADNI_Nifti_QC_N4/I314061_T1_N4.nii.gz",
      "ptid": "023_S_4020",
      "visit": "v11",
      "acq_date": "7/03/2012",
      "phc_scan_date": "2012-07-03",
      "source": "phc",
      "question": "MRI scan (Image Data ID I314061) acquired on 7/03/2012 for a male participant (visit v11). Predict the subject's T1 scan age in years and answer with a numeric value using one decimal place.",
      "answer": "67.8",
      "answer_code": "67.8",
      "answer_units": "years",
      "demographics": {
        "sex": "male",
        "sex_code": "1",
        "visit": "v11",
        "phc_scandate": "2012-07-03",
        "image_acq_date": "7/03/2012"
      }
    },
    {
      "image_id": "I313141",
      "image_path": "ADNI_Nifti_QC_N4/I313141_T1_N4.nii.gz",
      "ptid": "014_S_0548",
      "visit": "v11",
      "acq_date": "6/26/2012",
      "phc_scan_date": "2012-06-26",
      "source": "phc",
      "question": "MRI scan (Image Data ID I313141) acquired on 6/26/2012 for a female participant (visit v11). Predict the subject's T1 scan age in years and answer with a numeric value using one decimal place.",
      "answer": "79.9",
      "answer_code": "79.9",
      "answer_units": "years",
      "demographics": {
        "sex": "female",
        "sex_code": "2",
        "visit": "v11",
        "phc_scandate": "2012-06-26",
        "image_acq_date": "6/26/2012"
      }
    },
    {
      "image_id": "I25762",
      "image_path": "ADNI_Nifti_QC_N4/I25762_T1_N4.nii.gz",
      "ptid": "099_S_0880",
      "visit": "sc",
      "acq_date": "10/05/2006",
      "phc_scan_date": "2006-10-05",
      "source": "phc",
      "question": "MRI scan (Image Data ID I25762) acquired on 10/05/2006 for a male participant (visit sc). Predict the subject's T1 scan age in years and answer with a numeric value using one decimal place.",
      "answer": "84.3",
      "answer_code": "84.3",
      "answer_units": "years",
      "demographics": {
        "sex": "male",
        "sex_code": "1",
        "visit": "sc",
        "phc_scandate": "2006-10-05",
        "image_acq_date": "10/05/2006"
      }
    },
    {
      "image_id": "I349271",
      "image_path": "ADNI_Nifti_QC_N4/I349271_T1_N4.nii.gz",
      "ptid": "021_S_4744",
      "visit": "v05",
      "acq_date": "12/04/2012",
      "phc_scan_date": "2012-12-04",
      "source": "phc",
      "question": "MRI scan (Image Data ID I349271) acquired on 12/04/2012 for a female participant (visit v05). Predict the subject's T1 scan age in years and answer with a numeric value using one decimal place.",
      "answer": "72.9",
      "answer_code": "72.9",
      "answer_units": "years",
      "demographics": {
        "sex": "female",
        "sex_code": "2",
        "visit": "v05",
        "phc_scandate": "2012-12-04",
        "image_acq_date": "12/04/2012"
      }
    },
    {
      "image_id": "I204975",
      "image_path": "ADNI_Nifti_QC_N4/I204975_T1_N4.nii.gz",
      "ptid": "068_S_2171",
      "visit": "scmri",
      "acq_date": "11/09/2010",
      "phc_scan_date": "2010-11-09",
      "source": "phc",
      "question": "MRI scan (Image Data ID I204975) acquired on 11/09/2010 for a female participant (visit scmri). Predict the subject's T1 scan age in years and answer with a numeric value using one decimal place.",
      "answer": "65.4",
      "answer_code": "65.4",
      "answer_units": "years",
      "demographics": {
        "sex": "female",
        "sex_code": "2",
        "visit": "scmri",
        "phc_scandate": "2010-11-09",
        "image_acq_date": "11/09/2010"
      }
    },
    {
      "image_id": "I256865",
      "image_path": "ADNI_Nifti_QC_N4/I256865_T1_N4.nii.gz",
      "ptid": "011_S_4222",
      "visit": "v02",
      "acq_date": "9/14/2011",
      "phc_scan_date": "2011-09-14",
      "source": "phc",
      "question": "MRI scan (Image Data ID I256865) acquired on 9/14/2011 for a female participant (visit v02). Predict the subject's T1 scan age in years and answer with a numeric value using one decimal place.",
      "answer": "82.4",
      "answer_code": "82.4",
      "answer_units": "years",
      "demographics": {
        "sex": "female",
        "sex_code": "2",
        "visit": "v02",
        "phc_scandate": "2011-09-14",
        "image_acq_date": "9/14/2011"
      }
    },
    {
      "image_id": "I35211",
      "image_path": "ADNI_Nifti_QC_N4/I35211_T1_N4.nii.gz",
      "ptid": "133_S_1170",
      "visit": "sc",
      "acq_date": "12/29/2006",
      "phc_scan_date": "2006-12-29",
      "source": "phc",
      "question": "MRI scan (Image Data ID I35211) acquired on 12/29/2006 for a male participant (visit sc). Predict the subject's T1 scan age in years and answer with a numeric value using one decimal place.",
      "answer": "73.1",
      "answer_code": "73.1",
      "answer_units": "years",
      "demographics": {
        "sex": "male",
        "sex_code": "1",
        "visit": "sc",
        "phc_scandate": "2006-12-29",
        "image_acq_date": "12/29/2006"
      }
    },
    {
      "image_id": "I362139",
      "image_path": "ADNI_Nifti_QC_N4/I362139_T1_N4.nii.gz",
      "ptid": "019_S_4548",
      "visit": "v11",
      "acq_date": "3/04/2013",
      "phc_scan_date": "2013-03-04",
      "source": "phc",
      "question": "MRI scan (Image Data ID I362139) acquired on 3/04/2013 for a male participant (visit v11). Predict the subject's T1 scan age in years and answer with a numeric value using one decimal place.",
      "answer": "85.9",
      "answer_code": "85.9",
      "answer_units": "years",
      "demographics": {
        "sex": "male",
        "sex_code": "1",
        "visit": "v11",
        "phc_scandate": "2013-03-04",
        "image_acq_date": "3/04/2013"
      }
    },
    {
      "image_id": "I341919",
      "image_path": "ADNI_Nifti_QC_N4/I341919_T1_N4.nii.gz",
      "ptid": "100_S_4469",
      "visit": "v05",
      "acq_date": "10/23/2012",
      "phc_scan_date": "2012-10-23",
      "source": "phc",
      "question": "MRI scan (Image Data ID I341919) acquired on 10/23/2012 for a male participant (visit v05). Predict the subject's T1 scan age in years and answer with a numeric value using one decimal place.",
      "answer": "66.8",
      "answer_code": "66.8",
      "answer_units": "years",
      "demographics": {
        "sex": "male",
        "sex_code": "1",
        "visit": "v05",
        "phc_scandate": "2012-10-23",
        "image_acq_date": "10/23/2012"
      }
    },
    {
      "image_id": "I618312",
      "image_path": "ADNI_Nifti_QC_N4/I618312_T1_N4.nii.gz",
      "ptid": "073_S_4311",
      "visit": "v41",
      "acq_date": "1/14/2016",
      "phc_scan_date": "2016-01-14",
      "source": "phc",
      "question": "MRI scan (Image Data ID I618312) acquired on 1/14/2016 for a female participant (visit v41). Predict the subject's T1 scan age in years and answer with a numeric value using one decimal place.",
      "answer": "76.8",
      "answer_code": "76.8",
      "answer_units": "years",
      "demographics": {
        "sex": "female",
        "sex_code": "2",
        "visit": "v41",
        "phc_scandate": "2016-01-14",
        "image_acq_date": "1/14/2016"
      }
    },
    {
      "image_id": "I286222",
      "image_path": "ADNI_Nifti_QC_N4/I286222_T1_N4.nii.gz",
      "ptid": "094_S_4503",
      "visit": "v02",
      "acq_date": "2/22/2012",
      "phc_scan_date": "2012-02-22",
      "source": "phc",
      "question": "MRI scan (Image Data ID I286222) acquired on 2/22/2012 for a female participant (visit v02). Predict the subject's T1 scan age in years and answer with a numeric value using one decimal place.",
      "answer": "71.8",
      "answer_code": "71.8",
      "answer_units": "years",
      "demographics": {
        "sex": "female",
        "sex_code": "2",
        "visit": "v02",
        "phc_scandate": "2012-02-22",
        "image_acq_date": "2/22/2012"
      }
    },
    {
      "image_id": "I99234",
      "image_path": "ADNI_Nifti_QC_N4/I99234_T1_N4.nii.gz",
      "ptid": "128_S_1242",
      "visit": "m12",
      "acq_date": "3/21/2008",
      "phc_scan_date": "2008-03-21",
      "source": "phc",
      "question": "MRI scan (Image Data ID I99234) acquired on 3/21/2008 for a female participant (visit m12). Predict the subject's T1 scan age in years and answer with a numeric value using one decimal place.",
      "answer": "72.3",
      "answer_code": "72.3",
      "answer_units": "years",
      "demographics": {
        "sex": "female",
        "sex_code": "2",
        "visit": "m12",
        "phc_scandate": "2008-03-21",
        "image_acq_date": "3/21/2008"
      }
    },
    {
      "image_id": "I288447",
      "image_path": "ADNI_Nifti_QC_N4/I288447_T1_N4.nii.gz",
      "ptid": "022_S_2167",
      "visit": "v06",
      "acq_date": "2/28/2012",
      "phc_scan_date": "2012-02-28",
      "source": "phc",
      "question": "MRI scan (Image Data ID I288447) acquired on 2/28/2012 for a male participant (visit v06). Predict the subject's T1 scan age in years and answer with a numeric value using one decimal place.",
      "answer": "82.1",
      "answer_code": "82.1",
      "answer_units": "years",
      "demographics": {
        "sex": "male",
        "sex_code": "1",
        "visit": "v06",
        "phc_scandate": "2012-02-28",
        "image_acq_date": "2/28/2012"
      }
    },
    {
      "image_id": "I72069",
      "image_path": "ADNI_Nifti_QC_N4/I72069_T1_N4.nii.gz",
      "ptid": "137_S_0722",
      "visit": "m12",
      "acq_date": "9/10/2007",
      "phc_scan_date": "2007-09-10",
      "source": "phc",
      "question": "MRI scan (Image Data ID I72069) acquired on 9/10/2007 for a male participant (visit m12). Predict the subject's T1 scan age in years and answer with a numeric value using one decimal place.",
      "answer": "71.3",
      "answer_code": "71.3",
      "answer_units": "years",
      "demographics": {
        "sex": "male",
        "sex_code": "1",
        "visit": "m12",
        "phc_scandate": "2007-09-10",
        "image_acq_date": "9/10/2007"
      }
    },
    {
      "image_id": "I53700",
      "image_path": "ADNI_Nifti_QC_N4/I53700_T1_N4.nii.gz",
      "ptid": "007_S_0316",
      "visit": "m12",
      "acq_date": "5/07/2007",
      "phc_scan_date": "2007-05-07",
      "source": "phc",
      "question": "MRI scan (Image Data ID I53700) acquired on 5/07/2007 for a male participant (visit m12). Predict the subject's T1 scan age in years and answer with a numeric value using one decimal place.",
      "answer": "82",
      "answer_code": "82",
      "answer_units": "years",
      "demographics": {
        "sex": "male",
        "sex_code": "1",
        "visit": "m12",
        "phc_scandate": "2007-05-07",
        "image_acq_date": "5/07/2007"
      }
    },
    {
      "image_id": "I163726",
      "image_path": "ADNI_Nifti_QC_N4/I163726_T1_N4.nii.gz",
      "ptid": "041_S_1002",
      "visit": "m36",
      "acq_date": "1/13/2010",
      "phc_scan_date": "2010-01-13",
      "source": "phc",
      "question": "MRI scan (Image Data ID I163726) acquired on 1/13/2010 for a female participant (visit m36). Predict the subject's T1 scan age in years and answer with a numeric value using one decimal place.",
      "answer": "79.6",
      "answer_code": "79.6",
      "answer_units": "years",
      "demographics": {
        "sex": "female",
        "sex_code": "2",
        "visit": "m36",
        "phc_scandate": "2010-01-13",
        "image_acq_date": "1/13/2010"
      }
    },
    {
      "image_id": "I344604",
      "image_path": "ADNI_Nifti_QC_N4/I344604_T1_N4.nii.gz",
      "ptid": "116_S_4338",
      "visit": "v11",
      "acq_date": "11/07/2012",
      "phc_scan_date": "2012-11-07",
      "source": "phc",
      "question": "MRI scan (Image Data ID I344604) acquired on 11/07/2012 for a male participant (visit v11). Predict the subject's T1 scan age in years and answer with a numeric value using one decimal place.",
      "answer": "81.6",
      "answer_code": "81.6",
      "answer_units": "years",
      "demographics": {
        "sex": "male",
        "sex_code": "1",
        "visit": "v11",
        "phc_scandate": "2012-11-07",
        "image_acq_date": "11/07/2012"
      }
    },
    {
      "image_id": "I9487",
      "image_path": "ADNI_Nifti_QC_N4/I9487_T1_N4.nii.gz",
      "ptid": "027_S_0074",
      "visit": "sc",
      "acq_date": "12/09/2005",
      "phc_scan_date": "2005-12-09",
      "source": "phc",
      "question": "MRI scan (Image Data ID I9487) acquired on 12/09/2005 for a male participant (visit sc). Predict the subject's T1 scan age in years and answer with a numeric value using one decimal place.",
      "answer": "78.3",
      "answer_code": "78.3",
      "answer_units": "years",
      "demographics": {
        "sex": "male",
        "sex_code": "1",
        "visit": "sc",
        "phc_scandate": "2005-12-09",
        "image_acq_date": "12/09/2005"
      }
    },
    {
      "image_id": "I799834",
      "image_path": "ADNI_Nifti_QC_N4/I799834_T1_N4.nii.gz",
      "ptid": "116_S_4855",
      "visit": "v41",
      "acq_date": "12/12/2016",
      "phc_scan_date": "2016-12-12",
      "source": "phc",
      "question": "MRI scan (Image Data ID I799834) acquired on 12/12/2016 for a male participant (visit v41). Predict the subject's T1 scan age in years and answer with a numeric value using one decimal place.",
      "answer": "88.3",
      "answer_code": "88.3",
      "answer_units": "years",
      "demographics": {
        "sex": "male",
        "sex_code": "1",
        "visit": "v41",
        "phc_scandate": "2016-12-12",
        "image_acq_date": "12/12/2016"
      }
    },
    {
      "image_id": "I227008",
      "image_path": "ADNI_Nifti_QC_N4/I227008_T1_N4.nii.gz",
      "ptid": "027_S_0256",
      "visit": "m60",
      "acq_date": "4/08/2011",
      "phc_scan_date": "2011-04-08",
      "source": "phc",
      "question": "MRI scan (Image Data ID I227008) acquired on 4/08/2011 for a male participant (visit m60). Predict the subject's T1 scan age in years and answer with a numeric value using one decimal place.",
      "answer": "75.3",
      "answer_code": "75.3",
      "answer_units": "years",
      "demographics": {
        "sex": "male",
        "sex_code": "1",
        "visit": "m60",
        "phc_scandate": "2011-04-08",
        "image_acq_date": "4/08/2011"
      }
    },
    {
      "image_id": "I95374",
      "image_path": "ADNI_Nifti_QC_N4/I95374_T1_N4.nii.gz",
      "ptid": "022_S_1351",
      "visit": "m12",
      "acq_date": "3/05/2008",
      "phc_scan_date": "2008-03-05",
      "source": "phc",
      "question": "MRI scan (Image Data ID I95374) acquired on 3/05/2008 for a female participant (visit m12). Predict the subject's T1 scan age in years and answer with a numeric value using one decimal place.",
      "answer": "73",
      "answer_code": "73",
      "answer_units": "years",
      "demographics": {
        "sex": "female",
        "sex_code": "2",
        "visit": "m12",
        "phc_scandate": "2008-03-05",
        "image_acq_date": "3/05/2008"
      }
    },
    {
      "image_id": "I32044",
      "image_path": "ADNI_Nifti_QC_N4/I32044_T1_N4.nii.gz",
      "ptid": "003_S_1122",
      "visit": "sc",
      "acq_date": "12/06/2006",
      "phc_scan_date": "2006-12-06",
      "source": "phc",
      "question": "MRI scan (Image Data ID I32044) acquired on 12/06/2006 for a female participant (visit sc). Predict the subject's T1 scan age in years and answer with a numeric value using one decimal place.",
      "answer": "76.8",
      "answer_code": "76.8",
      "answer_units": "years",
      "demographics": {
        "sex": "female",
        "sex_code": "2",
        "visit": "sc",
        "phc_scandate": "2006-12-06",
        "image_acq_date": "12/06/2006"
      }
    },
    {
      "image_id": "I82023",
      "image_path": "ADNI_Nifti_QC_N4/I82023_T1_N4.nii.gz",
      "ptid": "027_S_0408",
      "visit": "m18",
      "acq_date": "11/13/2007",
      "phc_scan_date": "2007-11-13",
      "source": "phc",
      "question": "MRI scan (Image Data ID I82023) acquired on 11/13/2007 for a male participant (visit m18). Predict the subject's T1 scan age in years and answer with a numeric value using one decimal place.",
      "answer": "83.8",
      "answer_code": "83.8",
      "answer_units": "years",
      "demographics": {
        "sex": "male",
        "sex_code": "1",
        "visit": "m18",
        "phc_scandate": "2007-11-13",
        "image_acq_date": "11/13/2007"
      }
    },
    {
      "image_id": "I372948",
      "image_path": "ADNI_Nifti_QC_N4/I372948_T1_N4.nii.gz",
      "ptid": "041_S_4720",
      "visit": "v11",
      "acq_date": "5/17/2013",
      "phc_scan_date": "2013-05-17",
      "source": "phc",
      "question": "MRI scan (Image Data ID I372948) acquired on 5/17/2013 for a male participant (visit v11). Predict the subject's T1 scan age in years and answer with a numeric value using one decimal place.",
      "answer": "78.5",
      "answer_code": "78.5",
      "answer_units": "years",
      "demographics": {
        "sex": "male",
        "sex_code": "1",
        "visit": "v11",
        "phc_scandate": "2013-05-17",
        "image_acq_date": "5/17/2013"
      }
    },
    {
      "image_id": "I303101",
      "image_path": "ADNI_Nifti_QC_N4/I303101_T1_N4.nii.gz",
      "ptid": "073_S_4540",
      "visit": "v04",
      "acq_date": "5/10/2012",
      "phc_scan_date": "2012-05-10",
      "source": "phc",
      "question": "MRI scan (Image Data ID I303101) acquired on 5/10/2012 for a female participant (visit v04). Predict the subject's T1 scan age in years and answer with a numeric value using one decimal place.",
      "answer": "71.4",
      "answer_code": "71.4",
      "answer_units": "years",
      "demographics": {
        "sex": "female",
        "sex_code": "2",
        "visit": "v04",
        "phc_scandate": "2012-05-10",
        "image_acq_date": "5/10/2012"
      }
    },
    {
      "image_id": "I194712",
      "image_path": "ADNI_Nifti_QC_N4/I194712_T1_N4.nii.gz",
      "ptid": "116_S_0657",
      "visit": "m48",
      "acq_date": "10/01/2010",
      "phc_scan_date": "2010-10-01",
      "source": "phc",
      "question": "MRI scan (Image Data ID I194712) acquired on 10/01/2010 for a female participant (visit m48). Predict the subject's T1 scan age in years and answer with a numeric value using one decimal place.",
      "answer": "82",
      "answer_code": "82",
      "answer_units": "years",
      "demographics": {
        "sex": "female",
        "sex_code": "2",
        "visit": "m48",
        "phc_scandate": "2010-10-01",
        "image_acq_date": "10/01/2010"
      }
    },
    {
      "image_id": "I224790",
      "image_path": "ADNI_Nifti_QC_N4/I224790_T1_N4.nii.gz",
      "ptid": "128_S_2036",
      "visit": "m06",
      "acq_date": "3/17/2011",
      "phc_scan_date": "2011-03-17",
      "source": "phc",
      "question": "MRI scan (Image Data ID I224790) acquired on 3/17/2011 for a female participant (visit m06). Predict the subject's T1 scan age in years and answer with a numeric value using one decimal place.",
      "answer": "67.4",
      "answer_code": "67.4",
      "answer_units": "years",
      "demographics": {
        "sex": "female",
        "sex_code": "2",
        "visit": "m06",
        "phc_scandate": "2011-03-17",
        "image_acq_date": "3/17/2011"
      }
    },
    {
      "image_id": "I126898",
      "image_path": "ADNI_Nifti_QC_N4/I126898_T1_N4.nii.gz",
      "ptid": "036_S_0869",
      "visit": "m24",
      "acq_date": "11/17/2008",
      "phc_scan_date": "2008-11-17",
      "source": "phc",
      "question": "MRI scan (Image Data ID I126898) acquired on 11/17/2008 for a female participant (visit m24). Predict the subject's T1 scan age in years and answer with a numeric value using one decimal place.",
      "answer": "85.1",
      "answer_code": "85.1",
      "answer_units": "years",
      "demographics": {
        "sex": "female",
        "sex_code": "2",
        "visit": "m24",
        "phc_scandate": "2008-11-17",
        "image_acq_date": "11/17/2008"
      }
    },
    {
      "image_id": "I33171",
      "image_path": "ADNI_Nifti_QC_N4/I33171_T1_N4.nii.gz",
      "ptid": "002_S_0619",
      "visit": "m06",
      "acq_date": "12/13/2006",
      "phc_scan_date": "2006-12-13",
      "source": "phc",
      "question": "MRI scan (Image Data ID I33171) acquired on 12/13/2006 for a male participant (visit m06). Predict the subject's T1 scan age in years and answer with a numeric value using one decimal place.",
      "answer": "78.1",
      "answer_code": "78.1",
      "answer_units": "years",
      "demographics": {
        "sex": "male",
        "sex_code": "1",
        "visit": "m06",
        "phc_scandate": "2006-12-13",
        "image_acq_date": "12/13/2006"
      }
    },
    {
      "image_id": "I243629",
      "image_path": "ADNI_Nifti_QC_N4/I243629_T1_N4.nii.gz",
      "ptid": "014_S_4093",
      "visit": "v02",
      "acq_date": "7/07/2011",
      "phc_scan_date": "2011-07-07",
      "source": "phc",
      "question": "MRI scan (Image Data ID I243629) acquired on 7/07/2011 for a female participant (visit v02). Predict the subject's T1 scan age in years and answer with a numeric value using one decimal place.",
      "answer": "70.1",
      "answer_code": "70.1",
      "answer_units": "years",
      "demographics": {
        "sex": "female",
        "sex_code": "2",
        "visit": "v02",
        "phc_scandate": "2011-07-07",
        "image_acq_date": "7/07/2011"
      }
    },
    {
      "image_id": "I71878",
      "image_path": "ADNI_Nifti_QC_N4/I71878_T1_N4.nii.gz",
      "ptid": "007_S_1222",
      "visit": "m06",
      "acq_date": "8/28/2007",
      "phc_scan_date": "2007-08-28",
      "source": "phc",
      "question": "MRI scan (Image Data ID I71878) acquired on 8/28/2007 for a female participant (visit m06). Predict the subject's T1 scan age in years and answer with a numeric value using one decimal place.",
      "answer": "74",
      "answer_code": "74",
      "answer_units": "years",
      "demographics": {
        "sex": "female",
        "sex_code": "2",
        "visit": "m06",
        "phc_scandate": "2007-08-28",
        "image_acq_date": "8/28/2007"
      }
    },
    {
      "image_id": "I283095",
      "image_path": "ADNI_Nifti_QC_N4/I283095_T1_N4.nii.gz",
      "ptid": "068_S_4431",
      "visit": "v02",
      "acq_date": "2/06/2012",
      "phc_scan_date": "2012-02-06",
      "source": "phc",
      "question": "MRI scan (Image Data ID I283095) acquired on 2/06/2012 for a male participant (visit v02). Predict the subject's T1 scan age in years and answer with a numeric value using one decimal place.",
      "answer": "74.2",
      "answer_code": "74.2",
      "answer_units": "years",
      "demographics": {
        "sex": "male",
        "sex_code": "1",
        "visit": "v02",
        "phc_scandate": "2012-02-06",
        "image_acq_date": "2/06/2012"
      }
    },
    {
      "image_id": "I365183",
      "image_path": "ADNI_Nifti_QC_N4/I365183_T1_N4.nii.gz",
      "ptid": "016_S_4591",
      "visit": "v11",
      "acq_date": "4/01/2013",
      "phc_scan_date": "2013-04-01",
      "source": "phc",
      "question": "MRI scan (Image Data ID I365183) acquired on 4/01/2013 for a female participant (visit v11). Predict the subject's T1 scan age in years and answer with a numeric value using one decimal place.",
      "answer": "67",
      "answer_code": "67",
      "answer_units": "years",
      "demographics": {
        "sex": "female",
        "sex_code": "2",
        "visit": "v11",
        "phc_scandate": "2013-04-01",
        "image_acq_date": "4/01/2013"
      }
    },
    {
      "image_id": "I435201",
      "image_path": "ADNI_Nifti_QC_N4/I435201_T1_N4.nii.gz",
      "ptid": "022_S_4805",
      "visit": "v21",
      "acq_date": "7/11/2014",
      "phc_scan_date": "2014-07-11",
      "source": "phc",
      "question": "MRI scan (Image Data ID I435201) acquired on 7/11/2014 for a female participant (visit v21). Predict the subject's T1 scan age in years and answer with a numeric value using one decimal place.",
      "answer": "74",
      "answer_code": "74",
      "answer_units": "years",
      "demographics": {
        "sex": "female",
        "sex_code": "2",
        "visit": "v21",
        "phc_scandate": "2014-07-11",
        "image_acq_date": "7/11/2014"
      }
    },
    {
      "image_id": "I259743",
      "image_path": "ADNI_Nifti_QC_N4/I259743_T1_N4.nii.gz",
      "ptid": "014_S_4263",
      "visit": "v02",
      "acq_date": "10/06/2011",
      "phc_scan_date": "2011-10-06",
      "source": "phc",
      "question": "MRI scan (Image Data ID I259743) acquired on 10/06/2011 for a male participant (visit v02). Predict the subject's T1 scan age in years and answer with a numeric value using one decimal place.",
      "answer": "74.4",
      "answer_code": "74.4",
      "answer_units": "years",
      "demographics": {
        "sex": "male",
        "sex_code": "1",
        "visit": "v02",
        "phc_scandate": "2011-10-06",
        "image_acq_date": "10/06/2011"
      }
    },
    {
      "image_id": "I311236",
      "image_path": "ADNI_Nifti_QC_N4/I311236_T1_N4.nii.gz",
      "ptid": "007_S_4568",
      "visit": "v04",
      "acq_date": "6/19/2012",
      "phc_scan_date": "2012-06-19",
      "source": "phc",
      "question": "MRI scan (Image Data ID I311236) acquired on 6/19/2012 for a female participant (visit v04). Predict the subject's T1 scan age in years and answer with a numeric value using one decimal place.",
      "answer": "71",
      "answer_code": "71",
      "answer_units": "years",
      "demographics": {
        "sex": "female",
        "sex_code": "2",
        "visit": "v04",
        "phc_scandate": "2012-06-19",
        "image_acq_date": "6/19/2012"
      }
    },
    {
      "image_id": "I422058",
      "image_path": "ADNI_Nifti_QC_N4/I422058_T1_N4.nii.gz",
      "ptid": "100_S_0296",
      "visit": "v21",
      "acq_date": "4/24/2014",
      "phc_scan_date": "2014-04-24",
      "source": "phc",
      "question": "MRI scan (Image Data ID I422058) acquired on 4/24/2014 for a male participant (visit v21). Predict the subject's T1 scan age in years and answer with a numeric value using one decimal place.",
      "answer": "87.4",
      "answer_code": "87.4",
      "answer_units": "years",
      "demographics": {
        "sex": "male",
        "sex_code": "1",
        "visit": "v21",
        "phc_scandate": "2014-04-24",
        "image_acq_date": "4/24/2014"
      }
    },
    {
      "image_id": "I207211",
      "image_path": "ADNI_Nifti_QC_N4/I207211_T1_N4.nii.gz",
      "ptid": "023_S_2068",
      "visit": "m03",
      "acq_date": "12/01/2010",
      "phc_scan_date": "2010-12-01",
      "source": "phc",
      "question": "MRI scan (Image Data ID I207211) acquired on 12/01/2010 for a male participant (visit m03). Predict the subject's T1 scan age in years and answer with a numeric value using one decimal place.",
      "answer": "83.5",
      "answer_code": "83.5",
      "answer_units": "years",
      "demographics": {
        "sex": "male",
        "sex_code": "1",
        "visit": "m03",
        "phc_scandate": "2010-12-01",
        "image_acq_date": "12/01/2010"
      }
    },
    {
      "image_id": "I323679",
      "image_path": "ADNI_Nifti_QC_N4/I323679_T1_N4.nii.gz",
      "ptid": "153_S_4151",
      "visit": "v11",
      "acq_date": "8/14/2012",
      "phc_scan_date": "2012-08-14",
      "source": "phc",
      "question": "MRI scan (Image Data ID I323679) acquired on 8/14/2012 for a male participant (visit v11). Predict the subject's T1 scan age in years and answer with a numeric value using one decimal place.",
      "answer": "73.4",
      "answer_code": "73.4",
      "answer_units": "years",
      "demographics": {
        "sex": "male",
        "sex_code": "1",
        "visit": "v11",
        "phc_scandate": "2012-08-14",
        "image_acq_date": "8/14/2012"
      }
    },
    {
      "image_id": "I423902",
      "image_path": "ADNI_Nifti_QC_N4/I423902_T1_N4.nii.gz",
      "ptid": "094_S_4503",
      "visit": "v21",
      "acq_date": "5/06/2014",
      "phc_scan_date": "2014-05-06",
      "source": "phc",
      "question": "MRI scan (Image Data ID I423902) acquired on 5/06/2014 for a female participant (visit v21). Predict the subject's T1 scan age in years and answer with a numeric value using one decimal place.",
      "answer": "74",
      "answer_code": "74",
      "answer_units": "years",
      "demographics": {
        "sex": "female",
        "sex_code": "2",
        "visit": "v21",
        "phc_scandate": "2014-05-06",
        "image_acq_date": "5/06/2014"
      }
    },
    {
      "image_id": "I229076",
      "image_path": "ADNI_Nifti_QC_N4/I229076_T1_N4.nii.gz",
      "ptid": "021_S_0276",
      "visit": "m60",
      "acq_date": "4/25/2011",
      "phc_scan_date": "2011-04-25",
      "source": "phc",
      "question": "MRI scan (Image Data ID I229076) acquired on 4/25/2011 for a male participant (visit m60). Predict the subject's T1 scan age in years and answer with a numeric value using one decimal place.",
      "answer": "76.1",
      "answer_code": "76.1",
      "answer_units": "years",
      "demographics": {
        "sex": "male",
        "sex_code": "1",
        "visit": "m60",
        "phc_scandate": "2011-04-25",
        "image_acq_date": "4/25/2011"
      }
    },
    {
      "image_id": "I28367",
      "image_path": "ADNI_Nifti_QC_N4/I28367_T1_N4.nii.gz",
      "ptid": "128_S_0310",
      "visit": "m06",
      "acq_date": "10/30/2006",
      "phc_scan_date": "2006-10-30",
      "source": "phc",
      "question": "MRI scan (Image Data ID I28367) acquired on 10/30/2006 for a male participant (visit m06). Predict the subject's T1 scan age in years and answer with a numeric value using one decimal place.",
      "answer": "83.4",
      "answer_code": "83.4",
      "answer_units": "years",
      "demographics": {
        "sex": "male",
        "sex_code": "1",
        "visit": "m06",
        "phc_scandate": "2006-10-30",
        "image_acq_date": "10/30/2006"
      }
    },
    {
      "image_id": "I38572",
      "image_path": "ADNI_Nifti_QC_N4/I38572_T1_N4.nii.gz",
      "ptid": "010_S_0829",
      "visit": "sc",
      "acq_date": "2/08/2007",
      "phc_scan_date": "2007-02-08",
      "source": "phc",
      "question": "MRI scan (Image Data ID I38572) acquired on 2/08/2007 for a female participant (visit sc). Predict the subject's T1 scan age in years and answer with a numeric value using one decimal place.",
      "answer": "65",
      "answer_code": "65",
      "answer_units": "years",
      "demographics": {
        "sex": "female",
        "sex_code": "2",
        "visit": "sc",
        "phc_scandate": "2007-02-08",
        "image_acq_date": "2/08/2007"
      }
    },
    {
      "image_id": "I142385",
      "image_path": "ADNI_Nifti_QC_N4/I142385_T1_N4.nii.gz",
      "ptid": "127_S_1382",
      "visit": "m24",
      "acq_date": "4/22/2009",
      "phc_scan_date": "2009-04-22",
      "source": "phc",
      "question": "MRI scan (Image Data ID I142385) acquired on 4/22/2009 for a male participant (visit m24). Predict the subject's T1 scan age in years and answer with a numeric value using one decimal place.",
      "answer": "66.4",
      "answer_code": "66.4",
      "answer_units": "years",
      "demographics": {
        "sex": "male",
        "sex_code": "1",
        "visit": "m24",
        "phc_scandate": "2009-04-22",
        "image_acq_date": "4/22/2009"
      }
    },
    {
      "image_id": "I13964",
      "image_path": "ADNI_Nifti_QC_N4/I13964_T1_N4.nii.gz",
      "ptid": "094_S_0434",
      "visit": "sc",
      "acq_date": "4/20/2006",
      "phc_scan_date": "2006-04-20",
      "source": "phc",
      "question": "MRI scan (Image Data ID I13964) acquired on 4/20/2006 for a male participant (visit sc). Predict the subject's T1 scan age in years and answer with a numeric value using one decimal place.",
      "answer": "71.8",
      "answer_code": "71.8",
      "answer_units": "years",
      "demographics": {
        "sex": "male",
        "sex_code": "1",
        "visit": "sc",
        "phc_scandate": "2006-04-20",
        "image_acq_date": "4/20/2006"
      }
    },
    {
      "image_id": "I389362",
      "image_path": "ADNI_Nifti_QC_N4/I389362_T1_N4.nii.gz",
      "ptid": "006_S_4150",
      "visit": "v21",
      "acq_date": "9/10/2013",
      "phc_scan_date": "2013-09-10",
      "source": "phc",
      "question": "MRI scan (Image Data ID I389362) acquired on 9/10/2013 for a male participant (visit v21). Predict the subject's T1 scan age in years and answer with a numeric value using one decimal place.",
      "answer": "76.1",
      "answer_code": "76.1",
      "answer_units": "years",
      "demographics": {
        "sex": "male",
        "sex_code": "1",
        "visit": "v21",
        "phc_scandate": "2013-09-10",
        "image_acq_date": "9/10/2013"
      }
    },
    {
      "image_id": "I229408",
      "image_path": "ADNI_Nifti_QC_N4/I229408_T1_N4.nii.gz",
      "ptid": "094_S_2367",
      "visit": "scmri",
      "acq_date": "4/27/2011",
      "phc_scan_date": "2011-04-27",
      "source": "phc",
      "question": "MRI scan (Image Data ID I229408) acquired on 4/27/2011 for a male participant (visit scmri). Predict the subject's T1 scan age in years and answer with a numeric value using one decimal place.",
      "answer": "74.9",
      "answer_code": "74.9",
      "answer_units": "years",
      "demographics": {
        "sex": "male",
        "sex_code": "1",
        "visit": "scmri",
        "phc_scandate": "2011-04-27",
        "image_acq_date": "4/27/2011"
      }
    },
    {
      "image_id": "I313256",
      "image_path": "ADNI_Nifti_QC_N4/I313256_T1_N4.nii.gz",
      "ptid": "072_S_4394",
      "visit": "v05",
      "acq_date": "6/28/2012",
      "phc_scan_date": "2012-06-28",
      "source": "phc",
      "question": "MRI scan (Image Data ID I313256) acquired on 6/28/2012 for a female participant (visit v05). Predict the subject's T1 scan age in years and answer with a numeric value using one decimal place.",
      "answer": "76.5",
      "answer_code": "76.5",
      "answer_units": "years",
      "demographics": {
        "sex": "female",
        "sex_code": "2",
        "visit": "v05",
        "phc_scandate": "2012-06-28",
        "image_acq_date": "6/28/2012"
      }
    },
    {
      "image_id": "I351324",
      "image_path": "ADNI_Nifti_QC_N4/I351324_T1_N4.nii.gz",
      "ptid": "027_S_4757",
      "visit": "v05",
      "acq_date": "12/13/2012",
      "phc_scan_date": "2012-12-13",
      "source": "phc",
      "question": "MRI scan (Image Data ID I351324) acquired on 12/13/2012 for a female participant (visit v05). Predict the subject's T1 scan age in years and answer with a numeric value using one decimal place.",
      "answer": "63.7",
      "answer_code": "63.7",
      "answer_units": "years",
      "demographics": {
        "sex": "female",
        "sex_code": "2",
        "visit": "v05",
        "phc_scandate": "2012-12-13",
        "image_acq_date": "12/13/2012"
      }
    },
    {
      "image_id": "I60143",
      "image_path": "ADNI_Nifti_QC_N4/I60143_T1_N4.nii.gz",
      "ptid": "037_S_0501",
      "visit": "m12",
      "acq_date": "7/11/2007",
      "phc_scan_date": "2007-07-11",
      "source": "phc",
      "question": "MRI scan (Image Data ID I60143) acquired on 7/11/2007 for a male participant (visit m12). Predict the subject's T1 scan age in years and answer with a numeric value using one decimal place.",
      "answer": "79.2",
      "answer_code": "79.2",
      "answer_units": "years",
      "demographics": {
        "sex": "male",
        "sex_code": "1",
        "visit": "m12",
        "phc_scandate": "2007-07-11",
        "image_acq_date": "7/11/2007"
      }
    },
    {
      "image_id": "I260734",
      "image_path": "ADNI_Nifti_QC_N4/I260734_T1_N4.nii.gz",
      "ptid": "073_S_4300",
      "visit": "v02",
      "acq_date": "10/12/2011",
      "phc_scan_date": "2011-10-12",
      "source": "phc",
      "question": "MRI scan (Image Data ID I260734) acquired on 10/12/2011 for a female participant (visit v02). Predict the subject's T1 scan age in years and answer with a numeric value using one decimal place.",
      "answer": "80.6",
      "answer_code": "80.6",
      "answer_units": "years",
      "demographics": {
        "sex": "female",
        "sex_code": "2",
        "visit": "v02",
        "phc_scandate": "2011-10-12",
        "image_acq_date": "10/12/2011"
      }
    },
    {
      "image_id": "I415530",
      "image_path": "ADNI_Nifti_QC_N4/I415530_T1_N4.nii.gz",
      "ptid": "027_S_1045",
      "visit": "v11",
      "acq_date": "2/14/2014",
      "phc_scan_date": "2014-02-14",
      "source": "phc",
      "question": "MRI scan (Image Data ID I415530) acquired on 2/14/2014 for a female participant (visit v11). Predict the subject's T1 scan age in years and answer with a numeric value using one decimal place.",
      "answer": "90",
      "answer_code": "90",
      "answer_units": "years",
      "demographics": {
        "sex": "female",
        "sex_code": "2",
        "visit": "v11",
        "phc_scandate": "2014-02-14",
        "image_acq_date": "2/14/2014"
      }
    },
    {
      "image_id": "I273584",
      "image_path": "ADNI_Nifti_QC_N4/I273584_T1_N4.nii.gz",
      "ptid": "037_S_4410",
      "visit": "v02",
      "acq_date": "12/19/2011",
      "phc_scan_date": "2011-12-19",
      "source": "phc",
      "question": "MRI scan (Image Data ID I273584) acquired on 12/19/2011 for a female participant (visit v02). Predict the subject's T1 scan age in years and answer with a numeric value using one decimal place.",
      "answer": "69.2",
      "answer_code": "69.2",
      "answer_units": "years",
      "demographics": {
        "sex": "female",
        "sex_code": "2",
        "visit": "v02",
        "phc_scandate": "2011-12-19",
        "image_acq_date": "12/19/2011"
      }
    },
    {
      "image_id": "I48337",
      "image_path": "ADNI_Nifti_QC_N4/I48337_T1_N4.nii.gz",
      "ptid": "041_S_0549",
      "visit": "m06",
      "acq_date": "4/05/2007",
      "phc_scan_date": "2007-04-05",
      "source": "phc",
      "question": "MRI scan (Image Data ID I48337) acquired on 4/05/2007 for a male participant (visit m06). Predict the subject's T1 scan age in years and answer with a numeric value using one decimal place.",
      "answer": "69.7",
      "answer_code": "69.7",
      "answer_units": "years",
      "demographics": {
        "sex": "male",
        "sex_code": "1",
        "visit": "m06",
        "phc_scandate": "2007-04-05",
        "image_acq_date": "4/05/2007"
      }
    },
    {
      "image_id": "I288858",
      "image_path": "ADNI_Nifti_QC_N4/I288858_T1_N4.nii.gz",
      "ptid": "153_S_4159",
      "visit": "v05",
      "acq_date": "3/07/2012",
      "phc_scan_date": "2012-03-07",
      "source": "phc",
      "question": "MRI scan (Image Data ID I288858) acquired on 3/07/2012 for a female participant (visit v05). Predict the subject's T1 scan age in years and answer with a numeric value using one decimal place.",
      "answer": "71.7",
      "answer_code": "71.7",
      "answer_units": "years",
      "demographics": {
        "sex": "female",
        "sex_code": "2",
        "visit": "v05",
        "phc_scandate": "2012-03-07",
        "image_acq_date": "3/07/2012"
      }
    },
    {
      "image_id": "I98100",
      "image_path": "ADNI_Nifti_QC_N4/I98100_T1_N4.nii.gz",
      "ptid": "062_S_1299",
      "visit": "m12",
      "acq_date": "3/14/2008",
      "phc_scan_date": "2008-03-14",
      "source": "phc",
      "question": "MRI scan (Image Data ID I98100) acquired on 3/14/2008 for a male participant (visit m12). Predict the subject's T1 scan age in years and answer with a numeric value using one decimal place.",
      "answer": "72.9",
      "answer_code": "72.9",
      "answer_units": "years",
      "demographics": {
        "sex": "male",
        "sex_code": "1",
        "visit": "m12",
        "phc_scandate": "2008-03-14",
        "image_acq_date": "3/14/2008"
      }
    },
    {
      "image_id": "I437442",
      "image_path": "ADNI_Nifti_QC_N4/I437442_T1_N4.nii.gz",
      "ptid": "021_S_4857",
      "visit": "v21",
      "acq_date": "7/23/2014",
      "phc_scan_date": "2014-07-23",
      "source": "phc",
      "question": "MRI scan (Image Data ID I437442) acquired on 7/23/2014 for a male participant (visit v21). Predict the subject's T1 scan age in years and answer with a numeric value using one decimal place.",
      "answer": "70.4",
      "answer_code": "70.4",
      "answer_units": "years",
      "demographics": {
        "sex": "male",
        "sex_code": "1",
        "visit": "v21",
        "phc_scandate": "2014-07-23",
        "image_acq_date": "7/23/2014"
      }
    },
    {
      "image_id": "I37688",
      "image_path": "ADNI_Nifti_QC_N4/I37688_T1_N4.nii.gz",
      "ptid": "941_S_1203",
      "visit": "sc",
      "acq_date": "1/29/2007",
      "phc_scan_date": "2007-01-29",
      "source": "phc",
      "question": "MRI scan (Image Data ID I37688) acquired on 1/29/2007 for a male participant (visit sc). Predict the subject's T1 scan age in years and answer with a numeric value using one decimal place.",
      "answer": "83.4",
      "answer_code": "83.4",
      "answer_units": "years",
      "demographics": {
        "sex": "male",
        "sex_code": "1",
        "visit": "sc",
        "phc_scandate": "2007-01-29",
        "image_acq_date": "1/29/2007"
      }
    },
    {
      "image_id": "I581089",
      "image_path": "ADNI_Nifti_QC_N4/I581089_T1_N4.nii.gz",
      "ptid": "129_S_4287",
      "visit": "v41",
      "acq_date": "12/14/2015",
      "phc_scan_date": "2015-12-14",
      "source": "phc",
      "question": "MRI scan (Image Data ID I581089) acquired on 12/14/2015 for a female participant (visit v41). Predict the subject's T1 scan age in years and answer with a numeric value using one decimal place.",
      "answer": "75.1",
      "answer_code": "75.1",
      "answer_units": "years",
      "demographics": {
        "sex": "female",
        "sex_code": "2",
        "visit": "v41",
        "phc_scandate": "2015-12-14",
        "image_acq_date": "12/14/2015"
      }
    },
    {
      "image_id": "I11335",
      "image_path": "ADNI_Nifti_QC_N4/I11335_T1_N4.nii.gz",
      "ptid": "136_S_0186",
      "visit": "sc",
      "acq_date": "2/24/2006",
      "phc_scan_date": "2006-02-24",
      "source": "phc",
      "question": "MRI scan (Image Data ID I11335) acquired on 2/24/2006 for a female participant (visit sc). Predict the subject's T1 scan age in years and answer with a numeric value using one decimal place.",
      "answer": "80.5",
      "answer_code": "80.5",
      "answer_units": "years",
      "demographics": {
        "sex": "female",
        "sex_code": "2",
        "visit": "sc",
        "phc_scandate": "2006-02-24",
        "image_acq_date": "2/24/2006"
      }
    },
    {
      "image_id": "I431791",
      "image_path": "ADNI_Nifti_QC_N4/I431791_T1_N4.nii.gz",
      "ptid": "036_S_4538",
      "visit": "v21",
      "acq_date": "6/20/2014",
      "phc_scan_date": "2014-06-20",
      "source": "phc",
      "question": "MRI scan (Image Data ID I431791) acquired on 6/20/2014 for a female participant (visit v21). Predict the subject's T1 scan age in years and answer with a numeric value using one decimal place.",
      "answer": "81.2",
      "answer_code": "81.2",
      "answer_units": "years",
      "demographics": {
        "sex": "female",
        "sex_code": "2",
        "visit": "v21",
        "phc_scandate": "2014-06-20",
        "image_acq_date": "6/20/2014"
      }
    },
    {
      "image_id": "I25960",
      "image_path": "ADNI_Nifti_QC_N4/I25960_T1_N4.nii.gz",
      "ptid": "128_S_0947",
      "visit": "sc",
      "acq_date": "10/06/2006",
      "phc_scan_date": "2006-10-06",
      "source": "phc",
      "question": "MRI scan (Image Data ID I25960) acquired on 10/06/2006 for a female participant (visit sc). Predict the subject's T1 scan age in years and answer with a numeric value using one decimal place.",
      "answer": "82.7",
      "answer_code": "82.7",
      "answer_units": "years",
      "demographics": {
        "sex": "female",
        "sex_code": "2",
        "visit": "sc",
        "phc_scandate": "2006-10-06",
        "image_acq_date": "10/06/2006"
      }
    },
    {
      "image_id": "I489648",
      "image_path": "ADNI_Nifti_QC_N4/I489648_T1_N4.nii.gz",
      "ptid": "072_S_2072",
      "visit": "v21",
      "acq_date": "9/17/2013",
      "phc_scan_date": "2013-09-17",
      "source": "phc",
      "question": "MRI scan (Image Data ID I489648) acquired on 9/17/2013 for a male participant (visit v21). Predict the subject's T1 scan age in years and answer with a numeric value using one decimal place.",
      "answer": "75.9",
      "answer_code": "75.9",
      "answer_units": "years",
      "demographics": {
        "sex": "male",
        "sex_code": "1",
        "visit": "v21",
        "phc_scandate": "2013-09-17",
        "image_acq_date": "9/17/2013"
      }
    },
    {
      "image_id": "I380190",
      "image_path": "ADNI_Nifti_QC_N4/I380190_T1_N4.nii.gz",
      "ptid": "011_S_4827",
      "visit": "v11",
      "acq_date": "7/11/2013",
      "phc_scan_date": "2013-07-11",
      "source": "phc",
      "question": "MRI scan (Image Data ID I380190) acquired on 7/11/2013 for a male participant (visit v11). Predict the subject's T1 scan age in years and answer with a numeric value using one decimal place.",
      "answer": "72.1",
      "answer_code": "72.1",
      "answer_units": "years",
      "demographics": {
        "sex": "male",
        "sex_code": "1",
        "visit": "v11",
        "phc_scandate": "2013-07-11",
        "image_acq_date": "7/11/2013"
      }
    },
    {
      "image_id": "I9736",
      "image_path": "ADNI_Nifti_QC_N4/I9736_T1_N4.nii.gz",
      "ptid": "023_S_0084",
      "visit": "sc",
      "acq_date": "1/04/2006",
      "phc_scan_date": "2006-01-04",
      "source": "phc",
      "question": "MRI scan (Image Data ID I9736) acquired on 1/04/2006 for a female participant (visit sc). Predict the subject's T1 scan age in years and answer with a numeric value using one decimal place.",
      "answer": "75.4",
      "answer_code": "75.4",
      "answer_units": "years",
      "demographics": {
        "sex": "female",
        "sex_code": "2",
        "visit": "sc",
        "phc_scandate": "2006-01-04",
        "image_acq_date": "1/04/2006"
      }
    },
    {
      "image_id": "I390969",
      "image_path": "ADNI_Nifti_QC_N4/I390969_T1_N4.nii.gz",
      "ptid": "009_S_0751",
      "visit": "v21",
      "acq_date": "9/13/2013",
      "phc_scan_date": "2013-09-13",
      "source": "phc",
      "question": "MRI scan (Image Data ID I390969) acquired on 9/13/2013 for a male participant (visit v21). Predict the subject's T1 scan age in years and answer with a numeric value using one decimal place.",
      "answer": "78.1",
      "answer_code": "78.1",
      "answer_units": "years",
      "demographics": {
        "sex": "male",
        "sex_code": "1",
        "visit": "v21",
        "phc_scandate": "2013-09-13",
        "image_acq_date": "9/13/2013"
      }
    },
    {
      "image_id": "I323971",
      "image_path": "ADNI_Nifti_QC_N4/I323971_T1_N4.nii.gz",
      "ptid": "135_S_4722",
      "visit": "v04",
      "acq_date": "8/15/2012",
      "phc_scan_date": "2012-08-15",
      "source": "phc",
      "question": "MRI scan (Image Data ID I323971) acquired on 8/15/2012 for a female participant (visit v04). Predict the subject's T1 scan age in years and answer with a numeric value using one decimal place.",
      "answer": "68.3",
      "answer_code": "68.3",
      "answer_units": "years",
      "demographics": {
        "sex": "female",
        "sex_code": "2",
        "visit": "v04",
        "phc_scandate": "2012-08-15",
        "image_acq_date": "8/15/2012"
      }
    },
    {
      "image_id": "I241291",
      "image_path": "ADNI_Nifti_QC_N4/I241291_T1_N4.nii.gz",
      "ptid": "072_S_4063",
      "visit": "v02",
      "acq_date": "6/17/2011",
      "phc_scan_date": "2011-06-17",
      "source": "phc",
      "question": "MRI scan (Image Data ID I241291) acquired on 6/17/2011 for a female participant (visit v02). Predict the subject's T1 scan age in years and answer with a numeric value using one decimal place.",
      "answer": "59.3",
      "answer_code": "59.3",
      "answer_units": "years",
      "demographics": {
        "sex": "female",
        "sex_code": "2",
        "visit": "v02",
        "phc_scandate": "2011-06-17",
        "image_acq_date": "6/17/2011"
      }
    },
    {
      "image_id": "I57836",
      "image_path": "ADNI_Nifti_QC_N4/I57836_T1_N4.nii.gz",
      "ptid": "014_S_0557",
      "visit": "m12",
      "acq_date": "6/26/2007",
      "phc_scan_date": "2007-06-26",
      "source": "phc",
      "question": "MRI scan (Image Data ID I57836) acquired on 6/26/2007 for a male participant (visit m12). Predict the subject's T1 scan age in years and answer with a numeric value using one decimal place.",
      "answer": "73.2",
      "answer_code": "73.2",
      "answer_units": "years",
      "demographics": {
        "sex": "male",
        "sex_code": "1",
        "visit": "m12",
        "phc_scandate": "2007-06-26",
        "image_acq_date": "6/26/2007"
      }
    },
    {
      "image_id": "I115527",
      "image_path": "ADNI_Nifti_QC_N4/I115527_T1_N4.nii.gz",
      "ptid": "014_S_0658",
      "visit": "m24",
      "acq_date": "8/05/2008",
      "phc_scan_date": "2008-08-05",
      "source": "phc",
      "question": "MRI scan (Image Data ID I115527) acquired on 8/05/2008 for a male participant (visit m24). Predict the subject's T1 scan age in years and answer with a numeric value using one decimal place.",
      "answer": "74.3",
      "answer_code": "74.3",
      "answer_units": "years",
      "demographics": {
        "sex": "male",
        "sex_code": "1",
        "visit": "m24",
        "phc_scandate": "2008-08-05",
        "image_acq_date": "8/05/2008"
      }
    },
    {
      "image_id": "I351687",
      "image_path": "ADNI_Nifti_QC_N4/I351687_T1_N4.nii.gz",
      "ptid": "005_S_4707",
      "visit": "v05",
      "acq_date": "12/14/2012",
      "phc_scan_date": "2012-12-14",
      "source": "phc",
      "question": "MRI scan (Image Data ID I351687) acquired on 12/14/2012 for a male participant (visit v05). Predict the subject's T1 scan age in years and answer with a numeric value using one decimal place.",
      "answer": "68.6",
      "answer_code": "68.6",
      "answer_units": "years",
      "demographics": {
        "sex": "male",
        "sex_code": "1",
        "visit": "v05",
        "phc_scandate": "2012-12-14",
        "image_acq_date": "12/14/2012"
      }
    },
    {
      "image_id": "I322851",
      "image_path": "ADNI_Nifti_QC_N4/I322851_T1_N4.nii.gz",
      "ptid": "116_S_0382",
      "visit": "v11",
      "acq_date": "6/29/2012",
      "phc_scan_date": "2012-06-29",
      "source": "phc",
      "question": "MRI scan (Image Data ID I322851) acquired on 6/29/2012 for a female participant (visit v11). Predict the subject's T1 scan age in years and answer with a numeric value using one decimal place.",
      "answer": "81.7",
      "answer_code": "81.7",
      "answer_units": "years",
      "demographics": {
        "sex": "female",
        "sex_code": "2",
        "visit": "v11",
        "phc_scandate": "2012-06-29",
        "image_acq_date": "6/29/2012"
      }
    },
    {
      "image_id": "I42634",
      "image_path": "ADNI_Nifti_QC_N4/I42634_T1_N4.nii.gz",
      "ptid": "098_S_0171",
      "visit": "m12",
      "acq_date": "2/19/2007",
      "phc_scan_date": "2007-02-19",
      "source": "phc",
      "question": "MRI scan (Image Data ID I42634) acquired on 2/19/2007 for a female participant (visit m12). Predict the subject's T1 scan age in years and answer with a numeric value using one decimal place.",
      "answer": "79.4",
      "answer_code": "79.4",
      "answer_units": "years",
      "demographics": {
        "sex": "female",
        "sex_code": "2",
        "visit": "m12",
        "phc_scandate": "2007-02-19",
        "image_acq_date": "2/19/2007"
      }
    },
    {
      "image_id": "I473799",
      "image_path": "ADNI_Nifti_QC_N4/I473799_T1_N4.nii.gz",
      "ptid": "073_S_0089",
      "visit": "v31",
      "acq_date": "2/18/2015",
      "phc_scan_date": "2015-02-18",
      "source": "phc",
      "question": "MRI scan (Image Data ID I473799) acquired on 2/18/2015 for a male participant (visit v31). Predict the subject's T1 scan age in years and answer with a numeric value using one decimal place.",
      "answer": "74.3",
      "answer_code": "74.3",
      "answer_units": "years",
      "demographics": {
        "sex": "male",
        "sex_code": "1",
        "visit": "v31",
        "phc_scandate": "2015-02-18",
        "image_acq_date": "2/18/2015"
      }
    },
    {
      "image_id": "I69921",
      "image_path": "ADNI_Nifti_QC_N4/I69921_T1_N4.nii.gz",
      "ptid": "007_S_1206",
      "visit": "m06",
      "acq_date": "8/21/2007",
      "phc_scan_date": "2007-08-21",
      "source": "phc",
      "question": "MRI scan (Image Data ID I69921) acquired on 8/21/2007 for a male participant (visit m06). Predict the subject's T1 scan age in years and answer with a numeric value using one decimal place.",
      "answer": "73.6",
      "answer_code": "73.6",
      "answer_units": "years",
      "demographics": {
        "sex": "male",
        "sex_code": "1",
        "visit": "m06",
        "phc_scandate": "2007-08-21",
        "image_acq_date": "8/21/2007"
      }
    },
    {
      "image_id": "I416348",
      "image_path": "ADNI_Nifti_QC_N4/I416348_T1_N4.nii.gz",
      "ptid": "052_S_1352",
      "visit": "v21",
      "acq_date": "3/10/2014",
      "phc_scan_date": "2014-03-10",
      "source": "phc",
      "question": "MRI scan (Image Data ID I416348) acquired on 3/10/2014 for a male participant (visit v21). Predict the subject's T1 scan age in years and answer with a numeric value using one decimal place.",
      "answer": "93",
      "answer_code": "93",
      "answer_units": "years",
      "demographics": {
        "sex": "male",
        "sex_code": "1",
        "visit": "v21",
        "phc_scandate": "2014-03-10",
        "image_acq_date": "3/10/2014"
      }
    },
    {
      "image_id": "I337005",
      "image_path": "ADNI_Nifti_QC_N4/I337005_T1_N4.nii.gz",
      "ptid": "035_S_4582",
      "visit": "v05",
      "acq_date": "9/24/2012",
      "phc_scan_date": "2012-09-24",
      "source": "phc",
      "question": "MRI scan (Image Data ID I337005) acquired on 9/24/2012 for a female participant (visit v05). Predict the subject's T1 scan age in years and answer with a numeric value using one decimal place.",
      "answer": "67.2",
      "answer_code": "67.2",
      "answer_units": "years",
      "demographics": {
        "sex": "female",
        "sex_code": "2",
        "visit": "v05",
        "phc_scandate": "2012-09-24",
        "image_acq_date": "9/24/2012"
      }
    },
    {
      "image_id": "I505126",
      "image_path": "ADNI_Nifti_QC_N4/I505126_T1_N4.nii.gz",
      "ptid": "006_S_5153",
      "visit": "v21",
      "acq_date": "8/13/2015",
      "phc_scan_date": "2015-08-13",
      "source": "phc",
      "question": "MRI scan (Image Data ID I505126) acquired on 8/13/2015 for a male participant (visit v21). Predict the subject's T1 scan age in years and answer with a numeric value using one decimal place.",
      "answer": "81.4",
      "answer_code": "81.4",
      "answer_units": "years",
      "demographics": {
        "sex": "male",
        "sex_code": "1",
        "visit": "v21",
        "phc_scandate": "2015-08-13",
        "image_acq_date": "8/13/2015"
      }
    },
    {
      "image_id": "I244900",
      "image_path": "ADNI_Nifti_QC_N4/I244900_T1_N4.nii.gz",
      "ptid": "011_S_4120",
      "visit": "v02",
      "acq_date": "7/15/2011",
      "phc_scan_date": "2011-07-15",
      "source": "phc",
      "question": "MRI scan (Image Data ID I244900) acquired on 7/15/2011 for a female participant (visit v02). Predict the subject's T1 scan age in years and answer with a numeric value using one decimal place.",
      "answer": "81.9",
      "answer_code": "81.9",
      "answer_units": "years",
      "demographics": {
        "sex": "female",
        "sex_code": "2",
        "visit": "v02",
        "phc_scandate": "2011-07-15",
        "image_acq_date": "7/15/2011"
      }
    },
    {
      "image_id": "I28418",
      "image_path": "ADNI_Nifti_QC_N4/I28418_T1_N4.nii.gz",
      "ptid": "051_S_1040",
      "visit": "sc",
      "acq_date": "10/31/2006",
      "phc_scan_date": "2006-10-31",
      "source": "phc",
      "question": "MRI scan (Image Data ID I28418) acquired on 10/31/2006 for a male participant (visit sc). Predict the subject's T1 scan age in years and answer with a numeric value using one decimal place.",
      "answer": "71.6",
      "answer_code": "71.6",
      "answer_units": "years",
      "demographics": {
        "sex": "male",
        "sex_code": "1",
        "visit": "sc",
        "phc_scandate": "2006-10-31",
        "image_acq_date": "10/31/2006"
      }
    },
    {
      "image_id": "I310159",
      "image_path": "ADNI_Nifti_QC_N4/I310159_T1_N4.nii.gz",
      "ptid": "023_S_0331",
      "visit": "v11",
      "acq_date": "6/07/2012",
      "phc_scan_date": "2012-06-07",
      "source": "phc",
      "question": "MRI scan (Image Data ID I310159) acquired on 6/07/2012 for a female participant (visit v11). Predict the subject's T1 scan age in years and answer with a numeric value using one decimal place.",
      "answer": "70.9",
      "answer_code": "70.9",
      "answer_units": "years",
      "demographics": {
        "sex": "female",
        "sex_code": "2",
        "visit": "v11",
        "phc_scandate": "2012-06-07",
        "image_acq_date": "6/07/2012"
      }
    },
    {
      "image_id": "I282523",
      "image_path": "ADNI_Nifti_QC_N4/I282523_T1_N4.nii.gz",
      "ptid": "005_S_2390",
      "visit": "m06",
      "acq_date": "2/02/2012",
      "phc_scan_date": "2012-02-02",
      "source": "phc",
      "question": "MRI scan (Image Data ID I282523) acquired on 2/02/2012 for a female participant (visit m06). Predict the subject's T1 scan age in years and answer with a numeric value using one decimal place.",
      "answer": "88.6",
      "answer_code": "88.6",
      "answer_units": "years",
      "demographics": {
        "sex": "female",
        "sex_code": "2",
        "visit": "m06",
        "phc_scandate": "2012-02-02",
        "image_acq_date": "2/02/2012"
      }
    },
    {
      "image_id": "I17512",
      "image_path": "ADNI_Nifti_QC_N4/I17512_T1_N4.nii.gz",
      "ptid": "018_S_0406",
      "visit": "bl",
      "acq_date": "6/26/2006",
      "phc_scan_date": "2006-06-26",
      "source": "phc",
      "question": "MRI scan (Image Data ID I17512) acquired on 6/26/2006 for a male participant (visit bl). Predict the subject's T1 scan age in years and answer with a numeric value using one decimal place.",
      "answer": "78.1",
      "answer_code": "78.1",
      "answer_units": "years",
      "demographics": {
        "sex": "male",
        "sex_code": "1",
        "visit": "bl",
        "phc_scandate": "2006-06-26",
        "image_acq_date": "6/26/2006"
      }
    },
    {
      "image_id": "I240050",
      "image_path": "ADNI_Nifti_QC_N4/I240050_T1_N4.nii.gz",
      "ptid": "031_S_2233",
      "visit": "m06",
      "acq_date": "6/13/2011",
      "phc_scan_date": "2011-06-13",
      "source": "phc",
      "question": "MRI scan (Image Data ID I240050) acquired on 6/13/2011 for a female participant (visit m06). Predict the subject's T1 scan age in years and answer with a numeric value using one decimal place.",
      "answer": "56.2",
      "answer_code": "56.2",
      "answer_units": "years",
      "demographics": {
        "sex": "female",
        "sex_code": "2",
        "visit": "m06",
        "phc_scandate": "2011-06-13",
        "image_acq_date": "6/13/2011"
      }
    },
    {
      "image_id": "I394670",
      "image_path": "ADNI_Nifti_QC_N4/I394670_T1_N4.nii.gz",
      "ptid": "037_S_4214",
      "visit": "v21",
      "acq_date": "10/16/2013",
      "phc_scan_date": "2013-10-16",
      "source": "phc",
      "question": "MRI scan (Image Data ID I394670) acquired on 10/16/2013 for a male participant (visit v21). Predict the subject's T1 scan age in years and answer with a numeric value using one decimal place.",
      "answer": "76.4",
      "answer_code": "76.4",
      "answer_units": "years",
      "demographics": {
        "sex": "male",
        "sex_code": "1",
        "visit": "v21",
        "phc_scandate": "2013-10-16",
        "image_acq_date": "10/16/2013"
      }
    },
    {
      "image_id": "I401050",
      "image_path": "ADNI_Nifti_QC_N4/I401050_T1_N4.nii.gz",
      "ptid": "051_S_1072",
      "visit": "v11",
      "acq_date": "12/09/2013",
      "phc_scan_date": "2013-12-09",
      "source": "phc",
      "question": "MRI scan (Image Data ID I401050) acquired on 12/09/2013 for a female participant (visit v11). Predict the subject's T1 scan age in years and answer with a numeric value using one decimal place.",
      "answer": "67",
      "answer_code": "67",
      "answer_units": "years",
      "demographics": {
        "sex": "female",
        "sex_code": "2",
        "visit": "v11",
        "phc_scandate": "2013-12-09",
        "image_acq_date": "12/09/2013"
      }
    },
    {
      "image_id": "I368232",
      "image_path": "ADNI_Nifti_QC_N4/I368232_T1_N4.nii.gz",
      "ptid": "041_S_4629",
      "visit": "v11",
      "acq_date": "4/22/2013",
      "phc_scan_date": "2013-04-22",
      "source": "phc",
      "question": "MRI scan (Image Data ID I368232) acquired on 4/22/2013 for a male participant (visit v11). Predict the subject's T1 scan age in years and answer with a numeric value using one decimal place.",
      "answer": "71.7",
      "answer_code": "71.7",
      "answer_units": "years",
      "demographics": {
        "sex": "male",
        "sex_code": "1",
        "visit": "v11",
        "phc_scandate": "2013-04-22",
        "image_acq_date": "4/22/2013"
      }
    },
    {
      "image_id": "I367135",
      "image_path": "ADNI_Nifti_QC_N4/I367135_T1_N4.nii.gz",
      "ptid": "027_S_0116",
      "visit": "v06",
      "acq_date": "4/11/2013",
      "phc_scan_date": "2013-04-11",
      "source": "phc",
      "question": "MRI scan (Image Data ID I367135) acquired on 4/11/2013 for a male participant (visit v06). Predict the subject's T1 scan age in years and answer with a numeric value using one decimal place.",
      "answer": "85.8",
      "answer_code": "85.8",
      "answer_units": "years",
      "demographics": {
        "sex": "male",
        "sex_code": "1",
        "visit": "v06",
        "phc_scandate": "2013-04-11",
        "image_acq_date": "4/11/2013"
      }
    },
    {
      "image_id": "I378957",
      "image_path": "ADNI_Nifti_QC_N4/I378957_T1_N4.nii.gz",
      "ptid": "072_S_4769",
      "visit": "v11",
      "acq_date": "7/01/2013",
      "phc_scan_date": "2013-07-01",
      "source": "phc",
      "question": "MRI scan (Image Data ID I378957) acquired on 7/01/2013 for a female participant (visit v11). Predict the subject's T1 scan age in years and answer with a numeric value using one decimal place.",
      "answer": "59.1",
      "answer_code": "59.1",
      "answer_units": "years",
      "demographics": {
        "sex": "female",
        "sex_code": "2",
        "visit": "v11",
        "phc_scandate": "2013-07-01",
        "image_acq_date": "7/01/2013"
      }
    },
    {
      "image_id": "I166431",
      "image_path": "ADNI_Nifti_QC_N4/I166431_T1_N4.nii.gz",
      "ptid": "002_S_1280",
      "visit": "m36",
      "acq_date": "2/18/2010",
      "phc_scan_date": "2010-02-18",
      "source": "phc",
      "question": "MRI scan (Image Data ID I166431) acquired on 2/18/2010 for a female participant (visit m36). Predict the subject's T1 scan age in years and answer with a numeric value using one decimal place.",
      "answer": "73.9",
      "answer_code": "73.9",
      "answer_units": "years",
      "demographics": {
        "sex": "female",
        "sex_code": "2",
        "visit": "m36",
        "phc_scandate": "2010-02-18",
        "image_acq_date": "2/18/2010"
      }
    },
    {
      "image_id": "I26073",
      "image_path": "ADNI_Nifti_QC_N4/I26073_T1_N4.nii.gz",
      "ptid": "011_S_0016",
      "visit": "m12",
      "acq_date": "10/10/2006",
      "phc_scan_date": "2006-10-10",
      "source": "phc",
      "question": "MRI scan (Image Data ID I26073) acquired on 10/10/2006 for a male participant (visit m12). Predict the subject's T1 scan age in years and answer with a numeric value using one decimal place.",
      "answer": "66.6",
      "answer_code": "66.6",
      "answer_units": "years",
      "demographics": {
        "sex": "male",
        "sex_code": "1",
        "visit": "m12",
        "phc_scandate": "2006-10-10",
        "image_acq_date": "10/10/2006"
      }
    },
    {
      "image_id": "I124054",
      "image_path": "ADNI_Nifti_QC_N4/I124054_T1_N4.nii.gz",
      "ptid": "052_S_1352",
      "visit": "m18",
      "acq_date": "10/27/2008",
      "phc_scan_date": "2008-10-27",
      "source": "phc",
      "question": "MRI scan (Image Data ID I124054) acquired on 10/27/2008 for a male participant (visit m18). Predict the subject's T1 scan age in years and answer with a numeric value using one decimal place.",
      "answer": "87.6",
      "answer_code": "87.6",
      "answer_units": "years",
      "demographics": {
        "sex": "male",
        "sex_code": "1",
        "visit": "m18",
        "phc_scandate": "2008-10-27",
        "image_acq_date": "10/27/2008"
      }
    },
    {
      "image_id": "I316771",
      "image_path": "ADNI_Nifti_QC_N4/I316771_T1_N4.nii.gz",
      "ptid": "127_S_4843",
      "visit": "v02",
      "acq_date": "7/18/2012",
      "phc_scan_date": "2012-07-18",
      "source": "phc",
      "question": "MRI scan (Image Data ID I316771) acquired on 7/18/2012 for a female participant (visit v02). Predict the subject's T1 scan age in years and answer with a numeric value using one decimal place.",
      "answer": "73.4",
      "answer_code": "73.4",
      "answer_units": "years",
      "demographics": {
        "sex": "female",
        "sex_code": "2",
        "visit": "v02",
        "phc_scandate": "2012-07-18",
        "image_acq_date": "7/18/2012"
      }
    },
    {
      "image_id": "I601144",
      "image_path": "ADNI_Nifti_QC_N4/I601144_T1_N4.nii.gz",
      "ptid": "098_S_4275",
      "visit": "v41",
      "acq_date": "1/11/2016",
      "phc_scan_date": "2016-01-11",
      "source": "phc",
      "question": "MRI scan (Image Data ID I601144) acquired on 1/11/2016 for a male participant (visit v41). Predict the subject's T1 scan age in years and answer with a numeric value using one decimal place.",
      "answer": "77.1",
      "answer_code": "77.1",
      "answer_units": "years",
      "demographics": {
        "sex": "male",
        "sex_code": "1",
        "visit": "v41",
        "phc_scandate": "2016-01-11",
        "image_acq_date": "1/11/2016"
      }
    },
    {
      "image_id": "I282292",
      "image_path": "ADNI_Nifti_QC_N4/I282292_T1_N4.nii.gz",
      "ptid": "130_S_4468",
      "visit": "v02",
      "acq_date": "2/01/2012",
      "phc_scan_date": "2012-02-01",
      "source": "phc",
      "question": "MRI scan (Image Data ID I282292) acquired on 2/01/2012 for a female participant (visit v02). Predict the subject's T1 scan age in years and answer with a numeric value using one decimal place.",
      "answer": "62.4",
      "answer_code": "62.4",
      "answer_units": "years",
      "demographics": {
        "sex": "female",
        "sex_code": "2",
        "visit": "v02",
        "phc_scandate": "2012-02-01",
        "image_acq_date": "2/01/2012"
      }
    },
    {
      "image_id": "I225667",
      "image_path": "ADNI_Nifti_QC_N4/I225667_T1_N4.nii.gz",
      "ptid": "116_S_4010",
      "visit": "v02",
      "acq_date": "3/31/2011",
      "phc_scan_date": "2011-03-31",
      "source": "phc",
      "question": "MRI scan (Image Data ID I225667) acquired on 3/31/2011 for a female participant (visit v02). Predict the subject's T1 scan age in years and answer with a numeric value using one decimal place.",
      "answer": "70.8",
      "answer_code": "70.8",
      "answer_units": "years",
      "demographics": {
        "sex": "female",
        "sex_code": "2",
        "visit": "v02",
        "phc_scandate": "2011-03-31",
        "image_acq_date": "3/31/2011"
      }
    },
    {
      "image_id": "I29547",
      "image_path": "ADNI_Nifti_QC_N4/I29547_T1_N4.nii.gz",
      "ptid": "027_S_0417",
      "visit": "m06",
      "acq_date": "11/14/2006",
      "phc_scan_date": "2006-11-14",
      "source": "phc",
      "question": "MRI scan (Image Data ID I29547) acquired on 11/14/2006 for a male participant (visit m06). Predict the subject's T1 scan age in years and answer with a numeric value using one decimal place.",
      "answer": "80.4",
      "answer_code": "80.4",
      "answer_units": "years",
      "demographics": {
        "sex": "male",
        "sex_code": "1",
        "visit": "m06",
        "phc_scandate": "2006-11-14",
        "image_acq_date": "11/14/2006"
      }
    },
    {
      "image_id": "I336944",
      "image_path": "ADNI_Nifti_QC_N4/I336944_T1_N4.nii.gz",
      "ptid": "070_S_4793",
      "visit": "v04",
      "acq_date": "9/27/2012",
      "phc_scan_date": "2012-09-27",
      "source": "phc",
      "question": "MRI scan (Image Data ID I336944) acquired on 9/27/2012 for a male participant (visit v04). Predict the subject's T1 scan age in years and answer with a numeric value using one decimal place.",
      "answer": "85.6",
      "answer_code": "85.6",
      "answer_units": "years",
      "demographics": {
        "sex": "male",
        "sex_code": "1",
        "visit": "v04",
        "phc_scandate": "2012-09-27",
        "image_acq_date": "9/27/2012"
      }
    },
    {
      "image_id": "I364841",
      "image_path": "ADNI_Nifti_QC_N4/I364841_T1_N4.nii.gz",
      "ptid": "005_S_5119",
      "visit": "v02",
      "acq_date": "3/28/2013",
      "phc_scan_date": "2013-03-28",
      "source": "phc",
      "question": "MRI scan (Image Data ID I364841) acquired on 3/28/2013 for a female participant (visit v02). Predict the subject's T1 scan age in years and answer with a numeric value using one decimal place.",
      "answer": "77.1",
      "answer_code": "77.1",
      "answer_units": "years",
      "demographics": {
        "sex": "female",
        "sex_code": "2",
        "visit": "v02",
        "phc_scandate": "2013-03-28",
        "image_acq_date": "3/28/2013"
      }
    },
    {
      "image_id": "I266980",
      "image_path": "ADNI_Nifti_QC_N4/I266980_T1_N4.nii.gz",
      "ptid": "005_S_0553",
      "visit": "v06",
      "acq_date": "11/16/2011",
      "phc_scan_date": "2011-11-16",
      "source": "phc",
      "question": "MRI scan (Image Data ID I266980) acquired on 11/16/2011 for a male participant (visit v06). Predict the subject's T1 scan age in years and answer with a numeric value using one decimal place.",
      "answer": "90.3",
      "answer_code": "90.3",
      "answer_units": "years",
      "demographics": {
        "sex": "male",
        "sex_code": "1",
        "visit": "v06",
        "phc_scandate": "2011-11-16",
        "image_acq_date": "11/16/2011"
      }
    },
    {
      "image_id": "I71261",
      "image_path": "ADNI_Nifti_QC_N4/I71261_T1_N4.nii.gz",
      "ptid": "024_S_1307",
      "visit": "m06",
      "acq_date": "9/04/2007",
      "phc_scan_date": "2007-09-04",
      "source": "phc",
      "question": "MRI scan (Image Data ID I71261) acquired on 9/04/2007 for a female participant (visit m06). Predict the subject's T1 scan age in years and answer with a numeric value using one decimal place.",
      "answer": "75.9",
      "answer_code": "75.9",
      "answer_units": "years",
      "demographics": {
        "sex": "female",
        "sex_code": "2",
        "visit": "m06",
        "phc_scandate": "2007-09-04",
        "image_acq_date": "9/04/2007"
      }
    },
    {
      "image_id": "I385089",
      "image_path": "ADNI_Nifti_QC_N4/I385089_T1_N4.nii.gz",
      "ptid": "012_S_4128",
      "visit": "v21",
      "acq_date": "8/05/2013",
      "phc_scan_date": "2013-08-05",
      "source": "phc",
      "question": "MRI scan (Image Data ID I385089) acquired on 8/05/2013 for a female participant (visit v21). Predict the subject's T1 scan age in years and answer with a numeric value using one decimal place.",
      "answer": "75",
      "answer_code": "75",
      "answer_units": "years",
      "demographics": {
        "sex": "female",
        "sex_code": "2",
        "visit": "v21",
        "phc_scandate": "2013-08-05",
        "image_acq_date": "8/05/2013"
      }
    },
    {
      "image_id": "I475755",
      "image_path": "ADNI_Nifti_QC_N4/I475755_T1_N4.nii.gz",
      "ptid": "131_S_0123",
      "visit": "v31",
      "acq_date": "3/03/2015",
      "phc_scan_date": "2015-03-03",
      "source": "phc",
      "question": "MRI scan (Image Data ID I475755) acquired on 3/03/2015 for a male participant (visit v31). Predict the subject's T1 scan age in years and answer with a numeric value using one decimal place.",
      "answer": "82.6",
      "answer_code": "82.6",
      "answer_units": "years",
      "demographics": {
        "sex": "male",
        "sex_code": "1",
        "visit": "v31",
        "phc_scandate": "2015-03-03",
        "image_acq_date": "3/03/2015"
      }
    },
    {
      "image_id": "I36714",
      "image_path": "ADNI_Nifti_QC_N4/I36714_T1_N4.nii.gz",
      "ptid": "123_S_0072",
      "visit": "m12",
      "acq_date": "1/18/2007",
      "phc_scan_date": "2007-01-18",
      "source": "phc",
      "question": "MRI scan (Image Data ID I36714) acquired on 1/18/2007 for a male participant (visit m12). Predict the subject's T1 scan age in years and answer with a numeric value using one decimal place.",
      "answer": "71.8",
      "answer_code": "71.8",
      "answer_units": "years",
      "demographics": {
        "sex": "male",
        "sex_code": "1",
        "visit": "m12",
        "phc_scandate": "2007-01-18",
        "image_acq_date": "1/18/2007"
      }
    },
    {
      "image_id": "I256637",
      "image_path": "ADNI_Nifti_QC_N4/I256637_T1_N4.nii.gz",
      "ptid": "002_S_2043",
      "visit": "v06",
      "acq_date": "9/16/2011",
      "phc_scan_date": "2011-09-16",
      "source": "phc",
      "question": "MRI scan (Image Data ID I256637) acquired on 9/16/2011 for a female participant (visit v06). Predict the subject's T1 scan age in years and answer with a numeric value using one decimal place.",
      "answer": "73.4",
      "answer_code": "73.4",
      "answer_units": "years",
      "demographics": {
        "sex": "female",
        "sex_code": "2",
        "visit": "v06",
        "phc_scandate": "2011-09-16",
        "image_acq_date": "9/16/2011"
      }
    },
    {
      "image_id": "I352998",
      "image_path": "ADNI_Nifti_QC_N4/I352998_T1_N4.nii.gz",
      "ptid": "027_S_2219",
      "visit": "v06",
      "acq_date": "12/28/2012",
      "phc_scan_date": "2012-12-28",
      "source": "phc",
      "question": "MRI scan (Image Data ID I352998) acquired on 12/28/2012 for a male participant (visit v06). Predict the subject's T1 scan age in years and answer with a numeric value using one decimal place.",
      "answer": "76.5",
      "answer_code": "76.5",
      "answer_units": "years",
      "demographics": {
        "sex": "male",
        "sex_code": "1",
        "visit": "v06",
        "phc_scandate": "2012-12-28",
        "image_acq_date": "12/28/2012"
      }
    },
    {
      "image_id": "I73242",
      "image_path": "ADNI_Nifti_QC_N4/I73242_T1_N4.nii.gz",
      "ptid": "137_S_0158",
      "visit": "m18",
      "acq_date": "9/13/2007",
      "phc_scan_date": "2007-09-13",
      "source": "phc",
      "question": "MRI scan (Image Data ID I73242) acquired on 9/13/2007 for a female participant (visit m18). Predict the subject's T1 scan age in years and answer with a numeric value using one decimal place.",
      "answer": "82.1",
      "answer_code": "82.1",
      "answer_units": "years",
      "demographics": {
        "sex": "female",
        "sex_code": "2",
        "visit": "m18",
        "phc_scandate": "2007-09-13",
        "image_acq_date": "9/13/2007"
      }
    },
    {
      "image_id": "I621331",
      "image_path": "ADNI_Nifti_QC_N4/I621331_T1_N4.nii.gz",
      "ptid": "032_S_4386",
      "visit": "v41",
      "acq_date": "2/04/2016",
      "phc_scan_date": "2016-02-04",
      "source": "phc",
      "question": "MRI scan (Image Data ID I621331) acquired on 2/04/2016 for a female participant (visit v41). Predict the subject's T1 scan age in years and answer with a numeric value using one decimal place.",
      "answer": "89",
      "answer_code": "89",
      "answer_units": "years",
      "demographics": {
        "sex": "female",
        "sex_code": "2",
        "visit": "v41",
        "phc_scandate": "2016-02-04",
        "image_acq_date": "2/04/2016"
      }
    },
    {
      "image_id": "I378470",
      "image_path": "ADNI_Nifti_QC_N4/I378470_T1_N4.nii.gz",
      "ptid": "021_S_5236",
      "visit": "v02",
      "acq_date": "6/27/2013",
      "phc_scan_date": "2013-06-27",
      "source": "phc",
      "question": "MRI scan (Image Data ID I378470) acquired on 6/27/2013 for a male participant (visit v02). Predict the subject's T1 scan age in years and answer with a numeric value using one decimal place.",
      "answer": "85.4",
      "answer_code": "85.4",
      "answer_units": "years",
      "demographics": {
        "sex": "male",
        "sex_code": "1",
        "visit": "v02",
        "phc_scandate": "2013-06-27",
        "image_acq_date": "6/27/2013"
      }
    },
    {
      "image_id": "I55234",
      "image_path": "ADNI_Nifti_QC_N4/I55234_T1_N4.nii.gz",
      "ptid": "027_S_1045",
      "visit": "m06",
      "acq_date": "5/25/2007",
      "phc_scan_date": "2007-05-25",
      "source": "phc",
      "question": "MRI scan (Image Data ID I55234) acquired on 5/25/2007 for a female participant (visit m06). Predict the subject's T1 scan age in years and answer with a numeric value using one decimal place.",
      "answer": "83.3",
      "answer_code": "83.3",
      "answer_units": "years",
      "demographics": {
        "sex": "female",
        "sex_code": "2",
        "visit": "m06",
        "phc_scandate": "2007-05-25",
        "image_acq_date": "5/25/2007"
      }
    },
    {
      "image_id": "I432170",
      "image_path": "ADNI_Nifti_QC_N4/I432170_T1_N4.nii.gz",
      "ptid": "018_S_4809",
      "visit": "v21",
      "acq_date": "6/19/2014",
      "phc_scan_date": "2014-06-19",
      "source": "phc",
      "question": "MRI scan (Image Data ID I432170) acquired on 6/19/2014 for a male participant (visit v21). Predict the subject's T1 scan age in years and answer with a numeric value using one decimal place.",
      "answer": "80.3",
      "answer_code": "80.3",
      "answer_units": "years",
      "demographics": {
        "sex": "male",
        "sex_code": "1",
        "visit": "v21",
        "phc_scandate": "2014-06-19",
        "image_acq_date": "6/19/2014"
      }
    },
    {
      "image_id": "I373519",
      "image_path": "ADNI_Nifti_QC_N4/I373519_T1_N4.nii.gz",
      "ptid": "010_S_4442",
      "visit": "v11",
      "acq_date": "5/10/2013",
      "phc_scan_date": "2013-05-10",
      "source": "phc",
      "question": "MRI scan (Image Data ID I373519) acquired on 5/10/2013 for a female participant (visit v11). Predict the subject's T1 scan age in years and answer with a numeric value using one decimal place.",
      "answer": "75.6",
      "answer_code": "75.6",
      "answer_units": "years",
      "demographics": {
        "sex": "female",
        "sex_code": "2",
        "visit": "v11",
        "phc_scandate": "2013-05-10",
        "image_acq_date": "5/10/2013"
      }
    },
    {
      "image_id": "I415550",
      "image_path": "ADNI_Nifti_QC_N4/I415550_T1_N4.nii.gz",
      "ptid": "027_S_0074",
      "visit": "v11",
      "acq_date": "1/23/2014",
      "phc_scan_date": "2014-01-23",
      "source": "phc",
      "question": "MRI scan (Image Data ID I415550) acquired on 1/23/2014 for a male participant (visit v11). Predict the subject's T1 scan age in years and answer with a numeric value using one decimal place.",
      "answer": "86.5",
      "answer_code": "86.5",
      "answer_units": "years",
      "demographics": {
        "sex": "male",
        "sex_code": "1",
        "visit": "v11",
        "phc_scandate": "2014-01-23",
        "image_acq_date": "1/23/2014"
      }
    },
    {
      "image_id": "I314311",
      "image_path": "ADNI_Nifti_QC_N4/I314311_T1_N4.nii.gz",
      "ptid": "073_S_4762",
      "visit": "v02",
      "acq_date": "5/24/2012",
      "phc_scan_date": "2012-05-24",
      "source": "phc",
      "question": "MRI scan (Image Data ID I314311) acquired on 5/24/2012 for a male participant (visit v02). Predict the subject's T1 scan age in years and answer with a numeric value using one decimal place.",
      "answer": "73.8",
      "answer_code": "73.8",
      "answer_units": "years",
      "demographics": {
        "sex": "male",
        "sex_code": "1",
        "visit": "v02",
        "phc_scandate": "2012-05-24",
        "image_acq_date": "5/24/2012"
      }
    },
    {
      "image_id": "I8584",
      "image_path": "ADNI_Nifti_QC_N4/I8584_T1_N4.nii.gz",
      "ptid": "067_S_0056",
      "visit": "sc",
      "acq_date": "11/09/2005",
      "phc_scan_date": "2005-11-09",
      "source": "phc",
      "question": "MRI scan (Image Data ID I8584) acquired on 11/09/2005 for a female participant (visit sc). Predict the subject's T1 scan age in years and answer with a numeric value using one decimal place.",
      "answer": "69.7",
      "answer_code": "69.7",
      "answer_units": "years",
      "demographics": {
        "sex": "female",
        "sex_code": "2",
        "visit": "sc",
        "phc_scandate": "2005-11-09",
        "image_acq_date": "11/09/2005"
      }
    },
    {
      "image_id": "I10897",
      "image_path": "ADNI_Nifti_QC_N4/I10897_T1_N4.nii.gz",
      "ptid": "128_S_0188",
      "visit": "sc",
      "acq_date": "2/06/2006",
      "phc_scan_date": "2006-02-06",
      "source": "phc",
      "question": "MRI scan (Image Data ID I10897) acquired on 2/06/2006 for a male participant (visit sc). Predict the subject's T1 scan age in years and answer with a numeric value using one decimal place.",
      "answer": "86.2",
      "answer_code": "86.2",
      "answer_units": "years",
      "demographics": {
        "sex": "male",
        "sex_code": "1",
        "visit": "sc",
        "phc_scandate": "2006-02-06",
        "image_acq_date": "2/06/2006"
      }
    },
    {
      "image_id": "I340119",
      "image_path": "ADNI_Nifti_QC_N4/I340119_T1_N4.nii.gz",
      "ptid": "073_S_4311",
      "visit": "v11",
      "acq_date": "10/15/2012",
      "phc_scan_date": "2012-10-15",
      "source": "phc",
      "question": "MRI scan (Image Data ID I340119) acquired on 10/15/2012 for a female participant (visit v11). Predict the subject's T1 scan age in years and answer with a numeric value using one decimal place.",
      "answer": "73.6",
      "answer_code": "73.6",
      "answer_units": "years",
      "demographics": {
        "sex": "female",
        "sex_code": "2",
        "visit": "v11",
        "phc_scandate": "2012-10-15",
        "image_acq_date": "10/15/2012"
      }
    },
    {
      "image_id": "I303305",
      "image_path": "ADNI_Nifti_QC_N4/I303305_T1_N4.nii.gz",
      "ptid": "126_S_4514",
      "visit": "v04",
      "acq_date": "5/14/2012",
      "phc_scan_date": "2012-05-14",
      "source": "phc",
      "question": "MRI scan (Image Data ID I303305) acquired on 5/14/2012 for a female participant (visit v04). Predict the subject's T1 scan age in years and answer with a numeric value using one decimal place.",
      "answer": "68",
      "answer_code": "68",
      "answer_units": "years",
      "demographics": {
        "sex": "female",
        "sex_code": "2",
        "visit": "v04",
        "phc_scandate": "2012-05-14",
        "image_acq_date": "5/14/2012"
      }
    },
    {
      "image_id": "I275004",
      "image_path": "ADNI_Nifti_QC_N4/I275004_T1_N4.nii.gz",
      "ptid": "024_S_4084",
      "visit": "v05",
      "acq_date": "12/27/2011",
      "phc_scan_date": "2011-12-27",
      "source": "phc",
      "question": "MRI scan (Image Data ID I275004) acquired on 12/27/2011 for a female participant (visit v05). Predict the subject's T1 scan age in years and answer with a numeric value using one decimal place.",
      "answer": "69",
      "answer_code": "69",
      "answer_units": "years",
      "demographics": {
        "sex": "female",
        "sex_code": "2",
        "visit": "v05",
        "phc_scandate": "2011-12-27",
        "image_acq_date": "12/27/2011"
      }
    },
    {
      "image_id": "I117573",
      "image_path": "ADNI_Nifti_QC_N4/I117573_T1_N4.nii.gz",
      "ptid": "052_S_0671",
      "visit": "m24",
      "acq_date": "9/04/2008",
      "phc_scan_date": "2008-09-04",
      "source": "phc",
      "question": "MRI scan (Image Data ID I117573) acquired on 9/04/2008 for a female participant (visit m24). Predict the subject's T1 scan age in years and answer with a numeric value using one decimal place.",
      "answer": "63.3",
      "answer_code": "63.3",
      "answer_units": "years",
      "demographics": {
        "sex": "female",
        "sex_code": "2",
        "visit": "m24",
        "phc_scandate": "2008-09-04",
        "image_acq_date": "9/04/2008"
      }
    },
    {
      "image_id": "I454273",
      "image_path": "ADNI_Nifti_QC_N4/I454273_T1_N4.nii.gz",
      "ptid": "127_S_0925",
      "visit": "v31",
      "acq_date": "11/20/2014",
      "phc_scan_date": "2014-11-20",
      "source": "phc",
      "question": "MRI scan (Image Data ID I454273) acquired on 11/20/2014 for a male participant (visit v31). Predict the subject's T1 scan age in years and answer with a numeric value using one decimal place.",
      "answer": "82.7",
      "answer_code": "82.7",
      "answer_units": "years",
      "demographics": {
        "sex": "male",
        "sex_code": "1",
        "visit": "v31",
        "phc_scandate": "2014-11-20",
        "image_acq_date": "11/20/2014"
      }
    },
    {
      "image_id": "I226140",
      "image_path": "ADNI_Nifti_QC_N4/I226140_T1_N4.nii.gz",
      "ptid": "021_S_2100",
      "visit": "m06",
      "acq_date": "4/04/2011",
      "phc_scan_date": "2011-04-04",
      "source": "phc",
      "question": "MRI scan (Image Data ID I226140) acquired on 4/04/2011 for a female participant (visit m06). Predict the subject's T1 scan age in years and answer with a numeric value using one decimal place.",
      "answer": "88.5",
      "answer_code": "88.5",
      "answer_units": "years",
      "demographics": {
        "sex": "female",
        "sex_code": "2",
        "visit": "m06",
        "phc_scandate": "2011-04-04",
        "image_acq_date": "4/04/2011"
      }
    },
    {
      "image_id": "I297480",
      "image_path": "ADNI_Nifti_QC_N4/I297480_T1_N4.nii.gz",
      "ptid": "137_S_4672",
      "visit": "v02",
      "acq_date": "4/16/2012",
      "phc_scan_date": "2012-04-16",
      "source": "phc",
      "question": "MRI scan (Image Data ID I297480) acquired on 4/16/2012 for a male participant (visit v02). Predict the subject's T1 scan age in years and answer with a numeric value using one decimal place.",
      "answer": "66.9",
      "answer_code": "66.9",
      "answer_units": "years",
      "demographics": {
        "sex": "male",
        "sex_code": "1",
        "visit": "v02",
        "phc_scandate": "2012-04-16",
        "image_acq_date": "4/16/2012"
      }
    },
    {
      "image_id": "I17168",
      "image_path": "ADNI_Nifti_QC_N4/I17168_T1_N4.nii.gz",
      "ptid": "018_S_0425",
      "visit": "bl",
      "acq_date": "6/19/2006",
      "phc_scan_date": "2006-06-19",
      "source": "phc",
      "question": "MRI scan (Image Data ID I17168) acquired on 6/19/2006 for a male participant (visit bl). Predict the subject's T1 scan age in years and answer with a numeric value using one decimal place.",
      "answer": "86",
      "answer_code": "86",
      "answer_units": "years",
      "demographics": {
        "sex": "male",
        "sex_code": "1",
        "visit": "bl",
        "phc_scandate": "2006-06-19",
        "image_acq_date": "6/19/2006"
      }
    },
    {
      "image_id": "I167090",
      "image_path": "ADNI_Nifti_QC_N4/I167090_T1_N4.nii.gz",
      "ptid": "116_S_0752",
      "visit": "m36",
      "acq_date": "9/03/2009",
      "phc_scan_date": "2009-09-03",
      "source": "phc",
      "question": "MRI scan (Image Data ID I167090) acquired on 9/03/2009 for a female participant (visit m36). Predict the subject's T1 scan age in years and answer with a numeric value using one decimal place.",
      "answer": "85.1",
      "answer_code": "85.1",
      "answer_units": "years",
      "demographics": {
        "sex": "female",
        "sex_code": "2",
        "visit": "m36",
        "phc_scandate": "2009-09-03",
        "image_acq_date": "9/03/2009"
      }
    },
    {
      "image_id": "I12242",
      "image_path": "ADNI_Nifti_QC_N4/I12242_T1_N4.nii.gz",
      "ptid": "128_S_0245",
      "visit": "sc",
      "acq_date": "3/21/2006",
      "phc_scan_date": "2006-03-21",
      "source": "phc",
      "question": "MRI scan (Image Data ID I12242) acquired on 3/21/2006 for a female participant (visit sc). Predict the subject's T1 scan age in years and answer with a numeric value using one decimal place.",
      "answer": "73.9",
      "answer_code": "73.9",
      "answer_units": "years",
      "demographics": {
        "sex": "female",
        "sex_code": "2",
        "visit": "sc",
        "phc_scandate": "2006-03-21",
        "image_acq_date": "3/21/2006"
      }
    },
    {
      "image_id": "I255956",
      "image_path": "ADNI_Nifti_QC_N4/I255956_T1_N4.nii.gz",
      "ptid": "067_S_2304",
      "visit": "m06",
      "acq_date": "9/14/2011",
      "phc_scan_date": "2011-09-14",
      "source": "phc",
      "question": "MRI scan (Image Data ID I255956) acquired on 9/14/2011 for a male participant (visit m06). Predict the subject's T1 scan age in years and answer with a numeric value using one decimal place.",
      "answer": "62",
      "answer_code": "62",
      "answer_units": "years",
      "demographics": {
        "sex": "male",
        "sex_code": "1",
        "visit": "m06",
        "phc_scandate": "2011-09-14",
        "image_acq_date": "9/14/2011"
      }
    },
    {
      "image_id": "I269543",
      "image_path": "ADNI_Nifti_QC_N4/I269543_T1_N4.nii.gz",
      "ptid": "127_S_2213",
      "visit": "v06",
      "acq_date": "12/01/2011",
      "phc_scan_date": "2011-12-01",
      "source": "phc",
      "question": "MRI scan (Image Data ID I269543) acquired on 12/01/2011 for a female participant (visit v06). Predict the subject's T1 scan age in years and answer with a numeric value using one decimal place.",
      "answer": "83.4",
      "answer_code": "83.4",
      "answer_units": "years",
      "demographics": {
        "sex": "female",
        "sex_code": "2",
        "visit": "v06",
        "phc_scandate": "2011-12-01",
        "image_acq_date": "12/01/2011"
      }
    },
    {
      "image_id": "I444303",
      "image_path": "ADNI_Nifti_QC_N4/I444303_T1_N4.nii.gz",
      "ptid": "011_S_4893",
      "visit": "v21",
      "acq_date": "9/17/2014",
      "phc_scan_date": "2014-09-17",
      "source": "phc",
      "question": "MRI scan (Image Data ID I444303) acquired on 9/17/2014 for a female participant (visit v21). Predict the subject's T1 scan age in years and answer with a numeric value using one decimal place.",
      "answer": "70.3",
      "answer_code": "70.3",
      "answer_units": "years",
      "demographics": {
        "sex": "female",
        "sex_code": "2",
        "visit": "v21",
        "phc_scandate": "2014-09-17",
        "image_acq_date": "9/17/2014"
      }
    },
    {
      "image_id": "I265154",
      "image_path": "ADNI_Nifti_QC_N4/I265154_T1_N4.nii.gz",
      "ptid": "153_S_4159",
      "visit": "v04",
      "acq_date": "11/08/2011",
      "phc_scan_date": "2011-11-08",
      "source": "phc",
      "question": "MRI scan (Image Data ID I265154) acquired on 11/08/2011 for a female participant (visit v04). Predict the subject's T1 scan age in years and answer with a numeric value using one decimal place.",
      "answer": "71.4",
      "answer_code": "71.4",
      "answer_units": "years",
      "demographics": {
        "sex": "female",
        "sex_code": "2",
        "visit": "v04",
        "phc_scandate": "2011-11-08",
        "image_acq_date": "11/08/2011"
      }
    },
    {
      "image_id": "I273504",
      "image_path": "ADNI_Nifti_QC_N4/I273504_T1_N4.nii.gz",
      "ptid": "018_S_4400",
      "visit": "v02",
      "acq_date": "12/20/2011",
      "phc_scan_date": "2011-12-20",
      "source": "phc",
      "question": "MRI scan (Image Data ID I273504) acquired on 12/20/2011 for a male participant (visit v02). Predict the subject's T1 scan age in years and answer with a numeric value using one decimal place.",
      "answer": "71.2",
      "answer_code": "71.2",
      "answer_units": "years",
      "demographics": {
        "sex": "male",
        "sex_code": "1",
        "visit": "v02",
        "phc_scandate": "2011-12-20",
        "image_acq_date": "12/20/2011"
      }
    },
    {
      "image_id": "I258840",
      "image_path": "ADNI_Nifti_QC_N4/I258840_T1_N4.nii.gz",
      "ptid": "126_S_2405",
      "visit": "scmri",
      "acq_date": "9/29/2011",
      "phc_scan_date": "2011-09-29",
      "source": "phc",
      "question": "MRI scan (Image Data ID I258840) acquired on 9/29/2011 for a female participant (visit scmri). Predict the subject's T1 scan age in years and answer with a numeric value using one decimal place.",
      "answer": "71.7",
      "answer_code": "71.7",
      "answer_units": "years",
      "demographics": {
        "sex": "female",
        "sex_code": "2",
        "visit": "scmri",
        "phc_scandate": "2011-09-29",
        "image_acq_date": "9/29/2011"
      }
    },
    {
      "image_id": "I350951",
      "image_path": "ADNI_Nifti_QC_N4/I350951_T1_N4.nii.gz",
      "ptid": "011_S_4949",
      "visit": "v04",
      "acq_date": "12/11/2012",
      "phc_scan_date": "2012-12-11",
      "source": "phc",
      "question": "MRI scan (Image Data ID I350951) acquired on 12/11/2012 for a female participant (visit v04). Predict the subject's T1 scan age in years and answer with a numeric value using one decimal place.",
      "answer": "78.4",
      "answer_code": "78.4",
      "answer_units": "years",
      "demographics": {
        "sex": "female",
        "sex_code": "2",
        "visit": "v04",
        "phc_scandate": "2012-12-11",
        "image_acq_date": "12/11/2012"
      }
    },
    {
      "image_id": "I12280",
      "image_path": "ADNI_Nifti_QC_N4/I12280_T1_N4.nii.gz",
      "ptid": "022_S_0219",
      "visit": "sc",
      "acq_date": "3/17/2006",
      "phc_scan_date": "2006-03-17",
      "source": "phc",
      "question": "MRI scan (Image Data ID I12280) acquired on 3/17/2006 for a male participant (visit sc). Predict the subject's T1 scan age in years and answer with a numeric value using one decimal place.",
      "answer": "74.6",
      "answer_code": "74.6",
      "answer_units": "years",
      "demographics": {
        "sex": "male",
        "sex_code": "1",
        "visit": "sc",
        "phc_scandate": "2006-03-17",
        "image_acq_date": "3/17/2006"
      }
    },
    {
      "image_id": "I279130",
      "image_path": "ADNI_Nifti_QC_N4/I279130_T1_N4.nii.gz",
      "ptid": "141_S_4456",
      "visit": "v02",
      "acq_date": "1/17/2012",
      "phc_scan_date": "2012-01-17",
      "source": "phc",
      "question": "MRI scan (Image Data ID I279130) acquired on 1/17/2012 for a male participant (visit v02). Predict the subject's T1 scan age in years and answer with a numeric value using one decimal place.",
      "answer": "77.6",
      "answer_code": "77.6",
      "answer_units": "years",
      "demographics": {
        "sex": "male",
        "sex_code": "1",
        "visit": "v02",
        "phc_scandate": "2012-01-17",
        "image_acq_date": "1/17/2012"
      }
    },
    {
      "image_id": "I380956",
      "image_path": "ADNI_Nifti_QC_N4/I380956_T1_N4.nii.gz",
      "ptid": "027_S_4802",
      "visit": "v11",
      "acq_date": "7/16/2013",
      "phc_scan_date": "2013-07-16",
      "source": "phc",
      "question": "MRI scan (Image Data ID I380956) acquired on 7/16/2013 for a male participant (visit v11). Predict the subject's T1 scan age in years and answer with a numeric value using one decimal place.",
      "answer": "84.3",
      "answer_code": "84.3",
      "answer_units": "years",
      "demographics": {
        "sex": "male",
        "sex_code": "1",
        "visit": "v11",
        "phc_scandate": "2013-07-16",
        "image_acq_date": "7/16/2013"
      }
    },
    {
      "image_id": "I364733",
      "image_path": "ADNI_Nifti_QC_N4/I364733_T1_N4.nii.gz",
      "ptid": "023_S_4502",
      "visit": "v11",
      "acq_date": "3/28/2013",
      "phc_scan_date": "2013-03-28",
      "source": "phc",
      "question": "MRI scan (Image Data ID I364733) acquired on 3/28/2013 for a female participant (visit v11). Predict the subject's T1 scan age in years and answer with a numeric value using one decimal place.",
      "answer": "59.7",
      "answer_code": "59.7",
      "answer_units": "years",
      "demographics": {
        "sex": "female",
        "sex_code": "2",
        "visit": "v11",
        "phc_scandate": "2013-03-28",
        "image_acq_date": "3/28/2013"
      }
    },
    {
      "image_id": "I84563",
      "image_path": "ADNI_Nifti_QC_N4/I84563_T1_N4.nii.gz",
      "ptid": "041_S_1002",
      "visit": "m12",
      "acq_date": "12/11/2007",
      "phc_scan_date": "2007-12-11",
      "source": "phc",
      "question": "MRI scan (Image Data ID I84563) acquired on 12/11/2007 for a female participant (visit m12). Predict the subject's T1 scan age in years and answer with a numeric value using one decimal place.",
      "answer": "77.5",
      "answer_code": "77.5",
      "answer_units": "years",
      "demographics": {
        "sex": "female",
        "sex_code": "2",
        "visit": "m12",
        "phc_scandate": "2007-12-11",
        "image_acq_date": "12/11/2007"
      }
    },
    {
      "image_id": "I306536",
      "image_path": "ADNI_Nifti_QC_N4/I306536_T1_N4.nii.gz",
      "ptid": "116_S_4338",
      "visit": "v05",
      "acq_date": "5/25/2012",
      "phc_scan_date": "2012-05-25",
      "source": "phc",
      "question": "MRI scan (Image Data ID I306536) acquired on 5/25/2012 for a male participant (visit v05). Predict the subject's T1 scan age in years and answer with a numeric value using one decimal place.",
      "answer": "81.2",
      "answer_code": "81.2",
      "answer_units": "years",
      "demographics": {
        "sex": "male",
        "sex_code": "1",
        "visit": "v05",
        "phc_scandate": "2012-05-25",
        "image_acq_date": "5/25/2012"
      }
    },
    {
      "image_id": "I11281",
      "image_path": "ADNI_Nifti_QC_N4/I11281_T1_N4.nii.gz",
      "ptid": "032_S_0214",
      "visit": "sc",
      "acq_date": "2/20/2006",
      "phc_scan_date": "2006-02-20",
      "source": "phc",
      "question": "MRI scan (Image Data ID I11281) acquired on 2/20/2006 for a male participant (visit sc). Predict the subject's T1 scan age in years and answer with a numeric value using one decimal place.",
      "answer": "65.2",
      "answer_code": "65.2",
      "answer_units": "years",
      "demographics": {
        "sex": "male",
        "sex_code": "1",
        "visit": "sc",
        "phc_scandate": "2006-02-20",
        "image_acq_date": "2/20/2006"
      }
    },
    {
      "image_id": "I285589",
      "image_path": "ADNI_Nifti_QC_N4/I285589_T1_N4.nii.gz",
      "ptid": "029_S_4385",
      "visit": "v02",
      "acq_date": "2/15/2012",
      "phc_scan_date": "2012-02-15",
      "source": "phc",
      "question": "MRI scan (Image Data ID I285589) acquired on 2/15/2012 for a female participant (visit v02). Predict the subject's T1 scan age in years and answer with a numeric value using one decimal place.",
      "answer": "68.4",
      "answer_code": "68.4",
      "answer_units": "years",
      "demographics": {
        "sex": "female",
        "sex_code": "2",
        "visit": "v02",
        "phc_scandate": "2012-02-15",
        "image_acq_date": "2/15/2012"
      }
    },
    {
      "image_id": "I372101",
      "image_path": "ADNI_Nifti_QC_N4/I372101_T1_N4.nii.gz",
      "ptid": "137_S_4623",
      "visit": "v11",
      "acq_date": "5/13/2013",
      "phc_scan_date": "2013-05-13",
      "source": "phc",
      "question": "MRI scan (Image Data ID I372101) acquired on 5/13/2013 for a female participant (visit v11). Predict the subject's T1 scan age in years and answer with a numeric value using one decimal place.",
      "answer": "62.3",
      "answer_code": "62.3",
      "answer_units": "years",
      "demographics": {
        "sex": "female",
        "sex_code": "2",
        "visit": "v11",
        "phc_scandate": "2013-05-13",
        "image_acq_date": "5/13/2013"
      }
    },
    {
      "image_id": "I775622",
      "image_path": "ADNI_Nifti_QC_N4/I775622_T1_N4.nii.gz",
      "ptid": "127_S_4197",
      "visit": "v51",
      "acq_date": "9/13/2016",
      "phc_scan_date": "2016-09-13",
      "source": "phc",
      "question": "MRI scan (Image Data ID I775622) acquired on 9/13/2016 for a male participant (visit v51). Predict the subject's T1 scan age in years and answer with a numeric value using one decimal place.",
      "answer": "84.5",
      "answer_code": "84.5",
      "answer_units": "years",
      "demographics": {
        "sex": "male",
        "sex_code": "1",
        "visit": "v51",
        "phc_scandate": "2016-09-13",
        "image_acq_date": "9/13/2016"
      }
    },
    {
      "image_id": "I57238",
      "image_path": "ADNI_Nifti_QC_N4/I57238_T1_N4.nii.gz",
      "ptid": "037_S_0377",
      "visit": "m12",
      "acq_date": "6/18/2007",
      "phc_scan_date": "2007-06-18",
      "source": "phc",
      "question": "MRI scan (Image Data ID I57238) acquired on 6/18/2007 for a male participant (visit m12). Predict the subject's T1 scan age in years and answer with a numeric value using one decimal place.",
      "answer": "80.6",
      "answer_code": "80.6",
      "answer_units": "years",
      "demographics": {
        "sex": "male",
        "sex_code": "1",
        "visit": "m12",
        "phc_scandate": "2007-06-18",
        "image_acq_date": "6/18/2007"
      }
    },
    {
      "image_id": "I305151",
      "image_path": "ADNI_Nifti_QC_N4/I305151_T1_N4.nii.gz",
      "ptid": "031_S_4032",
      "visit": "v11",
      "acq_date": "5/17/2012",
      "phc_scan_date": "2012-05-17",
      "source": "phc",
      "question": "MRI scan (Image Data ID I305151) acquired on 5/17/2012 for a female participant (visit v11). Predict the subject's T1 scan age in years and answer with a numeric value using one decimal place.",
      "answer": "71.3",
      "answer_code": "71.3",
      "answer_units": "years",
      "demographics": {
        "sex": "female",
        "sex_code": "2",
        "visit": "v11",
        "phc_scandate": "2012-05-17",
        "image_acq_date": "5/17/2012"
      }
    },
    {
      "image_id": "I108117",
      "image_path": "ADNI_Nifti_QC_N4/I108117_T1_N4.nii.gz",
      "ptid": "067_S_0290",
      "visit": "m24",
      "acq_date": "6/02/2008",
      "phc_scan_date": "2008-06-02",
      "source": "phc",
      "question": "MRI scan (Image Data ID I108117) acquired on 6/02/2008 for a male participant (visit m24). Predict the subject's T1 scan age in years and answer with a numeric value using one decimal place.",
      "answer": "77.5",
      "answer_code": "77.5",
      "answer_units": "years",
      "demographics": {
        "sex": "male",
        "sex_code": "1",
        "visit": "m24",
        "phc_scandate": "2008-06-02",
        "image_acq_date": "6/02/2008"
      }
    },
    {
      "image_id": "I354551",
      "image_path": "ADNI_Nifti_QC_N4/I354551_T1_N4.nii.gz",
      "ptid": "070_S_4793",
      "visit": "v05",
      "acq_date": "1/10/2013",
      "phc_scan_date": "2013-01-10",
      "source": "phc",
      "question": "MRI scan (Image Data ID I354551) acquired on 1/10/2013 for a male participant (visit v05). Predict the subject's T1 scan age in years and answer with a numeric value using one decimal place.",
      "answer": "85.9",
      "answer_code": "85.9",
      "answer_units": "years",
      "demographics": {
        "sex": "male",
        "sex_code": "1",
        "visit": "v05",
        "phc_scandate": "2013-01-10",
        "image_acq_date": "1/10/2013"
      }
    },
    {
      "image_id": "I316060",
      "image_path": "ADNI_Nifti_QC_N4/I316060_T1_N4.nii.gz",
      "ptid": "135_S_4657",
      "visit": "v04",
      "acq_date": "7/12/2012",
      "phc_scan_date": "2012-07-12",
      "source": "phc",
      "question": "MRI scan (Image Data ID I316060) acquired on 7/12/2012 for a female participant (visit v04). Predict the subject's T1 scan age in years and answer with a numeric value using one decimal place.",
      "answer": "71.9",
      "answer_code": "71.9",
      "answer_units": "years",
      "demographics": {
        "sex": "female",
        "sex_code": "2",
        "visit": "v04",
        "phc_scandate": "2012-07-12",
        "image_acq_date": "7/12/2012"
      }
    },
    {
      "image_id": "I40525",
      "image_path": "ADNI_Nifti_QC_N4/I40525_T1_N4.nii.gz",
      "ptid": "033_S_0733",
      "visit": "m06",
      "acq_date": "2/09/2007",
      "phc_scan_date": "2007-02-09",
      "source": "phc",
      "question": "MRI scan (Image Data ID I40525) acquired on 2/09/2007 for a female participant (visit m06). Predict the subject's T1 scan age in years and answer with a numeric value using one decimal place.",
      "answer": "57.8",
      "answer_code": "57.8",
      "answer_units": "years",
      "demographics": {
        "sex": "female",
        "sex_code": "2",
        "visit": "m06",
        "phc_scandate": "2007-02-09",
        "image_acq_date": "2/09/2007"
      }
    },
    {
      "image_id": "I131874",
      "image_path": "ADNI_Nifti_QC_N4/I131874_T1_N4.nii.gz",
      "ptid": "073_S_0909",
      "visit": "m24",
      "acq_date": "12/17/2008",
      "phc_scan_date": "2008-12-17",
      "source": "phc",
      "question": "MRI scan (Image Data ID I131874) acquired on 12/17/2008 for a female participant (visit m24). Predict the subject's T1 scan age in years and answer with a numeric value using one decimal place.",
      "answer": "71.5",
      "answer_code": "71.5",
      "answer_units": "years",
      "demographics": {
        "sex": "female",
        "sex_code": "2",
        "visit": "m24",
        "phc_scandate": "2008-12-17",
        "image_acq_date": "12/17/2008"
      }
    },
    {
      "image_id": "I24028",
      "image_path": "ADNI_Nifti_QC_N4/I24028_T1_N4.nii.gz",
      "ptid": "109_S_0777",
      "visit": "sc",
      "acq_date": "9/07/2006",
      "phc_scan_date": "2006-09-07",
      "source": "phc",
      "question": "MRI scan (Image Data ID I24028) acquired on 9/07/2006 for a female participant (visit sc). Predict the subject's T1 scan age in years and answer with a numeric value using one decimal place.",
      "answer": "75.3",
      "answer_code": "75.3",
      "answer_units": "years",
      "demographics": {
        "sex": "female",
        "sex_code": "2",
        "visit": "sc",
        "phc_scandate": "2006-09-07",
        "image_acq_date": "9/07/2006"
      }
    },
    {
      "image_id": "I317195",
      "image_path": "ADNI_Nifti_QC_N4/I317195_T1_N4.nii.gz",
      "ptid": "027_S_4802",
      "visit": "v02",
      "acq_date": "7/22/2012",
      "phc_scan_date": "2012-07-22",
      "source": "phc",
      "question": "MRI scan (Image Data ID I317195) acquired on 7/22/2012 for a male participant (visit v02). Predict the subject's T1 scan age in years and answer with a numeric value using one decimal place.",
      "answer": "83.4",
      "answer_code": "83.4",
      "answer_units": "years",
      "demographics": {
        "sex": "male",
        "sex_code": "1",
        "visit": "v02",
        "phc_scandate": "2012-07-22",
        "image_acq_date": "7/22/2012"
      }
    },
    {
      "image_id": "I275399",
      "image_path": "ADNI_Nifti_QC_N4/I275399_T1_N4.nii.gz",
      "ptid": "023_S_0042",
      "visit": "v11",
      "acq_date": "11/30/2011",
      "phc_scan_date": "2011-11-30",
      "source": "phc",
      "question": "MRI scan (Image Data ID I275399) acquired on 11/30/2011 for a male participant (visit v11). Predict the subject's T1 scan age in years and answer with a numeric value using one decimal place.",
      "answer": "79",
      "answer_code": "79",
      "answer_units": "years",
      "demographics": {
        "sex": "male",
        "sex_code": "1",
        "visit": "v11",
        "phc_scandate": "2011-11-30",
        "image_acq_date": "11/30/2011"
      }
    },
    {
      "image_id": "I55704",
      "image_path": "ADNI_Nifti_QC_N4/I55704_T1_N4.nii.gz",
      "ptid": "116_S_1083",
      "visit": "m06",
      "acq_date": "5/25/2007",
      "phc_scan_date": "2007-05-25",
      "source": "phc",
      "question": "MRI scan (Image Data ID I55704) acquired on 5/25/2007 for a female participant (visit m06). Predict the subject's T1 scan age in years and answer with a numeric value using one decimal place.",
      "answer": "72.5",
      "answer_code": "72.5",
      "answer_units": "years",
      "demographics": {
        "sex": "female",
        "sex_code": "2",
        "visit": "m06",
        "phc_scandate": "2007-05-25",
        "image_acq_date": "5/25/2007"
      }
    },
    {
      "image_id": "I87403",
      "image_path": "ADNI_Nifti_QC_N4/I87403_T1_N4.nii.gz",
      "ptid": "131_S_0384",
      "visit": "m18",
      "acq_date": "1/15/2008",
      "phc_scan_date": "2008-01-15",
      "source": "phc",
      "question": "MRI scan (Image Data ID I87403) acquired on 1/15/2008 for a male participant (visit m18). Predict the subject's T1 scan age in years and answer with a numeric value using one decimal place.",
      "answer": "81.7",
      "answer_code": "81.7",
      "answer_units": "years",
      "demographics": {
        "sex": "male",
        "sex_code": "1",
        "visit": "m18",
        "phc_scandate": "2008-01-15",
        "image_acq_date": "1/15/2008"
      }
    },
    {
      "image_id": "I271932",
      "image_path": "ADNI_Nifti_QC_N4/I271932_T1_N4.nii.gz",
      "ptid": "021_S_4402",
      "visit": "v02",
      "acq_date": "12/14/2011",
      "phc_scan_date": "2011-12-14",
      "source": "phc",
      "question": "MRI scan (Image Data ID I271932) acquired on 12/14/2011 for a female participant (visit v02). Predict the subject's T1 scan age in years and answer with a numeric value using one decimal place.",
      "answer": "73",
      "answer_code": "73",
      "answer_units": "years",
      "demographics": {
        "sex": "female",
        "sex_code": "2",
        "visit": "v02",
        "phc_scandate": "2011-12-14",
        "image_acq_date": "12/14/2011"
      }
    },
    {
      "image_id": "I243832",
      "image_path": "ADNI_Nifti_QC_N4/I243832_T1_N4.nii.gz",
      "ptid": "027_S_0644",
      "visit": "m60",
      "acq_date": "7/07/2011",
      "phc_scan_date": "2011-07-07",
      "source": "phc",
      "question": "MRI scan (Image Data ID I243832) acquired on 7/07/2011 for a male participant (visit m60). Predict the subject's T1 scan age in years and answer with a numeric value using one decimal place.",
      "answer": "80.2",
      "answer_code": "80.2",
      "answer_units": "years",
      "demographics": {
        "sex": "male",
        "sex_code": "1",
        "visit": "m60",
        "phc_scandate": "2011-07-07",
        "image_acq_date": "7/07/2011"
      }
    },
    {
      "image_id": "I424035",
      "image_path": "ADNI_Nifti_QC_N4/I424035_T1_N4.nii.gz",
      "ptid": "009_S_4612",
      "visit": "v21",
      "acq_date": "4/30/2014",
      "phc_scan_date": "2014-04-30",
      "source": "phc",
      "question": "MRI scan (Image Data ID I424035) acquired on 4/30/2014 for a female participant (visit v21). Predict the subject's T1 scan age in years and answer with a numeric value using one decimal place.",
      "answer": "70.6",
      "answer_code": "70.6",
      "answer_units": "years",
      "demographics": {
        "sex": "female",
        "sex_code": "2",
        "visit": "v21",
        "phc_scandate": "2014-04-30",
        "image_acq_date": "4/30/2014"
      }
    },
    {
      "image_id": "I296647",
      "image_path": "ADNI_Nifti_QC_N4/I296647_T1_N4.nii.gz",
      "ptid": "002_S_4229",
      "visit": "v05",
      "acq_date": "4/10/2012",
      "phc_scan_date": "2012-04-10",
      "source": "phc",
      "question": "MRI scan (Image Data ID I296647) acquired on 4/10/2012 for a male participant (visit v05). Predict the subject's T1 scan age in years and answer with a numeric value using one decimal place.",
      "answer": "67",
      "answer_code": "67",
      "answer_units": "years",
      "demographics": {
        "sex": "male",
        "sex_code": "1",
        "visit": "v05",
        "phc_scandate": "2012-04-10",
        "image_acq_date": "4/10/2012"
      }
    },
    {
      "image_id": "I101894",
      "image_path": "ADNI_Nifti_QC_N4/I101894_T1_N4.nii.gz",
      "ptid": "041_S_0262",
      "visit": "m24",
      "acq_date": "4/09/2008",
      "phc_scan_date": "2008-04-09",
      "source": "phc",
      "question": "MRI scan (Image Data ID I101894) acquired on 4/09/2008 for a male participant (visit m24). Predict the subject's T1 scan age in years and answer with a numeric value using one decimal place.",
      "answer": "88",
      "answer_code": "88",
      "answer_units": "years",
      "demographics": {
        "sex": "male",
        "sex_code": "1",
        "visit": "m24",
        "phc_scandate": "2008-04-09",
        "image_acq_date": "4/09/2008"
      }
    },
    {
      "image_id": "I103267",
      "image_path": "ADNI_Nifti_QC_N4/I103267_T1_N4.nii.gz",
      "ptid": "052_S_1352",
      "visit": "m12",
      "acq_date": "4/21/2008",
      "phc_scan_date": "2008-04-21",
      "source": "phc",
      "question": "MRI scan (Image Data ID I103267) acquired on 4/21/2008 for a male participant (visit m12). Predict the subject's T1 scan age in years and answer with a numeric value using one decimal place.",
      "answer": "87.1",
      "answer_code": "87.1",
      "answer_units": "years",
      "demographics": {
        "sex": "male",
        "sex_code": "1",
        "visit": "m12",
        "phc_scandate": "2008-04-21",
        "image_acq_date": "4/21/2008"
      }
    },
    {
      "image_id": "I257018",
      "image_path": "ADNI_Nifti_QC_N4/I257018_T1_N4.nii.gz",
      "ptid": "123_S_2055",
      "visit": "v06",
      "acq_date": "9/20/2011",
      "phc_scan_date": "2011-09-20",
      "source": "phc",
      "question": "MRI scan (Image Data ID I257018) acquired on 9/20/2011 for a male participant (visit v06). Predict the subject's T1 scan age in years and answer with a numeric value using one decimal place.",
      "answer": "76.4",
      "answer_code": "76.4",
      "answer_units": "years",
      "demographics": {
        "sex": "male",
        "sex_code": "1",
        "visit": "v06",
        "phc_scandate": "2011-09-20",
        "image_acq_date": "9/20/2011"
      }
    },
    {
      "image_id": "I16051",
      "image_path": "ADNI_Nifti_QC_N4/I16051_T1_N4.nii.gz",
      "ptid": "099_S_0533",
      "visit": "sc",
      "acq_date": "5/25/2006",
      "phc_scan_date": "2006-05-25",
      "source": "phc",
      "question": "MRI scan (Image Data ID I16051) acquired on 5/25/2006 for a female participant (visit sc). Predict the subject's T1 scan age in years and answer with a numeric value using one decimal place.",
      "answer": "81.1",
      "answer_code": "81.1",
      "answer_units": "years",
      "demographics": {
        "sex": "female",
        "sex_code": "2",
        "visit": "sc",
        "phc_scandate": "2006-05-25",
        "image_acq_date": "5/25/2006"
      }
    },
    {
      "image_id": "I378395",
      "image_path": "ADNI_Nifti_QC_N4/I378395_T1_N4.nii.gz",
      "ptid": "041_S_5131",
      "visit": "v04",
      "acq_date": "6/26/2013",
      "phc_scan_date": "2013-06-26",
      "source": "phc",
      "question": "MRI scan (Image Data ID I378395) acquired on 6/26/2013 for a male participant (visit v04). Predict the subject's T1 scan age in years and answer with a numeric value using one decimal place.",
      "answer": "70.8",
      "answer_code": "70.8",
      "answer_units": "years",
      "demographics": {
        "sex": "male",
        "sex_code": "1",
        "visit": "v04",
        "phc_scandate": "2013-06-26",
        "image_acq_date": "6/26/2013"
      }
    },
    {
      "image_id": "I304600",
      "image_path": "ADNI_Nifti_QC_N4/I304600_T1_N4.nii.gz",
      "ptid": "130_S_4294",
      "visit": "v05",
      "acq_date": "5/15/2012",
      "phc_scan_date": "2012-05-15",
      "source": "phc",
      "question": "MRI scan (Image Data ID I304600) acquired on 5/15/2012 for a female participant (visit v05). Predict the subject's T1 scan age in years and answer with a numeric value using one decimal place.",
      "answer": "75.9",
      "answer_code": "75.9",
      "answer_units": "years",
      "demographics": {
        "sex": "female",
        "sex_code": "2",
        "visit": "v05",
        "phc_scandate": "2012-05-15",
        "image_acq_date": "5/15/2012"
      }
    },
    {
      "image_id": "I776709",
      "image_path": "ADNI_Nifti_QC_N4/I776709_T1_N4.nii.gz",
      "ptid": "022_S_5004",
      "visit": "v11",
      "acq_date": "11/05/2013",
      "phc_scan_date": "2013-11-05",
      "source": "phc",
      "question": "MRI scan (Image Data ID I776709) acquired on 11/05/2013 for a male participant (visit v11). Predict the subject's T1 scan age in years and answer with a numeric value using one decimal place.",
      "answer": "65.7",
      "answer_code": "65.7",
      "answer_units": "years",
      "demographics": {
        "sex": "male",
        "sex_code": "1",
        "visit": "v11",
        "phc_scandate": "2013-11-05",
        "image_acq_date": "11/05/2013"
      }
    },
    {
      "image_id": "I671052",
      "image_path": "ADNI_Nifti_QC_N4/I671052_T1_N4.nii.gz",
      "ptid": "127_S_5132",
      "visit": "v21",
      "acq_date": "5/07/2015",
      "phc_scan_date": "2015-05-07",
      "source": "phc",
      "question": "MRI scan (Image Data ID I671052) acquired on 5/07/2015 for a female participant (visit v21). Predict the subject's T1 scan age in years and answer with a numeric value using one decimal place.",
      "answer": "71.5",
      "answer_code": "71.5",
      "answer_units": "years",
      "demographics": {
        "sex": "female",
        "sex_code": "2",
        "visit": "v21",
        "phc_scandate": "2015-05-07",
        "image_acq_date": "5/07/2015"
      }
    },
    {
      "image_id": "I200224",
      "image_path": "ADNI_Nifti_QC_N4/I200224_T1_N4.nii.gz",
      "ptid": "072_S_2026",
      "visit": "m03",
      "acq_date": "10/28/2010",
      "phc_scan_date": "2010-10-28",
      "source": "phc",
      "question": "MRI scan (Image Data ID I200224) acquired on 10/28/2010 for a female participant (visit m03). Predict the subject's T1 scan age in years and answer with a numeric value using one decimal place.",
      "answer": "82.9",
      "answer_code": "82.9",
      "answer_units": "years",
      "demographics": {
        "sex": "female",
        "sex_code": "2",
        "visit": "m03",
        "phc_scandate": "2010-10-28",
        "image_acq_date": "10/28/2010"
      }
    },
    {
      "image_id": "I153243",
      "image_path": "ADNI_Nifti_QC_N4/I153243_T1_N4.nii.gz",
      "ptid": "137_S_0669",
      "visit": "m36",
      "acq_date": "8/17/2009",
      "phc_scan_date": "2009-08-17",
      "source": "phc",
      "question": "MRI scan (Image Data ID I153243) acquired on 8/17/2009 for a male participant (visit m36). Predict the subject's T1 scan age in years and answer with a numeric value using one decimal place.",
      "answer": "66.7",
      "answer_code": "66.7",
      "answer_units": "years",
      "demographics": {
        "sex": "male",
        "sex_code": "1",
        "visit": "m36",
        "phc_scandate": "2009-08-17",
        "image_acq_date": "8/17/2009"
      }
    },
    {
      "image_id": "I104847",
      "image_path": "ADNI_Nifti_QC_N4/I104847_T1_N4.nii.gz",
      "ptid": "137_S_0301",
      "visit": "m24",
      "acq_date": "5/06/2008",
      "phc_scan_date": "2008-05-06",
      "source": "phc",
      "question": "MRI scan (Image Data ID I104847) acquired on 5/06/2008 for a female participant (visit m24). Predict the subject's T1 scan age in years and answer with a numeric value using one decimal place.",
      "answer": "75.7",
      "answer_code": "75.7",
      "answer_units": "years",
      "demographics": {
        "sex": "female",
        "sex_code": "2",
        "visit": "m24",
        "phc_scandate": "2008-05-06",
        "image_acq_date": "5/06/2008"
      }
    },
    {
      "image_id": "I135623",
      "image_path": "ADNI_Nifti_QC_N4/I135623_T1_N4.nii.gz",
      "ptid": "126_S_1187",
      "visit": "m24",
      "acq_date": "1/29/2009",
      "phc_scan_date": "2009-01-29",
      "source": "phc",
      "question": "MRI scan (Image Data ID I135623) acquired on 1/29/2009 for a male participant (visit m24). Predict the subject's T1 scan age in years and answer with a numeric value using one decimal place.",
      "answer": "78.6",
      "answer_code": "78.6",
      "answer_units": "years",
      "demographics": {
        "sex": "male",
        "sex_code": "1",
        "visit": "m24",
        "phc_scandate": "2009-01-29",
        "image_acq_date": "1/29/2009"
      }
    },
    {
      "image_id": "I28019",
      "image_path": "ADNI_Nifti_QC_N4/I28019_T1_N4.nii.gz",
      "ptid": "023_S_0031",
      "visit": "m12",
      "acq_date": "10/30/2006",
      "phc_scan_date": "2006-10-30",
      "source": "phc",
      "question": "MRI scan (Image Data ID I28019) acquired on 10/30/2006 for a female participant (visit m12). Predict the subject's T1 scan age in years and answer with a numeric value using one decimal place.",
      "answer": "78.9",
      "answer_code": "78.9",
      "answer_units": "years",
      "demographics": {
        "sex": "female",
        "sex_code": "2",
        "visit": "m12",
        "phc_scandate": "2006-10-30",
        "image_acq_date": "10/30/2006"
      }
    },
    {
      "image_id": "I105672",
      "image_path": "ADNI_Nifti_QC_N4/I105672_T1_N4.nii.gz",
      "ptid": "141_S_1094",
      "visit": "m12",
      "acq_date": "1/19/2008",
      "phc_scan_date": "2008-01-19",
      "source": "phc",
      "question": "MRI scan (Image Data ID I105672) acquired on 1/19/2008 for a male participant (visit m12). Predict the subject's T1 scan age in years and answer with a numeric value using one decimal place.",
      "answer": "77.2",
      "answer_code": "77.2",
      "answer_units": "years",
      "demographics": {
        "sex": "male",
        "sex_code": "1",
        "visit": "m12",
        "phc_scandate": "2008-01-19",
        "image_acq_date": "1/19/2008"
      }
    },
    {
      "image_id": "I557372",
      "image_path": "ADNI_Nifti_QC_N4/I557372_T1_N4.nii.gz",
      "ptid": "018_S_4313",
      "visit": "v41",
      "acq_date": "11/18/2015",
      "phc_scan_date": "2015-11-18",
      "source": "phc",
      "question": "MRI scan (Image Data ID I557372) acquired on 11/18/2015 for a female participant (visit v41). Predict the subject's T1 scan age in years and answer with a numeric value using one decimal place.",
      "answer": "81.1",
      "answer_code": "81.1",
      "answer_units": "years",
      "demographics": {
        "sex": "female",
        "sex_code": "2",
        "visit": "v41",
        "phc_scandate": "2015-11-18",
        "image_acq_date": "11/18/2015"
      }
    },
    {
      "image_id": "I350306",
      "image_path": "ADNI_Nifti_QC_N4/I350306_T1_N4.nii.gz",
      "ptid": "057_S_4897",
      "visit": "v04",
      "acq_date": "12/10/2012",
      "phc_scan_date": "2012-12-10",
      "source": "phc",
      "question": "MRI scan (Image Data ID I350306) acquired on 12/10/2012 for a female participant (visit v04). Predict the subject's T1 scan age in years and answer with a numeric value using one decimal place.",
      "answer": "76.3",
      "answer_code": "76.3",
      "answer_units": "years",
      "demographics": {
        "sex": "female",
        "sex_code": "2",
        "visit": "v04",
        "phc_scandate": "2012-12-10",
        "image_acq_date": "12/10/2012"
      }
    },
    {
      "image_id": "I223901",
      "image_path": "ADNI_Nifti_QC_N4/I223901_T1_N4.nii.gz",
      "ptid": "002_S_1261",
      "visit": "m48",
      "acq_date": "3/14/2011",
      "phc_scan_date": "2011-03-14",
      "source": "phc",
      "question": "MRI scan (Image Data ID I223901) acquired on 3/14/2011 for a female participant (visit m48). Predict the subject's T1 scan age in years and answer with a numeric value using one decimal place.",
      "answer": "75.3",
      "answer_code": "75.3",
      "answer_units": "years",
      "demographics": {
        "sex": "female",
        "sex_code": "2",
        "visit": "m48",
        "phc_scandate": "2011-03-14",
        "image_acq_date": "3/14/2011"
      }
    },
    {
      "image_id": "I218230",
      "image_path": "ADNI_Nifti_QC_N4/I218230_T1_N4.nii.gz",
      "ptid": "072_S_2027",
      "visit": "m06",
      "acq_date": "2/18/2011",
      "phc_scan_date": "2011-02-18",
      "source": "phc",
      "question": "MRI scan (Image Data ID I218230) acquired on 2/18/2011 for a female participant (visit m06). Predict the subject's T1 scan age in years and answer with a numeric value using one decimal place.",
      "answer": "62.6",
      "answer_code": "62.6",
      "answer_units": "years",
      "demographics": {
        "sex": "female",
        "sex_code": "2",
        "visit": "m06",
        "phc_scandate": "2011-02-18",
        "image_acq_date": "2/18/2011"
      }
    },
    {
      "image_id": "I241013",
      "image_path": "ADNI_Nifti_QC_N4/I241013_T1_N4.nii.gz",
      "ptid": "024_S_4084",
      "visit": "v02",
      "acq_date": "6/16/2011",
      "phc_scan_date": "2011-06-16",
      "source": "phc",
      "question": "MRI scan (Image Data ID I241013) acquired on 6/16/2011 for a female participant (visit v02). Predict the subject's T1 scan age in years and answer with a numeric value using one decimal place.",
      "answer": "68.5",
      "answer_code": "68.5",
      "answer_units": "years",
      "demographics": {
        "sex": "female",
        "sex_code": "2",
        "visit": "v02",
        "phc_scandate": "2011-06-16",
        "image_acq_date": "6/16/2011"
      }
    },
    {
      "image_id": "I14178",
      "image_path": "ADNI_Nifti_QC_N4/I14178_T1_N4.nii.gz",
      "ptid": "137_S_0459",
      "visit": "sc",
      "acq_date": "4/25/2006",
      "phc_scan_date": "2006-04-25",
      "source": "phc",
      "question": "MRI scan (Image Data ID I14178) acquired on 4/25/2006 for a male participant (visit sc). Predict the subject's T1 scan age in years and answer with a numeric value using one decimal place.",
      "answer": "73",
      "answer_code": "73",
      "answer_units": "years",
      "demographics": {
        "sex": "male",
        "sex_code": "1",
        "visit": "sc",
        "phc_scandate": "2006-04-25",
        "image_acq_date": "4/25/2006"
      }
    },
    {
      "image_id": "I328605",
      "image_path": "ADNI_Nifti_QC_N4/I328605_T1_N4.nii.gz",
      "ptid": "073_S_4739",
      "visit": "v04",
      "acq_date": "8/30/2012",
      "phc_scan_date": "2012-08-30",
      "source": "phc",
      "question": "MRI scan (Image Data ID I328605) acquired on 8/30/2012 for a male participant (visit v04). Predict the subject's T1 scan age in years and answer with a numeric value using one decimal place.",
      "answer": "65.5",
      "answer_code": "65.5",
      "answer_units": "years",
      "demographics": {
        "sex": "male",
        "sex_code": "1",
        "visit": "v04",
        "phc_scandate": "2012-08-30",
        "image_acq_date": "8/30/2012"
      }
    },
    {
      "image_id": "I315505",
      "image_path": "ADNI_Nifti_QC_N4/I315505_T1_N4.nii.gz",
      "ptid": "024_S_4392",
      "visit": "v05",
      "acq_date": "7/09/2012",
      "phc_scan_date": "2012-07-09",
      "source": "phc",
      "question": "MRI scan (Image Data ID I315505) acquired on 7/09/2012 for a male participant (visit v05). Predict the subject's T1 scan age in years and answer with a numeric value using one decimal place.",
      "answer": "83.1",
      "answer_code": "83.1",
      "answer_units": "years",
      "demographics": {
        "sex": "male",
        "sex_code": "1",
        "visit": "v05",
        "phc_scandate": "2012-07-09",
        "image_acq_date": "7/09/2012"
      }
    },
    {
      "image_id": "I316980",
      "image_path": "ADNI_Nifti_QC_N4/I316980_T1_N4.nii.gz",
      "ptid": "031_S_2022",
      "visit": "v11",
      "acq_date": "7/19/2012",
      "phc_scan_date": "2012-07-19",
      "source": "phc",
      "question": "MRI scan (Image Data ID I316980) acquired on 7/19/2012 for a male participant (visit v11). Predict the subject's T1 scan age in years and answer with a numeric value using one decimal place.",
      "answer": "68.1",
      "answer_code": "68.1",
      "answer_units": "years",
      "demographics": {
        "sex": "male",
        "sex_code": "1",
        "visit": "v11",
        "phc_scandate": "2012-07-19",
        "image_acq_date": "7/19/2012"
      }
    },
    {
      "image_id": "I76280",
      "image_path": "ADNI_Nifti_QC_N4/I76280_T1_N4.nii.gz",
      "ptid": "023_S_0916",
      "visit": "m12",
      "acq_date": "9/28/2007",
      "phc_scan_date": "2007-09-28",
      "source": "phc",
      "question": "MRI scan (Image Data ID I76280) acquired on 9/28/2007 for a male participant (visit m12). Predict the subject's T1 scan age in years and answer with a numeric value using one decimal place.",
      "answer": "80.8",
      "answer_code": "80.8",
      "answer_units": "years",
      "demographics": {
        "sex": "male",
        "sex_code": "1",
        "visit": "m12",
        "phc_scandate": "2007-09-28",
        "image_acq_date": "9/28/2007"
      }
    },
    {
      "image_id": "I42976",
      "image_path": "ADNI_Nifti_QC_N4/I42976_T1_N4.nii.gz",
      "ptid": "032_S_0718",
      "visit": "m06",
      "acq_date": "3/05/2007",
      "phc_scan_date": "2007-03-05",
      "source": "phc",
      "question": "MRI scan (Image Data ID I42976) acquired on 3/05/2007 for a female participant (visit m06). Predict the subject's T1 scan age in years and answer with a numeric value using one decimal place.",
      "answer": "81.2",
      "answer_code": "81.2",
      "answer_units": "years",
      "demographics": {
        "sex": "female",
        "sex_code": "2",
        "visit": "m06",
        "phc_scandate": "2007-03-05",
        "image_acq_date": "3/05/2007"
      }
    },
    {
      "image_id": "I252701",
      "image_path": "ADNI_Nifti_QC_N4/I252701_T1_N4.nii.gz",
      "ptid": "021_S_0626",
      "visit": "v06",
      "acq_date": "8/25/2011",
      "phc_scan_date": "2011-08-25",
      "source": "phc",
      "question": "MRI scan (Image Data ID I252701) acquired on 8/25/2011 for a male participant (visit v06). Predict the subject's T1 scan age in years and answer with a numeric value using one decimal place.",
      "answer": "88.5",
      "answer_code": "88.5",
      "answer_units": "years",
      "demographics": {
        "sex": "male",
        "sex_code": "1",
        "visit": "v06",
        "phc_scandate": "2011-08-25",
        "image_acq_date": "8/25/2011"
      }
    },
    {
      "image_id": "I270173",
      "image_path": "ADNI_Nifti_QC_N4/I270173_T1_N4.nii.gz",
      "ptid": "052_S_0989",
      "visit": "m60",
      "acq_date": "12/06/2011",
      "phc_scan_date": "2011-12-06",
      "source": "phc",
      "question": "MRI scan (Image Data ID I270173) acquired on 12/06/2011 for a female participant (visit m60). Predict the subject's T1 scan age in years and answer with a numeric value using one decimal place.",
      "answer": "69.5",
      "answer_code": "69.5",
      "answer_units": "years",
      "demographics": {
        "sex": "female",
        "sex_code": "2",
        "visit": "m60",
        "phc_scandate": "2011-12-06",
        "image_acq_date": "12/06/2011"
      }
    },
    {
      "image_id": "I23376",
      "image_path": "ADNI_Nifti_QC_N4/I23376_T1_N4.nii.gz",
      "ptid": "018_S_0142",
      "visit": "m06",
      "acq_date": "8/25/2006",
      "phc_scan_date": "2006-08-25",
      "source": "phc",
      "question": "MRI scan (Image Data ID I23376) acquired on 8/25/2006 for a male participant (visit m06). Predict the subject's T1 scan age in years and answer with a numeric value using one decimal place.",
      "answer": "79.9",
      "answer_code": "79.9",
      "answer_units": "years",
      "demographics": {
        "sex": "male",
        "sex_code": "1",
        "visit": "m06",
        "phc_scandate": "2006-08-25",
        "image_acq_date": "8/25/2006"
      }
    },
    {
      "image_id": "I165706",
      "image_path": "ADNI_Nifti_QC_N4/I165706_T1_N4.nii.gz",
      "ptid": "029_S_1218",
      "visit": "m36",
      "acq_date": "2/02/2010",
      "phc_scan_date": "2010-02-02",
      "source": "phc",
      "question": "MRI scan (Image Data ID I165706) acquired on 2/02/2010 for a female participant (visit m36). Predict the subject's T1 scan age in years and answer with a numeric value using one decimal place.",
      "answer": "88.6",
      "answer_code": "88.6",
      "answer_units": "years",
      "demographics": {
        "sex": "female",
        "sex_code": "2",
        "visit": "m36",
        "phc_scandate": "2010-02-02",
        "image_acq_date": "2/02/2010"
      }
    },
    {
      "image_id": "I403662",
      "image_path": "ADNI_Nifti_QC_N4/I403662_T1_N4.nii.gz",
      "ptid": "141_S_1052",
      "visit": "v21",
      "acq_date": "12/21/2013",
      "phc_scan_date": "2013-12-21",
      "source": "phc",
      "question": "MRI scan (Image Data ID I403662) acquired on 12/21/2013 for a female participant (visit v21). Predict the subject's T1 scan age in years and answer with a numeric value using one decimal place.",
      "answer": "76.2",
      "answer_code": "76.2",
      "answer_units": "years",
      "demographics": {
        "sex": "female",
        "sex_code": "2",
        "visit": "v21",
        "phc_scandate": "2013-12-21",
        "image_acq_date": "12/21/2013"
      }
    },
    {
      "image_id": "I216091",
      "image_path": "ADNI_Nifti_QC_N4/I216091_T1_N4.nii.gz",
      "ptid": "003_S_0981",
      "visit": "m48",
      "acq_date": "1/04/2011",
      "phc_scan_date": "2011-01-04",
      "source": "phc",
      "question": "MRI scan (Image Data ID I216091) acquired on 1/04/2011 for a female participant (visit m48). Predict the subject's T1 scan age in years and answer with a numeric value using one decimal place.",
      "answer": "88.7",
      "answer_code": "88.7",
      "answer_units": "years",
      "demographics": {
        "sex": "female",
        "sex_code": "2",
        "visit": "m48",
        "phc_scandate": "2011-01-04",
        "image_acq_date": "1/04/2011"
      }
    },
    {
      "image_id": "I56598",
      "image_path": "ADNI_Nifti_QC_N4/I56598_T1_N4.nii.gz",
      "ptid": "031_S_0568",
      "visit": "m12",
      "acq_date": "6/08/2007",
      "phc_scan_date": "2007-06-08",
      "source": "phc",
      "question": "MRI scan (Image Data ID I56598) acquired on 6/08/2007 for a female participant (visit m12). Predict the subject's T1 scan age in years and answer with a numeric value using one decimal place.",
      "answer": "80.9",
      "answer_code": "80.9",
      "answer_units": "years",
      "demographics": {
        "sex": "female",
        "sex_code": "2",
        "visit": "m12",
        "phc_scandate": "2007-06-08",
        "image_acq_date": "6/08/2007"
      }
    },
    {
      "image_id": "I306392",
      "image_path": "ADNI_Nifti_QC_N4/I306392_T1_N4.nii.gz",
      "ptid": "137_S_4536",
      "visit": "v04",
      "acq_date": "5/24/2012",
      "phc_scan_date": "2012-05-24",
      "source": "phc",
      "question": "MRI scan (Image Data ID I306392) acquired on 5/24/2012 for a female participant (visit v04). Predict the subject's T1 scan age in years and answer with a numeric value using one decimal place.",
      "answer": "78.2",
      "answer_code": "78.2",
      "answer_units": "years",
      "demographics": {
        "sex": "female",
        "sex_code": "2",
        "visit": "v04",
        "phc_scandate": "2012-05-24",
        "image_acq_date": "5/24/2012"
      }
    },
    {
      "image_id": "I46508",
      "image_path": "ADNI_Nifti_QC_N4/I46508_T1_N4.nii.gz",
      "ptid": "109_S_1343",
      "visit": "sc",
      "acq_date": "3/20/2007",
      "phc_scan_date": "2007-03-20",
      "source": "phc",
      "question": "MRI scan (Image Data ID I46508) acquired on 3/20/2007 for a male participant (visit sc). Predict the subject's T1 scan age in years and answer with a numeric value using one decimal place.",
      "answer": "64.8",
      "answer_code": "64.8",
      "answer_units": "years",
      "demographics": {
        "sex": "male",
        "sex_code": "1",
        "visit": "sc",
        "phc_scandate": "2007-03-20",
        "image_acq_date": "3/20/2007"
      }
    },
    {
      "image_id": "I110431",
      "image_path": "ADNI_Nifti_QC_N4/I110431_T1_N4.nii.gz",
      "ptid": "094_S_0526",
      "visit": "m24",
      "acq_date": "5/22/2008",
      "phc_scan_date": "2008-05-22",
      "source": "phc",
      "question": "MRI scan (Image Data ID I110431) acquired on 5/22/2008 for a female participant (visit m24). Predict the subject's T1 scan age in years and answer with a numeric value using one decimal place.",
      "answer": "87.2",
      "answer_code": "87.2",
      "answer_units": "years",
      "demographics": {
        "sex": "female",
        "sex_code": "2",
        "visit": "m24",
        "phc_scandate": "2008-05-22",
        "image_acq_date": "5/22/2008"
      }
    },
    {
      "image_id": "I301634",
      "image_path": "ADNI_Nifti_QC_N4/I301634_T1_N4.nii.gz",
      "ptid": "072_S_4462",
      "visit": "v04",
      "acq_date": "5/03/2012",
      "phc_scan_date": "2012-05-03",
      "source": "phc",
      "question": "MRI scan (Image Data ID I301634) acquired on 5/03/2012 for a male participant (visit v04). Predict the subject's T1 scan age in years and answer with a numeric value using one decimal place.",
      "answer": "71.7",
      "answer_code": "71.7",
      "answer_units": "years",
      "demographics": {
        "sex": "male",
        "sex_code": "1",
        "visit": "v04",
        "phc_scandate": "2012-05-03",
        "image_acq_date": "5/03/2012"
      }
    },
    {
      "image_id": "I60888",
      "image_path": "ADNI_Nifti_QC_N4/I60888_T1_N4.nii.gz",
      "ptid": "133_S_0913",
      "visit": "m06",
      "acq_date": "7/18/2007",
      "phc_scan_date": "2007-07-18",
      "source": "phc",
      "question": "MRI scan (Image Data ID I60888) acquired on 7/18/2007 for a female participant (visit m06). Predict the subject's T1 scan age in years and answer with a numeric value using one decimal place.",
      "answer": "57.3",
      "answer_code": "57.3",
      "answer_units": "years",
      "demographics": {
        "sex": "female",
        "sex_code": "2",
        "visit": "m06",
        "phc_scandate": "2007-07-18",
        "image_acq_date": "7/18/2007"
      }
    },
    {
      "image_id": "I307356",
      "image_path": "ADNI_Nifti_QC_N4/I307356_T1_N4.nii.gz",
      "ptid": "127_S_4624",
      "visit": "v02",
      "acq_date": "5/31/2012",
      "phc_scan_date": "2012-05-31",
      "source": "phc",
      "question": "MRI scan (Image Data ID I307356) acquired on 5/31/2012 for a female participant (visit v02). Predict the subject's T1 scan age in years and answer with a numeric value using one decimal place.",
      "answer": "77.9",
      "answer_code": "77.9",
      "answer_units": "years",
      "demographics": {
        "sex": "female",
        "sex_code": "2",
        "visit": "v02",
        "phc_scandate": "2012-05-31",
        "image_acq_date": "5/31/2012"
      }
    },
    {
      "image_id": "I33743",
      "image_path": "ADNI_Nifti_QC_N4/I33743_T1_N4.nii.gz",
      "ptid": "023_S_0058",
      "visit": "m12",
      "acq_date": "12/19/2006",
      "phc_scan_date": "2006-12-19",
      "source": "phc",
      "question": "MRI scan (Image Data ID I33743) acquired on 12/19/2006 for a male participant (visit m12). Predict the subject's T1 scan age in years and answer with a numeric value using one decimal place.",
      "answer": "71.3",
      "answer_code": "71.3",
      "answer_units": "years",
      "demographics": {
        "sex": "male",
        "sex_code": "1",
        "visit": "m12",
        "phc_scandate": "2006-12-19",
        "image_acq_date": "12/19/2006"
      }
    },
    {
      "image_id": "I95527",
      "image_path": "ADNI_Nifti_QC_N4/I95527_T1_N4.nii.gz",
      "ptid": "041_S_0549",
      "visit": "m18",
      "acq_date": "3/05/2008",
      "phc_scan_date": "2008-03-05",
      "source": "phc",
      "question": "MRI scan (Image Data ID I95527) acquired on 3/05/2008 for a male participant (visit m18). Predict the subject's T1 scan age in years and answer with a numeric value using one decimal place.",
      "answer": "70.6",
      "answer_code": "70.6",
      "answer_units": "years",
      "demographics": {
        "sex": "male",
        "sex_code": "1",
        "visit": "m18",
        "phc_scandate": "2008-03-05",
        "image_acq_date": "3/05/2008"
      }
    },
    {
      "image_id": "I334663",
      "image_path": "ADNI_Nifti_QC_N4/I334663_T1_N4.nii.gz",
      "ptid": "024_S_4223",
      "visit": "v11",
      "acq_date": "9/17/2012",
      "phc_scan_date": "2012-09-17",
      "source": "phc",
      "question": "MRI scan (Image Data ID I334663) acquired on 9/17/2012 for a male participant (visit v11). Predict the subject's T1 scan age in years and answer with a numeric value using one decimal place.",
      "answer": "76.9",
      "answer_code": "76.9",
      "answer_units": "years",
      "demographics": {
        "sex": "male",
        "sex_code": "1",
        "visit": "v11",
        "phc_scandate": "2012-09-17",
        "image_acq_date": "9/17/2012"
      }
    },
    {
      "image_id": "I499425",
      "image_path": "ADNI_Nifti_QC_N4/I499425_T1_N4.nii.gz",
      "ptid": "009_S_1030",
      "visit": "v11",
      "acq_date": "11/02/2012",
      "phc_scan_date": "2012-11-02",
      "source": "phc",
      "question": "MRI scan (Image Data ID I499425) acquired on 11/02/2012 for a male participant (visit v11). Predict the subject's T1 scan age in years and answer with a numeric value using one decimal place.",
      "answer": "73.6",
      "answer_code": "73.6",
      "answer_units": "years",
      "demographics": {
        "sex": "male",
        "sex_code": "1",
        "visit": "v11",
        "phc_scandate": "2012-11-02",
        "image_acq_date": "11/02/2012"
      }
    },
    {
      "image_id": "I9046",
      "image_path": "ADNI_Nifti_QC_N4/I9046_T1_N4.nii.gz",
      "ptid": "023_S_0061",
      "visit": "sc",
      "acq_date": "11/29/2005",
      "phc_scan_date": "2005-11-29",
      "source": "phc",
      "question": "MRI scan (Image Data ID I9046) acquired on 11/29/2005 for a female participant (visit sc). Predict the subject's T1 scan age in years and answer with a numeric value using one decimal place.",
      "answer": "77.2",
      "answer_code": "77.2",
      "answer_units": "years",
      "demographics": {
        "sex": "female",
        "sex_code": "2",
        "visit": "sc",
        "phc_scandate": "2005-11-29",
        "image_acq_date": "11/29/2005"
      }
    },
    {
      "image_id": "I33775",
      "image_path": "ADNI_Nifti_QC_N4/I33775_T1_N4.nii.gz",
      "ptid": "029_S_0914",
      "visit": "sc",
      "acq_date": "12/18/2006",
      "phc_scan_date": "2006-12-18",
      "source": "phc",
      "question": "MRI scan (Image Data ID I33775) acquired on 12/18/2006 for a male participant (visit sc). Predict the subject's T1 scan age in years and answer with a numeric value using one decimal place.",
      "answer": "74.8",
      "answer_code": "74.8",
      "answer_units": "years",
      "demographics": {
        "sex": "male",
        "sex_code": "1",
        "visit": "sc",
        "phc_scandate": "2006-12-18",
        "image_acq_date": "12/18/2006"
      }
    },
    {
      "image_id": "I351091",
      "image_path": "ADNI_Nifti_QC_N4/I351091_T1_N4.nii.gz",
      "ptid": "023_S_4164",
      "visit": "v11",
      "acq_date": "12/12/2012",
      "phc_scan_date": "2012-12-12",
      "source": "phc",
      "question": "MRI scan (Image Data ID I351091) acquired on 12/12/2012 for a male participant (visit v11). Predict the subject's T1 scan age in years and answer with a numeric value using one decimal place.",
      "answer": "74",
      "answer_code": "74",
      "answer_units": "years",
      "demographics": {
        "sex": "male",
        "sex_code": "1",
        "visit": "v11",
        "phc_scandate": "2012-12-12",
        "image_acq_date": "12/12/2012"
      }
    },
    {
      "image_id": "I401086",
      "image_path": "ADNI_Nifti_QC_N4/I401086_T1_N4.nii.gz",
      "ptid": "073_S_4393",
      "visit": "v21",
      "acq_date": "12/09/2013",
      "phc_scan_date": "2013-12-09",
      "source": "phc",
      "question": "MRI scan (Image Data ID I401086) acquired on 12/09/2013 for a male participant (visit v21). Predict the subject's T1 scan age in years and answer with a numeric value using one decimal place.",
      "answer": "75.6",
      "answer_code": "75.6",
      "answer_units": "years",
      "demographics": {
        "sex": "male",
        "sex_code": "1",
        "visit": "v21",
        "phc_scandate": "2013-12-09",
        "image_acq_date": "12/09/2013"
      }
    },
    {
      "image_id": "I25444",
      "image_path": "ADNI_Nifti_QC_N4/I25444_T1_N4.nii.gz",
      "ptid": "127_S_0259",
      "visit": "m06",
      "acq_date": "9/21/2006",
      "phc_scan_date": "2006-09-21",
      "source": "phc",
      "question": "MRI scan (Image Data ID I25444) acquired on 9/21/2006 for a male participant (visit m06). Predict the subject's T1 scan age in years and answer with a numeric value using one decimal place.",
      "answer": "71.2",
      "answer_code": "71.2",
      "answer_units": "years",
      "demographics": {
        "sex": "male",
        "sex_code": "1",
        "visit": "m06",
        "phc_scandate": "2006-09-21",
        "image_acq_date": "9/21/2006"
      }
    },
    {
      "image_id": "I143718",
      "image_path": "ADNI_Nifti_QC_N4/I143718_T1_N4.nii.gz",
      "ptid": "037_S_1421",
      "visit": "m18",
      "acq_date": "5/13/2009",
      "phc_scan_date": "2009-05-13",
      "source": "phc",
      "question": "MRI scan (Image Data ID I143718) acquired on 5/13/2009 for a female participant (visit m18). Predict the subject's T1 scan age in years and answer with a numeric value using one decimal place.",
      "answer": "76.2",
      "answer_code": "76.2",
      "answer_units": "years",
      "demographics": {
        "sex": "female",
        "sex_code": "2",
        "visit": "m18",
        "phc_scandate": "2009-05-13",
        "image_acq_date": "5/13/2009"
      }
    },
    {
      "image_id": "I388008",
      "image_path": "ADNI_Nifti_QC_N4/I388008_T1_N4.nii.gz",
      "ptid": "041_S_4143",
      "visit": "v21",
      "acq_date": "8/28/2013",
      "phc_scan_date": "2013-08-28",
      "source": "phc",
      "question": "MRI scan (Image Data ID I388008) acquired on 8/28/2013 for a female participant (visit v21). Predict the subject's T1 scan age in years and answer with a numeric value using one decimal place.",
      "answer": "65.8",
      "answer_code": "65.8",
      "answer_units": "years",
      "demographics": {
        "sex": "female",
        "sex_code": "2",
        "visit": "v21",
        "phc_scandate": "2013-08-28",
        "image_acq_date": "8/28/2013"
      }
    },
    {
      "image_id": "I401254",
      "image_path": "ADNI_Nifti_QC_N4/I401254_T1_N4.nii.gz",
      "ptid": "051_S_5293",
      "visit": "v02",
      "acq_date": "12/11/2013",
      "phc_scan_date": "2013-12-11",
      "source": "phc",
      "question": "MRI scan (Image Data ID I401254) acquired on 12/11/2013 for a male participant (visit v02). Predict the subject's T1 scan age in years and answer with a numeric value using one decimal place.",
      "answer": "70.7",
      "answer_code": "70.7",
      "answer_units": "years",
      "demographics": {
        "sex": "male",
        "sex_code": "1",
        "visit": "v02",
        "phc_scandate": "2013-12-11",
        "image_acq_date": "12/11/2013"
      }
    },
    {
      "image_id": "I344477",
      "image_path": "ADNI_Nifti_QC_N4/I344477_T1_N4.nii.gz",
      "ptid": "128_S_4742",
      "visit": "v04",
      "acq_date": "9/04/2012",
      "phc_scan_date": "2012-09-04",
      "source": "phc",
      "question": "MRI scan (Image Data ID I344477) acquired on 9/04/2012 for a female participant (visit v04). Predict the subject's T1 scan age in years and answer with a numeric value using one decimal place.",
      "answer": "70.9",
      "answer_code": "70.9",
      "answer_units": "years",
      "demographics": {
        "sex": "female",
        "sex_code": "2",
        "visit": "v04",
        "phc_scandate": "2012-09-04",
        "image_acq_date": "9/04/2012"
      }
    },
    {
      "image_id": "I335543",
      "image_path": "ADNI_Nifti_QC_N4/I335543_T1_N4.nii.gz",
      "ptid": "067_S_4184",
      "visit": "v11",
      "acq_date": "9/19/2012",
      "phc_scan_date": "2012-09-19",
      "source": "phc",
      "question": "MRI scan (Image Data ID I335543) acquired on 9/19/2012 for a female participant (visit v11). Predict the subject's T1 scan age in years and answer with a numeric value using one decimal place.",
      "answer": "63.4",
      "answer_code": "63.4",
      "answer_units": "years",
      "demographics": {
        "sex": "female",
        "sex_code": "2",
        "visit": "v11",
        "phc_scandate": "2012-09-19",
        "image_acq_date": "9/19/2012"
      }
    },
    {
      "image_id": "I99944",
      "image_path": "ADNI_Nifti_QC_N4/I99944_T1_N4.nii.gz",
      "ptid": "094_S_1267",
      "visit": "m12",
      "acq_date": "3/24/2008",
      "phc_scan_date": "2008-03-24",
      "source": "phc",
      "question": "MRI scan (Image Data ID I99944) acquired on 3/24/2008 for a male participant (visit m12). Predict the subject's T1 scan age in years and answer with a numeric value using one decimal place.",
      "answer": "74.4",
      "answer_code": "74.4",
      "answer_units": "years",
      "demographics": {
        "sex": "male",
        "sex_code": "1",
        "visit": "m12",
        "phc_scandate": "2008-03-24",
        "image_acq_date": "3/24/2008"
      }
    },
    {
      "image_id": "I291858",
      "image_path": "ADNI_Nifti_QC_N4/I291858_T1_N4.nii.gz",
      "ptid": "023_S_4501",
      "visit": "v02",
      "acq_date": "3/22/2012",
      "phc_scan_date": "2012-03-22",
      "source": "phc",
      "question": "MRI scan (Image Data ID I291858) acquired on 3/22/2012 for a male participant (visit v02). Predict the subject's T1 scan age in years and answer with a numeric value using one decimal place.",
      "answer": "79.1",
      "answer_code": "79.1",
      "answer_units": "years",
      "demographics": {
        "sex": "male",
        "sex_code": "1",
        "visit": "v02",
        "phc_scandate": "2012-03-22",
        "image_acq_date": "3/22/2012"
      }
    },
    {
      "image_id": "I398424",
      "image_path": "ADNI_Nifti_QC_N4/I398424_T1_N4.nii.gz",
      "ptid": "099_S_2063",
      "visit": "v21",
      "acq_date": "11/13/2013",
      "phc_scan_date": "2013-11-13",
      "source": "phc",
      "question": "MRI scan (Image Data ID I398424) acquired on 11/13/2013 for a male participant (visit v21). Predict the subject's T1 scan age in years and answer with a numeric value using one decimal place.",
      "answer": "71.5",
      "answer_code": "71.5",
      "answer_units": "years",
      "demographics": {
        "sex": "male",
        "sex_code": "1",
        "visit": "v21",
        "phc_scandate": "2013-11-13",
        "image_acq_date": "11/13/2013"
      }
    },
    {
      "image_id": "I118098",
      "image_path": "ADNI_Nifti_QC_N4/I118098_T1_N4.nii.gz",
      "ptid": "062_S_1182",
      "visit": "m18",
      "acq_date": "9/17/2008",
      "phc_scan_date": "2008-09-17",
      "source": "phc",
      "question": "MRI scan (Image Data ID I118098) acquired on 9/17/2008 for a female participant (visit m18). Predict the subject's T1 scan age in years and answer with a numeric value using one decimal place.",
      "answer": "77.9",
      "answer_code": "77.9",
      "answer_units": "years",
      "demographics": {
        "sex": "female",
        "sex_code": "2",
        "visit": "m18",
        "phc_scandate": "2008-09-17",
        "image_acq_date": "9/17/2008"
      }
    },
    {
      "image_id": "I56297",
      "image_path": "ADNI_Nifti_QC_N4/I56297_T1_N4.nii.gz",
      "ptid": "127_S_0393",
      "visit": "m12",
      "acq_date": "6/06/2007",
      "phc_scan_date": "2007-06-06",
      "source": "phc",
      "question": "MRI scan (Image Data ID I56297) acquired on 6/06/2007 for a female participant (visit m12). Predict the subject's T1 scan age in years and answer with a numeric value using one decimal place.",
      "answer": "87.4",
      "answer_code": "87.4",
      "answer_units": "years",
      "demographics": {
        "sex": "female",
        "sex_code": "2",
        "visit": "m12",
        "phc_scandate": "2007-06-06",
        "image_acq_date": "6/06/2007"
      }
    },
    {
      "image_id": "I393061",
      "image_path": "ADNI_Nifti_QC_N4/I393061_T1_N4.nii.gz",
      "ptid": "016_S_4887",
      "visit": "v11",
      "acq_date": "10/01/2013",
      "phc_scan_date": "2013-10-01",
      "source": "phc",
      "question": "MRI scan (Image Data ID I393061) acquired on 10/01/2013 for a male participant (visit v11). Predict the subject's T1 scan age in years and answer with a numeric value using one decimal place.",
      "answer": "75",
      "answer_code": "75",
      "answer_units": "years",
      "demographics": {
        "sex": "male",
        "sex_code": "1",
        "visit": "v11",
        "phc_scandate": "2013-10-01",
        "image_acq_date": "10/01/2013"
      }
    },
    {
      "image_id": "I118125",
      "image_path": "ADNI_Nifti_QC_N4/I118125_T1_N4.nii.gz",
      "ptid": "037_S_1421",
      "visit": "m12",
      "acq_date": "9/17/2008",
      "phc_scan_date": "2008-09-17",
      "source": "phc",
      "question": "MRI scan (Image Data ID I118125) acquired on 9/17/2008 for a female participant (visit m12). Predict the subject's T1 scan age in years and answer with a numeric value using one decimal place.",
      "answer": "75.5",
      "answer_code": "75.5",
      "answer_units": "years",
      "demographics": {
        "sex": "female",
        "sex_code": "2",
        "visit": "m12",
        "phc_scandate": "2008-09-17",
        "image_acq_date": "9/17/2008"
      }
    },
    {
      "image_id": "I208097",
      "image_path": "ADNI_Nifti_QC_N4/I208097_T1_N4.nii.gz",
      "ptid": "014_S_2185",
      "visit": "scmri",
      "acq_date": "12/10/2010",
      "phc_scan_date": "2010-12-10",
      "source": "phc",
      "question": "MRI scan (Image Data ID I208097) acquired on 12/10/2010 for a male participant (visit scmri). Predict the subject's T1 scan age in years and answer with a numeric value using one decimal place.",
      "answer": "73.2",
      "answer_code": "73.2",
      "answer_units": "years",
      "demographics": {
        "sex": "male",
        "sex_code": "1",
        "visit": "scmri",
        "phc_scandate": "2010-12-10",
        "image_acq_date": "12/10/2010"
      }
    },
    {
      "image_id": "I362815",
      "image_path": "ADNI_Nifti_QC_N4/I362815_T1_N4.nii.gz",
      "ptid": "116_S_4898",
      "visit": "v05",
      "acq_date": "3/11/2013",
      "phc_scan_date": "2013-03-11",
      "source": "phc",
      "question": "MRI scan (Image Data ID I362815) acquired on 3/11/2013 for a male participant (visit v05). Predict the subject's T1 scan age in years and answer with a numeric value using one decimal place.",
      "answer": "75.8",
      "answer_code": "75.8",
      "answer_units": "years",
      "demographics": {
        "sex": "male",
        "sex_code": "1",
        "visit": "v05",
        "phc_scandate": "2013-03-11",
        "image_acq_date": "3/11/2013"
      }
    },
    {
      "image_id": "I373559",
      "image_path": "ADNI_Nifti_QC_N4/I373559_T1_N4.nii.gz",
      "ptid": "041_S_4004",
      "visit": "v21",
      "acq_date": "5/22/2013",
      "phc_scan_date": "2013-05-22",
      "source": "phc",
      "question": "MRI scan (Image Data ID I373559) acquired on 5/22/2013 for a female participant (visit v21). Predict the subject's T1 scan age in years and answer with a numeric value using one decimal place.",
      "answer": "69",
      "answer_code": "69",
      "answer_units": "years",
      "demographics": {
        "sex": "female",
        "sex_code": "2",
        "visit": "v21",
        "phc_scandate": "2013-05-22",
        "image_acq_date": "5/22/2013"
      }
    },
    {
      "image_id": "I238615",
      "image_path": "ADNI_Nifti_QC_N4/I238615_T1_N4.nii.gz",
      "ptid": "098_S_4050",
      "visit": "v02",
      "acq_date": "5/27/2011",
      "phc_scan_date": "2011-05-27",
      "source": "phc",
      "question": "MRI scan (Image Data ID I238615) acquired on 5/27/2011 for a male participant (visit v02). Predict the subject's T1 scan age in years and answer with a numeric value using one decimal place.",
      "answer": "77.1",
      "answer_code": "77.1",
      "answer_units": "years",
      "demographics": {
        "sex": "male",
        "sex_code": "1",
        "visit": "v02",
        "phc_scandate": "2011-05-27",
        "image_acq_date": "5/27/2011"
      }
    },
    {
      "image_id": "I315249",
      "image_path": "ADNI_Nifti_QC_N4/I315249_T1_N4.nii.gz",
      "ptid": "032_S_4823",
      "visit": "v02",
      "acq_date": "7/05/2012",
      "phc_scan_date": "2012-07-05",
      "source": "phc",
      "question": "MRI scan (Image Data ID I315249) acquired on 7/05/2012 for a male participant (visit v02). Predict the subject's T1 scan age in years and answer with a numeric value using one decimal place.",
      "answer": "82.3",
      "answer_code": "82.3",
      "answer_units": "years",
      "demographics": {
        "sex": "male",
        "sex_code": "1",
        "visit": "v02",
        "phc_scandate": "2012-07-05",
        "image_acq_date": "7/05/2012"
      }
    },
    {
      "image_id": "I57437",
      "image_path": "ADNI_Nifti_QC_N4/I57437_T1_N4.nii.gz",
      "ptid": "037_S_1078",
      "visit": "m06",
      "acq_date": "6/20/2007",
      "phc_scan_date": "2007-06-20",
      "source": "phc",
      "question": "MRI scan (Image Data ID I57437) acquired on 6/20/2007 for a male participant (visit m06). Predict the subject's T1 scan age in years and answer with a numeric value using one decimal place.",
      "answer": "71.3",
      "answer_code": "71.3",
      "answer_units": "years",
      "demographics": {
        "sex": "male",
        "sex_code": "1",
        "visit": "m06",
        "phc_scandate": "2007-06-20",
        "image_acq_date": "6/20/2007"
      }
    },
    {
      "image_id": "I8314",
      "image_path": "ADNI_Nifti_QC_N4/I8314_T1_N4.nii.gz",
      "ptid": "011_S_0023",
      "visit": "sc",
      "acq_date": "10/31/2005",
      "phc_scan_date": "2005-10-31",
      "source": "phc",
      "question": "MRI scan (Image Data ID I8314) acquired on 10/31/2005 for a male participant (visit sc). Predict the subject's T1 scan age in years and answer with a numeric value using one decimal place.",
      "answer": "71.9",
      "answer_code": "71.9",
      "answer_units": "years",
      "demographics": {
        "sex": "male",
        "sex_code": "1",
        "visit": "sc",
        "phc_scandate": "2005-10-31",
        "image_acq_date": "10/31/2005"
      }
    },
    {
      "image_id": "I71185",
      "image_path": "ADNI_Nifti_QC_N4/I71185_T1_N4.nii.gz",
      "ptid": "052_S_1251",
      "visit": "m06",
      "acq_date": "8/31/2007",
      "phc_scan_date": "2007-09-24",
      "source": "phc",
      "question": "MRI scan (Image Data ID I71185) acquired on 8/31/2007 for a female participant (visit m06). Predict the subject's T1 scan age in years and answer with a numeric value using one decimal place.",
      "answer": "74.9",
      "answer_code": "74.9",
      "answer_units": "years",
      "demographics": {
        "sex": "female",
        "sex_code": "2",
        "visit": "m06",
        "phc_scandate": "2007-09-24",
        "image_acq_date": "8/31/2007"
      }
    },
    {
      "image_id": "I78461",
      "image_path": "ADNI_Nifti_QC_N4/I78461_T1_N4.nii.gz",
      "ptid": "131_S_1389",
      "visit": "m06",
      "acq_date": "10/25/2007",
      "phc_scan_date": "2007-10-25",
      "source": "phc",
      "question": "MRI scan (Image Data ID I78461) acquired on 10/25/2007 for a male participant (visit m06). Predict the subject's T1 scan age in years and answer with a numeric value using one decimal place.",
      "answer": "76.8",
      "answer_code": "76.8",
      "answer_units": "years",
      "demographics": {
        "sex": "male",
        "sex_code": "1",
        "visit": "m06",
        "phc_scandate": "2007-10-25",
        "image_acq_date": "10/25/2007"
      }
    },
    {
      "image_id": "I361326",
      "image_path": "ADNI_Nifti_QC_N4/I361326_T1_N4.nii.gz",
      "ptid": "002_S_1280",
      "visit": "v11",
      "acq_date": "2/26/2013",
      "phc_scan_date": "2013-02-26",
      "source": "phc",
      "question": "MRI scan (Image Data ID I361326) acquired on 2/26/2013 for a female participant (visit v11). Predict the subject's T1 scan age in years and answer with a numeric value using one decimal place.",
      "answer": "76.9",
      "answer_code": "76.9",
      "answer_units": "years",
      "demographics": {
        "sex": "female",
        "sex_code": "2",
        "visit": "v11",
        "phc_scandate": "2013-02-26",
        "image_acq_date": "2/26/2013"
      }
    },
    {
      "image_id": "I415615",
      "image_path": "ADNI_Nifti_QC_N4/I415615_T1_N4.nii.gz",
      "ptid": "031_S_2233",
      "visit": "v21",
      "acq_date": "2/27/2014",
      "phc_scan_date": "2014-02-27",
      "source": "phc",
      "question": "MRI scan (Image Data ID I415615) acquired on 2/27/2014 for a female participant (visit v21). Predict the subject's T1 scan age in years and answer with a numeric value using one decimal place.",
      "answer": "58.9",
      "answer_code": "58.9",
      "answer_units": "years",
      "demographics": {
        "sex": "female",
        "sex_code": "2",
        "visit": "v21",
        "phc_scandate": "2014-02-27",
        "image_acq_date": "2/27/2014"
      }
    },
    {
      "image_id": "I84328",
      "image_path": "ADNI_Nifti_QC_N4/I84328_T1_N4.nii.gz",
      "ptid": "099_S_0880",
      "visit": "m12",
      "acq_date": "12/07/2007",
      "phc_scan_date": "2007-12-07",
      "source": "phc",
      "question": "MRI scan (Image Data ID I84328) acquired on 12/07/2007 for a male participant (visit m12). Predict the subject's T1 scan age in years and answer with a numeric value using one decimal place.",
      "answer": "85.5",
      "answer_code": "85.5",
      "answer_units": "years",
      "demographics": {
        "sex": "male",
        "sex_code": "1",
        "visit": "m12",
        "phc_scandate": "2007-12-07",
        "image_acq_date": "12/07/2007"
      }
    },
    {
      "image_id": "I461030",
      "image_path": "ADNI_Nifti_QC_N4/I461030_T1_N4.nii.gz",
      "ptid": "137_S_0972",
      "visit": "v31",
      "acq_date": "12/09/2014",
      "phc_scan_date": "2014-12-09",
      "source": "phc",
      "question": "MRI scan (Image Data ID I461030) acquired on 12/09/2014 for a male participant (visit v31). Predict the subject's T1 scan age in years and answer with a numeric value using one decimal place.",
      "answer": "86",
      "answer_code": "86",
      "answer_units": "years",
      "demographics": {
        "sex": "male",
        "sex_code": "1",
        "visit": "v31",
        "phc_scandate": "2014-12-09",
        "image_acq_date": "12/09/2014"
      }
    },
    {
      "image_id": "I69885",
      "image_path": "ADNI_Nifti_QC_N4/I69885_T1_N4.nii.gz",
      "ptid": "007_S_0128",
      "visit": "m18",
      "acq_date": "8/20/2007",
      "phc_scan_date": "2007-08-20",
      "source": "phc",
      "question": "MRI scan (Image Data ID I69885) acquired on 8/20/2007 for a female participant (visit m18). Predict the subject's T1 scan age in years and answer with a numeric value using one decimal place.",
      "answer": "65.8",
      "answer_code": "65.8",
      "answer_units": "years",
      "demographics": {
        "sex": "female",
        "sex_code": "2",
        "visit": "m18",
        "phc_scandate": "2007-08-20",
        "image_acq_date": "8/20/2007"
      }
    },
    {
      "image_id": "I388286",
      "image_path": "ADNI_Nifti_QC_N4/I388286_T1_N4.nii.gz",
      "ptid": "033_S_0734",
      "visit": "v21",
      "acq_date": "8/30/2013",
      "phc_scan_date": "2013-08-30",
      "source": "phc",
      "question": "MRI scan (Image Data ID I388286) acquired on 8/30/2013 for a male participant (visit v21). Predict the subject's T1 scan age in years and answer with a numeric value using one decimal place.",
      "answer": "79.8",
      "answer_code": "79.8",
      "answer_units": "years",
      "demographics": {
        "sex": "male",
        "sex_code": "1",
        "visit": "v21",
        "phc_scandate": "2013-08-30",
        "image_acq_date": "8/30/2013"
      }
    },
    {
      "image_id": "I289653",
      "image_path": "ADNI_Nifti_QC_N4/I289653_T1_N4.nii.gz",
      "ptid": "100_S_4511",
      "visit": "v02",
      "acq_date": "3/09/2012",
      "phc_scan_date": "2012-03-09",
      "source": "phc",
      "question": "MRI scan (Image Data ID I289653) acquired on 3/09/2012 for a male participant (visit v02). Predict the subject's T1 scan age in years and answer with a numeric value using one decimal place.",
      "answer": "69.8",
      "answer_code": "69.8",
      "answer_units": "years",
      "demographics": {
        "sex": "male",
        "sex_code": "1",
        "visit": "v02",
        "phc_scandate": "2012-03-09",
        "image_acq_date": "3/09/2012"
      }
    },
    {
      "image_id": "I240238",
      "image_path": "ADNI_Nifti_QC_N4/I240238_T1_N4.nii.gz",
      "ptid": "153_S_4077",
      "visit": "v02",
      "acq_date": "6/15/2011",
      "phc_scan_date": "2011-06-15",
      "source": "phc",
      "question": "MRI scan (Image Data ID I240238) acquired on 6/15/2011 for a male participant (visit v02). Predict the subject's T1 scan age in years and answer with a numeric value using one decimal place.",
      "answer": "75.5",
      "answer_code": "75.5",
      "answer_units": "years",
      "demographics": {
        "sex": "male",
        "sex_code": "1",
        "visit": "v02",
        "phc_scandate": "2011-06-15",
        "image_acq_date": "6/15/2011"
      }
    },
    {
      "image_id": "I65946",
      "image_path": "ADNI_Nifti_QC_N4/I65946_T1_N4.nii.gz",
      "ptid": "067_S_1185",
      "visit": "m06",
      "acq_date": "8/07/2007",
      "phc_scan_date": "2007-08-07",
      "source": "phc",
      "question": "MRI scan (Image Data ID I65946) acquired on 8/07/2007 for a male participant (visit m06). Predict the subject's T1 scan age in years and answer with a numeric value using one decimal place.",
      "answer": "62.7",
      "answer_code": "62.7",
      "answer_units": "years",
      "demographics": {
        "sex": "male",
        "sex_code": "1",
        "visit": "m06",
        "phc_scandate": "2007-08-07",
        "image_acq_date": "8/07/2007"
      }
    },
    {
      "image_id": "I302554",
      "image_path": "ADNI_Nifti_QC_N4/I302554_T1_N4.nii.gz",
      "ptid": "031_S_4474",
      "visit": "v04",
      "acq_date": "5/07/2012",
      "phc_scan_date": "2012-05-07",
      "source": "phc",
      "question": "MRI scan (Image Data ID I302554) acquired on 5/07/2012 for a male participant (visit v04). Predict the subject's T1 scan age in years and answer with a numeric value using one decimal place.",
      "answer": "86",
      "answer_code": "86",
      "answer_units": "years",
      "demographics": {
        "sex": "male",
        "sex_code": "1",
        "visit": "v04",
        "phc_scandate": "2012-05-07",
        "image_acq_date": "5/07/2012"
      }
    },
    {
      "image_id": "I379744",
      "image_path": "ADNI_Nifti_QC_N4/I379744_T1_N4.nii.gz",
      "ptid": "003_S_5209",
      "visit": "v02",
      "acq_date": "7/09/2013",
      "phc_scan_date": "2013-07-09",
      "source": "phc",
      "question": "MRI scan (Image Data ID I379744) acquired on 7/09/2013 for a male participant (visit v02). Predict the subject's T1 scan age in years and answer with a numeric value using one decimal place.",
      "answer": "76.2",
      "answer_code": "76.2",
      "answer_units": "years",
      "demographics": {
        "sex": "male",
        "sex_code": "1",
        "visit": "v02",
        "phc_scandate": "2013-07-09",
        "image_acq_date": "7/09/2013"
      }
    },
    {
      "image_id": "I395677",
      "image_path": "ADNI_Nifti_QC_N4/I395677_T1_N4.nii.gz",
      "ptid": "129_S_4287",
      "visit": "v21",
      "acq_date": "10/22/2013",
      "phc_scan_date": "2013-10-22",
      "source": "phc",
      "question": "MRI scan (Image Data ID I395677) acquired on 10/22/2013 for a female participant (visit v21). Predict the subject's T1 scan age in years and answer with a numeric value using one decimal place.",
      "answer": "73",
      "answer_code": "73",
      "answer_units": "years",
      "demographics": {
        "sex": "female",
        "sex_code": "2",
        "visit": "v21",
        "phc_scandate": "2013-10-22",
        "image_acq_date": "10/22/2013"
      }
    },
    {
      "image_id": "I299100",
      "image_path": "ADNI_Nifti_QC_N4/I299100_T1_N4.nii.gz",
      "ptid": "072_S_4226",
      "visit": "v05",
      "acq_date": "4/20/2012",
      "phc_scan_date": "2012-04-20",
      "source": "phc",
      "question": "MRI scan (Image Data ID I299100) acquired on 4/20/2012 for a female participant (visit v05). Predict the subject's T1 scan age in years and answer with a numeric value using one decimal place.",
      "answer": "63.6",
      "answer_code": "63.6",
      "answer_units": "years",
      "demographics": {
        "sex": "female",
        "sex_code": "2",
        "visit": "v05",
        "phc_scandate": "2012-04-20",
        "image_acq_date": "4/20/2012"
      }
    },
    {
      "image_id": "I25185",
      "image_path": "ADNI_Nifti_QC_N4/I25185_T1_N4.nii.gz",
      "ptid": "141_S_0852",
      "visit": "sc",
      "acq_date": "9/25/2006",
      "phc_scan_date": "2006-09-25",
      "source": "phc",
      "question": "MRI scan (Image Data ID I25185) acquired on 9/25/2006 for a female participant (visit sc). Predict the subject's T1 scan age in years and answer with a numeric value using one decimal place.",
      "answer": "84.4",
      "answer_code": "84.4",
      "answer_units": "years",
      "demographics": {
        "sex": "female",
        "sex_code": "2",
        "visit": "sc",
        "phc_scandate": "2006-09-25",
        "image_acq_date": "9/25/2006"
      }
    },
    {
      "image_id": "I499238",
      "image_path": "ADNI_Nifti_QC_N4/I499238_T1_N4.nii.gz",
      "ptid": "073_S_5227",
      "visit": "v21",
      "acq_date": "6/30/2015",
      "phc_scan_date": "2015-06-30",
      "source": "phc",
      "question": "MRI scan (Image Data ID I499238) acquired on 6/30/2015 for a male participant (visit v21). Predict the subject's T1 scan age in years and answer with a numeric value using one decimal place.",
      "answer": "73.4",
      "answer_code": "73.4",
      "answer_units": "years",
      "demographics": {
        "sex": "male",
        "sex_code": "1",
        "visit": "v21",
        "phc_scandate": "2015-06-30",
        "image_acq_date": "6/30/2015"
      }
    },
    {
      "image_id": "I144165",
      "image_path": "ADNI_Nifti_QC_N4/I144165_T1_N4.nii.gz",
      "ptid": "116_S_0361",
      "visit": "m36",
      "acq_date": "4/29/2009",
      "phc_scan_date": "2009-04-29",
      "source": "phc",
      "question": "MRI scan (Image Data ID I144165) acquired on 4/29/2009 for a male participant (visit m36). Predict the subject's T1 scan age in years and answer with a numeric value using one decimal place.",
      "answer": "77.6",
      "answer_code": "77.6",
      "answer_units": "years",
      "demographics": {
        "sex": "male",
        "sex_code": "1",
        "visit": "m36",
        "phc_scandate": "2009-04-29",
        "image_acq_date": "4/29/2009"
      }
    },
    {
      "image_id": "I469588",
      "image_path": "ADNI_Nifti_QC_N4/I469588_T1_N4.nii.gz",
      "ptid": "027_S_2183",
      "visit": "v21",
      "acq_date": "1/21/2015",
      "phc_scan_date": "2015-01-21",
      "source": "phc",
      "question": "MRI scan (Image Data ID I469588) acquired on 1/21/2015 for a male participant (visit v21). Predict the subject's T1 scan age in years and answer with a numeric value using one decimal place.",
      "answer": "87.4",
      "answer_code": "87.4",
      "answer_units": "years",
      "demographics": {
        "sex": "male",
        "sex_code": "1",
        "visit": "v21",
        "phc_scandate": "2015-01-21",
        "image_acq_date": "1/21/2015"
      }
    },
    {
      "image_id": "I346866",
      "image_path": "ADNI_Nifti_QC_N4/I346866_T1_N4.nii.gz",
      "ptid": "128_S_4607",
      "visit": "v05",
      "acq_date": "11/09/2012",
      "phc_scan_date": "2012-11-09",
      "source": "phc",
      "question": "MRI scan (Image Data ID I346866) acquired on 11/09/2012 for a female participant (visit v05). Predict the subject's T1 scan age in years and answer with a numeric value using one decimal place.",
      "answer": "56.9",
      "answer_code": "56.9",
      "answer_units": "years",
      "demographics": {
        "sex": "female",
        "sex_code": "2",
        "visit": "v05",
        "phc_scandate": "2012-11-09",
        "image_acq_date": "11/09/2012"
      }
    },
    {
      "image_id": "I394452",
      "image_path": "ADNI_Nifti_QC_N4/I394452_T1_N4.nii.gz",
      "ptid": "135_S_4954",
      "visit": "v11",
      "acq_date": "10/15/2013",
      "phc_scan_date": "2013-10-15",
      "source": "phc",
      "question": "MRI scan (Image Data ID I394452) acquired on 10/15/2013 for a male participant (visit v11). Predict the subject's T1 scan age in years and answer with a numeric value using one decimal place.",
      "answer": "62.3",
      "answer_code": "62.3",
      "answer_units": "years",
      "demographics": {
        "sex": "male",
        "sex_code": "1",
        "visit": "v11",
        "phc_scandate": "2013-10-15",
        "image_acq_date": "10/15/2013"
      }
    },
    {
      "image_id": "I7211",
      "image_path": "ADNI_Nifti_QC_N4/I7211_T1_N4.nii.gz",
      "ptid": "011_S_0008",
      "visit": "sc",
      "acq_date": "9/13/2005",
      "phc_scan_date": "2005-09-13",
      "source": "phc",
      "question": "MRI scan (Image Data ID I7211) acquired on 9/13/2005 for a female participant (visit sc). Predict the subject's T1 scan age in years and answer with a numeric value using one decimal place.",
      "answer": "84.6",
      "answer_code": "84.6",
      "answer_units": "years",
      "demographics": {
        "sex": "female",
        "sex_code": "2",
        "visit": "sc",
        "phc_scandate": "2005-09-13",
        "image_acq_date": "9/13/2005"
      }
    },
    {
      "image_id": "I129443",
      "image_path": "ADNI_Nifti_QC_N4/I129443_T1_N4.nii.gz",
      "ptid": "023_S_0042",
      "visit": "m36",
      "acq_date": "12/05/2008",
      "phc_scan_date": "2008-12-05",
      "source": "phc",
      "question": "MRI scan (Image Data ID I129443) acquired on 12/05/2008 for a male participant (visit m36). Predict the subject's T1 scan age in years and answer with a numeric value using one decimal place.",
      "answer": "76",
      "answer_code": "76",
      "answer_units": "years",
      "demographics": {
        "sex": "male",
        "sex_code": "1",
        "visit": "m36",
        "phc_scandate": "2008-12-05",
        "image_acq_date": "12/05/2008"
      }
    },
    {
      "image_id": "I430316",
      "image_path": "ADNI_Nifti_QC_N4/I430316_T1_N4.nii.gz",
      "ptid": "094_S_4649",
      "visit": "v21",
      "acq_date": "6/10/2014",
      "phc_scan_date": "2014-06-10",
      "source": "phc",
      "question": "MRI scan (Image Data ID I430316) acquired on 6/10/2014 for a male participant (visit v21). Predict the subject's T1 scan age in years and answer with a numeric value using one decimal place.",
      "answer": "67.6",
      "answer_code": "67.6",
      "answer_units": "years",
      "demographics": {
        "sex": "male",
        "sex_code": "1",
        "visit": "v21",
        "phc_scandate": "2014-06-10",
        "image_acq_date": "6/10/2014"
      }
    },
    {
      "image_id": "I333665",
      "image_path": "ADNI_Nifti_QC_N4/I333665_T1_N4.nii.gz",
      "ptid": "116_S_0752",
      "visit": "v11",
      "acq_date": "9/11/2012",
      "phc_scan_date": "2012-09-11",
      "source": "phc",
      "question": "MRI scan (Image Data ID I333665) acquired on 9/11/2012 for a female participant (visit v11). Predict the subject's T1 scan age in years and answer with a numeric value using one decimal place.",
      "answer": "88.1",
      "answer_code": "88.1",
      "answer_units": "years",
      "demographics": {
        "sex": "female",
        "sex_code": "2",
        "visit": "v11",
        "phc_scandate": "2012-09-11",
        "image_acq_date": "9/11/2012"
      }
    },
    {
      "image_id": "I287221",
      "image_path": "ADNI_Nifti_QC_N4/I287221_T1_N4.nii.gz",
      "ptid": "073_S_4393",
      "visit": "v04",
      "acq_date": "2/29/2012",
      "phc_scan_date": "2012-02-29",
      "source": "phc",
      "question": "MRI scan (Image Data ID I287221) acquired on 2/29/2012 for a male participant (visit v04). Predict the subject's T1 scan age in years and answer with a numeric value using one decimal place.",
      "answer": "73.8",
      "answer_code": "73.8",
      "answer_units": "years",
      "demographics": {
        "sex": "male",
        "sex_code": "1",
        "visit": "v04",
        "phc_scandate": "2012-02-29",
        "image_acq_date": "2/29/2012"
      }
    },
    {
      "image_id": "I47669",
      "image_path": "ADNI_Nifti_QC_N4/I47669_T1_N4.nii.gz",
      "ptid": "007_S_1304",
      "visit": "bl",
      "acq_date": "4/02/2007",
      "phc_scan_date": "2007-04-02",
      "source": "phc",
      "question": "MRI scan (Image Data ID I47669) acquired on 4/02/2007 for a female participant (visit bl). Predict the subject's T1 scan age in years and answer with a numeric value using one decimal place.",
      "answer": "74.9",
      "answer_code": "74.9",
      "answer_units": "years",
      "demographics": {
        "sex": "female",
        "sex_code": "2",
        "visit": "bl",
        "phc_scandate": "2007-04-02",
        "image_acq_date": "4/02/2007"
      }
    },
    {
      "image_id": "I370446",
      "image_path": "ADNI_Nifti_QC_N4/I370446_T1_N4.nii.gz",
      "ptid": "019_S_4680",
      "visit": "v11",
      "acq_date": "5/06/2013",
      "phc_scan_date": "2013-05-06",
      "source": "phc",
      "question": "MRI scan (Image Data ID I370446) acquired on 5/06/2013 for a female participant (visit v11). Predict the subject's T1 scan age in years and answer with a numeric value using one decimal place.",
      "answer": "64.5",
      "answer_code": "64.5",
      "answer_units": "years",
      "demographics": {
        "sex": "female",
        "sex_code": "2",
        "visit": "v11",
        "phc_scandate": "2013-05-06",
        "image_acq_date": "5/06/2013"
      }
    },
    {
      "image_id": "I330549",
      "image_path": "ADNI_Nifti_QC_N4/I330549_T1_N4.nii.gz",
      "ptid": "123_S_4780",
      "visit": "v04",
      "acq_date": "9/04/2012",
      "phc_scan_date": "2012-09-04",
      "source": "phc",
      "question": "MRI scan (Image Data ID I330549) acquired on 9/04/2012 for a female participant (visit v04). Predict the subject's T1 scan age in years and answer with a numeric value using one decimal place.",
      "answer": "70.5",
      "answer_code": "70.5",
      "answer_units": "years",
      "demographics": {
        "sex": "female",
        "sex_code": "2",
        "visit": "v04",
        "phc_scandate": "2012-09-04",
        "image_acq_date": "9/04/2012"
      }
    },
    {
      "image_id": "I208016",
      "image_path": "ADNI_Nifti_QC_N4/I208016_T1_N4.nii.gz",
      "ptid": "035_S_2192",
      "visit": "scmri",
      "acq_date": "12/08/2010",
      "phc_scan_date": "2010-12-08",
      "source": "phc",
      "question": "MRI scan (Image Data ID I208016) acquired on 12/08/2010 for a female participant (visit scmri). Predict the subject's T1 scan age in years and answer with a numeric value using one decimal place.",
      "answer": "73.4",
      "answer_code": "73.4",
      "answer_units": "years",
      "demographics": {
        "sex": "female",
        "sex_code": "2",
        "visit": "scmri",
        "phc_scandate": "2010-12-08",
        "image_acq_date": "12/08/2010"
      }
    },
    {
      "image_id": "I77851",
      "image_path": "ADNI_Nifti_QC_N4/I77851_T1_N4.nii.gz",
      "ptid": "033_S_0922",
      "visit": "m12",
      "acq_date": "10/12/2007",
      "phc_scan_date": "2007-10-12",
      "source": "phc",
      "question": "MRI scan (Image Data ID I77851) acquired on 10/12/2007 for a male participant (visit m12). Predict the subject's T1 scan age in years and answer with a numeric value using one decimal place.",
      "answer": "69.2",
      "answer_code": "69.2",
      "answer_units": "years",
      "demographics": {
        "sex": "male",
        "sex_code": "1",
        "visit": "m12",
        "phc_scandate": "2007-10-12",
        "image_acq_date": "10/12/2007"
      }
    },
    {
      "image_id": "I431117",
      "image_path": "ADNI_Nifti_QC_N4/I431117_T1_N4.nii.gz",
      "ptid": "135_S_4723",
      "visit": "v21",
      "acq_date": "6/17/2014",
      "phc_scan_date": "2014-06-17",
      "source": "phc",
      "question": "MRI scan (Image Data ID I431117) acquired on 6/17/2014 for a female participant (visit v21). Predict the subject's T1 scan age in years and answer with a numeric value using one decimal place.",
      "answer": "71.6",
      "answer_code": "71.6",
      "answer_units": "years",
      "demographics": {
        "sex": "female",
        "sex_code": "2",
        "visit": "v21",
        "phc_scandate": "2014-06-17",
        "image_acq_date": "6/17/2014"
      }
    },
    {
      "image_id": "I38877",
      "image_path": "ADNI_Nifti_QC_N4/I38877_T1_N4.nii.gz",
      "ptid": "131_S_0691",
      "visit": "m06",
      "acq_date": "2/09/2007",
      "phc_scan_date": "2007-02-09",
      "source": "phc",
      "question": "MRI scan (Image Data ID I38877) acquired on 2/09/2007 for a male participant (visit m06). Predict the subject's T1 scan age in years and answer with a numeric value using one decimal place.",
      "answer": "65",
      "answer_code": "65",
      "answer_units": "years",
      "demographics": {
        "sex": "male",
        "sex_code": "1",
        "visit": "m06",
        "phc_scandate": "2007-02-09",
        "image_acq_date": "2/09/2007"
      }
    },
    {
      "image_id": "I393951",
      "image_path": "ADNI_Nifti_QC_N4/I393951_T1_N4.nii.gz",
      "ptid": "027_S_4962",
      "visit": "v11",
      "acq_date": "10/08/2013",
      "phc_scan_date": "2013-10-08",
      "source": "phc",
      "question": "MRI scan (Image Data ID I393951) acquired on 10/08/2013 for a female participant (visit v11). Predict the subject's T1 scan age in years and answer with a numeric value using one decimal place.",
      "answer": "81.2",
      "answer_code": "81.2",
      "answer_units": "years",
      "demographics": {
        "sex": "female",
        "sex_code": "2",
        "visit": "v11",
        "phc_scandate": "2013-10-08",
        "image_acq_date": "10/08/2013"
      }
    },
    {
      "image_id": "I414938",
      "image_path": "ADNI_Nifti_QC_N4/I414938_T1_N4.nii.gz",
      "ptid": "002_S_5256",
      "visit": "v05",
      "acq_date": "2/19/2014",
      "phc_scan_date": "2014-02-19",
      "source": "phc",
      "question": "MRI scan (Image Data ID I414938) acquired on 2/19/2014 for a female participant (visit v05). Predict the subject's T1 scan age in years and answer with a numeric value using one decimal place.",
      "answer": "71.1",
      "answer_code": "71.1",
      "answer_units": "years",
      "demographics": {
        "sex": "female",
        "sex_code": "2",
        "visit": "v05",
        "phc_scandate": "2014-02-19",
        "image_acq_date": "2/19/2014"
      }
    },
    {
      "image_id": "I144856",
      "image_path": "ADNI_Nifti_QC_N4/I144856_T1_N4.nii.gz",
      "ptid": "073_S_0386",
      "visit": "m36",
      "acq_date": "5/28/2009",
      "phc_scan_date": "2009-05-28",
      "source": "phc",
      "question": "MRI scan (Image Data ID I144856) acquired on 5/28/2009 for a female participant (visit m36). Predict the subject's T1 scan age in years and answer with a numeric value using one decimal place.",
      "answer": "75.5",
      "answer_code": "75.5",
      "answer_units": "years",
      "demographics": {
        "sex": "female",
        "sex_code": "2",
        "visit": "m36",
        "phc_scandate": "2009-05-28",
        "image_acq_date": "5/28/2009"
      }
    },
    {
      "image_id": "I264215",
      "image_path": "ADNI_Nifti_QC_N4/I264215_T1_N4.nii.gz",
      "ptid": "136_S_4269",
      "visit": "v02",
      "acq_date": "10/31/2011",
      "phc_scan_date": "2011-10-31",
      "source": "phc",
      "question": "MRI scan (Image Data ID I264215) acquired on 10/31/2011 for a female participant (visit v02). Predict the subject's T1 scan age in years and answer with a numeric value using one decimal place.",
      "answer": "65.7",
      "answer_code": "65.7",
      "answer_units": "years",
      "demographics": {
        "sex": "female",
        "sex_code": "2",
        "visit": "v02",
        "phc_scandate": "2011-10-31",
        "image_acq_date": "10/31/2011"
      }
    },
    {
      "image_id": "I338729",
      "image_path": "ADNI_Nifti_QC_N4/I338729_T1_N4.nii.gz",
      "ptid": "027_S_4955",
      "visit": "v02",
      "acq_date": "10/04/2012",
      "phc_scan_date": "2012-10-04",
      "source": "phc",
      "question": "MRI scan (Image Data ID I338729) acquired on 10/04/2012 for a male participant (visit v02). Predict the subject's T1 scan age in years and answer with a numeric value using one decimal place.",
      "answer": "71.5",
      "answer_code": "71.5",
      "answer_units": "years",
      "demographics": {
        "sex": "male",
        "sex_code": "1",
        "visit": "v02",
        "phc_scandate": "2012-10-04",
        "image_acq_date": "10/04/2012"
      }
    },
    {
      "image_id": "I192620",
      "image_path": "ADNI_Nifti_QC_N4/I192620_T1_N4.nii.gz",
      "ptid": "016_S_0702",
      "visit": "m48",
      "acq_date": "8/31/2010",
      "phc_scan_date": "2010-08-31",
      "source": "phc",
      "question": "MRI scan (Image Data ID I192620) acquired on 8/31/2010 for a male participant (visit m48). Predict the subject's T1 scan age in years and answer with a numeric value using one decimal place.",
      "answer": "89.2",
      "answer_code": "89.2",
      "answer_units": "years",
      "demographics": {
        "sex": "male",
        "sex_code": "1",
        "visit": "m48",
        "phc_scandate": "2010-08-31",
        "image_acq_date": "8/31/2010"
      }
    },
    {
      "image_id": "I388701",
      "image_path": "ADNI_Nifti_QC_N4/I388701_T1_N4.nii.gz",
      "ptid": "129_S_0778",
      "visit": "v21",
      "acq_date": "9/04/2013",
      "phc_scan_date": "2013-09-04",
      "source": "phc",
      "question": "MRI scan (Image Data ID I388701) acquired on 9/04/2013 for a male participant (visit v21). Predict the subject's T1 scan age in years and answer with a numeric value using one decimal place.",
      "answer": "79.6",
      "answer_code": "79.6",
      "answer_units": "years",
      "demographics": {
        "sex": "male",
        "sex_code": "1",
        "visit": "v21",
        "phc_scandate": "2013-09-04",
        "image_acq_date": "9/04/2013"
      }
    },
    {
      "image_id": "I320038",
      "image_path": "ADNI_Nifti_QC_N4/I320038_T1_N4.nii.gz",
      "ptid": "141_S_4426",
      "visit": "v05",
      "acq_date": "7/28/2012",
      "phc_scan_date": "2012-07-28",
      "source": "phc",
      "question": "MRI scan (Image Data ID I320038) acquired on 7/28/2012 for a male participant (visit v05). Predict the subject's T1 scan age in years and answer with a numeric value using one decimal place.",
      "answer": "77.9",
      "answer_code": "77.9",
      "answer_units": "years",
      "demographics": {
        "sex": "male",
        "sex_code": "1",
        "visit": "v05",
        "phc_scandate": "2012-07-28",
        "image_acq_date": "7/28/2012"
      }
    },
    {
      "image_id": "I285160",
      "image_path": "ADNI_Nifti_QC_N4/I285160_T1_N4.nii.gz",
      "ptid": "135_S_4356",
      "visit": "v04",
      "acq_date": "2/16/2012",
      "phc_scan_date": "2012-02-16",
      "source": "phc",
      "question": "MRI scan (Image Data ID I285160) acquired on 2/16/2012 for a male participant (visit v04). Predict the subject's T1 scan age in years and answer with a numeric value using one decimal place.",
      "answer": "68.4",
      "answer_code": "68.4",
      "answer_units": "years",
      "demographics": {
        "sex": "male",
        "sex_code": "1",
        "visit": "v04",
        "phc_scandate": "2012-02-16",
        "image_acq_date": "2/16/2012"
      }
    },
    {
      "image_id": "I269635",
      "image_path": "ADNI_Nifti_QC_N4/I269635_T1_N4.nii.gz",
      "ptid": "137_S_4351",
      "visit": "v02",
      "acq_date": "12/02/2011",
      "phc_scan_date": "2011-12-02",
      "source": "phc",
      "question": "MRI scan (Image Data ID I269635) acquired on 12/02/2011 for a female participant (visit v02). Predict the subject's T1 scan age in years and answer with a numeric value using one decimal place.",
      "answer": "67.9",
      "answer_code": "67.9",
      "answer_units": "years",
      "demographics": {
        "sex": "female",
        "sex_code": "2",
        "visit": "v02",
        "phc_scandate": "2011-12-02",
        "image_acq_date": "12/02/2011"
      }
    },
    {
      "image_id": "I350652",
      "image_path": "ADNI_Nifti_QC_N4/I350652_T1_N4.nii.gz",
      "ptid": "082_S_4339",
      "visit": "v11",
      "acq_date": "12/10/2012",
      "phc_scan_date": "2012-12-10",
      "source": "phc",
      "question": "MRI scan (Image Data ID I350652) acquired on 12/10/2012 for a male participant (visit v11). Predict the subject's T1 scan age in years and answer with a numeric value using one decimal place.",
      "answer": "85.5",
      "answer_code": "85.5",
      "answer_units": "years",
      "demographics": {
        "sex": "male",
        "sex_code": "1",
        "visit": "v11",
        "phc_scandate": "2012-12-10",
        "image_acq_date": "12/10/2012"
      }
    },
    {
      "image_id": "I270386",
      "image_path": "ADNI_Nifti_QC_N4/I270386_T1_N4.nii.gz",
      "ptid": "082_S_4224",
      "visit": "v04",
      "acq_date": "12/06/2011",
      "phc_scan_date": "2011-12-06",
      "source": "phc",
      "question": "MRI scan (Image Data ID I270386) acquired on 12/06/2011 for a male participant (visit v04). Predict the subject's T1 scan age in years and answer with a numeric value using one decimal place.",
      "answer": "75.4",
      "answer_code": "75.4",
      "answer_units": "years",
      "demographics": {
        "sex": "male",
        "sex_code": "1",
        "visit": "v04",
        "phc_scandate": "2011-12-06",
        "image_acq_date": "12/06/2011"
      }
    },
    {
      "image_id": "I114056",
      "image_path": "ADNI_Nifti_QC_N4/I114056_T1_N4.nii.gz",
      "ptid": "016_S_1121",
      "visit": "m18",
      "acq_date": "7/21/2008",
      "phc_scan_date": "2008-07-21",
      "source": "phc",
      "question": "MRI scan (Image Data ID I114056) acquired on 7/21/2008 for a female participant (visit m18). Predict the subject's T1 scan age in years and answer with a numeric value using one decimal place.",
      "answer": "57.9",
      "answer_code": "57.9",
      "answer_units": "years",
      "demographics": {
        "sex": "female",
        "sex_code": "2",
        "visit": "m18",
        "phc_scandate": "2008-07-21",
        "image_acq_date": "7/21/2008"
      }
    },
    {
      "image_id": "I115805",
      "image_path": "ADNI_Nifti_QC_N4/I115805_T1_N4.nii.gz",
      "ptid": "033_S_0725",
      "visit": "m24",
      "acq_date": "8/06/2008",
      "phc_scan_date": "2008-08-06",
      "source": "phc",
      "question": "MRI scan (Image Data ID I115805) acquired on 8/06/2008 for a male participant (visit m24). Predict the subject's T1 scan age in years and answer with a numeric value using one decimal place.",
      "answer": "83.1",
      "answer_code": "83.1",
      "answer_units": "years",
      "demographics": {
        "sex": "male",
        "sex_code": "1",
        "visit": "m24",
        "phc_scandate": "2008-08-06",
        "image_acq_date": "8/06/2008"
      }
    },
    {
      "image_id": "I310636",
      "image_path": "ADNI_Nifti_QC_N4/I310636_T1_N4.nii.gz",
      "ptid": "128_S_2002",
      "visit": "v06",
      "acq_date": "6/13/2012",
      "phc_scan_date": "2012-06-13",
      "source": "phc",
      "question": "MRI scan (Image Data ID I310636) acquired on 6/13/2012 for a male participant (visit v06). Predict the subject's T1 scan age in years and answer with a numeric value using one decimal place.",
      "answer": "67",
      "answer_code": "67",
      "answer_units": "years",
      "demographics": {
        "sex": "male",
        "sex_code": "1",
        "visit": "v06",
        "phc_scandate": "2012-06-13",
        "image_acq_date": "6/13/2012"
      }
    },
    {
      "image_id": "I195412",
      "image_path": "ADNI_Nifti_QC_N4/I195412_T1_N4.nii.gz",
      "ptid": "023_S_0625",
      "visit": "m48",
      "acq_date": "10/07/2010",
      "phc_scan_date": "2010-10-07",
      "source": "phc",
      "question": "MRI scan (Image Data ID I195412) acquired on 10/07/2010 for a male participant (visit m48). Predict the subject's T1 scan age in years and answer with a numeric value using one decimal place.",
      "answer": "80.3",
      "answer_code": "80.3",
      "answer_units": "years",
      "demographics": {
        "sex": "male",
        "sex_code": "1",
        "visit": "m48",
        "phc_scandate": "2010-10-07",
        "image_acq_date": "10/07/2010"
      }
    },
    {
      "image_id": "I252720",
      "image_path": "ADNI_Nifti_QC_N4/I252720_T1_N4.nii.gz",
      "ptid": "116_S_4167",
      "visit": "v02",
      "acq_date": "8/10/2011",
      "phc_scan_date": "2011-08-10",
      "source": "phc",
      "question": "MRI scan (Image Data ID I252720) acquired on 8/10/2011 for a female participant (visit v02). Predict the subject's T1 scan age in years and answer with a numeric value using one decimal place.",
      "answer": "69.6",
      "answer_code": "69.6",
      "answer_units": "years",
      "demographics": {
        "sex": "female",
        "sex_code": "2",
        "visit": "v02",
        "phc_scandate": "2011-08-10",
        "image_acq_date": "8/10/2011"
      }
    },
    {
      "image_id": "I344118",
      "image_path": "ADNI_Nifti_QC_N4/I344118_T1_N4.nii.gz",
      "ptid": "135_S_4676",
      "visit": "v05",
      "acq_date": "11/06/2012",
      "phc_scan_date": "2012-11-06",
      "source": "phc",
      "question": "MRI scan (Image Data ID I344118) acquired on 11/06/2012 for a male participant (visit v05). Predict the subject's T1 scan age in years and answer with a numeric value using one decimal place.",
      "answer": "79.5",
      "answer_code": "79.5",
      "answer_units": "years",
      "demographics": {
        "sex": "male",
        "sex_code": "1",
        "visit": "v05",
        "phc_scandate": "2012-11-06",
        "image_acq_date": "11/06/2012"
      }
    },
    {
      "image_id": "I262208",
      "image_path": "ADNI_Nifti_QC_N4/I262208_T1_N4.nii.gz",
      "ptid": "021_S_2125",
      "visit": "v06",
      "acq_date": "10/24/2011",
      "phc_scan_date": "2011-10-24",
      "source": "phc",
      "question": "MRI scan (Image Data ID I262208) acquired on 10/24/2011 for a female participant (visit v06). Predict the subject's T1 scan age in years and answer with a numeric value using one decimal place.",
      "answer": "79.3",
      "answer_code": "79.3",
      "answer_units": "years",
      "demographics": {
        "sex": "female",
        "sex_code": "2",
        "visit": "v06",
        "phc_scandate": "2011-10-24",
        "image_acq_date": "10/24/2011"
      }
    },
    {
      "image_id": "I245969",
      "image_path": "ADNI_Nifti_QC_N4/I245969_T1_N4.nii.gz",
      "ptid": "072_S_4103",
      "visit": "v02",
      "acq_date": "7/20/2011",
      "phc_scan_date": "2011-07-20",
      "source": "phc",
      "question": "MRI scan (Image Data ID I245969) acquired on 7/20/2011 for a male participant (visit v02). Predict the subject's T1 scan age in years and answer with a numeric value using one decimal place.",
      "answer": "71.1",
      "answer_code": "71.1",
      "answer_units": "years",
      "demographics": {
        "sex": "male",
        "sex_code": "1",
        "visit": "v02",
        "phc_scandate": "2011-07-20",
        "image_acq_date": "7/20/2011"
      }
    },
    {
      "image_id": "I318399",
      "image_path": "ADNI_Nifti_QC_N4/I318399_T1_N4.nii.gz",
      "ptid": "011_S_4120",
      "visit": "v11",
      "acq_date": "7/24/2012",
      "phc_scan_date": "2012-07-24",
      "source": "phc",
      "question": "MRI scan (Image Data ID I318399) acquired on 7/24/2012 for a female participant (visit v11). Predict the subject's T1 scan age in years and answer with a numeric value using one decimal place.",
      "answer": "82.9",
      "answer_code": "82.9",
      "answer_units": "years",
      "demographics": {
        "sex": "female",
        "sex_code": "2",
        "visit": "v11",
        "phc_scandate": "2012-07-24",
        "image_acq_date": "7/24/2012"
      }
    },
    {
      "image_id": "I261785",
      "image_path": "ADNI_Nifti_QC_N4/I261785_T1_N4.nii.gz",
      "ptid": "109_S_4260",
      "visit": "v02",
      "acq_date": "10/14/2011",
      "phc_scan_date": "2011-10-14",
      "source": "phc",
      "question": "MRI scan (Image Data ID I261785) acquired on 10/14/2011 for a female participant (visit v02). Predict the subject's T1 scan age in years and answer with a numeric value using one decimal place.",
      "answer": "77.7",
      "answer_code": "77.7",
      "answer_units": "years",
      "demographics": {
        "sex": "female",
        "sex_code": "2",
        "visit": "v02",
        "phc_scandate": "2011-10-14",
        "image_acq_date": "10/14/2011"
      }
    },
    {
      "image_id": "I401556",
      "image_path": "ADNI_Nifti_QC_N4/I401556_T1_N4.nii.gz",
      "ptid": "041_S_5026",
      "visit": "v11",
      "acq_date": "12/11/2013",
      "phc_scan_date": "2013-12-11",
      "source": "phc",
      "question": "MRI scan (Image Data ID I401556) acquired on 12/11/2013 for a female participant (visit v11). Predict the subject's T1 scan age in years and answer with a numeric value using one decimal place.",
      "answer": "71.7",
      "answer_code": "71.7",
      "answer_units": "years",
      "demographics": {
        "sex": "female",
        "sex_code": "2",
        "visit": "v11",
        "phc_scandate": "2013-12-11",
        "image_acq_date": "12/11/2013"
      }
    },
    {
      "image_id": "I290437",
      "image_path": "ADNI_Nifti_QC_N4/I290437_T1_N4.nii.gz",
      "ptid": "012_S_4128",
      "visit": "v05",
      "acq_date": "3/06/2012",
      "phc_scan_date": "2012-03-06",
      "source": "phc",
      "question": "MRI scan (Image Data ID I290437) acquired on 3/06/2012 for a female participant (visit v05). Predict the subject's T1 scan age in years and answer with a numeric value using one decimal place.",
      "answer": "73.5",
      "answer_code": "73.5",
      "answer_units": "years",
      "demographics": {
        "sex": "female",
        "sex_code": "2",
        "visit": "v05",
        "phc_scandate": "2012-03-06",
        "image_acq_date": "3/06/2012"
      }
    },
    {
      "image_id": "I284993",
      "image_path": "ADNI_Nifti_QC_N4/I284993_T1_N4.nii.gz",
      "ptid": "022_S_4444",
      "visit": "v02",
      "acq_date": "2/14/2012",
      "phc_scan_date": "2012-02-14",
      "source": "phc",
      "question": "MRI scan (Image Data ID I284993) acquired on 2/14/2012 for a male participant (visit v02). Predict the subject's T1 scan age in years and answer with a numeric value using one decimal place.",
      "answer": "77.7",
      "answer_code": "77.7",
      "answer_units": "years",
      "demographics": {
        "sex": "male",
        "sex_code": "1",
        "visit": "v02",
        "phc_scandate": "2012-02-14",
        "image_acq_date": "2/14/2012"
      }
    },
    {
      "image_id": "I56821",
      "image_path": "ADNI_Nifti_QC_N4/I56821_T1_N4.nii.gz",
      "ptid": "014_S_1095",
      "visit": "m06",
      "acq_date": "6/12/2007",
      "phc_scan_date": "2007-06-12",
      "source": "phc",
      "question": "MRI scan (Image Data ID I56821) acquired on 6/12/2007 for a female participant (visit m06). Predict the subject's T1 scan age in years and answer with a numeric value using one decimal place.",
      "answer": "80.9",
      "answer_code": "80.9",
      "answer_units": "years",
      "demographics": {
        "sex": "female",
        "sex_code": "2",
        "visit": "m06",
        "phc_scandate": "2007-06-12",
        "image_acq_date": "6/12/2007"
      }
    },
    {
      "image_id": "I373483",
      "image_path": "ADNI_Nifti_QC_N4/I373483_T1_N4.nii.gz",
      "ptid": "094_S_2367",
      "visit": "v11",
      "acq_date": "5/21/2013",
      "phc_scan_date": "2013-05-21",
      "source": "phc",
      "question": "MRI scan (Image Data ID I373483) acquired on 5/21/2013 for a male participant (visit v11). Predict the subject's T1 scan age in years and answer with a numeric value using one decimal place.",
      "answer": "76.9",
      "answer_code": "76.9",
      "answer_units": "years",
      "demographics": {
        "sex": "male",
        "sex_code": "1",
        "visit": "v11",
        "phc_scandate": "2013-05-21",
        "image_acq_date": "5/21/2013"
      }
    },
    {
      "image_id": "I278815",
      "image_path": "ADNI_Nifti_QC_N4/I278815_T1_N4.nii.gz",
      "ptid": "002_S_4447",
      "visit": "v02",
      "acq_date": "1/17/2012",
      "phc_scan_date": "2012-01-17",
      "source": "phc",
      "question": "MRI scan (Image Data ID I278815) acquired on 1/17/2012 for a female participant (visit v02). Predict the subject's T1 scan age in years and answer with a numeric value using one decimal place.",
      "answer": "67.6",
      "answer_code": "67.6",
      "answer_units": "years",
      "demographics": {
        "sex": "female",
        "sex_code": "2",
        "visit": "v02",
        "phc_scandate": "2012-01-17",
        "image_acq_date": "1/17/2012"
      }
    },
    {
      "image_id": "I379092",
      "image_path": "ADNI_Nifti_QC_N4/I379092_T1_N4.nii.gz",
      "ptid": "019_S_5242",
      "visit": "v02",
      "acq_date": "7/02/2013",
      "phc_scan_date": "2013-07-02",
      "source": "phc",
      "question": "MRI scan (Image Data ID I379092) acquired on 7/02/2013 for a male participant (visit v02). Predict the subject's T1 scan age in years and answer with a numeric value using one decimal place.",
      "answer": "67.3",
      "answer_code": "67.3",
      "answer_units": "years",
      "demographics": {
        "sex": "male",
        "sex_code": "1",
        "visit": "v02",
        "phc_scandate": "2013-07-02",
        "image_acq_date": "7/02/2013"
      }
    },
    {
      "image_id": "I44642",
      "image_path": "ADNI_Nifti_QC_N4/I44642_T1_N4.nii.gz",
      "ptid": "133_S_0727",
      "visit": "m06",
      "acq_date": "3/14/2007",
      "phc_scan_date": "2007-03-14",
      "source": "phc",
      "question": "MRI scan (Image Data ID I44642) acquired on 3/14/2007 for a female participant (visit m06). Predict the subject's T1 scan age in years and answer with a numeric value using one decimal place.",
      "answer": "69.9",
      "answer_code": "69.9",
      "answer_units": "years",
      "demographics": {
        "sex": "female",
        "sex_code": "2",
        "visit": "m06",
        "phc_scandate": "2007-03-14",
        "image_acq_date": "3/14/2007"
      }
    },
    {
      "image_id": "I137176",
      "image_path": "ADNI_Nifti_QC_N4/I137176_T1_N4.nii.gz",
      "ptid": "003_S_1074",
      "visit": "m24",
      "acq_date": "2/26/2009",
      "phc_scan_date": "2009-02-26",
      "source": "phc",
      "question": "MRI scan (Image Data ID I137176) acquired on 2/26/2009 for a female participant (visit m24). Predict the subject's T1 scan age in years and answer with a numeric value using one decimal place.",
      "answer": "87.5",
      "answer_code": "87.5",
      "answer_units": "years",
      "demographics": {
        "sex": "female",
        "sex_code": "2",
        "visit": "m24",
        "phc_scandate": "2009-02-26",
        "image_acq_date": "2/26/2009"
      }
    },
    {
      "image_id": "I444267",
      "image_path": "ADNI_Nifti_QC_N4/I444267_T1_N4.nii.gz",
      "ptid": "127_S_4928",
      "visit": "v21",
      "acq_date": "9/19/2014",
      "phc_scan_date": "2014-09-19",
      "source": "phc",
      "question": "MRI scan (Image Data ID I444267) acquired on 9/19/2014 for a male participant (visit v21). Predict the subject's T1 scan age in years and answer with a numeric value using one decimal place.",
      "answer": "79.9",
      "answer_code": "79.9",
      "answer_units": "years",
      "demographics": {
        "sex": "male",
        "sex_code": "1",
        "visit": "v21",
        "phc_scandate": "2014-09-19",
        "image_acq_date": "9/19/2014"
      }
    },
    {
      "image_id": "I423126",
      "image_path": "ADNI_Nifti_QC_N4/I423126_T1_N4.nii.gz",
      "ptid": "003_S_5130",
      "visit": "v11",
      "acq_date": "4/25/2014",
      "phc_scan_date": "2014-04-25",
      "source": "phc",
      "question": "MRI scan (Image Data ID I423126) acquired on 4/25/2014 for a male participant (visit v11). Predict the subject's T1 scan age in years and answer with a numeric value using one decimal place.",
      "answer": "67.5",
      "answer_code": "67.5",
      "answer_units": "years",
      "demographics": {
        "sex": "male",
        "sex_code": "1",
        "visit": "v11",
        "phc_scandate": "2014-04-25",
        "image_acq_date": "4/25/2014"
      }
    },
    {
      "image_id": "I240481",
      "image_path": "ADNI_Nifti_QC_N4/I240481_T1_N4.nii.gz",
      "ptid": "099_S_2205",
      "visit": "m06",
      "acq_date": "6/16/2011",
      "phc_scan_date": "2011-06-16",
      "source": "phc",
      "question": "MRI scan (Image Data ID I240481) acquired on 6/16/2011 for a male participant (visit m06). Predict the subject's T1 scan age in years and answer with a numeric value using one decimal place.",
      "answer": "85.4",
      "answer_code": "85.4",
      "answer_units": "years",
      "demographics": {
        "sex": "male",
        "sex_code": "1",
        "visit": "m06",
        "phc_scandate": "2011-06-16",
        "image_acq_date": "6/16/2011"
      }
    },
    {
      "image_id": "I258293",
      "image_path": "ADNI_Nifti_QC_N4/I258293_T1_N4.nii.gz",
      "ptid": "129_S_4073",
      "visit": "v04",
      "acq_date": "9/27/2011",
      "phc_scan_date": "2011-09-27",
      "source": "phc",
      "question": "MRI scan (Image Data ID I258293) acquired on 9/27/2011 for a male participant (visit v04). Predict the subject's T1 scan age in years and answer with a numeric value using one decimal place.",
      "answer": "76.6",
      "answer_code": "76.6",
      "answer_units": "years",
      "demographics": {
        "sex": "male",
        "sex_code": "1",
        "visit": "v04",
        "phc_scandate": "2011-09-27",
        "image_acq_date": "9/27/2011"
      }
    },
    {
      "image_id": "I20609",
      "image_path": "ADNI_Nifti_QC_N4/I20609_T1_N4.nii.gz",
      "ptid": "007_S_0128",
      "visit": "m06",
      "acq_date": "8/14/2006",
      "phc_scan_date": "2006-08-14",
      "source": "phc",
      "question": "MRI scan (Image Data ID I20609) acquired on 8/14/2006 for a female participant (visit m06). Predict the subject's T1 scan age in years and answer with a numeric value using one decimal place.",
      "answer": "64.7",
      "answer_code": "64.7",
      "answer_units": "years",
      "demographics": {
        "sex": "female",
        "sex_code": "2",
        "visit": "m06",
        "phc_scandate": "2006-08-14",
        "image_acq_date": "8/14/2006"
      }
    },
    {
      "image_id": "I196572",
      "image_path": "ADNI_Nifti_QC_N4/I196572_T1_N4.nii.gz",
      "ptid": "099_S_2063",
      "visit": "scmri",
      "acq_date": "10/15/2010",
      "phc_scan_date": "2010-10-15",
      "source": "phc",
      "question": "MRI scan (Image Data ID I196572) acquired on 10/15/2010 for a male participant (visit scmri). Predict the subject's T1 scan age in years and answer with a numeric value using one decimal place.",
      "answer": "68.4",
      "answer_code": "68.4",
      "answer_units": "years",
      "demographics": {
        "sex": "male",
        "sex_code": "1",
        "visit": "scmri",
        "phc_scandate": "2010-10-15",
        "image_acq_date": "10/15/2010"
      }
    },
    {
      "image_id": "I325268",
      "image_path": "ADNI_Nifti_QC_N4/I325268_T1_N4.nii.gz",
      "ptid": "021_S_4718",
      "visit": "v04",
      "acq_date": "8/21/2012",
      "phc_scan_date": "2012-08-21",
      "source": "phc",
      "question": "MRI scan (Image Data ID I325268) acquired on 8/21/2012 for a male participant (visit v04). Predict the subject's T1 scan age in years and answer with a numeric value using one decimal place.",
      "answer": "78.9",
      "answer_code": "78.9",
      "answer_units": "years",
      "demographics": {
        "sex": "male",
        "sex_code": "1",
        "visit": "v04",
        "phc_scandate": "2012-08-21",
        "image_acq_date": "8/21/2012"
      }
    },
    {
      "image_id": "I367318",
      "image_path": "ADNI_Nifti_QC_N4/I367318_T1_N4.nii.gz",
      "ptid": "031_S_4947",
      "visit": "v05",
      "acq_date": "4/16/2013",
      "phc_scan_date": "2013-04-16",
      "source": "phc",
      "question": "MRI scan (Image Data ID I367318) acquired on 4/16/2013 for a male participant (visit v05). Predict the subject's T1 scan age in years and answer with a numeric value using one decimal place.",
      "answer": "75.2",
      "answer_code": "75.2",
      "answer_units": "years",
      "demographics": {
        "sex": "male",
        "sex_code": "1",
        "visit": "v05",
        "phc_scandate": "2013-04-16",
        "image_acq_date": "4/16/2013"
      }
    },
    {
      "image_id": "I269259",
      "image_path": "ADNI_Nifti_QC_N4/I269259_T1_N4.nii.gz",
      "ptid": "005_S_4168",
      "visit": "v04",
      "acq_date": "11/30/2011",
      "phc_scan_date": "2011-11-30",
      "source": "phc",
      "question": "MRI scan (Image Data ID I269259) acquired on 11/30/2011 for a male participant (visit v04). Predict the subject's T1 scan age in years and answer with a numeric value using one decimal place.",
      "answer": "82.5",
      "answer_code": "82.5",
      "answer_units": "years",
      "demographics": {
        "sex": "male",
        "sex_code": "1",
        "visit": "v04",
        "phc_scandate": "2011-11-30",
        "image_acq_date": "11/30/2011"
      }
    },
    {
      "image_id": "I311137",
      "image_path": "ADNI_Nifti_QC_N4/I311137_T1_N4.nii.gz",
      "ptid": "141_S_1255",
      "visit": "v06",
      "acq_date": "3/17/2012",
      "phc_scan_date": "2012-03-17",
      "source": "phc",
      "question": "MRI scan (Image Data ID I311137) acquired on 3/17/2012 for a female participant (visit v06). Predict the subject's T1 scan age in years and answer with a numeric value using one decimal place.",
      "answer": "81.7",
      "answer_code": "81.7",
      "answer_units": "years",
      "demographics": {
        "sex": "female",
        "sex_code": "2",
        "visit": "v06",
        "phc_scandate": "2012-03-17",
        "image_acq_date": "3/17/2012"
      }
    },
    {
      "image_id": "I283515",
      "image_path": "ADNI_Nifti_QC_N4/I283515_T1_N4.nii.gz",
      "ptid": "127_S_4500",
      "visit": "v02",
      "acq_date": "2/08/2012",
      "phc_scan_date": "2012-02-08",
      "source": "phc",
      "question": "MRI scan (Image Data ID I283515) acquired on 2/08/2012 for a female participant (visit v02). Predict the subject's T1 scan age in years and answer with a numeric value using one decimal place.",
      "answer": "90.4",
      "answer_code": "90.4",
      "answer_units": "years",
      "demographics": {
        "sex": "female",
        "sex_code": "2",
        "visit": "v02",
        "phc_scandate": "2012-02-08",
        "image_acq_date": "2/08/2012"
      }
    },
    {
      "image_id": "I573596",
      "image_path": "ADNI_Nifti_QC_N4/I573596_T1_N4.nii.gz",
      "ptid": "002_S_4262",
      "visit": "v41",
      "acq_date": "10/15/2015",
      "phc_scan_date": "2015-10-15",
      "source": "phc",
      "question": "MRI scan (Image Data ID I573596) acquired on 10/15/2015 for a female participant (visit v41). Predict the subject's T1 scan age in years and answer with a numeric value using one decimal place.",
      "answer": "76.9",
      "answer_code": "76.9",
      "answer_units": "years",
      "demographics": {
        "sex": "female",
        "sex_code": "2",
        "visit": "v41",
        "phc_scandate": "2015-10-15",
        "image_acq_date": "10/15/2015"
      }
    },
    {
      "image_id": "I344059",
      "image_path": "ADNI_Nifti_QC_N4/I344059_T1_N4.nii.gz",
      "ptid": "041_S_4874",
      "visit": "v04",
      "acq_date": "11/05/2012",
      "phc_scan_date": "2012-11-05",
      "source": "phc",
      "question": "MRI scan (Image Data ID I344059) acquired on 11/05/2012 for a female participant (visit v04). Predict the subject's T1 scan age in years and answer with a numeric value using one decimal place.",
      "answer": "58",
      "answer_code": "58",
      "answer_units": "years",
      "demographics": {
        "sex": "female",
        "sex_code": "2",
        "visit": "v04",
        "phc_scandate": "2012-11-05",
        "image_acq_date": "11/05/2012"
      }
    },
    {
      "image_id": "I313097",
      "image_path": "ADNI_Nifti_QC_N4/I313097_T1_N4.nii.gz",
      "ptid": "007_S_4611",
      "visit": "v04",
      "acq_date": "6/27/2012",
      "phc_scan_date": "2012-06-27",
      "source": "phc",
      "question": "MRI scan (Image Data ID I313097) acquired on 6/27/2012 for a male participant (visit v04). Predict the subject's T1 scan age in years and answer with a numeric value using one decimal place.",
      "answer": "67.3",
      "answer_code": "67.3",
      "answer_units": "years",
      "demographics": {
        "sex": "male",
        "sex_code": "1",
        "visit": "v04",
        "phc_scandate": "2012-06-27",
        "image_acq_date": "6/27/2012"
      }
    },
    {
      "image_id": "I12373",
      "image_path": "ADNI_Nifti_QC_N4/I12373_T1_N4.nii.gz",
      "ptid": "023_S_0331",
      "visit": "sc",
      "acq_date": "3/23/2006",
      "phc_scan_date": "2006-03-23",
      "source": "phc",
      "question": "MRI scan (Image Data ID I12373) acquired on 3/23/2006 for a female participant (visit sc). Predict the subject's T1 scan age in years and answer with a numeric value using one decimal place.",
      "answer": "64.7",
      "answer_code": "64.7",
      "answer_units": "years",
      "demographics": {
        "sex": "female",
        "sex_code": "2",
        "visit": "sc",
        "phc_scandate": "2006-03-23",
        "image_acq_date": "3/23/2006"
      }
    },
    {
      "image_id": "I371195",
      "image_path": "ADNI_Nifti_QC_N4/I371195_T1_N4.nii.gz",
      "ptid": "036_S_5112",
      "visit": "v02",
      "acq_date": "5/06/2013",
      "phc_scan_date": "2013-05-06",
      "source": "phc",
      "question": "MRI scan (Image Data ID I371195) acquired on 5/06/2013 for a female participant (visit v02). Predict the subject's T1 scan age in years and answer with a numeric value using one decimal place.",
      "answer": "74.5",
      "answer_code": "74.5",
      "answer_units": "years",
      "demographics": {
        "sex": "female",
        "sex_code": "2",
        "visit": "v02",
        "phc_scandate": "2013-05-06",
        "image_acq_date": "5/06/2013"
      }
    },
    {
      "image_id": "I310362",
      "image_path": "ADNI_Nifti_QC_N4/I310362_T1_N4.nii.gz",
      "ptid": "127_S_4765",
      "visit": "v02",
      "acq_date": "6/08/2012",
      "phc_scan_date": "2012-06-08",
      "source": "phc",
      "question": "MRI scan (Image Data ID I310362) acquired on 6/08/2012 for a male participant (visit v02). Predict the subject's T1 scan age in years and answer with a numeric value using one decimal place.",
      "answer": "76",
      "answer_code": "76",
      "answer_units": "years",
      "demographics": {
        "sex": "male",
        "sex_code": "1",
        "visit": "v02",
        "phc_scandate": "2012-06-08",
        "image_acq_date": "6/08/2012"
      }
    },
    {
      "image_id": "I506434",
      "image_path": "ADNI_Nifti_QC_N4/I506434_T1_N4.nii.gz",
      "ptid": "024_S_4169",
      "visit": "v41",
      "acq_date": "8/24/2015",
      "phc_scan_date": "2015-08-24",
      "source": "phc",
      "question": "MRI scan (Image Data ID I506434) acquired on 8/24/2015 for a female participant (visit v41). Predict the subject's T1 scan age in years and answer with a numeric value using one decimal place.",
      "answer": "66.1",
      "answer_code": "66.1",
      "answer_units": "years",
      "demographics": {
        "sex": "female",
        "sex_code": "2",
        "visit": "v41",
        "phc_scandate": "2015-08-24",
        "image_acq_date": "8/24/2015"
      }
    },
    {
      "image_id": "I489962",
      "image_path": "ADNI_Nifti_QC_N4/I489962_T1_N4.nii.gz",
      "ptid": "130_S_5142",
      "visit": "v21",
      "acq_date": "5/06/2015",
      "phc_scan_date": "2015-05-06",
      "source": "phc",
      "question": "MRI scan (Image Data ID I489962) acquired on 5/06/2015 for a female participant (visit v21). Predict the subject's T1 scan age in years and answer with a numeric value using one decimal place.",
      "answer": "78.5",
      "answer_code": "78.5",
      "answer_units": "years",
      "demographics": {
        "sex": "female",
        "sex_code": "2",
        "visit": "v21",
        "phc_scandate": "2015-05-06",
        "image_acq_date": "5/06/2015"
      }
    },
    {
      "image_id": "I11179",
      "image_path": "ADNI_Nifti_QC_N4/I11179_T1_N4.nii.gz",
      "ptid": "128_S_0225",
      "visit": "sc",
      "acq_date": "2/15/2006",
      "phc_scan_date": "2006-02-15",
      "source": "phc",
      "question": "MRI scan (Image Data ID I11179) acquired on 2/15/2006 for a female participant (visit sc). Predict the subject's T1 scan age in years and answer with a numeric value using one decimal place.",
      "answer": "82.4",
      "answer_code": "82.4",
      "answer_units": "years",
      "demographics": {
        "sex": "female",
        "sex_code": "2",
        "visit": "sc",
        "phc_scandate": "2006-02-15",
        "image_acq_date": "2/15/2006"
      }
    },
    {
      "image_id": "I73716",
      "image_path": "ADNI_Nifti_QC_N4/I73716_T1_N4.nii.gz",
      "ptid": "031_S_0830",
      "visit": "m12",
      "acq_date": "9/17/2007",
      "phc_scan_date": "2007-09-17",
      "source": "phc",
      "question": "MRI scan (Image Data ID I73716) acquired on 9/17/2007 for a male participant (visit m12). Predict the subject's T1 scan age in years and answer with a numeric value using one decimal place.",
      "answer": "71.9",
      "answer_code": "71.9",
      "answer_units": "years",
      "demographics": {
        "sex": "male",
        "sex_code": "1",
        "visit": "m12",
        "phc_scandate": "2007-09-17",
        "image_acq_date": "9/17/2007"
      }
    },
    {
      "image_id": "I172441",
      "image_path": "ADNI_Nifti_QC_N4/I172441_T1_N4.nii.gz",
      "ptid": "029_S_1384",
      "visit": "m36",
      "acq_date": "4/28/2010",
      "phc_scan_date": "2010-04-28",
      "source": "phc",
      "question": "MRI scan (Image Data ID I172441) acquired on 4/28/2010 for a male participant (visit m36). Predict the subject's T1 scan age in years and answer with a numeric value using one decimal place.",
      "answer": "75.2",
      "answer_code": "75.2",
      "answer_units": "years",
      "demographics": {
        "sex": "male",
        "sex_code": "1",
        "visit": "m36",
        "phc_scandate": "2010-04-28",
        "image_acq_date": "4/28/2010"
      }
    },
    {
      "image_id": "I133432",
      "image_path": "ADNI_Nifti_QC_N4/I133432_T1_N4.nii.gz",
      "ptid": "041_S_1010",
      "visit": "m24",
      "acq_date": "1/12/2009",
      "phc_scan_date": "2009-01-12",
      "source": "phc",
      "question": "MRI scan (Image Data ID I133432) acquired on 1/12/2009 for a male participant (visit m24). Predict the subject's T1 scan age in years and answer with a numeric value using one decimal place.",
      "answer": "76.6",
      "answer_code": "76.6",
      "answer_units": "years",
      "demographics": {
        "sex": "male",
        "sex_code": "1",
        "visit": "m24",
        "phc_scandate": "2009-01-12",
        "image_acq_date": "1/12/2009"
      }
    },
    {
      "image_id": "I117131",
      "image_path": "ADNI_Nifti_QC_N4/I117131_T1_N4.nii.gz",
      "ptid": "021_S_0626",
      "visit": "m24",
      "acq_date": "8/27/2008",
      "phc_scan_date": "2008-08-27",
      "source": "phc",
      "question": "MRI scan (Image Data ID I117131) acquired on 8/27/2008 for a male participant (visit m24). Predict the subject's T1 scan age in years and answer with a numeric value using one decimal place.",
      "answer": "85.5",
      "answer_code": "85.5",
      "answer_units": "years",
      "demographics": {
        "sex": "male",
        "sex_code": "1",
        "visit": "m24",
        "phc_scandate": "2008-08-27",
        "image_acq_date": "8/27/2008"
      }
    },
    {
      "image_id": "I321218",
      "image_path": "ADNI_Nifti_QC_N4/I321218_T1_N4.nii.gz",
      "ptid": "029_S_2376",
      "visit": "v06",
      "acq_date": "7/31/2012",
      "phc_scan_date": "2012-07-31",
      "source": "phc",
      "question": "MRI scan (Image Data ID I321218) acquired on 7/31/2012 for a male participant (visit v06). Predict the subject's T1 scan age in years and answer with a numeric value using one decimal place.",
      "answer": "83.2",
      "answer_code": "83.2",
      "answer_units": "years",
      "demographics": {
        "sex": "male",
        "sex_code": "1",
        "visit": "v06",
        "phc_scandate": "2012-07-31",
        "image_acq_date": "7/31/2012"
      }
    },
    {
      "image_id": "I703837",
      "image_path": "ADNI_Nifti_QC_N4/I703837_T1_N4.nii.gz",
      "ptid": "135_S_4723",
      "visit": "v41",
      "acq_date": "5/11/2016",
      "phc_scan_date": "2016-05-11",
      "source": "phc",
      "question": "MRI scan (Image Data ID I703837) acquired on 5/11/2016 for a female participant (visit v41). Predict the subject's T1 scan age in years and answer with a numeric value using one decimal place.",
      "answer": "73.5",
      "answer_code": "73.5",
      "answer_units": "years",
      "demographics": {
        "sex": "female",
        "sex_code": "2",
        "visit": "v41",
        "phc_scandate": "2016-05-11",
        "image_acq_date": "5/11/2016"
      }
    },
    {
      "image_id": "I157907",
      "image_path": "ADNI_Nifti_QC_N4/I157907_T1_N4.nii.gz",
      "ptid": "023_S_0963",
      "visit": "m36",
      "acq_date": "10/28/2009",
      "phc_scan_date": "2009-10-28",
      "source": "phc",
      "question": "MRI scan (Image Data ID I157907) acquired on 10/28/2009 for a male participant (visit m36). Predict the subject's T1 scan age in years and answer with a numeric value using one decimal place.",
      "answer": "75.7",
      "answer_code": "75.7",
      "answer_units": "years",
      "demographics": {
        "sex": "male",
        "sex_code": "1",
        "visit": "m36",
        "phc_scandate": "2009-10-28",
        "image_acq_date": "10/28/2009"
      }
    },
    {
      "image_id": "I28152",
      "image_path": "ADNI_Nifti_QC_N4/I28152_T1_N4.nii.gz",
      "ptid": "133_S_1031",
      "visit": "sc",
      "acq_date": "10/31/2006",
      "phc_scan_date": "2006-10-31",
      "source": "phc",
      "question": "MRI scan (Image Data ID I28152) acquired on 10/31/2006 for a female participant (visit sc). Predict the subject's T1 scan age in years and answer with a numeric value using one decimal place.",
      "answer": "77.2",
      "answer_code": "77.2",
      "answer_units": "years",
      "demographics": {
        "sex": "female",
        "sex_code": "2",
        "visit": "sc",
        "phc_scandate": "2006-10-31",
        "image_acq_date": "10/31/2006"
      }
    },
    {
      "image_id": "I20280",
      "image_path": "ADNI_Nifti_QC_N4/I20280_T1_N4.nii.gz",
      "ptid": "018_S_0103",
      "visit": "m06",
      "acq_date": "8/08/2006",
      "phc_scan_date": "2006-08-08",
      "source": "phc",
      "question": "MRI scan (Image Data ID I20280) acquired on 8/08/2006 for a male participant (visit m06). Predict the subject's T1 scan age in years and answer with a numeric value using one decimal place.",
      "answer": "88",
      "answer_code": "88",
      "answer_units": "years",
      "demographics": {
        "sex": "male",
        "sex_code": "1",
        "visit": "m06",
        "phc_scandate": "2006-08-08",
        "image_acq_date": "8/08/2006"
      }
    },
    {
      "image_id": "I260588",
      "image_path": "ADNI_Nifti_QC_N4/I260588_T1_N4.nii.gz",
      "ptid": "041_S_4041",
      "visit": "v04",
      "acq_date": "10/11/2011",
      "phc_scan_date": "2011-10-11",
      "source": "phc",
      "question": "MRI scan (Image Data ID I260588) acquired on 10/11/2011 for a female participant (visit v04). Predict the subject's T1 scan age in years and answer with a numeric value using one decimal place.",
      "answer": "78.4",
      "answer_code": "78.4",
      "answer_units": "years",
      "demographics": {
        "sex": "female",
        "sex_code": "2",
        "visit": "v04",
        "phc_scandate": "2011-10-11",
        "image_acq_date": "10/11/2011"
      }
    },
    {
      "image_id": "I115301",
      "image_path": "ADNI_Nifti_QC_N4/I115301_T1_N4.nii.gz",
      "ptid": "013_S_1186",
      "visit": "m18",
      "acq_date": "8/04/2008",
      "phc_scan_date": "2008-08-04",
      "source": "phc",
      "question": "MRI scan (Image Data ID I115301) acquired on 8/04/2008 for a male participant (visit m18). Predict the subject's T1 scan age in years and answer with a numeric value using one decimal place.",
      "answer": "84.8",
      "answer_code": "84.8",
      "answer_units": "years",
      "demographics": {
        "sex": "male",
        "sex_code": "1",
        "visit": "m18",
        "phc_scandate": "2008-08-04",
        "image_acq_date": "8/04/2008"
      }
    },
    {
      "image_id": "I35323",
      "image_path": "ADNI_Nifti_QC_N4/I35323_T1_N4.nii.gz",
      "ptid": "037_S_0501",
      "visit": "m06",
      "acq_date": "1/05/2007",
      "phc_scan_date": "2007-01-05",
      "source": "phc",
      "question": "MRI scan (Image Data ID I35323) acquired on 1/05/2007 for a male participant (visit m06). Predict the subject's T1 scan age in years and answer with a numeric value using one decimal place.",
      "answer": "78.7",
      "answer_code": "78.7",
      "answer_units": "years",
      "demographics": {
        "sex": "male",
        "sex_code": "1",
        "visit": "m06",
        "phc_scandate": "2007-01-05",
        "image_acq_date": "1/05/2007"
      }
    },
    {
      "image_id": "I139493",
      "image_path": "ADNI_Nifti_QC_N4/I139493_T1_N4.nii.gz",
      "ptid": "099_S_0291",
      "visit": "m36",
      "acq_date": "3/20/2009",
      "phc_scan_date": "2009-03-20",
      "source": "phc",
      "question": "MRI scan (Image Data ID I139493) acquired on 3/20/2009 for a male participant (visit m36). Predict the subject's T1 scan age in years and answer with a numeric value using one decimal place.",
      "answer": "82.5",
      "answer_code": "82.5",
      "answer_units": "years",
      "demographics": {
        "sex": "male",
        "sex_code": "1",
        "visit": "m36",
        "phc_scandate": "2009-03-20",
        "image_acq_date": "3/20/2009"
      }
    },
    {
      "image_id": "I328196",
      "image_path": "ADNI_Nifti_QC_N4/I328196_T1_N4.nii.gz",
      "ptid": "007_S_4911",
      "visit": "v02",
      "acq_date": "8/30/2012",
      "phc_scan_date": "2012-08-30",
      "source": "phc",
      "question": "MRI scan (Image Data ID I328196) acquired on 8/30/2012 for a male participant (visit v02). Predict the subject's T1 scan age in years and answer with a numeric value using one decimal place.",
      "answer": "74.6",
      "answer_code": "74.6",
      "answer_units": "years",
      "demographics": {
        "sex": "male",
        "sex_code": "1",
        "visit": "v02",
        "phc_scandate": "2012-08-30",
        "image_acq_date": "8/30/2012"
      }
    },
    {
      "image_id": "I104926",
      "image_path": "ADNI_Nifti_QC_N4/I104926_T1_N4.nii.gz",
      "ptid": "003_S_0908",
      "visit": "m18",
      "acq_date": "5/06/2008",
      "phc_scan_date": "2008-05-06",
      "source": "phc",
      "question": "MRI scan (Image Data ID I104926) acquired on 5/06/2008 for a female participant (visit m18). Predict the subject's T1 scan age in years and answer with a numeric value using one decimal place.",
      "answer": "64.6",
      "answer_code": "64.6",
      "answer_units": "years",
      "demographics": {
        "sex": "female",
        "sex_code": "2",
        "visit": "m18",
        "phc_scandate": "2008-05-06",
        "image_acq_date": "5/06/2008"
      }
    },
    {
      "image_id": "I341827",
      "image_path": "ADNI_Nifti_QC_N4/I341827_T1_N4.nii.gz",
      "ptid": "100_S_4970",
      "visit": "v02",
      "acq_date": "10/22/2012",
      "phc_scan_date": "2012-10-22",
      "source": "phc",
      "question": "MRI scan (Image Data ID I341827) acquired on 10/22/2012 for a male participant (visit v02). Predict the subject's T1 scan age in years and answer with a numeric value using one decimal place.",
      "answer": "87.6",
      "answer_code": "87.6",
      "answer_units": "years",
      "demographics": {
        "sex": "male",
        "sex_code": "1",
        "visit": "v02",
        "phc_scandate": "2012-10-22",
        "image_acq_date": "10/22/2012"
      }
    },
    {
      "image_id": "I386111",
      "image_path": "ADNI_Nifti_QC_N4/I386111_T1_N4.nii.gz",
      "ptid": "072_S_4103",
      "visit": "v21",
      "acq_date": "8/19/2013",
      "phc_scan_date": "2013-08-19",
      "source": "phc",
      "question": "MRI scan (Image Data ID I386111) acquired on 8/19/2013 for a male participant (visit v21). Predict the subject's T1 scan age in years and answer with a numeric value using one decimal place.",
      "answer": "73.1",
      "answer_code": "73.1",
      "answer_units": "years",
      "demographics": {
        "sex": "male",
        "sex_code": "1",
        "visit": "v21",
        "phc_scandate": "2013-08-19",
        "image_acq_date": "8/19/2013"
      }
    },
    {
      "image_id": "I401750",
      "image_path": "ADNI_Nifti_QC_N4/I401750_T1_N4.nii.gz",
      "ptid": "073_S_4382",
      "visit": "v21",
      "acq_date": "12/13/2013",
      "phc_scan_date": "2013-12-13",
      "source": "phc",
      "question": "MRI scan (Image Data ID I401750) acquired on 12/13/2013 for a female participant (visit v21). Predict the subject's T1 scan age in years and answer with a numeric value using one decimal place.",
      "answer": "78",
      "answer_code": "78",
      "answer_units": "years",
      "demographics": {
        "sex": "female",
        "sex_code": "2",
        "visit": "v21",
        "phc_scandate": "2013-12-13",
        "image_acq_date": "12/13/2013"
      }
    },
    {
      "image_id": "I470182",
      "image_path": "ADNI_Nifti_QC_N4/I470182_T1_N4.nii.gz",
      "ptid": "035_S_0555",
      "visit": "v31",
      "acq_date": "1/16/2015",
      "phc_scan_date": "2015-01-16",
      "source": "phc",
      "question": "MRI scan (Image Data ID I470182) acquired on 1/16/2015 for a male participant (visit v31). Predict the subject's T1 scan age in years and answer with a numeric value using one decimal place.",
      "answer": "85.4",
      "answer_code": "85.4",
      "answer_units": "years",
      "demographics": {
        "sex": "male",
        "sex_code": "1",
        "visit": "v31",
        "phc_scandate": "2015-01-16",
        "image_acq_date": "1/16/2015"
      }
    },
    {
      "image_id": "I50620",
      "image_path": "ADNI_Nifti_QC_N4/I50620_T1_N4.nii.gz",
      "ptid": "003_S_0908",
      "visit": "m06",
      "acq_date": "4/23/2007",
      "phc_scan_date": "2007-04-23",
      "source": "phc",
      "question": "MRI scan (Image Data ID I50620) acquired on 4/23/2007 for a female participant (visit m06). Predict the subject's T1 scan age in years and answer with a numeric value using one decimal place.",
      "answer": "63.6",
      "answer_code": "63.6",
      "answer_units": "years",
      "demographics": {
        "sex": "female",
        "sex_code": "2",
        "visit": "m06",
        "phc_scandate": "2007-04-23",
        "image_acq_date": "4/23/2007"
      }
    },
    {
      "image_id": "I422921",
      "image_path": "ADNI_Nifti_QC_N4/I422921_T1_N4.nii.gz",
      "ptid": "153_S_4621",
      "visit": "v21",
      "acq_date": "4/29/2014",
      "phc_scan_date": "2014-04-29",
      "source": "phc",
      "question": "MRI scan (Image Data ID I422921) acquired on 4/29/2014 for a male participant (visit v21). Predict the subject's T1 scan age in years and answer with a numeric value using one decimal place.",
      "answer": "72",
      "answer_code": "72",
      "answer_units": "years",
      "demographics": {
        "sex": "male",
        "sex_code": "1",
        "visit": "v21",
        "phc_scandate": "2014-04-29",
        "image_acq_date": "4/29/2014"
      }
    },
    {
      "image_id": "I269203",
      "image_path": "ADNI_Nifti_QC_N4/I269203_T1_N4.nii.gz",
      "ptid": "094_S_4162",
      "visit": "v04",
      "acq_date": "11/29/2011",
      "phc_scan_date": "2011-11-29",
      "source": "phc",
      "question": "MRI scan (Image Data ID I269203) acquired on 11/29/2011 for a female participant (visit v04). Predict the subject's T1 scan age in years and answer with a numeric value using one decimal place.",
      "answer": "71.7",
      "answer_code": "71.7",
      "answer_units": "years",
      "demographics": {
        "sex": "female",
        "sex_code": "2",
        "visit": "v04",
        "phc_scandate": "2011-11-29",
        "image_acq_date": "11/29/2011"
      }
    },
    {
      "image_id": "I312872",
      "image_path": "ADNI_Nifti_QC_N4/I312872_T1_N4.nii.gz",
      "ptid": "012_S_4545",
      "visit": "v04",
      "acq_date": "6/25/2012",
      "phc_scan_date": "2012-06-25",
      "source": "phc",
      "question": "MRI scan (Image Data ID I312872) acquired on 6/25/2012 for a female participant (visit v04). Predict the subject's T1 scan age in years and answer with a numeric value using one decimal place.",
      "answer": "67.4",
      "answer_code": "67.4",
      "answer_units": "years",
      "demographics": {
        "sex": "female",
        "sex_code": "2",
        "visit": "v04",
        "phc_scandate": "2012-06-25",
        "image_acq_date": "6/25/2012"
      }
    },
    {
      "image_id": "I282630",
      "image_path": "ADNI_Nifti_QC_N4/I282630_T1_N4.nii.gz",
      "ptid": "041_S_4495",
      "visit": "v02",
      "acq_date": "2/03/2012",
      "phc_scan_date": "2012-02-03",
      "source": "phc",
      "question": "MRI scan (Image Data ID I282630) acquired on 2/03/2012 for a male participant (visit v02). Predict the subject's T1 scan age in years and answer with a numeric value using one decimal place.",
      "answer": "67.4",
      "answer_code": "67.4",
      "answer_units": "years",
      "demographics": {
        "sex": "male",
        "sex_code": "1",
        "visit": "v02",
        "phc_scandate": "2012-02-03",
        "image_acq_date": "2/03/2012"
      }
    },
    {
      "image_id": "I99493",
      "image_path": "ADNI_Nifti_QC_N4/I99493_T1_N4.nii.gz",
      "ptid": "141_S_1024",
      "visit": "m12",
      "acq_date": "11/25/2007",
      "phc_scan_date": "2007-11-25",
      "source": "phc",
      "question": "MRI scan (Image Data ID I99493) acquired on 11/25/2007 for a male participant (visit m12). Predict the subject's T1 scan age in years and answer with a numeric value using one decimal place.",
      "answer": "69.7",
      "answer_code": "69.7",
      "answer_units": "years",
      "demographics": {
        "sex": "male",
        "sex_code": "1",
        "visit": "m12",
        "phc_scandate": "2007-11-25",
        "image_acq_date": "11/25/2007"
      }
    },
    {
      "image_id": "I364331",
      "image_path": "ADNI_Nifti_QC_N4/I364331_T1_N4.nii.gz",
      "ptid": "126_S_4507",
      "visit": "v11",
      "acq_date": "3/25/2013",
      "phc_scan_date": "2013-03-25",
      "source": "phc",
      "question": "MRI scan (Image Data ID I364331) acquired on 3/25/2013 for a male participant (visit v11). Predict the subject's T1 scan age in years and answer with a numeric value using one decimal place.",
      "answer": "79.4",
      "answer_code": "79.4",
      "answer_units": "years",
      "demographics": {
        "sex": "male",
        "sex_code": "1",
        "visit": "v11",
        "phc_scandate": "2013-03-25",
        "image_acq_date": "3/25/2013"
      }
    },
    {
      "image_id": "I63673",
      "image_path": "ADNI_Nifti_QC_N4/I63673_T1_N4.nii.gz",
      "ptid": "036_S_0672",
      "visit": "m12",
      "acq_date": "8/01/2007",
      "phc_scan_date": "2007-08-01",
      "source": "phc",
      "question": "MRI scan (Image Data ID I63673) acquired on 8/01/2007 for a female participant (visit m12). Predict the subject's T1 scan age in years and answer with a numeric value using one decimal place.",
      "answer": "63.2",
      "answer_code": "63.2",
      "answer_units": "years",
      "demographics": {
        "sex": "female",
        "sex_code": "2",
        "visit": "m12",
        "phc_scandate": "2007-08-01",
        "image_acq_date": "8/01/2007"
      }
    },
    {
      "image_id": "I392911",
      "image_path": "ADNI_Nifti_QC_N4/I392911_T1_N4.nii.gz",
      "ptid": "130_S_4883",
      "visit": "v11",
      "acq_date": "10/01/2013",
      "phc_scan_date": "2013-10-01",
      "source": "phc",
      "question": "MRI scan (Image Data ID I392911) acquired on 10/01/2013 for a female participant (visit v11). Predict the subject's T1 scan age in years and answer with a numeric value using one decimal place.",
      "answer": "77.3",
      "answer_code": "77.3",
      "answer_units": "years",
      "demographics": {
        "sex": "female",
        "sex_code": "2",
        "visit": "v11",
        "phc_scandate": "2013-10-01",
        "image_acq_date": "10/01/2013"
      }
    },
    {
      "image_id": "I58596",
      "image_path": "ADNI_Nifti_QC_N4/I58596_T1_N4.nii.gz",
      "ptid": "114_S_1103",
      "visit": "m06",
      "acq_date": "7/03/2007",
      "phc_scan_date": "2007-07-03",
      "source": "phc",
      "question": "MRI scan (Image Data ID I58596) acquired on 7/03/2007 for a male participant (visit m06). Predict the subject's T1 scan age in years and answer with a numeric value using one decimal place.",
      "answer": "83.7",
      "answer_code": "83.7",
      "answer_units": "years",
      "demographics": {
        "sex": "male",
        "sex_code": "1",
        "visit": "m06",
        "phc_scandate": "2007-07-03",
        "image_acq_date": "7/03/2007"
      }
    },
    {
      "image_id": "I358333",
      "image_path": "ADNI_Nifti_QC_N4/I358333_T1_N4.nii.gz",
      "ptid": "109_S_2200",
      "visit": "v11",
      "acq_date": "1/25/2013",
      "phc_scan_date": "2013-01-25",
      "source": "phc",
      "question": "MRI scan (Image Data ID I358333) acquired on 1/25/2013 for a female participant (visit v11). Predict the subject's T1 scan age in years and answer with a numeric value using one decimal place.",
      "answer": "78.3",
      "answer_code": "78.3",
      "answer_units": "years",
      "demographics": {
        "sex": "female",
        "sex_code": "2",
        "visit": "v11",
        "phc_scandate": "2013-01-25",
        "image_acq_date": "1/25/2013"
      }
    },
    {
      "image_id": "I16847",
      "image_path": "ADNI_Nifti_QC_N4/I16847_T1_N4.nii.gz",
      "ptid": "031_S_0568",
      "visit": "bl",
      "acq_date": "6/09/2006",
      "phc_scan_date": "2006-06-09",
      "source": "phc",
      "question": "MRI scan (Image Data ID I16847) acquired on 6/09/2006 for a female participant (visit bl). Predict the subject's T1 scan age in years and answer with a numeric value using one decimal place.",
      "answer": "79.9",
      "answer_code": "79.9",
      "answer_units": "years",
      "demographics": {
        "sex": "female",
        "sex_code": "2",
        "visit": "bl",
        "phc_scandate": "2006-06-09",
        "image_acq_date": "6/09/2006"
      }
    },
    {
      "image_id": "I86902",
      "image_path": "ADNI_Nifti_QC_N4/I86902_T1_N4.nii.gz",
      "ptid": "035_S_0048",
      "visit": "m24",
      "acq_date": "12/13/2007",
      "phc_scan_date": "2007-12-13",
      "source": "phc",
      "question": "MRI scan (Image Data ID I86902) acquired on 12/13/2007 for a male participant (visit m24). Predict the subject's T1 scan age in years and answer with a numeric value using one decimal place.",
      "answer": "80.4",
      "answer_code": "80.4",
      "answer_units": "years",
      "demographics": {
        "sex": "male",
        "sex_code": "1",
        "visit": "m24",
        "phc_scandate": "2007-12-13",
        "image_acq_date": "12/13/2007"
      }
    },
    {
      "image_id": "I295005",
      "image_path": "ADNI_Nifti_QC_N4/I295005_T1_N4.nii.gz",
      "ptid": "003_S_0981",
      "visit": "v06",
      "acq_date": "3/29/2012",
      "phc_scan_date": "2012-03-29",
      "source": "phc",
      "question": "MRI scan (Image Data ID I295005) acquired on 3/29/2012 for a female participant (visit v06). Predict the subject's T1 scan age in years and answer with a numeric value using one decimal place.",
      "answer": "89.9",
      "answer_code": "89.9",
      "answer_units": "years",
      "demographics": {
        "sex": "female",
        "sex_code": "2",
        "visit": "v06",
        "phc_scandate": "2012-03-29",
        "image_acq_date": "3/29/2012"
      }
    },
    {
      "image_id": "I317906",
      "image_path": "ADNI_Nifti_QC_N4/I317906_T1_N4.nii.gz",
      "ptid": "137_S_4587",
      "visit": "v04",
      "acq_date": "7/24/2012",
      "phc_scan_date": "2012-07-24",
      "source": "phc",
      "question": "MRI scan (Image Data ID I317906) acquired on 7/24/2012 for a female participant (visit v04). Predict the subject's T1 scan age in years and answer with a numeric value using one decimal place.",
      "answer": "66.1",
      "answer_code": "66.1",
      "answer_units": "years",
      "demographics": {
        "sex": "female",
        "sex_code": "2",
        "visit": "v04",
        "phc_scandate": "2012-07-24",
        "image_acq_date": "7/24/2012"
      }
    },
    {
      "image_id": "I70855",
      "image_path": "ADNI_Nifti_QC_N4/I70855_T1_N4.nii.gz",
      "ptid": "037_S_1421",
      "visit": "sc",
      "acq_date": "8/27/2007",
      "phc_scan_date": "2007-08-27",
      "source": "phc",
      "question": "MRI scan (Image Data ID I70855) acquired on 8/27/2007 for a female participant (visit sc). Predict the subject's T1 scan age in years and answer with a numeric value using one decimal place.",
      "answer": "74.5",
      "answer_code": "74.5",
      "answer_units": "years",
      "demographics": {
        "sex": "female",
        "sex_code": "2",
        "visit": "sc",
        "phc_scandate": "2007-08-27",
        "image_acq_date": "8/27/2007"
      }
    },
    {
      "image_id": "I342890",
      "image_path": "ADNI_Nifti_QC_N4/I342890_T1_N4.nii.gz",
      "ptid": "024_S_0985",
      "visit": "v11",
      "acq_date": "10/29/2012",
      "phc_scan_date": "2012-10-29",
      "source": "phc",
      "question": "MRI scan (Image Data ID I342890) acquired on 10/29/2012 for a male participant (visit v11). Predict the subject's T1 scan age in years and answer with a numeric value using one decimal place.",
      "answer": "87.8",
      "answer_code": "87.8",
      "answer_units": "years",
      "demographics": {
        "sex": "male",
        "sex_code": "1",
        "visit": "v11",
        "phc_scandate": "2012-10-29",
        "image_acq_date": "10/29/2012"
      }
    },
    {
      "image_id": "I393901",
      "image_path": "ADNI_Nifti_QC_N4/I393901_T1_N4.nii.gz",
      "ptid": "021_S_4245",
      "visit": "v21",
      "acq_date": "10/09/2013",
      "phc_scan_date": "2013-10-09",
      "source": "phc",
      "question": "MRI scan (Image Data ID I393901) acquired on 10/09/2013 for a male participant (visit v21). Predict the subject's T1 scan age in years and answer with a numeric value using one decimal place.",
      "answer": "75.7",
      "answer_code": "75.7",
      "answer_units": "years",
      "demographics": {
        "sex": "male",
        "sex_code": "1",
        "visit": "v21",
        "phc_scandate": "2013-10-09",
        "image_acq_date": "10/09/2013"
      }
    },
    {
      "image_id": "I110732",
      "image_path": "ADNI_Nifti_QC_N4/I110732_T1_N4.nii.gz",
      "ptid": "052_S_1054",
      "visit": "m18",
      "acq_date": "6/25/2008",
      "phc_scan_date": "2008-06-25",
      "source": "phc",
      "question": "MRI scan (Image Data ID I110732) acquired on 6/25/2008 for a male participant (visit m18). Predict the subject's T1 scan age in years and answer with a numeric value using one decimal place.",
      "answer": "71.6",
      "answer_code": "71.6",
      "answer_units": "years",
      "demographics": {
        "sex": "male",
        "sex_code": "1",
        "visit": "m18",
        "phc_scandate": "2008-06-25",
        "image_acq_date": "6/25/2008"
      }
    },
    {
      "image_id": "I341603",
      "image_path": "ADNI_Nifti_QC_N4/I341603_T1_N4.nii.gz",
      "ptid": "021_S_4276",
      "visit": "v11",
      "acq_date": "10/22/2012",
      "phc_scan_date": "2012-10-22",
      "source": "phc",
      "question": "MRI scan (Image Data ID I341603) acquired on 10/22/2012 for a female participant (visit v11). Predict the subject's T1 scan age in years and answer with a numeric value using one decimal place.",
      "answer": "75",
      "answer_code": "75",
      "answer_units": "years",
      "demographics": {
        "sex": "female",
        "sex_code": "2",
        "visit": "v11",
        "phc_scandate": "2012-10-22",
        "image_acq_date": "10/22/2012"
      }
    },
    {
      "image_id": "I235723",
      "image_path": "ADNI_Nifti_QC_N4/I235723_T1_N4.nii.gz",
      "ptid": "082_S_2121",
      "visit": "m06",
      "acq_date": "5/18/2011",
      "phc_scan_date": "2011-05-18",
      "source": "phc",
      "question": "MRI scan (Image Data ID I235723) acquired on 5/18/2011 for a female participant (visit m06). Predict the subject's T1 scan age in years and answer with a numeric value using one decimal place.",
      "answer": "68.5",
      "answer_code": "68.5",
      "answer_units": "years",
      "demographics": {
        "sex": "female",
        "sex_code": "2",
        "visit": "m06",
        "phc_scandate": "2011-05-18",
        "image_acq_date": "5/18/2011"
      }
    },
    {
      "image_id": "I53593",
      "image_path": "ADNI_Nifti_QC_N4/I53593_T1_N4.nii.gz",
      "ptid": "137_S_0283",
      "visit": "m12",
      "acq_date": "5/03/2007",
      "phc_scan_date": "2007-05-03",
      "source": "phc",
      "question": "MRI scan (Image Data ID I53593) acquired on 5/03/2007 for a male participant (visit m12). Predict the subject's T1 scan age in years and answer with a numeric value using one decimal place.",
      "answer": "79.6",
      "answer_code": "79.6",
      "answer_units": "years",
      "demographics": {
        "sex": "male",
        "sex_code": "1",
        "visit": "m12",
        "phc_scandate": "2007-05-03",
        "image_acq_date": "5/03/2007"
      }
    },
    {
      "image_id": "I241913",
      "image_path": "ADNI_Nifti_QC_N4/I241913_T1_N4.nii.gz",
      "ptid": "068_S_2194",
      "visit": "m06",
      "acq_date": "6/17/2011",
      "phc_scan_date": "2011-06-17",
      "source": "phc",
      "question": "MRI scan (Image Data ID I241913) acquired on 6/17/2011 for a female participant (visit m06). Predict the subject's T1 scan age in years and answer with a numeric value using one decimal place.",
      "answer": "71.7",
      "answer_code": "71.7",
      "answer_units": "years",
      "demographics": {
        "sex": "female",
        "sex_code": "2",
        "visit": "m06",
        "phc_scandate": "2011-06-17",
        "image_acq_date": "6/17/2011"
      }
    },
    {
      "image_id": "I15510",
      "image_path": "ADNI_Nifti_QC_N4/I15510_T1_N4.nii.gz",
      "ptid": "127_S_0394",
      "visit": "sc",
      "acq_date": "5/17/2006",
      "phc_scan_date": "2006-05-17",
      "source": "phc",
      "question": "MRI scan (Image Data ID I15510) acquired on 5/17/2006 for a female participant (visit sc). Predict the subject's T1 scan age in years and answer with a numeric value using one decimal place.",
      "answer": "84.2",
      "answer_code": "84.2",
      "answer_units": "years",
      "demographics": {
        "sex": "female",
        "sex_code": "2",
        "visit": "sc",
        "phc_scandate": "2006-05-17",
        "image_acq_date": "5/17/2006"
      }
    },
    {
      "image_id": "I512390",
      "image_path": "ADNI_Nifti_QC_N4/I512390_T1_N4.nii.gz",
      "ptid": "127_S_4210",
      "visit": "v41",
      "acq_date": "9/16/2015",
      "phc_scan_date": "2015-09-16",
      "source": "phc",
      "question": "MRI scan (Image Data ID I512390) acquired on 9/16/2015 for a male participant (visit v41). Predict the subject's T1 scan age in years and answer with a numeric value using one decimal place.",
      "answer": "68",
      "answer_code": "68",
      "answer_units": "years",
      "demographics": {
        "sex": "male",
        "sex_code": "1",
        "visit": "v41",
        "phc_scandate": "2015-09-16",
        "image_acq_date": "9/16/2015"
      }
    },
    {
      "image_id": "I389787",
      "image_path": "ADNI_Nifti_QC_N4/I389787_T1_N4.nii.gz",
      "ptid": "067_S_4184",
      "visit": "v21",
      "acq_date": "9/12/2013",
      "phc_scan_date": "2013-09-12",
      "source": "phc",
      "question": "MRI scan (Image Data ID I389787) acquired on 9/12/2013 for a female participant (visit v21). Predict the subject's T1 scan age in years and answer with a numeric value using one decimal place.",
      "answer": "64.4",
      "answer_code": "64.4",
      "answer_units": "years",
      "demographics": {
        "sex": "female",
        "sex_code": "2",
        "visit": "v21",
        "phc_scandate": "2013-09-12",
        "image_acq_date": "9/12/2013"
      }
    },
    {
      "image_id": "I316737",
      "image_path": "ADNI_Nifti_QC_N4/I316737_T1_N4.nii.gz",
      "ptid": "036_S_4820",
      "visit": "v02",
      "acq_date": "7/17/2012",
      "phc_scan_date": "2012-07-17",
      "source": "phc",
      "question": "MRI scan (Image Data ID I316737) acquired on 7/17/2012 for a female participant (visit v02). Predict the subject's T1 scan age in years and answer with a numeric value using one decimal place.",
      "answer": "85.7",
      "answer_code": "85.7",
      "answer_units": "years",
      "demographics": {
        "sex": "female",
        "sex_code": "2",
        "visit": "v02",
        "phc_scandate": "2012-07-17",
        "image_acq_date": "7/17/2012"
      }
    },
    {
      "image_id": "I10698",
      "image_path": "ADNI_Nifti_QC_N4/I10698_T1_N4.nii.gz",
      "ptid": "035_S_0156",
      "visit": "sc",
      "acq_date": "1/31/2006",
      "phc_scan_date": "2006-01-31",
      "source": "phc",
      "question": "MRI scan (Image Data ID I10698) acquired on 1/31/2006 for a male participant (visit sc). Predict the subject's T1 scan age in years and answer with a numeric value using one decimal place.",
      "answer": "74.2",
      "answer_code": "74.2",
      "answer_units": "years",
      "demographics": {
        "sex": "male",
        "sex_code": "1",
        "visit": "sc",
        "phc_scandate": "2006-01-31",
        "image_acq_date": "1/31/2006"
      }
    },
    {
      "image_id": "I387602",
      "image_path": "ADNI_Nifti_QC_N4/I387602_T1_N4.nii.gz",
      "ptid": "127_S_4844",
      "visit": "v11",
      "acq_date": "8/27/2013",
      "phc_scan_date": "2013-08-27",
      "source": "phc",
      "question": "MRI scan (Image Data ID I387602) acquired on 8/27/2013 for a male participant (visit v11). Predict the subject's T1 scan age in years and answer with a numeric value using one decimal place.",
      "answer": "86.5",
      "answer_code": "86.5",
      "answer_units": "years",
      "demographics": {
        "sex": "male",
        "sex_code": "1",
        "visit": "v11",
        "phc_scandate": "2013-08-27",
        "image_acq_date": "8/27/2013"
      }
    },
    {
      "image_id": "I87709",
      "image_path": "ADNI_Nifti_QC_N4/I87709_T1_N4.nii.gz",
      "ptid": "027_S_1213",
      "visit": "m12",
      "acq_date": "1/16/2008",
      "phc_scan_date": "2008-01-16",
      "source": "phc",
      "question": "MRI scan (Image Data ID I87709) acquired on 1/16/2008 for a female participant (visit m12). Predict the subject's T1 scan age in years and answer with a numeric value using one decimal place.",
      "answer": "75.9",
      "answer_code": "75.9",
      "answer_units": "years",
      "demographics": {
        "sex": "female",
        "sex_code": "2",
        "visit": "m12",
        "phc_scandate": "2008-01-16",
        "image_acq_date": "1/16/2008"
      }
    },
    {
      "image_id": "I228817",
      "image_path": "ADNI_Nifti_QC_N4/I228817_T1_N4.nii.gz",
      "ptid": "032_S_0214",
      "visit": "m60",
      "acq_date": "4/21/2011",
      "phc_scan_date": "2011-04-21",
      "source": "phc",
      "question": "MRI scan (Image Data ID I228817) acquired on 4/21/2011 for a male participant (visit m60). Predict the subject's T1 scan age in years and answer with a numeric value using one decimal place.",
      "answer": "70.3",
      "answer_code": "70.3",
      "answer_units": "years",
      "demographics": {
        "sex": "male",
        "sex_code": "1",
        "visit": "m60",
        "phc_scandate": "2011-04-21",
        "image_acq_date": "4/21/2011"
      }
    },
    {
      "image_id": "I49023",
      "image_path": "ADNI_Nifti_QC_N4/I49023_T1_N4.nii.gz",
      "ptid": "002_S_0938",
      "visit": "m06",
      "acq_date": "4/12/2007",
      "phc_scan_date": "2007-04-12",
      "source": "phc",
      "question": "MRI scan (Image Data ID I49023) acquired on 4/12/2007 for a female participant (visit m06). Predict the subject's T1 scan age in years and answer with a numeric value using one decimal place.",
      "answer": "82.8",
      "answer_code": "82.8",
      "answer_units": "years",
      "demographics": {
        "sex": "female",
        "sex_code": "2",
        "visit": "m06",
        "phc_scandate": "2007-04-12",
        "image_acq_date": "4/12/2007"
      }
    },
    {
      "image_id": "I379857",
      "image_path": "ADNI_Nifti_QC_N4/I379857_T1_N4.nii.gz",
      "ptid": "041_S_5244",
      "visit": "v02",
      "acq_date": "7/10/2013",
      "phc_scan_date": "2013-07-10",
      "source": "phc",
      "question": "MRI scan (Image Data ID I379857) acquired on 7/10/2013 for a female participant (visit v02). Predict the subject's T1 scan age in years and answer with a numeric value using one decimal place.",
      "answer": "75.8",
      "answer_code": "75.8",
      "answer_units": "years",
      "demographics": {
        "sex": "female",
        "sex_code": "2",
        "visit": "v02",
        "phc_scandate": "2013-07-10",
        "image_acq_date": "7/10/2013"
      }
    },
    {
      "image_id": "I56117",
      "image_path": "ADNI_Nifti_QC_N4/I56117_T1_N4.nii.gz",
      "ptid": "033_S_1116",
      "visit": "m06",
      "acq_date": "6/05/2007",
      "phc_scan_date": "2007-06-05",
      "source": "phc",
      "question": "MRI scan (Image Data ID I56117) acquired on 6/05/2007 for a male participant (visit m06). Predict the subject's T1 scan age in years and answer with a numeric value using one decimal place.",
      "answer": "84",
      "answer_code": "84",
      "answer_units": "years",
      "demographics": {
        "sex": "male",
        "sex_code": "1",
        "visit": "m06",
        "phc_scandate": "2007-06-05",
        "image_acq_date": "6/05/2007"
      }
    },
    {
      "image_id": "I489833",
      "image_path": "ADNI_Nifti_QC_N4/I489833_T1_N4.nii.gz",
      "ptid": "072_S_5207",
      "visit": "v05",
      "acq_date": "1/20/2014",
      "phc_scan_date": "2014-01-20",
      "source": "phc",
      "question": "MRI scan (Image Data ID I489833) acquired on 1/20/2014 for a male participant (visit v05). Predict the subject's T1 scan age in years and answer with a numeric value using one decimal place.",
      "answer": "75.6",
      "answer_code": "75.6",
      "answer_units": "years",
      "demographics": {
        "sex": "male",
        "sex_code": "1",
        "visit": "v05",
        "phc_scandate": "2014-01-20",
        "image_acq_date": "1/20/2014"
      }
    },
    {
      "image_id": "I436304",
      "image_path": "ADNI_Nifti_QC_N4/I436304_T1_N4.nii.gz",
      "ptid": "128_S_1406",
      "visit": "m06",
      "acq_date": "1/16/2008",
      "phc_scan_date": "2008-01-16",
      "source": "phc",
      "question": "MRI scan (Image Data ID I436304) acquired on 1/16/2008 for a female participant (visit m06). Predict the subject's T1 scan age in years and answer with a numeric value using one decimal place.",
      "answer": "61",
      "answer_code": "61",
      "answer_units": "years",
      "demographics": {
        "sex": "female",
        "sex_code": "2",
        "visit": "m06",
        "phc_scandate": "2008-01-16",
        "image_acq_date": "1/16/2008"
      }
    },
    {
      "image_id": "I260581",
      "image_path": "ADNI_Nifti_QC_N4/I260581_T1_N4.nii.gz",
      "ptid": "002_S_4270",
      "visit": "v02",
      "acq_date": "10/11/2011",
      "phc_scan_date": "2011-10-11",
      "source": "phc",
      "question": "MRI scan (Image Data ID I260581) acquired on 10/11/2011 for a female participant (visit v02). Predict the subject's T1 scan age in years and answer with a numeric value using one decimal place.",
      "answer": "74.7",
      "answer_code": "74.7",
      "answer_units": "years",
      "demographics": {
        "sex": "female",
        "sex_code": "2",
        "visit": "v02",
        "phc_scandate": "2011-10-11",
        "image_acq_date": "10/11/2011"
      }
    },
    {
      "image_id": "I711042",
      "image_path": "ADNI_Nifti_QC_N4/I711042_T1_N4.nii.gz",
      "ptid": "116_S_1249",
      "visit": "v41",
      "acq_date": "5/19/2016",
      "phc_scan_date": "2016-05-19",
      "source": "phc",
      "question": "MRI scan (Image Data ID I711042) acquired on 5/19/2016 for a female participant (visit v41). Predict the subject's T1 scan age in years and answer with a numeric value using one decimal place.",
      "answer": "80.2",
      "answer_code": "80.2",
      "answer_units": "years",
      "demographics": {
        "sex": "female",
        "sex_code": "2",
        "visit": "v41",
        "phc_scandate": "2016-05-19",
        "image_acq_date": "5/19/2016"
      }
    },
    {
      "image_id": "I363716",
      "image_path": "ADNI_Nifti_QC_N4/I363716_T1_N4.nii.gz",
      "ptid": "073_S_2190",
      "visit": "v11",
      "acq_date": "3/19/2013",
      "phc_scan_date": "2013-03-19",
      "source": "phc",
      "question": "MRI scan (Image Data ID I363716) acquired on 3/19/2013 for a male participant (visit v11). Predict the subject's T1 scan age in years and answer with a numeric value using one decimal place.",
      "answer": "84.8",
      "answer_code": "84.8",
      "answer_units": "years",
      "demographics": {
        "sex": "male",
        "sex_code": "1",
        "visit": "v11",
        "phc_scandate": "2013-03-19",
        "image_acq_date": "3/19/2013"
      }
    },
    {
      "image_id": "I358655",
      "image_path": "ADNI_Nifti_QC_N4/I358655_T1_N4.nii.gz",
      "ptid": "128_S_2151",
      "visit": "v11",
      "acq_date": "2/05/2013",
      "phc_scan_date": "2013-02-05",
      "source": "phc",
      "question": "MRI scan (Image Data ID I358655) acquired on 2/05/2013 for a male participant (visit v11). Predict the subject's T1 scan age in years and answer with a numeric value using one decimal place.",
      "answer": "73",
      "answer_code": "73",
      "answer_units": "years",
      "demographics": {
        "sex": "male",
        "sex_code": "1",
        "visit": "v11",
        "phc_scandate": "2013-02-05",
        "image_acq_date": "2/05/2013"
      }
    },
    {
      "image_id": "I89963",
      "image_path": "ADNI_Nifti_QC_N4/I89963_T1_N4.nii.gz",
      "ptid": "035_S_0156",
      "visit": "m24",
      "acq_date": "2/07/2008",
      "phc_scan_date": "2008-02-07",
      "source": "phc",
      "question": "MRI scan (Image Data ID I89963) acquired on 2/07/2008 for a male participant (visit m24). Predict the subject's T1 scan age in years and answer with a numeric value using one decimal place.",
      "answer": "76.2",
      "answer_code": "76.2",
      "answer_units": "years",
      "demographics": {
        "sex": "male",
        "sex_code": "1",
        "visit": "m24",
        "phc_scandate": "2008-02-07",
        "image_acq_date": "2/07/2008"
      }
    },
    {
      "image_id": "I323094",
      "image_path": "ADNI_Nifti_QC_N4/I323094_T1_N4.nii.gz",
      "ptid": "036_S_4894",
      "visit": "v02",
      "acq_date": "8/09/2012",
      "phc_scan_date": "2012-08-09",
      "source": "phc",
      "question": "MRI scan (Image Data ID I323094) acquired on 8/09/2012 for a female participant (visit v02). Predict the subject's T1 scan age in years and answer with a numeric value using one decimal place.",
      "answer": "60.8",
      "answer_code": "60.8",
      "answer_units": "years",
      "demographics": {
        "sex": "female",
        "sex_code": "2",
        "visit": "v02",
        "phc_scandate": "2012-08-09",
        "image_acq_date": "8/09/2012"
      }
    },
    {
      "image_id": "I55396",
      "image_path": "ADNI_Nifti_QC_N4/I55396_T1_N4.nii.gz",
      "ptid": "021_S_0273",
      "visit": "m12",
      "acq_date": "5/29/2007",
      "phc_scan_date": "2007-05-29",
      "source": "phc",
      "question": "MRI scan (Image Data ID I55396) acquired on 5/29/2007 for a male participant (visit m12). Predict the subject's T1 scan age in years and answer with a numeric value using one decimal place.",
      "answer": "64.1",
      "answer_code": "64.1",
      "answer_units": "years",
      "demographics": {
        "sex": "male",
        "sex_code": "1",
        "visit": "m12",
        "phc_scandate": "2007-05-29",
        "image_acq_date": "5/29/2007"
      }
    },
    {
      "image_id": "I281882",
      "image_path": "ADNI_Nifti_QC_N4/I281882_T1_N4.nii.gz",
      "ptid": "006_S_4485",
      "visit": "v02",
      "acq_date": "2/01/2012",
      "phc_scan_date": "2012-02-01",
      "source": "phc",
      "question": "MRI scan (Image Data ID I281882) acquired on 2/01/2012 for a male participant (visit v02). Predict the subject's T1 scan age in years and answer with a numeric value using one decimal place.",
      "answer": "73.4",
      "answer_code": "73.4",
      "answer_units": "years",
      "demographics": {
        "sex": "male",
        "sex_code": "1",
        "visit": "v02",
        "phc_scandate": "2012-02-01",
        "image_acq_date": "2/01/2012"
      }
    },
    {
      "image_id": "I288312",
      "image_path": "ADNI_Nifti_QC_N4/I288312_T1_N4.nii.gz",
      "ptid": "036_S_4538",
      "visit": "v02",
      "acq_date": "3/05/2012",
      "phc_scan_date": "2012-03-05",
      "source": "phc",
      "question": "MRI scan (Image Data ID I288312) acquired on 3/05/2012 for a female participant (visit v02). Predict the subject's T1 scan age in years and answer with a numeric value using one decimal place.",
      "answer": "78.9",
      "answer_code": "78.9",
      "answer_units": "years",
      "demographics": {
        "sex": "female",
        "sex_code": "2",
        "visit": "v02",
        "phc_scandate": "2012-03-05",
        "image_acq_date": "3/05/2012"
      }
    },
    {
      "image_id": "I280272",
      "image_path": "ADNI_Nifti_QC_N4/I280272_T1_N4.nii.gz",
      "ptid": "041_S_4271",
      "visit": "v04",
      "acq_date": "1/23/2012",
      "phc_scan_date": "2012-01-23",
      "source": "phc",
      "question": "MRI scan (Image Data ID I280272) acquired on 1/23/2012 for a male participant (visit v04). Predict the subject's T1 scan age in years and answer with a numeric value using one decimal place.",
      "answer": "62.2",
      "answer_code": "62.2",
      "answer_units": "years",
      "demographics": {
        "sex": "male",
        "sex_code": "1",
        "visit": "v04",
        "phc_scandate": "2012-01-23",
        "image_acq_date": "1/23/2012"
      }
    },
    {
      "image_id": "I495098",
      "image_path": "ADNI_Nifti_QC_N4/I495098_T1_N4.nii.gz",
      "ptid": "067_S_5159",
      "visit": "v21",
      "acq_date": "5/29/2015",
      "phc_scan_date": "2015-05-29",
      "source": "phc",
      "question": "MRI scan (Image Data ID I495098) acquired on 5/29/2015 for a female participant (visit v21). Predict the subject's T1 scan age in years and answer with a numeric value using one decimal place.",
      "answer": "68.6",
      "answer_code": "68.6",
      "answer_units": "years",
      "demographics": {
        "sex": "female",
        "sex_code": "2",
        "visit": "v21",
        "phc_scandate": "2015-05-29",
        "image_acq_date": "5/29/2015"
      }
    },
    {
      "image_id": "I362378",
      "image_path": "ADNI_Nifti_QC_N4/I362378_T1_N4.nii.gz",
      "ptid": "029_S_4385",
      "visit": "v11",
      "acq_date": "3/05/2013",
      "phc_scan_date": "2013-03-05",
      "source": "phc",
      "question": "MRI scan (Image Data ID I362378) acquired on 3/05/2013 for a female participant (visit v11). Predict the subject's T1 scan age in years and answer with a numeric value using one decimal place.",
      "answer": "69.4",
      "answer_code": "69.4",
      "answer_units": "years",
      "demographics": {
        "sex": "female",
        "sex_code": "2",
        "visit": "v11",
        "phc_scandate": "2013-03-05",
        "image_acq_date": "3/05/2013"
      }
    },
    {
      "image_id": "I119550",
      "image_path": "ADNI_Nifti_QC_N4/I119550_T1_N4.nii.gz",
      "ptid": "036_S_0813",
      "visit": "m24",
      "acq_date": "10/07/2008",
      "phc_scan_date": "2008-10-07",
      "source": "phc",
      "question": "MRI scan (Image Data ID I119550) acquired on 10/07/2008 for a male participant (visit m24). Predict the subject's T1 scan age in years and answer with a numeric value using one decimal place.",
      "answer": "75",
      "answer_code": "75",
      "answer_units": "years",
      "demographics": {
        "sex": "male",
        "sex_code": "1",
        "visit": "m24",
        "phc_scandate": "2008-10-07",
        "image_acq_date": "10/07/2008"
      }
    },
    {
      "image_id": "I413079",
      "image_path": "ADNI_Nifti_QC_N4/I413079_T1_N4.nii.gz",
      "ptid": "036_S_4430",
      "visit": "v21",
      "acq_date": "2/05/2014",
      "phc_scan_date": "2014-02-05",
      "source": "phc",
      "question": "MRI scan (Image Data ID I413079) acquired on 2/05/2014 for a male participant (visit v21). Predict the subject's T1 scan age in years and answer with a numeric value using one decimal place.",
      "answer": "82.2",
      "answer_code": "82.2",
      "answer_units": "years",
      "demographics": {
        "sex": "male",
        "sex_code": "1",
        "visit": "v21",
        "phc_scandate": "2014-02-05",
        "image_acq_date": "2/05/2014"
      }
    },
    {
      "image_id": "I348403",
      "image_path": "ADNI_Nifti_QC_N4/I348403_T1_N4.nii.gz",
      "ptid": "006_S_4713",
      "visit": "v05",
      "acq_date": "11/28/2012",
      "phc_scan_date": "2012-11-28",
      "source": "phc",
      "question": "MRI scan (Image Data ID I348403) acquired on 11/28/2012 for a male participant (visit v05). Predict the subject's T1 scan age in years and answer with a numeric value using one decimal place.",
      "answer": "71.2",
      "answer_code": "71.2",
      "answer_units": "years",
      "demographics": {
        "sex": "male",
        "sex_code": "1",
        "visit": "v05",
        "phc_scandate": "2012-11-28",
        "image_acq_date": "11/28/2012"
      }
    },
    {
      "image_id": "I58191",
      "image_path": "ADNI_Nifti_QC_N4/I58191_T1_N4.nii.gz",
      "ptid": "021_S_0984",
      "visit": "m06",
      "acq_date": "6/29/2007",
      "phc_scan_date": "2007-06-29",
      "source": "phc",
      "question": "MRI scan (Image Data ID I58191) acquired on 6/29/2007 for a male participant (visit m06). Predict the subject's T1 scan age in years and answer with a numeric value using one decimal place.",
      "answer": "77.4",
      "answer_code": "77.4",
      "answer_units": "years",
      "demographics": {
        "sex": "male",
        "sex_code": "1",
        "visit": "m06",
        "phc_scandate": "2007-06-29",
        "image_acq_date": "6/29/2007"
      }
    },
    {
      "image_id": "I321271",
      "image_path": "ADNI_Nifti_QC_N4/I321271_T1_N4.nii.gz",
      "ptid": "116_S_4855",
      "visit": "v02",
      "acq_date": "7/20/2012",
      "phc_scan_date": "2012-07-20",
      "source": "phc",
      "question": "MRI scan (Image Data ID I321271) acquired on 7/20/2012 for a male participant (visit v02). Predict the subject's T1 scan age in years and answer with a numeric value using one decimal place.",
      "answer": "83.9",
      "answer_code": "83.9",
      "answer_units": "years",
      "demographics": {
        "sex": "male",
        "sex_code": "1",
        "visit": "v02",
        "phc_scandate": "2012-07-20",
        "image_acq_date": "7/20/2012"
      }
    },
    {
      "image_id": "I225021",
      "image_path": "ADNI_Nifti_QC_N4/I225021_T1_N4.nii.gz",
      "ptid": "014_S_2185",
      "visit": "m03",
      "acq_date": "3/28/2011",
      "phc_scan_date": "2011-03-28",
      "source": "phc",
      "question": "MRI scan (Image Data ID I225021) acquired on 3/28/2011 for a male participant (visit m03). Predict the subject's T1 scan age in years and answer with a numeric value using one decimal place.",
      "answer": "73.5",
      "answer_code": "73.5",
      "answer_units": "years",
      "demographics": {
        "sex": "male",
        "sex_code": "1",
        "visit": "m03",
        "phc_scandate": "2011-03-28",
        "image_acq_date": "3/28/2011"
      }
    },
    {
      "image_id": "I38462",
      "image_path": "ADNI_Nifti_QC_N4/I38462_T1_N4.nii.gz",
      "ptid": "116_S_1243",
      "visit": "sc",
      "acq_date": "2/07/2007",
      "phc_scan_date": "2007-02-07",
      "source": "phc",
      "question": "MRI scan (Image Data ID I38462) acquired on 2/07/2007 for a male participant (visit sc). Predict the subject's T1 scan age in years and answer with a numeric value using one decimal place.",
      "answer": "77.4",
      "answer_code": "77.4",
      "answer_units": "years",
      "demographics": {
        "sex": "male",
        "sex_code": "1",
        "visit": "sc",
        "phc_scandate": "2007-02-07",
        "image_acq_date": "2/07/2007"
      }
    },
    {
      "image_id": "I98661",
      "image_path": "ADNI_Nifti_QC_N4/I98661_T1_N4.nii.gz",
      "ptid": "033_S_1285",
      "visit": "m12",
      "acq_date": "3/14/2008",
      "phc_scan_date": "2008-03-14",
      "source": "phc",
      "question": "MRI scan (Image Data ID I98661) acquired on 3/14/2008 for a female participant (visit m12). Predict the subject's T1 scan age in years and answer with a numeric value using one decimal place.",
      "answer": "81.2",
      "answer_code": "81.2",
      "answer_units": "years",
      "demographics": {
        "sex": "female",
        "sex_code": "2",
        "visit": "m12",
        "phc_scandate": "2008-03-14",
        "image_acq_date": "3/14/2008"
      }
    },
    {
      "image_id": "I84676",
      "image_path": "ADNI_Nifti_QC_N4/I84676_T1_N4.nii.gz",
      "ptid": "022_S_1097",
      "visit": "m12",
      "acq_date": "12/12/2007",
      "phc_scan_date": "2007-12-12",
      "source": "phc",
      "question": "MRI scan (Image Data ID I84676) acquired on 12/12/2007 for a male participant (visit m12). Predict the subject's T1 scan age in years and answer with a numeric value using one decimal place.",
      "answer": "74.2",
      "answer_code": "74.2",
      "answer_units": "years",
      "demographics": {
        "sex": "male",
        "sex_code": "1",
        "visit": "m12",
        "phc_scandate": "2007-12-12",
        "image_acq_date": "12/12/2007"
      }
    },
    {
      "image_id": "I149949",
      "image_path": "ADNI_Nifti_QC_N4/I149949_T1_N4.nii.gz",
      "ptid": "014_S_0563",
      "visit": "m36",
      "acq_date": "7/21/2009",
      "phc_scan_date": "2009-07-21",
      "source": "phc",
      "question": "MRI scan (Image Data ID I149949) acquired on 7/21/2009 for a male participant (visit m36). Predict the subject's T1 scan age in years and answer with a numeric value using one decimal place.",
      "answer": "83.9",
      "answer_code": "83.9",
      "answer_units": "years",
      "demographics": {
        "sex": "male",
        "sex_code": "1",
        "visit": "m36",
        "phc_scandate": "2009-07-21",
        "image_acq_date": "7/21/2009"
      }
    },
    {
      "image_id": "I237627",
      "image_path": "ADNI_Nifti_QC_N4/I237627_T1_N4.nii.gz",
      "ptid": "153_S_2148",
      "visit": "m06",
      "acq_date": "5/26/2011",
      "phc_scan_date": "2011-05-26",
      "source": "phc",
      "question": "MRI scan (Image Data ID I237627) acquired on 5/26/2011 for a female participant (visit m06). Predict the subject's T1 scan age in years and answer with a numeric value using one decimal place.",
      "answer": "68.4",
      "answer_code": "68.4",
      "answer_units": "years",
      "demographics": {
        "sex": "female",
        "sex_code": "2",
        "visit": "m06",
        "phc_scandate": "2011-05-26",
        "image_acq_date": "5/26/2011"
      }
    },
    {
      "image_id": "I326392",
